Samurai Shodown Game Boy FAH ;30,00 EUR;Envío internacional gratis;Vendidos  2 dic 2021Artículo vendido;desde Francia;
Jeu Samurai Shodown Game Boy FAH ;18,00 EUR;Envío no especificado;Vendidos  21 oct 2021Artículo vendido;desde Francia;
Gameboy Samurai Shodown Cartucho Oficial Genuino Nintendo;35,10 EUR;+ 17,58 EUR de envío estimado;Vendidos  3 oct 2021Artículo vendido;desde Reino Unido;
Samurai Shodown Gameboy;19,49 EUR;+ 4,03 EUR de envío;Vendidos  17 nov 2021Artículo vendido;desde Estados Unidos;
Switch-Samurai Shodown: NeoGeo Collection /Switch GAME NUOVO;30,36 EUR;+ 3,00 EUR de envío;Vendidos  21 sep 2021Artículo vendido;desde Reino Unido;
NEO GEO POCKET COLOR Juego-Samurai Shodown! 2-completa;70,22 EUR;+ 23,25 EUR de envío estimado;Vendidos  16 sep 2021Artículo vendido;desde Reino Unido;
Samurai Shodown Nintendo Switch Juego de Reino Unido ** Nuevo Y Sellado **;31,59 EUR;+ 10,53 EUR de envío;Vendidos  20 oct 2021Artículo vendido;desde Reino Unido;
Samurai Shodown Nintendo Switch Reino Unido Juego ** Free UK Post **;29,25 EUR;+ 10,53 EUR de envío;Vendidos  8 dic 2021Artículo vendido;desde Reino Unido;
Samurai Shodown NeoGeo Colección Nintendo Switch Juego;23,41 EUR;+ 22,25 EUR de envío estimado;Vendidos  15 oct 2021Artículo vendido;desde Reino Unido;
PlayStation 4-Samurai Shodown: NeoGeo Collection /PS4 (UK IMPORT) GAME NEW;26,25 EUR;+ 3,49 EUR de envío;Vendidos  28 oct 2021Artículo vendido;desde Reino Unido;
✳ Samurai Shodown Xbox One Juego. nuevo Sellado;13,99 EUR;+ 17,12 EUR de envío estimado;Vendidos  6 oct 2021Artículo vendido;desde Reino Unido;
PlayStation 4-Samurai Shodown: NeoGeo Collection /PS4 GAME NUOVO;27,46 EUR;+ 3,00 EUR de envío;Vendidos  3 oct 2021Artículo vendido;desde Reino Unido;
Software - Xbox Series X-Samurai Shodown Enhanced Se (UK IMPORT) GAME NEW;22,99 EUR;+ 3,49 EUR de envío;Vendidos  14 sep 2021Artículo vendido;desde Reino Unido;
Xbox Series X-Samurai Shodown Enhanced Se GAME NUOVO;24,34 EUR;+ 3,00 EUR de envío;Vendidos  16 sep 2021Artículo vendido;desde Reino Unido;
Samurai Shodown Sen-Microsoft XBOX 360 Juego-PAL + Manual;11,69 EUR;Envío no especificado;Vendidos  7 dic 2021Artículo vendido;desde Reino Unido;
Samurai Shodown snes super nintendo juego bien Action juego lucha juego módulo Game;22,90 EUR;Envío no especificado;Vendidos  14 nov 2021Artículo vendido;desde Alemania;
Samurai Shodown (switch) de Deep Silver | Game | estado bien;23,54 EUR;Envío no especificado;Vendidos  29 nov 2021Artículo vendido;desde Alemania;
Switch-Samurai Shodown: NeoGeo Collection /Switch GAME NUOVO;30,42 EUR;+ 3,00 EUR de envío;Vendidos  3 nov 2021Artículo vendido;desde Reino Unido;
