Samurai Shodown Game Boy Game with Original Box and Instructions;129,99 EUR;+8,00 EUR shipping;from Germany;
New ListingSamurai Shodown Nintendo Game Boy  Brand New Very Rare;1.062,93 EUR;+17,72 EUR shipping;from Russian Federation;
Nintendo Gameboy-Samurai Shodown-OVP-Top-PAL;129,90 EUR;Shipping not specified;from Germany;
Samurai Shodown Nintendo Gameboy Complete USA Version ;109,95 EUR;+32,30 EUR shipping;from Netherlands;
Nintendo Game Boy, Samurai Shodown incl. Original box and instructions, DMG-X4-NOE;149,95 EUR;Shipping not specified;from Germany;
Samurai Shodown Nintendo Gameboy OVP CIB Boxed;109,90 EUR;Shipping not specified;from Germany;
Samurai Shodown – Nintendo Gameboy only Module Rare RPG Role Play Ninja;24,00 EUR;Shipping not specified;from Germany;
 gameboy Repro Custom box Samurai Shodown;5,00 EUR;Shipping not specified;from Italy;
Game Boy Samurai Shodown Spirit Japan GameBoy GB game US Seller;9,74 EUR;+4,87 EUR shipping;from United States;
Game Boy Samurai Shodown;1.328,67 EUR;+17,72 EUR shipping;from Mexico;
Samurai Shodown Nintendo Game Boy TESTED WORKING;23,03 EUR;Free shipping;from United States;
Samurai Shodown (Nintendo Gameboy 1993) USED Loose Tested;26,57 EUR;Free shipping;from United States;
Samurai Shodown (Game Boy, 1993);35,43 EUR;+4,61 EUR shipping;from United States;
Samurai Shodown III: Blades of Blood GAME BOY Japan Ver.;120,18 EUR;+17,72 EUR shipping;from Japan;
Samurai Shodown (Nintendo Gameboy 1993) USED;27,76 EUR;+3,53 EUR shipping;from United States;
Gameboy Nettou Samurai Shodown Iii No Box Only Cartridge;43,03 EUR;+17,72 EUR shipping;from Japan;
Samurai Shodown Nintendo Game Boy GB SPIRITS JAPAN;51,82 EUR;+15,94 EUR shipping;from Japan;
GAME BOY THE BEST Guide 1997 Book Catalog KOF96 Pokemon Samurai Shodown 3 GB31*;69,98 EUR;+22,14 EUR shipping;from Japan;
Samurai Shodown Nintendo Switch UK Game **FREE UK POST**;29,26 EUR;+10,54 EUR shipping;from United Kingdom;
PlayStation 4-Samurai Shodown: NeoGeo Collection /PS4 (UK IMPORT) GAME NEW;27,24 EUR;+3,42 EUR shipping;from United Kingdom;
Samurai Shodown Anthology Sony PSP Game PlayStation Portable Disk Only;22,10 EUR;+7,09 EUR shipping;from Bulgaria;
Samurai Shodown  PS4 Game - NEW & SEALED - FREE UK POSTAGE;30,32 EUR;+11,71 EUR shipping;from United Kingdom;
Samurai Shodown PS4 Brand New Sealed Video Game. German case English in game.;25,75 EUR;+17,39 EUR shipping estimate;from United Kingdom;
Samurai Shodown Anthology for Sony PSP * BOXED *;37,95 EUR;+10,00 EUR shipping;from Germany;
Xbox Series X-Samurai Shodown Enhanced Se (UK IMPORT) GAME NEW;24,13 EUR;+3,42 EUR shipping;from United Kingdom;
PlayStation 4-Samurai Shodown: NeoGeo Collection /PS4 GAME NUOVO;29,12 EUR;+3,00 EUR shipping;from United Kingdom;
Xbox Series X-Samurai Shodown Enhanced Se GAME NEUF;25,51 EUR;+4,00 EUR shipping;from United Kingdom;
Samurai Shodown V Special Limited Run Game #328 (Sony Playstation 4) NEW Ps4 SNK;79,95 EUR;+21,99 EUR shipping;from Germany;
Samurai Shodown 2 Neo Geo Pocket Color Game SNK;32,66 EUR;+19,86 EUR shipping estimate;from United Kingdom;
Xbox Series X-Samurai Shodown Enhanced Se GAME NUOVO;25,80 EUR;+3,00 EUR shipping;from United Kingdom;
Nintendo Switch-Samurai Shodown: NeoGeo Collection /Switch (UK IMPORT) GAME NEW;51,50 EUR;+3,42 EUR shipping;from United Kingdom;
PlayStation 4-Samurai Shodown: NeoGeo Collection /PS4 GAME NEUF;28,79 EUR;+4,00 EUR shipping;from United Kingdom;
Neo Geo CD game Samurai Shodown 3: Blades of Blood JAPAN boxed, Manual;23,41 EUR;+17,33 EUR shipping estimate;from United Kingdom;
Samurai Shodown NeoGeo Collection Nintendo Switch Game Pixnlove Exclusive Cover;52,70 EUR;+22,89 EUR shipping estimate;from United Kingdom;
Neo Geo CD game - Samurai Shodown 4: Amakusa's Revenge JAP boxed  MINT CONDITION;51,37 EUR;Free International Shipping;from Germany;
Samurai Shodown Neogeo Collection | Nintendo Switch | Video Game;43,76 EUR;Shipping not specified;from United Kingdom;
Nintendo Switch-Samurai Shodown: NeoGeo Collection /Switch GAME NUOVO;54,98 EUR;+3,00 EUR shipping;from United Kingdom;
Nintendo Switch-Samurai Shodown: NeoGeo Collection /Switch GAME NEUF;54,31 EUR;+4,00 EUR shipping;from United Kingdom;
Samurai Shodown: NeoGeo Collection for Sony Playstation 4 PS4 Video Game;29,33 EUR;Shipping not specified;from United Kingdom;
Samurai Shodown 5 V Playstation 2 PS2 FR Box, game in english;23,00 EUR;+12,50 EUR shipping;from France;
Nintendo SNES game Samurai Shodown US boxed;81,96 EUR;Free International Shipping;from Germany;
Nintendo SNES game - Samurai Shodown US boxed;69,97 EUR;Free International Shipping;from Germany;
Nintendo SNES game - Samurai Shodown US boxed;75,86 EUR;+54,67 EUR shipping;from Germany;
- Samurai Shodown CD Replacement Spare Game Case + Box Art Work Cover Only;4,67 EUR;+2,33 EUR shipping;from United Kingdom;
