Tenjin Kaisen Mercenary Force Jeu Nintendo Game Boy  Version NTSC-J (Japon);6,99 EUR;+ 3,00 EUR de envío;desde Francia;
Mercenary Force Game Boy cartuccia Nintendo;12,00 EUR;+ 25,00 EUR de envío;desde Italia;
Mercenary Force Nintendo Game Boy Pal;35,00 EUR;+ 5,00 EUR de envío;desde Italia;
Nintendo Game Boy - Mercenary Force - USA;24,99 EUR;+ 4,60 EUR de envío;desde Francia;
Mercenary Force Manuel - Instruction Booklet Game Boy FAH ;15,00 EUR;Envío internacional gratis;desde Francia;
Mercenary Force (Nintendo Game Boy, 1990) Cartridge Only;15,23 EUR;+ 2,77 EUR de envío;desde Canadá;
Genuine Gameboy Game Boy Mercenary Force AUS PAL Free Postage;20,36 EUR;+ 15,13 EUR de envío;desde Australia;
Mercenary Force (Nintendo Game Boy, 1990);18,68 EUR;+ 8,30 EUR de envío;desde Canadá;
Mercenary Force -  Gameboy - Cart Only - NTSC ASI;6,27 EUR;+ 14,50 EUR de envío;desde Australia;
Mercenary Force Nintendo Gameboy Authentic Tested With Manual Mint Condition;45,00 EUR;+ 9,80 EUR de envío;desde Países Bajos;
Mercenary Force Gameboy Game **USED;15,76 EUR;+ 3,15 EUR de envío;desde Australia;
Nintendo GameBoy - Mercenary Force / Tenjin Kaisen Japan;17,65 EUR;+ 9,46 EUR de envío;desde Australia;
