Bram Stoker's Dracula Nintendo Game Boy Juego Con Caja Y Folleto Completo En Caja;115,24 EUR;+ 17,73 EUR de envío;desde Alemania;
Nintendo Gameboy Bram Stoker's Dracula solo Carro Original.;29,29 EUR;+ 17,58 EUR de envío;desde Reino Unido;
Bram Stoker's Dracula (Nintendo Game Boy Gameboy) Completo en Caja buena forma;130,31 EUR;Envío gratis;desde Estados Unidos;
Bram Stoker's Dracula Nintendo Gameboy solo Manual ~ Juego Folleto de instrucciones;9,75 EUR;Envío gratis;desde Estados Unidos;
Bram Stoker's Dracula Nintendo Gameboy probado funciona sólo juego;22,15 EUR;Envío gratis;desde Estados Unidos;
Bram Stoker's Dracula Nintendo Gameboy probado obras de juego copia de alquiler;22,15 EUR;Envío gratis;desde Estados Unidos;
Bram Stoker's Dracula - Nintendo Game Boy;20,76 EUR;+ 9,70 EUR de envío;desde Canadá;
Nuevo anuncioBram Stoker's Dracula-Sega Mega Drive Juego (probado-Envío Rápido-Pal);46,82 EUR;+ 19,26 EUR de envío estimado;desde Reino Unido;
Bram Stoker's Dracula-Sega Game Gear-PAL-solo carro;23,43 EUR;+ 17,35 EUR de envío estimado;desde Reino Unido;
Super Nintendo SNES - Bram Stoker's Dracula - PAL - FAH;129,99 EUR;+ 26,20 EUR de envío;desde Francia;
Snes super nintendo juego Bram Stoker's Dracula con embalaje original y guía ukv;89,90 EUR;+ 8,99 EUR de envío;desde Alemania;
SNES Super Nintendo Bram Stoker's Dracula con embalaje original y guía NTSC EE. UU.;89,90 EUR;+ 8,99 EUR de envío;desde Alemania;
Nintendo NES Bram Stoker's Dracula FRA Très Bon état;59,90 EUR;+ 14,98 EUR de envío;desde Francia;
SEGA MASTER sistema-Bram Stoker's Dracula Complete Boxed UK PAL Juego (en muy buen estado);43,07 EUR;+ 21,53 EUR de envío estimado;desde Reino Unido;
Sega Game Gear-Bram Stoker's Dracula;29,24 EUR;+ 17,47 EUR de envío estimado;desde Reino Unido;
Nes juego nintendo-Bram Stoker's Dracula-PAL B-germano-rar-Top - en su embalaje original;359,90 EUR;Envío no especificado;desde Alemania;
Bram Stoker's Dracula Nintendo NES Cartridge Only ;45,00 EUR;+ 29,50 EUR de envío;desde Países Bajos;
Super Nintendo Bram Stoker's Dracula FAH Très Bon état;29,90 EUR;+ 14,98 EUR de envío;desde Francia;
Super Nintendo-Bram Stoker's Dracula - 1992-Sony Image Soft-SNES módulo;35,99 EUR;+ 8,90 EUR de envío;desde Alemania;
Nuevo anuncioDrácula Bram Stoker's Dracula-SNES Super Nintendo solo carro 🌟 🌟 🌟 Raro;46,87 EUR;+ 21,95 EUR de envío estimado;desde Reino Unido;
Bram Stoker's Dracula-SNES Super Nintendo solo carro;35,10 EUR;+ 17,60 EUR de envío estimado;desde Reino Unido;
SNES-Bram Stoker's Dracula - (OVP, con instrucciones);69,95 EUR;+ 9,95 EUR de envío;desde Alemania;
Bram Stoker's Dracula Super Nintendo;25,00 EUR;+ 5,50 EUR de envío;desde Francia;
SEGA Master System - Bram Stoker's Dracula - PAL;69,99 EUR;+ 26,20 EUR de envío;desde Francia;
# Sega Mega Drive-Bram Stoker's Dracula (solo módulo, sin OVP/unboxed) #;34,99 EUR;+ 8,00 EUR de envío;desde Alemania;
Bram Stoker's Dracula Para Super Nintendo (SNES) NTSC, American, en Caja, Probado;29,30 EUR;+ 21,22 EUR de envío estimado;desde Reino Unido;
Bram Stoker's Dracula Game Gear Spiel #4060;23,99 EUR;+ 16,09 EUR de envío;desde Suiza;
Bram Stoker's Dracula región libre (4K) Blu Ray de transferencia;15,03 EUR;Envío internacional gratis;desde Finlandia;
Bram Stoker's Dracula DVD 1992 Vampire Horror Movie 2-Disc Collector's Edition;9,96 EUR;+ 4,69 EUR de envío;desde Reino Unido;
Bram Stoker's Dracula UKV -Super Nintendo - SNES;29,71 EUR;+ 19,95 EUR de envío;desde Países Bajos;
Bram Stoker's Dracula Sega Genesis Mega Drive.;15,06 EUR;+ 5,32 EUR de envío;desde Rusia;
Bram Stoker's Dracula para PC CD-ROM * PSYGNOSIS limitada * 1995 * Raro *;52,73 EUR;+ 22,08 EUR de envío estimado;desde Reino Unido;
Bram Stoker's Dracula DVD Thriller & Mystery (2007) Gary Oldman;2,80 EUR;+ 11,71 EUR de envío;desde Reino Unido;
Bram Stoker's Dracula (Blu-Ray), new sealed, collectors edition;14,05 EUR;+ 17,15 EUR de envío estimado;desde Reino Unido;
Bram Stoker's Dracula 4K Año + Blu Ray;29,21 EUR;Envío internacional gratis;desde Finlandia;
Bram Stoker's Dracula (1992) - Keanu Reeves, Gary Oldman - NEW / SEALED UK DVD;4,68 EUR;+ 16,95 EUR de envío estimado;desde Reino Unido;
Bram Stoker's Dracula (new & sealed DVD / Francis Ford Coppola 1992);6,79 EUR;+ 2,93 EUR de envío;desde Reino Unido;
Bram Stoker's Dracula Blu Ray UK Release;7,02 EUR;+ 16,99 EUR de envío estimado;desde Reino Unido;
Bram Stoker's Dracula (1992) Brand New & Sealed ;4,63 EUR;+ 16,95 EUR de envío estimado;desde Reino Unido;
Bram Stoker's Dracula 25th Anniversary 2 Disc 4K UHD Blu-ray Horror Classic Cult;18,74 EUR;+ 17,25 EUR de envío estimado;desde Reino Unido;
Bram Stoker's Dracula Widescreen DVD Jewel Case Gary Oldman Keanu Reeves;4,10 EUR;+ 23,74 EUR de envío estimado;desde Reino Unido;
Bram Stoker's Dracula The Film and the Legend Francis Ford Coppola & James Hart;12,88 EUR;+ 17,12 EUR de envío estimado;desde Reino Unido;
Bram Stoker's Dracula, [DVD] VGC;5,85 EUR;+ 10,55 EUR de envío;desde Reino Unido;
Bram Stoker's Dracula ~ Blu-ray Steelbook ~ Project Pop Art  ~  New & Sealed;58,54 EUR;+ 21,33 EUR de envío estimado;desde Reino Unido;
