Alleyway UKV-1 Game Boy complet ;59,00 EUR;Envío internacional gratis;desde Francia;
Alleyway Jeu Nintendo Game Boy GB Version PAL NOE;10,99 EUR;+ 3,00 EUR de envío;desde Francia;
Vintage Alleyway Nintendo Game Boy Juego 1990 En Caja Usado + Iva;12,88 EUR;+ 36,07 EUR de envío estimado;desde Reino Unido;
game boy classic Nintendo Alleyway Box Completo Mattel;69,99 EUR;Envío no especificado;desde Italia;
Genuine Alleyway de vídeo juego para Nintendo Game Boy japonés Probado;7,02 EUR;+ 16,99 EUR de envío estimado;desde Reino Unido;
Game Boy-Alleyway-DMG-aw - noe-OVP & instrucciones cib Nintendo Gameboy Top;49,95 EUR;Envío no especificado;desde Alemania;
Alleyway Game Boy Japan;5,00 EUR;+ 10,00 EUR de envío;desde Italia;
Nuevo anuncioGame Boy Alleyway Juego;11,71 EUR;+ 19,24 EUR de envío estimado;desde Reino Unido;
Nintendo Game Boy Alleyway PAL Reino Unido Gameboy en muy buena condición;23,32 EUR;+ 14,65 EUR de envío;desde Reino Unido;
Alleyway (Game Boy GB 1989) Solo Cartucho;14,90 EUR;+ 12,90 EUR de envío;desde España;
Nintendo Gameboy Alleyway en Caja con Manual Gwo libre poste del Reino Unido;23,43 EUR;+ 17,35 EUR de envío estimado;desde Reino Unido;
Alleyway Nintendo Gameboy Juego 💯% Genuino Probado;8,19 EUR;+ 17,03 EUR de envío estimado;desde Reino Unido;
Alleyway (Game Boy GB 1989) Usa Import;14,90 EUR;+ 9,90 EUR de envío;desde España;
Alleyway Nintendo Gameboy Japonés Original Cartucho De Juego DMG-Awa #2;5,85 EUR;+ 16,97 EUR de envío estimado;desde Reino Unido;
Alleyway Game Boy Spiel #880;23,99 EUR;+ 16,09 EUR de envío;desde Suiza;
Alleyway | Game Boy Color | GBA | usado solo módulo;11,99 EUR;+ 15,00 EUR de envío;desde Alemania;
Nintendo Gameboy Game: Alleyway [PAL] (Complete) [FAH];44,95 EUR;+ 25,00 EUR de envío;desde Países Bajos;
Alleyway | Nintendo Gameboy | solo módulo | estado muy bien;11,90 EUR;+ 35,00 EUR de envío;desde Alemania;
Alleyway Nintendo Game Boy Cartucho sólo Libre P&P;7,02 EUR;+ 16,99 EUR de envío estimado;desde Reino Unido;
Alleyway Nintendo Game Boy Loose;5,00 EUR;+ 35,00 EUR de envío;desde Italia;
Alleyway Nintendo Gameboy Juego;8,19 EUR;+ 17,03 EUR de envío estimado;desde Reino Unido;
Alleyway Nintendo Gameboy Japonés Original Cartucho De Juego DMG-Awa #1;5,85 EUR;+ 16,97 EUR de envío estimado;desde Reino Unido;
Gb-Alleyway para Nintendo GameBoy;12,95 EUR;+ 9,95 EUR de envío;desde Alemania;
Alleyway - Nintendo GameBoy - NGB;3,95 EUR;+ 19,95 EUR de envío;desde Países Bajos;
Alleyway Gameboy (solo carro);5,80 EUR;+ 16,97 EUR de envío estimado;desde Reino Unido;
Alleyway - Nintendo GameBoy - NGB - JP;14,95 EUR;+ 19,95 EUR de envío;desde Países Bajos;
Alleyway Nintendo Gameboy juego función probado;5,99 EUR;+ 9,99 EUR de envío;desde Alemania;
