Nintendo Game Boy * Wario Land II * EMBALAJE ORIGINAL CiB instrucciones AW2E-EE. UU.;129,95 EUR;+ 6,70 EUR de envío;desde Alemania;
Nintendo Game Boy Color juego Wario Land II 2 con embalaje original y guía EUR;249,90 EUR;+ 36,99 EUR de envío;desde Alemania;
Wario Land II Nintendo Game Boy;19,90 EUR;+ 5,50 EUR de envío;desde Francia;
Nintendo Game Boy Color juego Wario Land II módulo EUR;39,90 EUR;+ 8,99 EUR de envío;desde Alemania;
Nintendo Game Boy Color - Wario Land II [Retro game vintage Mario '90s];190,00 EUR;Envío no especificado;desde Italia;
Nintendo Game Boy Classic juego Wario Land II 2 módulo EUR;34,90 EUR;+ 8,99 EUR de envío;desde Alemania;
Wario Land II 2 Nintendo Gameboy Color Advance Juego, Genuine! solo carro L @ @ K;25,69 EUR;+ 19,52 EUR de envío estimado;desde Reino Unido;
Nintendo Game Boy Classic juego Wario Land II 2 con embalaje original y guía EE. UU.;159,90 EUR;+ 36,99 EUR de envío;desde Alemania;
Wario Land II 2 Nintendo Game Boy Color GBC Jap NTSC;41,00 EUR;+ 27,00 EUR de envío;desde Francia;
Wario Land II (2) sur Gameboy et gameboy Advance !!!!;25,99 EUR;+ 5,99 EUR de envío;desde Francia;
Nintendo Gameboy Pocket Blue azul fah Donkey Kong III Wario Land II set;229,90 EUR;+ 36,99 EUR de envío;desde Alemania;
Nintendo Gameboy Juego-Wario Land II 2;18,67 EUR;+ 17,23 EUR de envío estimado;desde Reino Unido;
Nintendo-Game Boy Color-unfolded Brand New "Wario Land II" boxes-rar;79,99 EUR;+ 30,00 EUR de envío;desde Alemania;
Nintendo Gameboy Juego-Wario Land II 2;18,67 EUR;+ 17,23 EUR de envío estimado;desde Reino Unido;
Gameboy Wario Land II CARTUCHO Gwo Gratis Reino Unido franqueo;17,54 EUR;+ 17,20 EUR de envío estimado;desde Reino Unido;
Japonés Nintendo Gameboy-DMG-AW2J - Wario Land II 2;13,65 EUR;+ 17,12 EUR de envío estimado;desde Reino Unido;
Juego Wario Land II 2 Nintendo Gameboy Color GBC PAL Original Cartucho Cartridge;27,00 EUR;+ 37,00 EUR de envío;desde España;
Nintendo Gameboy Color juego-Wario Land II (2) (módulo) 11191483;34,99 EUR;+ 67,99 EUR de envío;desde Alemania;
