Juego de caracteres de Pijamas Para Hombre Salón conjunto oficial de Star Wars Animal PJ S M L XL;11,13 EUR a 16,16 EUR;+ 22,13 EUR de envío estimado;Vendidos  3 dic 2021Artículo vendido;desde Reino Unido;
Lego Star Wars Video Game-Game Boy Advance-módulo-Nintendo-GameBoy GBA;8,29 EUR;Envío no especificado;Vendidos  3 dic 2021Artículo vendido;desde Alemania;
Lego Star Wars * NINTENDO GAMEBOY ADVANCE SP DS 100% Genuino;7,01 EUR;+ 16,99 EUR de envío estimado;Vendidos  3 dic 2021Artículo vendido;desde Reino Unido;
LEGO Star Wars The Video Game En Boite - GameBoy Advance GBA - Complet - TBE;29,90 EUR;+ 34,95 EUR de envío;Vendidos  2 dic 2021Artículo vendido;desde Francia;
Nintendo GAME BOY ADVANCE Lote: Hot Wheels Sims coches Power Rangers Nemo Star Wars;22,27 EUR;+ 18,49 EUR de envío estimado;Vendidos  2 dic 2021Artículo vendido;desde Reino Unido;
Lego Star Wars The Video Game-Game Boy Advance-flojo Cartucho Y Manual;6,55 EUR;+ 5,57 EUR de envío;Vendidos  2 dic 2021Artículo vendido;desde Reino Unido;
11 juegos para Game Boy Classic, Advance & Color Harvest Moon Star Wars Tetris...;16,80 EUR;Envío no especificado;Vendidos  1 dic 2021Artículo vendido;desde Alemania;
Star Wars El Imperio Contraataca juego para Game Boy. en Caja;33,99 EUR;+ 21,68 EUR de envío estimado;Vendidos  1 dic 2021Artículo vendido;desde Reino Unido;
Lego Star Wars The Complete Saga Xbox 360 Juego Niños Niñas Niños Marron;7,02 EUR;+ 19,29 EUR de envío estimado;Vendidos  30 nov 2021Artículo vendido;desde Reino Unido;
Star Wars l'Empire Contre-Attaque Game Boy FAH ;15,00 EUR;Envío internacional gratis;Vendidos  30 nov 2021Artículo vendido;desde Francia;
3x Gameboy Advance Juegos Lego El Señor De Los Anillos Star Wars;8,26 EUR;+ 32,65 EUR de envío estimado;Vendidos  29 nov 2021Artículo vendido;desde Reino Unido;
Star Wars Nintendo Gameboy Color Advance Juego Con Manual, Genuine! probado;11,71 EUR;+ 19,43 EUR de envío estimado;Vendidos  29 nov 2021Artículo vendido;desde Reino Unido;
Game Boy Advance-Star Wars-Vuelo Del Halcón;1,17 EUR;+ 20,63 EUR de envío estimado;Vendidos  29 nov 2021Artículo vendido;desde Reino Unido;
Star Wars Juego Boy Advance GBA paquete Falcon Jedi Ataque De Los Clones trilogía;33,93 EUR;+ 9,38 EUR de envío;Vendidos  28 nov 2021Artículo vendido;desde Reino Unido;
Star Wars Episodio III: Revenge of the Sith original Nintendo Gameboy Advance GBA;4,00 EUR;Envío no especificado;Vendidos  27 nov 2021Artículo vendido;desde Alemania;
Gameboy Star Wars-El Imperio contraataca;11,50 EUR;+ 3,70 EUR de envío;Vendidos  27 nov 2021Artículo vendido;desde Alemania;
Star Wars episodio 2 ataque de los clones Nintendo Gameboy Advance Cartucho De Juego;5,22 EUR;+ 16,96 EUR de envío estimado;Vendidos  27 nov 2021Artículo vendido;desde Reino Unido;
Nintendo Gameboy Advance GBA-Star Wars, Harry Potter, Scooby Doo 2, Bob Esponja;15,77 EUR;+ 17,18 EUR de envío estimado;Vendidos  26 nov 2021Artículo vendido;desde Reino Unido;
Star Wars Episode III : La Revanche des Sith - Game Boy Advance;45,00 EUR;Envío internacional gratis;Vendidos  26 nov 2021Artículo vendido;desde Francia;
Nintendo Gameboy En Caja-Scooby Doo, Harry Potter, Atlantis & Lego Star Wars;26,32 EUR;+ 17,42 EUR de envío estimado;Vendidos  26 nov 2021Artículo vendido;desde Reino Unido;
Star Wars Original Nintendo Gameboy. probado y funcionando. MBC PAL;10,54 EUR;+ 18,20 EUR de envío estimado;Vendidos  25 nov 2021Artículo vendido;desde Reino Unido;
2 X N64 Universo Nintendo Gameboy Nintendo Poster-Mario Wario Kirby Star Wars;17,52 EUR;+ 17,23 EUR de envío estimado;Vendidos  25 nov 2021Artículo vendido;desde Reino Unido;
Nintendo Game Boy Classic juego Star Wars con embalaje original y guía Noe;79,90 EUR;+ 8,99 EUR de envío;Vendidos  24 nov 2021Artículo vendido;desde Alemania;
Nintendo Gameboy Advance Star Wars el vuelo del halcón Juego Y Manual;5,86 EUR;+ 34,75 EUR de envío estimado;Vendidos  24 nov 2021Artículo vendido;desde Reino Unido;
Star Wars Gameboy Carro/Caja/manual de #0036;5,86 EUR;+ 34,98 EUR de envío estimado;Vendidos  23 nov 2021Artículo vendido;desde Reino Unido;
Nintendo Game Boy Color: Verde + 2 Juegos Dr Mario & Star Wars Racer Paquete de Estuche;76,17 EUR;+ 37,08 EUR de envío estimado;Vendidos  21 nov 2021Artículo vendido;desde Reino Unido;
Star Wars: el nuevo ejército droide-Gameboy Advance-GBA (solo Cartucho);4,63 EUR;+ 4,69 EUR de envío;Vendidos  21 nov 2021Artículo vendido;desde Reino Unido;
Nintendo Gameboy Color Star Wars episodio 1 Racer;5,50 EUR;Envío no especificado;Vendidos  20 nov 2021Artículo vendido;desde Alemania;
Star Wars vuelo del halcón (Nintendo Game Boy Advance, 2003) Sellado De Fábrica;41,02 EUR;+ 32,58 EUR de envío estimado;Vendidos  19 nov 2021Artículo vendido;desde Reino Unido;
Star Wars Jedi power battles per Nintendo-Game Boy Advance;30,00 EUR;+ 14,50 EUR de envío;Vendidos  19 nov 2021Artículo vendido;desde Italia;
Star Wars Trilogy apprentice of the force juego módulo Nintendo Gameboy Advance;7,90 EUR;+ 5,20 EUR de envío;Vendidos  19 nov 2021Artículo vendido;desde Alemania;
Star Wars Nintendo Game Boy Cartucho sólo Libre P&P;5,85 EUR;+ 16,97 EUR de envío estimado;Vendidos  19 nov 2021Artículo vendido;desde Reino Unido;
Star Wars Gameboy;11,71 EUR;+ 20,03 EUR de envío estimado;Vendidos  18 nov 2021Artículo vendido;desde Reino Unido;
