Star Wars: Flight of the Falcon (Nintendo Game Boy Advance, 2005);19,95 EUR;+13,90 EUR de env칤o;desde Alemania;
Star Wars-Nintendo Gameboy Game Boy GB-Cartucho Y Estuche;9,36 EUR;+ 17,03 EUR de env칤o estimado;desde Reino Unido;
Star Wars Game Boy - Sealled - NEW;400,00 EUR;+25,00 EUR de env칤o;desde Espa침a;
Original Nintendo Game Boy Star Wars Edition-trabajo-Raro;760,70 EUR;+ 56,33 EUR de env칤o estimado;desde Reino Unido;
Star Wars: el imperio contraataca (French)/Nintendo Game Boy m칩dulo & Case;25,99 EUR;+6,90 EUR de env칤o;desde Alemania;
Star Wars return of the Jedi Game Boy juego con embalaje original y gu칤a;109,99 EUR;+8,00 EUR de env칤o;desde Alemania;
Star Wars-Nintendo Gameboy Game Boy GB-Cartucho Y Estuche;10,52 EUR;+ 17,05 EUR de env칤o estimado;desde Reino Unido;
Lego Star Wars II la trilog칤a original juego Nintendo Game Boy Advance GBA SP;11,12 EUR;+17,55 EUR de env칤o;desde Reino Unido;
Nintendo Game Boy Color Star Wars Episode 1 Obi-Wan's Adventures GBC Vers. EUR  ;35,90 EUR;Env칤o no especificado;desde Francia;
Nintendo Game Boy-Super Star Wars-Return of the Jedi-nuevo-en su embalaje original VGA Ready;1.199,90 EUR;Env칤o no especificado;desde Alemania;
Star Wars para Nintendo Gameboy CIB en Caja;33,88 EUR;+ 17,55 EUR de env칤o estimado;desde Reino Unido;
Star Wars episodio 1 Racer Nintendo Game Boy Color BOXED PAL;46,80 EUR;+ 17,82 EUR de env칤o estimado;desde Reino Unido;
Lego Star Wars: The Video Game | Game Boy Advance GBA | Completo | EUR;15,20 EUR;+ 17,14 EUR de env칤o estimado;desde Reino Unido;
Star Wars Yoda historias Nintendo Game Boy Color Original (solo carro);11,69 EUR;+2,93 EUR de env칤o;desde Reino Unido;
Star Wars El Imperio Contraataca Premium Edition Juegos Game Boy Limited Run;116,97 EUR;+ 24,26 EUR de env칤o estimado;desde Reino Unido;
Star Wars Jedi Power Battles * Nintendo Game Boy Advance * muy bien probado *;13,41 EUR;+5,99 EUR de env칤o;desde Alemania;
Game Boy Color * Star Wars: Yoda Stories * Wata 9.8 a + + no VGA;2.999,95 EUR;+35,99 EUR de env칤o;desde Alemania;
Star Wars The Empire Strikes Back Game boy PAL UK Cartucho Envio Combinado ;22,90 EUR;+9,90 EUR de env칤o;desde Espa침a;
Nintendo Game Boy - Star Wars - USA;12,99 EUR;+5,00 EUR de env칤o;desde Francia;
Nintendo Game Boy Super Star Wars Return Of The Jedi 游빊Poster Inc.游빊;99,95 EUR;+32,30 EUR de env칤o;desde Pa칤ses Bajos;
Nintendo Gameboy Game Boy Carro de video juego de juego de Star Wars;14,03 EUR;+9,36 EUR de env칤o;desde Reino Unido;
Star Wars-Nintendo Game Boy-PAL-SOLO Carro-Funcionando-ukfreepost;10,47 EUR;+ 17,05 EUR de env칤o estimado;desde Reino Unido;
Nintendo Game Boy-Star Wars The Empire Strikes Back-limited run Games-nuevo;98,99 EUR;+25,00 EUR de env칤o;desde Alemania;
Star Wars - Nintendo GameBoy Classic #164;18,89 EUR;+2,99 EUR de env칤o;desde Alemania;
Lego Star Wars II 2 Game Boy Advance Juego! busque en la tienda!;25,69 EUR;+ 17,38 EUR de env칤o estimado;desde Reino Unido;
Lego Star Wars 2 Gameboy Advance Nintendo En Caja Completa PAL;29,25 EUR;+ 17,45 EUR de env칤o estimado;desde Reino Unido;
Nintendo Game Boy Classic juego Super Star Wars m칩dulo EUR;19,90 EUR;+8,99 EUR de env칤o;desde Alemania;
