Nintendo Game Boy-Trax-Top-Embalaje original-us;599,90 EUR;Envío no especificado;desde Alemania;
Trax cómo jugar instrucciones Manuale di-Nintendo Gameboy Classic Game Boy;14,99 EUR;Envío no especificado;desde Alemania;
Trax Para Nintendo Game Boy GB PROBADO FUNCIONANDO VER FOTOS solo carro;39,70 EUR;Envío gratis;desde Estados Unidos;
Juego NINTENDO GAMEBOY GAME BOY Trax;26,46 EUR;Envío gratis;desde Estados Unidos;
Trax-Nintendo Game Boy-Completo en Caja Completo En Caja;216,16 EUR;+ 7,37 EUR de envío;desde Estados Unidos;
Trax (Game Boy, 1991) Ultra Raro Sellado protegido NINTENDO Kirby Hal Labs;441,15 EUR;Envío gratis;desde Estados Unidos;
Tanque de ponkotsu TOTSUGEKI (Nintendo Game Boy) HAL Laboratory Trax completa Cartucho en Caja;167,63 EUR;+ 3,97 EUR de envío;desde Estados Unidos;
Trax (Nintendo Gameboy, 1991) Auténtico Raro Excelente Estado Con Estuche;40,58 EUR;+ 3,93 EUR de envío;desde Estados Unidos;
Trax Nintendo Gameboy 1991 auténtico USA Gameboy juego MB;35,28 EUR;+ 3,97 EUR de envío;desde Estados Unidos;
Trax Game Boy Gb;441,15 EUR;+ 17,65 EUR de envío;desde México;
