Game Boy-Animaniacs;8,95 EUR;Envío no especificado;Vendidos  9 nov 2021Artículo vendido;desde Alemania;
Paquete De Juegos NINTENDO GAMEBOY Animaniacs Dr Franken Jorobado Persia Juego BOY USA;82,30 EUR;+ 23,62 EUR de envío estimado;Vendidos  8 nov 2021Artículo vendido;desde Reino Unido;
Animaniacs Gameboy juego probado como trabajando. cartucho sólo;6,47 EUR;+ 5,88 EUR de envío;Vendidos  23 oct 2021Artículo vendido;desde Reino Unido;
Nintendo Game Boy Juegos Lote 3 Animaniacs, Warioland 2, Worms Armageddon;24,74 EUR;+ 4,68 EUR de envío;Vendidos  29 nov 2021Artículo vendido;desde Estados Unidos;
Animaniacs auténtico Nintendo GameBoy Game Boy Original Juego Clásico;16,76 EUR;Envío gratis;Vendidos  26 nov 2021Artículo vendido;desde Estados Unidos;
Genuine probado trabajando-Animaniacs Nintendo Game Boy;3,97 EUR;+ 4,02 EUR de envío;Vendidos  24 nov 2021Artículo vendido;desde Estados Unidos;
Animaniacs (Nintendo Game Boy, 1995) auténtico Nintendo ￼;7,73 EUR;Envío gratis;Vendidos  11 nov 2021Artículo vendido;desde Estados Unidos;
Nintendo Game Boy Gameboy Pocket-Carcasa Roja y Animaniacs juego funciona!;35,34 EUR;+ 7,07 EUR de envío;Vendidos  3 nov 2021Artículo vendido;desde Estados Unidos;
Animaniacs (Nintendo Game Boy, 1995) Auténtico Probado;14,13 EUR;Envío gratis;Vendidos  28 oct 2021Artículo vendido;desde Estados Unidos;
Animaniacs - (Nintendo Game Boy, GB, 1995) Cartucho y Manual Probado;22,08 EUR;Envío gratis;Vendidos  15 oct 2021Artículo vendido;desde Estados Unidos;
Animaniacs Nintendo Gameboy Cartucho De Juego;3,76 EUR;+ 3,93 EUR de envío;Vendidos  3 oct 2021Artículo vendido;desde Estados Unidos;
Animaniacs Nintendo Gameboy 1995 Cart Only * Authentic tested * Free Shipping;13,77 EUR;+ 4,82 EUR de envío;Vendidos  1 oct 2021Artículo vendido;desde Canadá;
Animaniacs (Nintendo Game Boy, 1995);12,33 EUR;Envío gratis;Vendidos  25 sep 2021Artículo vendido;desde Estados Unidos;
Animaniacs (Nintendo Game Boy, 1995) auténtico Nintendo ￼;5,30 EUR;+ 3,93 EUR de envío;Vendidos  13 sep 2021Artículo vendido;desde Estados Unidos;
Animaniacs Nintendo Original Nintendo Game Boy * forma agradable * más difícil encontrar!;20,30 EUR;Envío gratis;Vendidos  8 sep 2021Artículo vendido;desde Estados Unidos;
Animaniacs Nintendo Game Boy, 1995-Auténtico Original Con Estuche Protector;15,90 EUR;Envío gratis;Vendidos  4 sep 2021Artículo vendido;desde Estados Unidos;
