Nintendo Game Boy *Animaniacs* OVP CiB Funda protectora manual ANCP-EUR;44,95 EUR;+ 6,70 EUR de envío;Vendidos  7 dic 2021Artículo vendido;desde Alemania;
Game Boy-Animaniacs;8,95 EUR;Envío no especificado;Vendidos  9 nov 2021Artículo vendido;desde Alemania;
Paquete De Juegos NINTENDO GAMEBOY Animaniacs Dr Franken Jorobado Persia Juego BOY USA;81,91 EUR;+ 23,51 EUR de envío estimado;Vendidos  8 nov 2021Artículo vendido;desde Reino Unido;
Animaniacs Gameboy juego probado como trabajando. cartucho sólo;6,44 EUR;+ 5,85 EUR de envío;Vendidos  23 oct 2021Artículo vendido;desde Reino Unido;
Animaniacs (Nintendo Game Boy, 1995) Auténtico probado limpio;8,82 EUR;+ 4,21 EUR de envío;Vendidos  5 dic 2021Artículo vendido;desde Estados Unidos;
Animaniacs-Nintendo Gameboy [Completo En Caja/Cartucho en Caja] -!! envío gratis de prioridad;57,60 EUR;Envío gratis;Vendidos  3 dic 2021Artículo vendido;desde Estados Unidos;
Nintendo Game Boy Juegos Lote 3 Animaniacs, Warioland 2, Worms Armageddon;24,81 EUR;+ 4,70 EUR de envío;Vendidos  29 nov 2021Artículo vendido;desde Estados Unidos;
Animaniacs auténtico Nintendo GameBoy Game Boy Original Juego Clásico;16,81 EUR;Envío gratis;Vendidos  26 nov 2021Artículo vendido;desde Estados Unidos;
Genuine probado trabajando-Animaniacs Nintendo Game Boy;3,98 EUR;+ 4,03 EUR de envío;Vendidos  24 nov 2021Artículo vendido;desde Estados Unidos;
Animaniacs (Nintendo Game Boy, 1995) auténtico Nintendo ￼;7,75 EUR;Envío gratis;Vendidos  11 nov 2021Artículo vendido;desde Estados Unidos;
Nintendo Game Boy Gameboy Pocket-Carcasa Roja y Animaniacs juego funciona!;35,44 EUR;+ 7,09 EUR de envío;Vendidos  3 nov 2021Artículo vendido;desde Estados Unidos;
Animaniacs (Nintendo Game Boy, 1995) Auténtico Probado;14,17 EUR;Envío gratis;Vendidos  28 oct 2021Artículo vendido;desde Estados Unidos;
Animaniacs - (Nintendo Game Boy, GB, 1995) Cartucho y Manual Probado;22,14 EUR;Envío gratis;Vendidos  15 oct 2021Artículo vendido;desde Estados Unidos;
Animaniacs Nintendo Gameboy Cartucho De Juego;3,77 EUR;+ 3,94 EUR de envío;Vendidos  3 oct 2021Artículo vendido;desde Estados Unidos;
Animaniacs Nintendo Gameboy 1995 Cart Only * Authentic tested * Free Shipping;13,94 EUR;+ 4,87 EUR de envío;Vendidos  1 oct 2021Artículo vendido;desde Canadá;
Animaniacs (Nintendo Game Boy, 1995);12,36 EUR;Envío gratis;Vendidos  25 sep 2021Artículo vendido;desde Estados Unidos;
Animaniacs (Nintendo Game Boy, 1995) auténtico Nintendo ￼;5,32 EUR;+ 3,94 EUR de envío;Vendidos  13 sep 2021Artículo vendido;desde Estados Unidos;
