Nintendo Game Boy Mega Man III 3 FAH Très Bon état;49,90 EUR;+ 11,98 EUR de envío;desde Francia;
Nintendo Game Boy - Mega Man III 3 - PAL - FAH;79,99 EUR;+ 24,70 EUR de envío;desde Francia;
Cartucho Mega Man III Nintendo Game Boy ORIGINAL;38,00 EUR;Envío no especificado;desde España;
Nintendo Game Boy Mega Man III UKV Très Bon état;49,90 EUR;+ 14,98 EUR de envío;desde Francia;
Nintendo Gameboy juego-Mega Man III (con embalaje original) - 11116295;699,99 EUR;+ 67,99 EUR de envío;desde Alemania;
Mega Man III 3 Juego de Nintendo Game Boy ? Módulo clásico de GameBoy ?? Aceptable ;28,50 EUR;Envío no especificado;desde Alemania;
