Nintendo Game Boy * True Lies * EMBALAJE ORIGINAL CiB instrucciones ATLP-EUR;99,95 EUR;+ 6,70 EUR de envío;desde Alemania;
Nintendo Game Boy-Juego True Lies-us/Japón-Gameboy-con Estuche-Libre P&P;35,29 EUR;+ 17,68 EUR de envío estimado;desde Reino Unido;
True Lies Nintendo Game Boy juego OVP como nuevo con instrucciones probado;46,99 EUR;+ 7,39 EUR de envío;desde Alemania;
True Lies Nintendo Game Boy Pal Version ;69,00 EUR;Envío no especificado;desde Italia;
Nintendo Game Boy Game True Lies - USA - Gameboy - Genuino - Gratis P&P ;17,64 EUR;+ 17,30 EUR de envío estimado;desde Reino Unido;
NINTENDO GAME BOY-True Lies (2) En Caja;94,09 EUR;Envío internacional gratis;desde Reino Unido;
NINTENDO GAME BOY-True Lies (en Caja);94,09 EUR;Envío internacional gratis;desde Reino Unido;
Notice Nintendo Game Boy True Lies EUR Excellent état;14,90 EUR;+ 11,98 EUR de envío;desde Francia;
Gb-schwarzenegger: True Lies para Nintendo GameBoy;24,95 EUR;+ 9,95 EUR de envío;desde Alemania;
1994 True Lies Snes Game Boy Game Gear Sega Genesis Poster Vintage/AD Enmarcado;32,94 EUR;+ 15,29 EUR de envío;desde Alemania;
Nintendo GameBoy juego - True Lies cartucho usado;21,99 EUR;Envío internacional gratis;desde Alemania;
True Lies Game Boy Folleto de instrucciones;8,24 EUR;+ 17,10 EUR de envío estimado;desde Reino Unido;
True Lies Nintendo Gameboy embalaje original en caja original;50,90 EUR;Envío no especificado;desde Alemania;
True Lies-Manual/instrucciones-GameBoy Classic;14,99 EUR;Envío no especificado;desde Alemania;
Nintendo Game Boy Juego True Lies Juego, Caja Y Manual;31,12 EUR;+ 4,22 EUR de envío;desde Estados Unidos;
True Lies (Nintendo Game Boy, 1995);13,34 EUR;