Jeu Game Boy Color Looney Tunes Racing Complet Comme Neuf avec stickers;43,50 EUR;Envío no especificado;Vendidos  2 dic 2021Artículo vendido;desde Francia;
Looney Tunes: Marciano alerta! - Nintendo Game Boy Color - (solo Cartucho);4,64 EUR;+ 4,70 EUR de envío;Vendidos  22 nov 2021Artículo vendido;desde Reino Unido;
Looney Tunes de nuevo en acción ps2 Juego Niños Niños El Pato Lucas Bugs Bunny Taz Etc;4,69 EUR;+ 19,29 EUR de envío estimado;Vendidos  22 nov 2021Artículo vendido;desde Reino Unido;
Nintendo Looney Tunes Juego Cartucho Gameboy. UKV UK Pal probado y funcionando!;7,04 EUR;+ 18,17 EUR de envío estimado;Vendidos  21 nov 2021Artículo vendido;desde Reino Unido;
Game Boy GB:Looney Tunes [TOP SUNSOFT & 1ERE EDITION] SEUL - USA;9,90 EUR;+ 1,80 EUR de envío;Vendidos  19 nov 2021Artículo vendido;desde Francia;
Looney Tunes-Game Boy-módulo-Nintendo-Gameboy - muy buen estado EXCELENTE;15,99 EUR;Envío no especificado;Vendidos  18 nov 2021Artículo vendido;desde Alemania;
Looney Tunes (Nintendo Gameboy, 1992);5,88 EUR;+ 31,90 EUR de envío estimado;Vendidos  17 nov 2021Artículo vendido;desde Reino Unido;
Looney Tunes Nintendo Gameboy Juego CARTUCHO solo probado libre de Reino Unido P&p Negro Carro;14,09 EUR;+ 17,19 EUR de envío estimado;Vendidos  15 nov 2021Artículo vendido;desde Reino Unido;
Looney Tunes Gameboy UKV RARO CIB #0015;41,07 EUR;+ 21,89 EUR de envío estimado;Vendidos  15 nov 2021Artículo vendido;desde Reino Unido;
Nintendo Gameboy Juegos-Instinto asesino, Looney Tunes & Kirby's Pinball Land;15,82 EUR;+ 17,23 EUR de envío estimado;Vendidos  13 nov 2021Artículo vendido;desde Reino Unido;
Looney Tunes Collector-ataque de Marte-Nintendo Gameboy Color módulo;3,51 EUR;Envío no especificado;Vendidos  7 nov 2021Artículo vendido;desde Alemania;
Looney Tunes carro y carrito manual y gusanos y Manual Gameboy;11,75 EUR;+ 16,69 EUR de envío;Vendidos  7 nov 2021Artículo vendido;desde Reino Unido;
Daffy Duck Looney Tunes | Nintendo Game Boy | Gameboy Classic | aceptable;8,90 EUR;Envío no especificado;Vendidos  6 nov 2021Artículo vendido;desde Alemania;
NINTENDO GAME BOY COLOR / Looney Tunes [ DMG-ALTP-FAH ];5,99 EUR;+ 3,50 EUR de envío;Vendidos  4 nov 2021Artículo vendido;desde Francia;
Gameboy: Daffy Duck. promotion 4 th 4 free Looney Tunes;5,99 EUR;+ 19,99 EUR de envío;Vendidos  31 oct 2021Artículo vendido;desde Países Bajos;
Looney Tunes Juego De Carreras Boy Color En Caja Completa Probada Funcionando GBC Gameboy;49,35 EUR;+ 20,29 EUR de envío estimado;Vendidos  27 oct 2021Artículo vendido;desde Reino Unido;
Tasmania Tazmanian Devil Nintendo Gameboy-isla Chase Looney Tunes 2;15,82 EUR;+ 17,23 EUR de envío estimado;Vendidos  27 oct 2021Artículo vendido;desde Reino Unido;
Nintendo Game Boy Lightboy JOBLOT monopolio Béisbol Looney Tunes Tetris 2 Boggle;17,04 EUR;+ 32,15 EUR de envío estimado;Vendidos  26 oct 2021Artículo vendido;desde Reino Unido;
Looney Tunes coleccionista Marciano Alert-Gameboy Colour/Gameboy Advance/SP;4,11 EUR;+ 31,87 EUR de envío estimado;Vendidos  22 oct 2021Artículo vendido;desde Reino Unido;
Nintendo Gameboy Color-Crazy Castle 4 & Looney Tunes Marciano alerta & Revenge;19,92 EUR;+ 17,32 EUR de envío estimado;Vendidos  19 oct 2021Artículo vendido;desde Reino Unido;
Looney Tunes Juego De Carreras Boy Color En Caja Completa Probada Funcionando GBC Gameboy;58,74 EUR;+ 18,15 EUR de envío estimado;Vendidos  19 oct 2021Artículo vendido;desde Reino Unido;
Gameboy Looney Tunes;15,50 EUR;+ 3,70 EUR de envío;Vendidos  9 oct 2021Artículo vendido;desde Alemania;
Looney Tunes de nuevo en Acción Nintendo Game Boy Advance GBA Juego Carro Genuino;7,05 EUR;+ 17,04 EUR de envío estimado;Vendidos  5 oct 2021Artículo vendido;desde Reino Unido;
Looney Tunes Gameboy En Caja Con Manual Y En Buen Estado;47,00 EUR;+ 16,69 EUR de envío;Vendidos  3 oct 2021Artículo vendido;desde Reino Unido;
Looney Tunes manual para la Nintendo Game Boy Sin Juego;4,69 EUR;+ 16,99 EUR de envío estimado;Vendidos  29 sep 2021Artículo vendido;desde Reino Unido;
Nintendo Gameboy-Lucas-Looney Tunes-Embalaje original-pal-Top;49,90 EUR;Envío no especificado;Vendidos  27 sep 2021Artículo vendido;desde Alemania;
GBC-Looney Tunes Collector: ataque de Marte para Nintendo Gameboy Color;7,95 EUR;+ 9,95 EUR de envío;Vendidos  25 sep 2021Artículo vendido;desde Alemania;
GBC-Looney Tunes Collector: la venganza de marte! para Nintendo Gameboy Color;7,95 EUR;+ 9,95 EUR de envío;Vendidos  25 sep 2021Artículo vendido;desde Alemania;
Looney Tunes Nintendo Gameboy juego/Game incl. funda/case Game Boy;10,00 EUR;+ 20,00 EUR de envío;Vendidos  25 sep 2021Artículo vendido;desde Alemania;
Looney Tunes Para El Nintendo Game Boy cartucho sólo;7,04 EUR;+ 17,04 EUR de envío estimado;Vendidos  21 sep 2021Artículo vendido;desde Reino Unido;
Looney Tunes Collector: ataque de Marte para Nintendo Gameboy Color;5,90 EUR;+ 6,50 EUR de envío;Vendidos  19 sep 2021Artículo vendido;desde Alemania;
Looney Tunes Nintendo Game Boy Reino Unido Juego Original (solo carro) ** GRATIS UK FRANQUEO **;4,69 EUR;+ 2,94 EUR de envío;Vendidos  14 sep 2021Artículo vendido;desde Reino Unido;
Looney Tunes Collector: ataque de Marte gameboy color OVP cib Boxed #2;14,90 EUR;+ 4,50 EUR de envío;Vendidos  10 sep 2021Artículo vendido;desde Alemania;
Daffy Duck Nintendo Gameboy juego Game Boy Sunsoft Looney Tunes bien;12,90 EUR;Envío no especificado;Vendidos  9 sep 2021Artículo vendido;desde Alemania;
Looney Tunes Marciano venganza (Nintendo Gameboy Color);5,88 EUR;+ 17,01 EUR de envío estimado;Vendidos  8 sep 2021Artículo vendido;desde Reino Unido;
GBC-Looney Tunes para Nintendo Gameboy Color;9,95 EUR;+ 9,95 EUR de envío;Vendidos  7 sep 2021Artículo vendido;desde Alemania;
Looney Tunes de nuevo en acción ps2 Juego Niños Chicos Chicas Donald El Pato Lucas Taz Etc;5,86 EUR;+ 19,32 EUR de envío estimado;Vendidos  6 sep 2021Artículo vendido;desde Reino Unido;
