Nintendo Game Boy Advance Looney Tunes Double Pack;15,00 EUR;+ 12,00 EUR de envío;desde España;
Nintendo Game Boy  Looney Tunes  GameBoy  Vers. NOE;5,90 EUR;Envío no especificado;desde Francia;
NINTENDO GAME BOY COLOR - Looney Tunes Collector: Martian Quest! CGB-P-ALMJ-JPN ;95,00 EUR;+ 19,90 EUR de envío;desde España;
Looney Tunes * Nintendo Game Boy * instruction cuadernillo English * estado bien;4,41 EUR;+ 5,99 EUR de envío;desde Alemania;
Nintendo Game Boy, Looney Tunes, VGA Gold 90 NM + / MT;1.799,00 EUR;+ 55,00 EUR de envío;desde Alemania;
Nintendo Game Boy Classic juego Looney Tunes con embalaje original y guía fah;149,90 EUR;+ 36,99 EUR de envío;desde Alemania;
GameBoy Looney Tunes;2,11 EUR;+ 3,70 EUR de envío;desde Alemania;
Looney Tunes (Nintendo Game Boy Color GBC 1999) Solo cartucho;6,90 EUR;+ 9,90 EUR de envío;desde España;
Nintendo Gameboy juego-Looney Tunes-Embalaje original-pal-Top -;39,90 EUR;Envío no especificado;desde Alemania;
Jeu Nintendo Game Boy Color - Looney Tunes - FRA - Loose;4,90 EUR;+ 6,70 EUR de envío;desde Francia;
Gameboy Advance-Bob Esponja película Looney Tunes Increibles Tweety Magic Gemas;19,93 EUR;+ 17,33 EUR de envío estimado;desde Reino Unido;
Looney Tunes Collector: la venganza de marte gameboy color OVP cib Boxed #2;19,90 EUR;+ 4,50 EUR de envío;desde Alemania;
Looney Tunes Collector ataque de Marte Game Boy Color módulo envío exprés en D;5,95 EUR;+ 12,50 EUR de envío;desde Alemania;
Looney Tunes Bugs Bunny Crazy Castle 3 Jeu Nintendo Game Boy PAL EUR;7,99 EUR;+ 3,50 EUR de envío;desde Francia;
Looney Tunes-solo Carro-Nintendo Game Boy | thegameworld;9,05 EUR;+ 17,10 EUR de envío estimado;desde Reino Unido;
Looney Tunes Collector venganza de marte! gameboy color OVP cib Boxed;17,70 EUR;+ 4,50 EUR de envío;desde Alemania;
Looney Tunes: de nuevo en acción-solo Carro-Nintendo GBA Game Boy Advance;6,13 EUR;+ 17,04 EUR de envío estimado;desde Reino Unido;
Nintendo Gameboy-Looney Tunes-Embalaje original-Top-pal-Ocean;79,90 EUR;Envío no especificado;desde Alemania;
Looney Tunes La Revanche Des Martiens - Nintendo Game Boy Color - FRA;4,90 EUR;+ 14,90 EUR de envío;desde Francia;
Looney Tunes Nintendo Game Boy Cartucho sólo Libre P&P;8,22 EUR;+ 17,08 EUR de envío estimado;desde Reino Unido;
Looney Tunes Martian Alert! (Nintendo Game Boy Color GBC 2000) Solo cartucho;9,90 EUR;+ 9,90 EUR de envío;desde España;
Looney Tunes ¡Venganza Marciana! (Game Boy Color GBC 2000) Solo cartucho;9,90 EUR;+ 9,90 EUR de envío;desde España;
Nintendo Gameboy Color En Caja-Looney Tunes coleccionista Marciano venganza;23,50 EUR;+ 17,40 EUR de envío estimado;desde Reino Unido;
Nintendo Game Boy Looney Tunes FAH état correct #1;4,90 EUR;+ 11,98 EUR de envío;desde Francia;
Looney Tunes 👍 en Acción Nintendo Game Boy Advance GBA Juego Carro Genuino;5,41 EUR;+ 19,65 EUR de envío estimado;desde Reino Unido;
Jeu Game Boy Color en loose Anglais  Looney Tunes  sans etiquette  Envoi suivi;4,99 EUR;+ 8,00 EUR de envío;desde Francia;
Looney Tunes Collector: la venganza de marte gameboy color OVP cib Boxed #3;19,90 EUR;+ 4,50 EUR de envío;desde Alemania;
Nintendo Gameboy Juego-Looney Tunes;9,35 EUR;+ 17,11 EUR de envío estimado;desde Reino Unido;
Nuevo anuncioNintendo GameBoy Looney Tunes En Caja Con Manual Gwo libre de gastos de envío del Reino Unido;47,02 EUR;+ 17,91 EUR de envío estimado;desde Reino Unido;
Nintendo Game Boy Advance GBA - Looney Tunes Back In Action - PAL - EUR;9,99 EUR;+ 4,80 EUR de envío;desde Francia;
Nintendo Game Boy Color Looney Tunes Racing FAH Excellent état;6,90 EUR;+ 11,98 EUR de envío;desde Francia;
Nintendo Gameboy Color En Caja-Looney Tunes coleccionista Marciano venganza;32,86 EUR;+ 17,61 EUR de envío estimado;desde Reino Unido;
Nintendo Game Boy Advance Looney Tunes Double Pack UKV Très Bon état #1;6,90 EUR;+ 11,98 EUR de envío;desde Francia;
Looney Tunes de nuevo en acción para Nintendo Gameboy Advance GBA en Caja;21,11 EUR;+ 14,11 EUR de envío;desde Reino Unido;
Nintendo Console Game Boy Color ITA   Looney Tunes Collector Starring Bugs Bunny;29,00 EUR;+ 19,00 EUR de envío;desde Italia;
Nintendo Gameboy Color En Caja-Clásico Looney Tunes El Pato Lucas aves Play;41,10 EUR;+ 17,79 EUR de envío estimado;desde Reino Unido;
Nuevo anuncioReino Unido NINTENDO GAMEBOY GAME BOY GB NGB Juego CARTUCHO solo Looney Tunes por SUNSOFT;8,23 EUR;+ 34,13 EUR de envío estimado;desde Reino Unido;
Nintendo Gameboy Advance En Caja-Looney Tunes de nuevo en acción;29,34 EUR;+ 17,53 EUR de envío estimado;desde Reino Unido;
Looney Tunes Double Pack para Nintendo Game Boy Advance/GBA;3,99 EUR;+ 1,70 EUR de envío;desde Alemania;
Lot 4 Jeux Nintendo Game Boy Gargoyles Gremling2 Looney Tunes Ducktales Disney;80,00 EUR;+ 29,00 EUR de envío;desde Francia;
Looney Tunes Collector: Attacke vom Mars | Nintendo Game Boy Color ;8,00 EUR;+ 9,00 EUR de envío;desde Italia;
Gameboy Advance-Bob Esponja Looney Tunes Disney Princesa Bratz Jimmy Neutron;19,93 EUR;+ 17,33 EUR de envío estimado;desde Reino Unido;
Looney Tunes Gameboy Juego en Caja;54,08 EUR;+ 18,06 EUR de envío estimado;desde Reino Unido;
Nintendo Gameboy Juegos-Looney Tunes y T2;11,76 EUR;+ 34,40 EUR de envío estimado;desde Reino Unido;
48677 manual de instrucciones-Looney Tunes de nuevo en acción-Nintendo Game Boy Adva;5,57 EUR;+ 5,87 EUR de envío;desde Reino Unido;
