| de Raging Fighter Nintendo GameBoy GB | NUEVO VGA 85+ sellado soldado;1.999,90 EUR;+ 44,99 EUR de envío;desde Alemania;
Nintendo Game Boy-Raging Fighter (en Caja);158,56 EUR;Envío internacional gratis;desde Reino Unido;
Raging Fighter-Game Boy-Módulo de juego-Nintendo-Gameboy-PAL;9,79 EUR;Envío no especificado;desde Alemania;
Nintendo Gameboy juego-Raging Fighter-Embalaje original-pal-raras-rar - Top;109,90 EUR;Envío no especificado;desde Alemania;
Raging Fighter-GAMEBOY Juego-UKV;14,09 EUR;+ 17,19 EUR de envío estimado;desde Reino Unido;
Nintendo Gameboy Raging Fighter-DMG cartucho de juego y el caso;11,75 EUR;+ 19,20 EUR de envío estimado;desde Reino Unido;
Raging Fighter Nintendo Game Boy Vga oro 85+ Casi Nuevo + Sellado de fábrica Rara;2.441,73 EUR;+ 17,76 EUR de envío;desde Rusia;
Raging Fighter ** ** Oficial Nintendo Gameboy Cartucho versión UK;9,69 EUR;+ 17,10 EUR de envío estimado;desde Reino Unido;
Gb-Raging Fighter para Nintendo GameBoy;12,95 EUR;+ 6,50 EUR de envío;desde Alemania;
Raging Fighter Notice - Manuel - Handleiding NOE-1 Game Boy;10,00 EUR;Envío internacional gratis;desde Francia;
Gameboy juego-Raging Fighter (PAL) (módulo);9,89 EUR;+ 67,99 EUR de envío;desde Alemania;
Nintendo GameBoy Juego-Raging Fighter (Cartucho con Manual);13,31 EUR;Envío internacional gratis;desde Alemania;
Nintendo GameBoy jeu - Raging Fighter (cartouche avec manuel) (utilisé);17,99 EUR;Envío internacional gratis;desde Alemania;
Nintendo GameBoy gioco - Raging Fighter cartuccia con il manuale usato;19,99 EUR;Envío internacional gratis;desde Alemania;
Raging Fighter-Nintendo Game Boy juego;9,99 EUR;Envío no especificado;desde Alemania;
Nintendo Gameboy Raging Fighter Game Boy  PAL only Modul;11,90 EUR;Envío no especificado;desde Austria;
| de Raging Fighter Nintendo GameBoy GB | NUEVO VGA 85 sellado soldado;1.499,90 EUR;+ 39,90 EUR de envío;desde Alemania;
Nintendo GameBoy Juego Raging Fighter Cartucho con Manual;14,09 EUR;Envío internacional gratis;desde Alemania;
Nintendo GameBoy game - Raging Fighter cartridge with manual;13,73 EUR;Envío internacional gratis;desde Alemania;
Nintendo GameBoy juego - Raging Fighter cartucha con manual usado;19,99 EUR;Envío internacional gratis;desde Alemania;
Raging Fighter Nintendo Game Boy KONAMI Cartucho en Caja Completo Con Claro Protector;88,77 EUR;Envío gratis;desde Estados Unidos;
Raging Fighter Nintendo Game Boy GB solo carro Probado Y Funcionando!;7,95 EUR;Envío gratis;desde Estados Unidos;
Raging Fighter Nintendo Boy * Auténtico * Juego Original;11,52 EUR;Envío gratis;desde Estados Unidos;
Nintendo Game Boy Original Raging Fighter Juego Cartucho Solo;8,85 EUR;+ 3,54 EUR de envío;desde Estados Unidos;
Raging Fighter Game Boy 1993 ANUNCIO IMPRESO DE COLECCIÓN/cartel oficial Auténtico Konami;13,31 EUR;Envío gratis;desde Estados Unidos;
Raging Fighter Nintendo Game Boy Cartridge (Japanese Version);8,20 EUR;+ 12,67 EUR de envío;desde Australia;
Raging Fighter (Nintendo Game Boy, 1993) Juego, Manual Y caso claro.;6,21 EUR;+ 4,00 EUR de envío;desde Estados Unidos;
Raging Fighter Para Nintendo Video Game Boy Cartucho! envío rápido! probado;8,87 EUR;Envío gratis;desde Estados Unidos;
Raging Fighter-NINTENDO GAME BOY;11,96 EUR;+ 2,62 EUR de envío;desde Estados Unidos;
Nintendo Game Boy Konami Raging Fighter liberación de Estados Unidos;8,87 EUR;Envío gratis;desde Estados Unidos;
Raging Fighter Para Nintendo Video Game Boy Cartucho! envío rápido! probado;3,99 EUR;+ 3,95 EUR de envío;desde Estados Unidos;
Raging Fighter (Nintendo Gameboy GB) solo Carro Gran forma Juego Boy;8,69 EUR;Envío gratis;desde Estados Unidos;
Raging Fighter GAME BOY versión japonesa;42,89 EUR;+ 13,30 EUR de envío;desde Japón;
Raging Fighter (Nintendo Game Boy, 1993) Gb Carro Y Estuche;8,87 EUR;Envío gratis;desde Estados Unidos;
Nintendo Gameboy Raging Fighter;3,44 EUR;+ 4,00 EUR de envío;desde Estados Unidos;
Raging Fighter (Nintendo Game Boy, 1993);7,09 EUR;+ 3,82 EUR de envío;desde Estados Unidos;
Raging Fighter (Nintendo Game Boy) Authentic/Cleaned/Tested Fighting - Gameboy;20,58 EUR;+ 10,28 EUR de envío;desde Canadá;
Lote de 4 Juegos Gameboy; Sergy, Raging Fighter, Tony Hawk, WWF-todos probado y trabajo;17,75 EUR;+ 4,40 EUR de envío;desde Estados Unidos;
Raging Fighter Para Nintendo Game Boy Probado;4,43 EUR;+ 4,22 EUR de envío;desde Estados Unidos;
Raging Fighter Nintendo Game Boy Gb Carro Probado Y Funcionando!;7,99 EUR;Envío gratis;desde Estados Unidos;
Game Boy Raging Fighter;1.331,85 EUR;+ 17,76 EUR de envío;desde México;
Raging Fighter Juego De Nintendo Game Boy Y Manual;14,20 EUR;Envío gratis;desde Estados Unidos;
Raging Fighter (Nintendo Game Boy, 1993);4,44 EUR;+ 4,04 EUR de envío;desde Estados Unidos;
Raging Fighter (Nintendo Game Boy, 1993) Original, SP o Advance Cartucho;8,87 EUR;+ 3,04 EUR de envío;desde Estados Unidos;
Gameboy Juego-Raging Fighter (PAL) (módulo);60,54 EUR;+ 17,76 EUR de envío;desde Alemania;
De Colección Nintendo Super Power Club desafío Trading Card #96 Raging Fighter Game Boy;1,23 EUR;+ 0,63 EUR de envío;desde Estados Unidos;
1993 Vintage video juego Print AD-Raging Fighter-Game Boy-Konami;6,39 EUR;+ 1,77 EUR de envío;desde Estados Unidos;
Raging Fighter (Nintendo Gameboy) Sólo Manual, Sin Juego;9,09 EUR;Envío gratis;desde Estados Unidos;
