Genuine Motocross Maniacs de vídeo juego para Nintendo Game Boy japonés Probado;9,40 EUR;+ 17,12 EUR de envío estimado;desde Reino Unido;
Genuine Motocross Maniacs de vídeo juego para Nintendo Game Boy japonés Probado;7,05 EUR;+ 17,06 EUR de envío estimado;desde Reino Unido;
Motocross Maniacs | Game Boy DMG | Completo | ukv;52,94 EUR;+ 18,05 EUR de envío estimado;desde Reino Unido;
Motocross Maniacs Nintendo Gameboy Juego probado trabajando poste libre;16,42 EUR;+ 17,26 EUR de envío estimado;desde Reino Unido;
Motocross Maniacs-Original Nintendo Game Boy-Cartucho únicamente;8,18 EUR;+ 17,09 EUR de envío estimado;desde Reino Unido;
Motocross Maniacs Nintendo Game Boy Color Advance Juego Solo Carro Genuino;14,77 EUR;+ 7,06 EUR de envío;desde Reino Unido;
Nintendo Gameboy Game Boy Motocross Maniacs Video Juego Carro;17,64 EUR;+ 10,59 EUR de envío;desde Reino Unido;
Juego de Motocross Maniacs Nintendo Gameboy;51,77 EUR;+ 29,41 EUR de envío;desde Reino Unido;
Nintendo GameBoy juego - Motocross Maniacs cartucho usado;21,99 EUR;Envío internacional gratis;desde Alemania;
Motocross Maniacs (Nintendo Game Boy) En Caja-Pal;50,68 EUR;+ 4,89 EUR de envío;desde Portugal;
Nintendo Game Boy Motocross Maniacs Notice / Instruction Manual - NOE;7,99 EUR;+ 2,75 EUR de envío;desde Francia;
Nintendo Game Boy Motocross Maniacs PAL Cart Only;5,95 EUR;+ 30,00 EUR de envío;desde Países Bajos;
Nintendo GameBoy Juego Motocross Maniacs Cartucho con Manual;21,17 EUR;Envío internacional gratis;desde Alemania;
Nintendo GameBoy gioco - Motocross Maniacs cartuccia con il manuale usato;26,99 EUR;Envío internacional gratis;desde Alemania;
Nintendo GameBoy jeu - Motocross Maniacs cartouche avec manuel utilisé;24,99 EUR;Envío internacional gratis;desde Alemania;
Nintendo GameBoy Cartucho De Juego Motocross Maniacs;15,29 EUR;Envío internacional gratis;desde Alemania;
Motocross Maniacs JPN - Nintendo GameBoy - NGB;4,21 EUR;+ 19,95 EUR de envío;desde Países Bajos;
Motocross Maniacs NOE - Nintendo GameBoy - NGB;6,76 EUR;+ 19,95 EUR de envío;desde Países Bajos;
Motocross Maniacs - FAH - Manual Nintendo Gameboy Classic;8,00 EUR;+ 5,00 EUR de envío;desde Países Bajos;
Motocross Maniacs NINTENDO GAME BOY ESP versión Vintage Original;14,59 EUR;Envío no especificado;desde Reino Unido;
Motocross Maniacs Gameboy NOE;45,00 EUR;Envío no especificado;desde Países Bajos;
Nintendo Game Boy Juego Motocross Maniacs En Caja Con Manual;47,06 EUR;Envío no especificado;desde Reino Unido;
Jeu Motocross Maniacs pour Nintendo Game Boy FAH Loose  - Floto Games;13,90 EUR;Envío no especificado;desde Francia;
Nintendo GameBoy game - Motocross Maniacs cartridge with manual;21,08 EUR;Envío internacional gratis;desde Alemania;
Nintendo GameBoy juego - Motocross Maniacs cartucha con manual usado;26,99 EUR;Envío internacional gratis;desde Alemania;
