Genuine Motocross Maniacs de vídeo juego para Nintendo Game Boy japonés Probado;7,01 EUR;+ 16,98 EUR de envío estimado;desde Reino Unido;
Genuine Motocross Maniacs de vídeo juego para Nintendo Game Boy japonés Probado;9,36 EUR;+ 17,04 EUR de envío estimado;desde Reino Unido;
Motocross Maniacs | Game Boy DMG | Completo | ukv;52,69 EUR;+ 17,96 EUR de envío estimado;desde Reino Unido;
Nintendo Gameboy Game Boy Motocross Maniacs Video Juego Carro;17,55 EUR;+ 10,54 EUR de envío;desde Reino Unido;
Motocross Maniacs-Original Nintendo Game Boy-Cartucho únicamente;8,14 EUR;+ 17,00 EUR de envío estimado;desde Reino Unido;
Motocross Maniacs Nintendo Game Boy Color Advance Juego Solo Carro Genuino;16,34 EUR;+ 7,03 EUR de envío;desde Reino Unido;
Juego de Motocross Maniacs Nintendo Gameboy;51,51 EUR;+ 29,26 EUR de envío;desde Reino Unido;
Nuevo anuncioNintendo Gameboy Motocross Maniacs Menta;5,84 EUR;+ 16,96 EUR de envío estimado;desde Reino Unido;
Nintendo Game Boy Motocross Maniacs Notice / Instruction Manual - NOE;7,99 EUR;+ 2,75 EUR de envío;desde Francia;
Nintendo Game Boy Juego Motocross Maniacs En Caja Con Manual;46,83 EUR;Envío no especificado;desde Reino Unido;
Jeu Motocross Maniacs pour Nintendo Game Boy FAH Loose  - Floto Games;13,90 EUR;Envío no especificado;desde Francia;
Nintendo Game Boy Motocross Maniacs;5,95 EUR;Envío no especificado;desde Alemania;
