Superman De Vídeo Juego Para Nintendo Game Boy PAL Probado;41,18 EUR;+ 17,81 EUR de envío estimado;desde Reino Unido;
Superman Returns fortaleza de la Soledad Nintendo Game Boy Advance, Genuino, Probado;10,59 EUR;+ 17,15 EUR de envío estimado;desde Reino Unido;
Superman Returns Videogioco Game Boy Advance Electronics Arts Sigillato;14,90 EUR;+ 13,90 EUR de envío;desde Italia;
Nintendo Game Boy Classic juego Superman con embalaje original y guía EUR;109,90 EUR;+ 36,99 EUR de envío;desde Alemania;
Superman Returns: fortaleza de la soledad Game Boy Advance GBA OVP cib Boxed;15,90 EUR;+ 5,00 EUR de envío;desde Alemania;
Superman Returns fortaleza de la Soledad Nintendo Game Boy Advance, Gba Nueva Dc;23,51 EUR;+ 17,64 EUR de envío;desde Reino Unido;
Superman Game Boy juego completo con embalaje original y guía;169,99 EUR;+ 8,00 EUR de envío;desde Alemania;
NINTENDO GAME BOY ADVANCE Superman Returns Europea PAL Sellado;17,06 EUR;+ 16,89 EUR de envío;desde Grecia;
La Liga De La Justicia Heroes ps2 juego Chicos Mujer Maravilla Superman Batman Etc -;4,70 EUR;+ 19,32 EUR de envío estimado;desde Reino Unido;
Superman Returns: fortaleza de la Soledad (Nintendo Game Boy Advance, 2006);24,90 EUR;+ 8,89 EUR de envío;desde Lituania;
Nintendo Gameboy-Superman-Wata 6.5 a +/embalaje original-nuevo-no VGA-no AFA-Top;1.799,90 EUR;Envío no especificado;desde Alemania;
Superman Returns Nintendo Game Boy Advance GBA nuovo sigillato;24,99 EUR;+ 10,00 EUR de envío;desde Italia;
Superman Returns - Jeu Nintendo GBA Game Boy Advance - NEUF - Rare - Import DE;24,90 EUR;+ 12,90 EUR de envío;desde Francia;
Superman Returns - Fortress of Solitude | Boxed | Gameboy Advance GBA🕹 | CIB ;10,00 EUR;+ 6,00 EUR de envío;desde Países Bajos;
Super 11 en 1 Gameboy Color Advance Multi Juego Cartucho Flappy Superman Mickey;11,76 EUR;+ 20,23 EUR de envío estimado;desde Reino Unido;
Nintendo Game Boy Advance Game Collection, Spider-Man, Nemo, Superman, Flash y muchos más.;18,95 EUR;Envío no especificado;desde Alemania;
Superman Game Boy Spiel #5273;28,70 EUR;+ 16,03 EUR de envío;desde Suiza;
Superman Returns fortaleza de la Soledad NINTENDO GAMEBOY ADVANCE JUEGO;8,81 EUR;+ 7,05 EUR de envío;desde Reino Unido;
Superman Returns fortaleza de la Soledad Nintendo Game Boy Advance - 3+;23,54 EUR;+ 21,54 EUR de envío estimado;desde Reino Unido;
Gb-Superman para Nintendo GameBoy;12,95 EUR;