Superman Returns: fortaleza de la soledad Game Boy Advance GBA OVP cib Boxed;15,90 EUR;+ 5,00 EUR de envío;Vendidos  9 dic 2021Artículo vendido;desde Alemania;
Superman Returns ps2 Juego Niños Niñas Niños super-hombre marron;2,91 EUR;+ 19,18 EUR de envío estimado;Vendidos  1 dic 2021Artículo vendido;desde Reino Unido;
Juego De Mesa rara Superman Aventuras en Nueva York Coman Boys Papirots España;37,45 EUR;+ 42,18 EUR de envío estimado;Vendidos  4 nov 2021Artículo vendido;desde Reino Unido;
Superman para Nintendo GameBoy;10,99 EUR;Envío no especificado;Vendidos  19 oct 2021Artículo vendido;desde Alemania;
Las devoluciones GAMEBOY ADVANCE Nueva Superman Juego GBA, funciona para DS/DS Lite Sellado;17,71 EUR;Envío gratis;Vendidos  11 dic 2021Artículo vendido;desde Estados Unidos;
Fortnite dibujos animados Gorra De Béisbol Niños Chicos Superman Juego Gorra Ajustable Transpirable;6,37 EUR;Envío internacional gratis;Vendidos  4 dic 2021Artículo vendido;desde China;
Superman (Sega Genesis, 1992) solo carro limpiado y probado;22,14 EUR;Envío gratis;Vendidos  3 dic 2021Artículo vendido;desde Estados Unidos;
Lote de 3DS Gameboy Color & Advance Juegos-Zelda Superman HAWK Reino Corazones;31,00 EUR;Envío gratis;Vendidos  1 dic 2021Artículo vendido;desde Estados Unidos;
Superman Returns: fortaleza de la Soledad (Nintendo Game Boy Advance, 2006);5,54 EUR;+ 4,78 EUR de envío;Vendidos  30 nov 2021Artículo vendido;desde Estados Unidos;
Superman Super Man Nintendo Game Boy Gameboy solo carro;4,43 EUR;+ 4,42 EUR de envío;Vendidos  24 nov 2021Artículo vendido;desde Estados Unidos;
Superman Cartucho sólo Sega Genesis Auténtico;19,49 EUR;Envío gratis;Vendidos  22 nov 2021Artículo vendido;desde Estados Unidos;
Vintage 1999 Superman video juego Promo Tee T-shirt Tamaño Grande Negro N64 Gameboy;106,33 EUR;+ 4,61 EUR de envío;Vendidos  9 nov 2021Artículo vendido;desde Estados Unidos;
Heroclix Superman Set Sun Boy #022 poco frecuentes Figura Con Tarjeta!;0,89 EUR;+ 3,54 EUR de envío;Vendidos  5 nov 2021Artículo vendido;desde Estados Unidos;
Heroclix Superman y Legión Conjunto Polar Boy #010 figura común con tarjeta!;0,89 EUR;+ 3,54 EUR de envío;Vendidos  5 nov 2021Artículo vendido;desde Estados Unidos;
Heroclix Superman Set Star Boy #007 figura común con tarjeta!;0,89 EUR;+ 3,54 EUR de envío;Vendidos  5 nov 2021Artículo vendido;desde Estados Unidos;
Heroclix Superman Niño Conjunto Legión y Ultra #018 poco frecuentes Figura Con Tarjeta!;0,89 EUR;+ 3,54 EUR de envío;Vendidos  5 nov 2021Artículo vendido;desde Estados Unidos;
Superman! con Caja! para Gameboy/Color/Advance GB GBA GBC Super Man * Probado *;88,60 EUR;Envío gratis;Vendidos  5 nov 2021Artículo vendido;desde Estados Unidos;
Superman (Sega Genesis, 1992) ☆ ☆ Completa;39,65 EUR;Envío gratis;Vendidos  5 nov 2021Artículo vendido;desde Estados Unidos;
Superman (1992) (1992), Sega Genesis probado auténtico no manual;22,14 EUR;+ 4,43 EUR de envío;Vendidos  30 oct 2021Artículo vendido;desde Estados Unidos;
Las devoluciones GAMEBOY ADVANCE Nueva Superman Juego GBA, funciona para DS/DS Lite Sellado;17,68 EUR;Envío gratis;Vendidos  24 oct 2021Artículo vendido;desde Estados Unidos;
Superman Nintendo Game Boy probado Auténtico;13,28 EUR;Envío gratis;Vendidos  14 oct 2021Artículo vendido;desde Estados Unidos;
Superman Sega Genesis 1992 juego y caja únicamente * falta Manual * Probado Funcionando;23,03 EUR;+ 3,54 EUR de envío;Vendidos  11 oct 2021Artículo vendido;desde Estados Unidos;
Superman (Sega Genesis, 1992) Carro Y Caja, Sin Manual-Probado;26,57 EUR;+ 5,32 EUR de envío;Vendidos  7 oct 2021Artículo vendido;desde Estados Unidos;
Superman Returns: Fortress of Solitude (Game Boy Advance) GBA Authentic/Cleaned;2,77 EUR;+ 10,44 EUR de envío;Vendidos  7 oct 2021Artículo vendido;desde Canadá;
Superman (Gameboy) Sellado De Fábrica;1.151,91 EUR;+ 7,53 EUR de envío;Vendidos  7 oct 2021Artículo vendido;desde Estados Unidos;
Superman-SEGA GENESIS!;7,09 EUR;+ 3,99 EUR de envío;Vendidos  4 oct 2021Artículo vendido;desde Estados Unidos;
(3) Nintendo Gameboy Advance Juegos Barbie 12 tanzenden Prinzessinen-Superman-Disney;12,21 EUR;Envío gratis;Vendidos  25 sep 2021Artículo vendido;desde Estados Unidos;
Superman Returns Nintendo Gameboy ADVANCE GBA probado Auténtico;7,08 EUR;Envío gratis;Vendidos  24 sep 2021Artículo vendido;desde Estados Unidos;
Superman Nintendo Game Boy probado Auténtico;9,75 EUR;+ 3,94 EUR de envío;Vendidos  23 sep 2021Artículo vendido;desde Estados Unidos;
Superman (Sega Genesis, 1992) Completo Cartucho en Caja Auténtica;38,10 EUR;Envío gratis;Vendidos  21 sep 2021Artículo vendido;desde Estados Unidos;
Superman (1992) (1992), Sega Genesis Suelto probado!;13,28 EUR;Envío gratis;Vendidos  17 sep 2021Artículo vendido;desde Estados Unidos;
Superman: cuenta regresiva a Apokolips (Nintendo Game Boy Advance, 2003);7,90 EUR;+ 2,65 EUR de envío;Vendidos  17 sep 2021Artículo vendido;desde Estados Unidos;
Superman Returns: fortaleza de la Soledad (Nintendo Game Boy Advance, 2006);4,42 EUR;Envío gratis;Vendidos  17 sep 2021Artículo vendido;desde Estados Unidos;
Superman (1992) (Sega Genesis, 1992);15,94 EUR;Envío gratis;Vendidos  14 sep 2021Artículo vendido;desde Estados Unidos;
Heroclix Superman y Legión Juego Ultra Boy#204 Tarjeta con Figura de alimentación por gravedad!;0,89 EUR;+ 3,54 EUR de envío;Vendidos  13 sep 2021Artículo vendido;desde Estados Unidos;
