The Addams Family * Nintendo Game Boy * Gameboy módulo * estado muy bien #4;11,95 EUR;Envío no especificado;Vendidos  20 nov 2021Artículo vendido;desde Alemania;
The Addams Family Gameboy Classic cómo jugar instruction cuadernillo Noe;6,90 EUR;Envío no especificado;Vendidos  19 oct 2021Artículo vendido;desde Alemania;
Jeu The Addams Family Pugsley's scavenger hunt sur Game boy version FAH;12,95 EUR;Envío no especificado;Vendidos  13 oct 2021Artículo vendido;desde Francia;
Nintendo Gameboy Classic GB - The Addams Family + Manual;13,95 EUR;+ 4,50 EUR de envío;Vendidos  12 oct 2021Artículo vendido;desde Países Bajos;
Nintendo Game Boy The Addams Family USA Version;59,95 EUR;+ 32,30 EUR de envío;Vendidos  21 sep 2021Artículo vendido;desde Países Bajos;
TOTAL Magazine #16 April 1993 Games Nintendo SNES NES Game Boy The Addams Family;7,03 EUR;+ 26,21 EUR de envío estimado;Vendidos  4 sep 2021Artículo vendido;desde Reino Unido;
The Addams Family - Sega Mega Drive;69,00 EUR;