Gameboy The Addams Family;13,50 EUR;+ 3,70 EUR de envío;Vendidos  4 dic 2021Artículo vendido;desde Alemania;
The Addams Family (DMG-AF-FAH) for Nintendo Game Boy with manual;10,99 EUR;Envío no especificado;Vendidos  23 nov 2021Artículo vendido;desde Países Bajos;
Gameboy The Addams Family;11,00 EUR;+ 3,70 EUR de envío;Vendidos  20 nov 2021Artículo vendido;desde Alemania;
The Addams Family * Nintendo Game Boy * Gameboy módulo * estado muy bien #4;11,95 EUR;Envío no especificado;Vendidos  20 nov 2021Artículo vendido;desde Alemania;
The Addams Family Gameboy Classic cómo jugar instruction cuadernillo Noe;6,90 EUR;Envío no especificado;Vendidos  19 oct 2021Artículo vendido;desde Alemania;
Jeu The Addams Family Pugsley's scavenger hunt sur Game boy version FAH;12,95 EUR;Envío no especificado;Vendidos  13 oct 2021Artículo vendido;desde Francia;
Nintendo Gameboy Classic GB - The Addams Family + Manual;13,95 EUR;+ 4,50 EUR de envío;Vendidos  12 oct 2021Artículo vendido;desde Países Bajos;
Nintendo Game Boy The Addams Family USA Version;59,95 EUR;+ 32,30 EUR de envío;Vendidos  21 sep 2021Artículo vendido;desde Países Bajos;
