Nes Attack of the Killer Tomatoes incl. caja original & instrucciones cib;113,88 EUR;+ 13,99 EUR de envío;Vendidos  4 sep 2021Artículo vendido;desde Alemania;
Attack of the Killer Tomatoes Nintendo NES juego completo con embalaje original & instrucciones cib;129,99 EUR;+ 8,00 EUR de envío;Vendidos  16 nov 2021Artículo vendido;desde Alemania;
Nintendo Entertainment System nes juego Attack of the Killer Tomatoes raras;20,00 EUR;+ 7,95 EUR de envío;Vendidos  24 sep 2021Artículo vendido;desde Alemania;
* us Blu-ray + DVD * Attack of the Killer Tomatoes/ataque de los tomates asesinos;15,00 EUR;+ 10,00 EUR de envío;Vendidos  7 oct 2021Artículo vendido;desde Alemania;
Nintendo NES juego | Attack of the Killer Tomatoes PAL B;31,50 EUR;Envío no especificado;Vendidos  22 sep 2021Artículo vendido;desde Alemania;
Attack of the Killer Tomatoes para Nintendo NES;38,99 EUR;Envío no especificado;Vendidos  29 nov 2021Artículo vendido;desde Alemania;
