Solomon's Club Nintendo Gameboy PAL Reino Unido con estuche protector-Juego Boy;8,23 EUR;+ 17,10 EUR de envío estimado;Vendidos  24 sep 2021Artículo vendido;desde Reino Unido;
Solomon's Club-UKV Nintendo Game Boy-Completo con Manual! - Gameboy;58,83 EUR;+ 18,18 EUR de envío estimado;Vendidos  19 sep 2021Artículo vendido;desde Reino Unido;
Solomon's Club (versión de Reino Unido) sólo Manual de instrucciones original Nintendo Gameboy;8,88 EUR;+ 1,77 EUR de envío;Vendidos  5 dic 2021Artículo vendido;desde Estados Unidos;
Solomon's Club (Nintendo GameBoy, 1991) VIDEO GAME CARTRIDGE ONLY game boy;12,65 EUR;+ 7,03 EUR de envío;Vendidos  20 oct 2021Artículo vendido;desde Canadá;
Solomon's Club Nintendo Gameboy Caja sólo Auténtico Original;31,11 EUR;+ 4,53 EUR de envío;Vendidos  18 oct 2021Artículo vendido;desde Estados Unidos;
Solomon's Club (Nintendo Gameboy) Auténtico Original-Envío Gratis Probado Con Estuche;16,00 EUR;Envío gratis;Vendidos  2 oct 2021Artículo vendido;desde Estados Unidos;
Solomon's Club - USA - Nintendo Gameboy;10,00 EUR;+ 25,00 EUR de envío;Vendidos  21 sep 2021Artículo vendido;desde Países Bajos;
Nintendo Gameboy Original Solomon's Club con folleto Probado Funciona;12,45 EUR;+ 3,91 EUR de envío;Vendidos  12 sep 2021Artículo vendido;desde Estados Unidos;
