Chuck Rock Game Boy UKV ;10,00 EUR;Envío internacional gratis;Vendidos  30 nov 2021Artículo vendido;desde Francia;
Chuck Rock - Nintendo Game Boy - PAL FAH;14,90 EUR;+ 5,80 EUR de envío;Vendidos  27 nov 2021Artículo vendido;desde Francia;
Manual de Instrucciones de Nintendo Gameboy-UKV-Chuck Rock;15,23 EUR;+ 17,23 EUR de envío estimado;Vendidos  21 nov 2021Artículo vendido;desde Reino Unido;
Chuck Rock (Sega Genesis, 1991), auténtico, probado y funciona;11,44 EUR;Envío gratis;Vendidos  1 dic 2021Artículo vendido;desde Estados Unidos;
Chuck Rock 1 (Sega Genesis, 1991) completo gran forma;83,93 EUR;Envío gratis;Vendidos  23 nov 2021Artículo vendido;desde Estados Unidos;
Chuck Rock (Sega Genesis) completa Completo en Caja-Virgin Interactivo difícil de encontrar;44,14 EUR;Envío gratis;Vendidos  19 oct 2021Artículo vendido;desde Estados Unidos;
Chuck Rock (Sega Genesis, 1991) probado funciona auténtico no manual lea los detalles;15,88 EUR;Envío gratis;Vendidos  13 oct 2021Artículo vendido;desde Estados Unidos;
Nintendo Gameboy Chuck Rock Juego;22,08 EUR;Envío gratis;Vendidos  6 oct 2021Artículo vendido;desde Estados Unidos;
Chuck Rock para SEGA GENESIS Completa Buen Estado;44,14 EUR;+ 4,64 EUR de envío;Vendidos  2 oct 2021Artículo vendido;desde Estados Unidos;
Chuck Rock (Sega Genesis, 1991) probado funciona auténtico no manual lea los detalles;17,65 EUR;Envío gratis;Vendidos  30 sep 2021Artículo vendido;desde Estados Unidos;
Chuck Rock 1 Sega Genesis Exmt condición auténtico Cartucho De Juego;13,24 EUR;Envío gratis;Vendidos  11 sep 2021Artículo vendido;desde Estados Unidos;
Chuck Rock II 2-hijo de Chuck-Sega juego de Mega Drive-PAL;18,81 EUR;+ 21,07 EUR de envío estimado;Vendidos  30 sep 2021Artículo vendido;desde Reino Unido;
Chuck Rock- Jeu Sega Game Gear- Jeu+boîtier bon état test ok;10,90 EUR;+ 8,00 EUR de envío;Vendidos  20 sep 2021Artículo vendido;desde Francia;
6 X Sega Game Gear Video Juegos-Chuck Rock, Mickey Mouse, lemmings etc. Paquete;32,91 EUR;+ 17,61 EUR de envío estimado;Vendidos  23 nov 2021Artículo vendido;desde Reino Unido;
Chuck Rock-ATARI ST Juego-Vintage Retro Gaming;5,87 EUR;+ 17,64 EUR de envío;Vendidos  7 oct 2021Artículo vendido;desde Reino Unido;
Chuck Rock-Sega Mega Drive Juego (probado-Envío Rápido-Pal);8,17 EUR;+ 18,48 EUR de envío estimado;Vendidos  16 sep 2021Artículo vendido;desde Reino Unido;
Chuck Rock II (2) hijo de Chuck Sega Mega Drive juego PAL completo y probado;25,87 EUR;+ 17,46 EUR de envío estimado;Vendidos  11 oct 2021Artículo vendido;desde Reino Unido;
Chuck Rock II-Son of Chuck-Sega Genesis 16 Bit Cartucho De Juego-en Caja;23,50 EUR;+ 17,40 EUR de envío estimado;Vendidos  29 sep 2021Artículo vendido;desde Reino Unido;
Chuck Rock Sega Game Gear Juego;5,87 EUR;+ 17,03 EUR de envío estimado;Vendidos  13 sep 2021Artículo vendido;desde Reino Unido;
Chuck Rock. Corkers juego tres. Commodore Amiga. cartel. completamente Funcional.;17,63 EUR;+ 17,28 EUR de envío estimado;Vendidos  11 sep 2021Artículo vendido;desde Reino Unido;
Chuck Rock Sega Mega Drive Juego Completo Pal;11,75 EUR;+ 17,16 EUR de envío estimado;Vendidos  28 sep 2021Artículo vendido;desde Reino Unido;
Chuck Rock II hijo de Chuck Sega Master Sistema Juego Gratis P&P;22,33 EUR;+ 17,38 EUR de envío estimado;Vendidos  14 nov 2021Artículo vendido;desde Reino Unido;
Sega Genesis/Megadrive Juego-Chuck Rock;6,94 EUR;+ 14,10 EUR de envío;Vendidos  18 nov 2021Artículo vendido;desde Reino Unido;
Commodore Amiga CD32 Juego-Chuck Rock 2 hijo de Chuck;34,09 EUR;+ 12,92 EUR de envío;Vendidos  17 oct 2021Artículo vendido;desde Reino Unido;
Chuck Rock Sega En Caja Con Manual de juego de Mega Drive PAL Megadrive probado CIB;15,27 EUR;+ 17,23 EUR de envío estimado;Vendidos  13 nov 2021Artículo vendido;desde Reino Unido;
Chuck Rock En Caja Completa Japonés Sega Game Gear;23,52 EUR;+ 19,55 EUR de envío estimado;Vendidos  20 sep 2021Artículo vendido;desde Reino Unido;
Chuck Rock Master System Juego! completa! busque en la tienda!;16,46 EUR;+ 21,38 EUR de envío estimado;Vendidos  10 nov 2021Artículo vendido;desde Reino Unido;
Chuck Rock 2 Master System Juego Completo;41,14 EUR;+ 17,79 EUR de envío estimado;Vendidos  12 nov 2021Artículo vendido;desde Reino Unido;
Chuck Rock un diseño de núcleo juego para el Atari ST Computadora + Póster Caja Grande;35,26 EUR;+ 17,66 EUR de envío estimado;Vendidos  21 sep 2021Artículo vendido;desde Reino Unido;
Notice jeu Sega Game Gear Chuck Rock 2 Son of Chuck Manuel Instruction Booklet;4,99 EUR;+ 3,50 EUR de envío;Vendidos  13 nov 2021Artículo vendido;desde Francia;
