Caesars Palace II 2-auténtico-Nintendo Game Boy Color-Caja/Manual Solamente!;6,88 EUR;Envío gratis;Vendidos  23 nov 2021Artículo vendido;desde Estados Unidos;
Caesars Palace II (Nintendo Game Boy Color) CB;7,93 EUR;Envío gratis;Vendidos  21 nov 2021Artículo vendido;desde Estados Unidos;
Caesars Palace Original Nintendo Game Boy Juego probado + trabajo & Auténtico!;2,90 EUR;+ 4,19 EUR de envío;Vendidos  20 nov 2021Artículo vendido;desde Estados Unidos;
Caesars Palace (Nintendo Game Boy, 1989) * limpiado! *;5,51 EUR;Envío gratis;Vendidos  20 nov 2021Artículo vendido;desde Estados Unidos;
Caesars Palace ADVANCE NINTENDO GAME BOY ADVANCE Video Juego Suelto;3,52 EUR;+ 3,52 EUR de envío;Vendidos  19 nov 2021Artículo vendido;desde Estados Unidos;
Caesars Palace Original Nintendo Game Boy Juego probado + trabajo & Auténtico!;7,93 EUR;Envío gratis;Vendidos  17 nov 2021Artículo vendido;desde Estados Unidos;
Caesars Palace (Virgin) Nintendo Game Boy Gameboy * Completo En Caja Completo En Caja, Casi Nuevo + + *;26,46 EUR;Envío gratis;Vendidos  15 nov 2021Artículo vendido;desde Estados Unidos;
Caesars Palace (Nintendo Game Boy, 1989) sólo juego de trabajo;6,17 EUR;Envío gratis;Vendidos  13 nov 2021Artículo vendido;desde Estados Unidos;
Caesars Palace (Nintendo Game Boy, 1989) Nuevo Sellado Nuevo En Caja;66,16 EUR;+ 8,82 EUR de envío;Vendidos  4 nov 2021Artículo vendido;desde Estados Unidos;
Caesars Palace (Nintendo Game Boy, 1989);6,17 EUR;Envío gratis;Vendidos  3 nov 2021Artículo vendido;desde Estados Unidos;
Game Boy Caesars Palace GB con Estuche/verificado manualmente Funcionando!;3,97 EUR;+ 3,97 EUR de envío;Vendidos  24 oct 2021Artículo vendido;desde Estados Unidos;
Caesars Palace Advance: Milenio Gold Edition (Game Boy Advance, 2001);5,25 EUR;Envío gratis;Vendidos  18 oct 2021Artículo vendido;desde Estados Unidos;
Lote de 3 Juegos Nintendo Gameboy: Shanghai Pocket, Vegas Stakes, Caesars Palace II;8,81 EUR;+ 4,50 EUR de envío;Vendidos  15 oct 2021Artículo vendido;desde Estados Unidos;
Caesars Palace Advance: Milenio Gold Edition-Juego Boy Advance GBA Juego;4,83 EUR;+ 2,60 EUR de envío;Vendidos  14 oct 2021Artículo vendido;desde Estados Unidos;
Caesars Palace Advance: MILLENIUM GOLD EDITION, sólo juego, juego Boy Advance;5,28 EUR;Envío gratis;Vendidos  5 oct 2021Artículo vendido;desde Estados Unidos;
Caesars Palace Ii Nintendo Game Boy Color Video Juego Casino Poker Blackjack Ranura;4,17 EUR;+ 3,88 EUR de envío;Vendidos  5 oct 2021Artículo vendido;desde Estados Unidos;
Nintendo Game Chico: 3 Juegos Lote-Rey León + Ultra Golf + Caesars Palace;12,35 EUR;Envío gratis;Vendidos  30 sep 2021Artículo vendido;desde Estados Unidos;
Caesars Palace Arcadia Juegos versión Nintendo Game Boy Video Juego Carro;4,40 EUR;Envío gratis;Vendidos  27 sep 2021Artículo vendido;desde Estados Unidos;
Caesars Palace (Nintendo Game Boy) * Totalmente Completo-Probado-casi Nuevo! *;27,78 EUR;Envío gratis;Vendidos  26 sep 2021Artículo vendido;desde Estados Unidos;
Caesars Palace-Original Nintendo GameBoy Juego;6,17 EUR;Envío gratis;Vendidos  23 sep 2021Artículo vendido;desde Estados Unidos;
Caesars Palace (Nintendo Game Boy, 1989);4,40 EUR;+ 3,52 EUR de envío;Vendidos  22 sep 2021Artículo vendido;desde Estados Unidos;
Caesars Palace (Original Nintendo Game Boy Juego Cartucho) Completo En Caja;11,46 EUR;Envío gratis;Vendidos  7 sep 2021Artículo vendido;desde Estados Unidos;
Caesars Palace 5 en 1 ranuras de video juego de mano Electrónico Poker Blackjack Funciona;18,79 EUR;+ 14,10 EUR de envío;Vendidos  7 oct 2021Artículo vendido;desde Reino Unido;
