Caesars Palace Juego Boy juego;5,27 EUR;+ 16,96 EUR de envío estimado;desde Reino Unido;
Caesars Palace Advance Nintendo Game Boy Advance BOXED PAL;17,57 EUR;+ 17,23 EUR de envío estimado;desde Reino Unido;
Caesars Palace | with Manual | Game Boy🕹 | Excellent Condition | Casino ;7,50 EUR;+ 3,50 EUR de envío;desde Países Bajos;
Caesars Palace Gameboy RARO CIB condición coleccionable ✔;52,68 EUR;+ 17,98 EUR de envío estimado;desde Reino Unido;
Nuevo anuncioCaesars Palace Ii Nintendo Gameboy Colour Color COMPLETO PAL;11,66 EUR;+ 17,10 EUR de envío estimado;desde Reino Unido;
Caesars Palace Nintendo Game Boy Color Advance Juego Completo En Caja Original;48,46 EUR;+ 21,99 EUR de envío estimado;desde Reino Unido;
Nintendo Game Boy Color Caesars Palace II EUR Très Bon état;4,90 EUR;+ 11,98 EUR de envío;desde Francia;
Caesars Palace 2 - Gameboy Color - Complet;14,99 EUR;+ 3,88 EUR de envío;desde Francia;
Nintendo Game Boy Gameboy A Mano En Caesars Palace;10,54 EUR;+ 11,72 EUR de envío;desde Reino Unido;
Caesars Palace Game Boy PAL;29,95 EUR;+ 19,95 EUR de envío;desde España;
Nintendo Game Boy Color Caesars Palace II Juego Cartucho Solo;2,05 EUR;+ 7,03 EUR de envío;desde Reino Unido;
Caesars Palace 2 Nintendo Gameboy Colour;8,18 EUR;+ 18,19 EUR de envío estimado;desde Reino Unido;
Nintendo Game Boy Color - Caesars Palace II 2 - PAL - EUR;4,99 EUR;+ 5,00 EUR de envío;desde Francia;
Caesars Palace - Gameboy Classic - FAH - GB CIB near MINT;49,99 EUR;+ 9,70 EUR de envío;desde Bélgica;
Caesars Palace Nuevo (no Sellado) Nintendo Gameboy Color.;31,47 EUR;+ 17,52 EUR de envío estimado;desde Reino Unido;
Caesars Palace Nintendo Game Boy Gameboy GB Región Libre Completo Versión en Inglés;35,15 EUR;+ 3,50 EUR de envío;desde Portugal;
Game Boy GB:Caesars Palace - Las Vegas [TOP & 1ERE EDITION] Jap;19,90 EUR;+ 5,80 EUR de envío;desde Francia;
Caesars Palace completa Nintendo Game Boy Advance GBA Libre P&P;10,54 EUR;+ 17,08 EUR de envío estimado;desde Reino Unido;
Gameboy Advance GBA-Caesars Palace King Kong Power Rangers Beyblade;17,52 EUR;+ 17,23 EUR de envío estimado;desde Reino Unido;
Nintendo Gameboy Juego-Caesars Palace;9,32 EUR;+ 17,05 EUR de envío estimado;desde Reino Unido;
Nintendo Gameboy Juego-Caesars Palace;9,32 EUR;+ 17,05 EUR de envío estimado;desde Reino Unido;
Nintendo Gameboy Juego-Caesars Palace;9,32 EUR;+ 17,05 EUR de envío estimado;desde Reino Unido;
Caesars Palace 2 Nintendo Gameboy Colour;5,85 EUR;+ 18,13 EUR de envío estimado;desde Reino Unido;
Game Boy GB : Caesars Palace - las Vegas [ Top & 1ERE Edition] Jap;19,90 EUR;+ 6,00 EUR de envío;desde Francia;
Caesars Palace ADVANCE Milenio Gold Edition Nintendo Gameboy Advance Juego;13,47 EUR;+ 18,28 EUR de envío;desde Reino Unido;
Nintendo Gameboy / Game Boy Advance Caesars Palace Advance Spiel en Ovp / CIB;19,95 EUR;+ 40,00 EUR de envío;desde Alemania;
Caesars Palace - Cart - Gameboy;4,50 EUR;+ 11,00 EUR de envío;desde Países Bajos;
Caesars Palace Gameboy Sin Caja;9,32 EUR;+ 17,05 EUR de envío estimado;desde Reino Unido;
Caesars Palace Milenio GOLD EDITION NINTENDO Gameboy Advance europeo Reino Unido Ver;4,51 EUR;+ 7,08 EUR de envío;desde Grecia;
Nintendo Gameboy Juegos-los Simpson, Scooby Doo, Caesars Palace 2, Scrabble;19,99 EUR;+ 17,28 EUR de envío estimado;desde Reino Unido;
Gameboy Color Game: Caesars Palace II [PAL] (Complete) [EUR];14,95 EUR;+ 17,50 EUR de envío;desde Países Bajos;
Reino Unido - Caesars Palace para Nintendo GameBoy;9,95 EUR;+ 6,50 EUR de envío;desde Alemania;
Caesars Palace Advance Nintendo Game Boy Advance En Caja;7,02 EUR;+ 21,10 EUR de envío estimado;desde Reino Unido;
Nintendo GameBoy Color Juego-Caesars Palace Ii En Caja Perfecto Estado;21,27 EUR;Envío internacional gratis;desde Alemania;
Notice - Instruction Booklet Caesars Palace II (2) Game Boy EUU;4,00 EUR;Envío internacional gratis;desde Francia;
Caesars Palace - Game Cartridge - Nintendo Game Boy Classic USA;5,00 EUR;+ 20,00 EUR de envío;desde Países Bajos;
Caesars Palace GAMEBOY NINTENDO EUR PARI NUOVO consegna Max 3 giorni leggi tutto;8,00 EUR;+ 25,00 EUR de envío;desde Italia;
Caesars Palace - Gameboy - Nintendo - Notice FAH;3,99 EUR;+ 3,88 EUR de envío;desde Francia;
