Caesars Palace Juego Boy juego;5,28 EUR;+ 16,99 EUR de envío estimado;desde Reino Unido;
Caesars Palace Advance Nintendo Game Boy Advance BOXED PAL;17,60 EUR;+ 17,26 EUR de envío estimado;desde Reino Unido;
Caesars Palace Game Boy PAL;29,95 EUR;+ 19,95 EUR de envío;desde España;
Caesars Palace Nintendo Game Boy Color Advance Juego Completo En Caja Original;48,56 EUR;+ 22,03 EUR de envío estimado;desde Reino Unido;
Nintendo Game Boy Color Caesars Palace II EUR Très Bon état;4,90 EUR;+ 11,98 EUR de envío;desde Francia;
Nintendo Game Boy Gameboy A Mano En Caesars Palace;10,56 EUR;+ 11,74 EUR de envío;desde Reino Unido;
Nintendo Game Boy Color - Caesars Palace II 2 - PAL - EUR;4,99 EUR;+ 5,00 EUR de envío;desde Francia;
Caesars Palace 2 - Gameboy Color - Complet;14,99 EUR;+ 3,88 EUR de envío;desde Francia;
Caesars Palace 2 Nintendo Gameboy Colour;8,20 EUR;+ 18,23 EUR de envío estimado;desde Reino Unido;
Caesars Palace Ii Nintendo Gameboy Colour Color COMPLETO PAL;11,69 EUR;+ 17,13 EUR de envío estimado;desde Reino Unido;
Caesars Palace Nuevo (no Sellado) Nintendo Gameboy Color.;31,53 EUR;+ 17,56 EUR de envío estimado;desde Reino Unido;
Caesars Palace Gameboy RARO CIB condición coleccionable ✔;52,79 EUR;+ 18,02 EUR de envío estimado;desde Reino Unido;
Caesars Palace completa Nintendo Game Boy Advance GBA Libre P&P;10,56 EUR;+ 17,11 EUR de envío estimado;desde Reino Unido;
Game Boy GB:Caesars Palace - Las Vegas [TOP & 1ERE EDITION] Jap;19,90 EUR;+ 5,80 EUR de envío;desde Francia;
Gameboy Advance GBA-Caesars Palace King Kong Power Rangers Beyblade;17,56 EUR;+ 17,26 EUR de envío estimado;desde Reino Unido;
Caesars Palace 2 Nintendo Gameboy Colour;5,86 EUR;+ 18,17 EUR de envío estimado;desde Reino Unido;
Game Boy GB : Caesars Palace - las Vegas [ Top & 1ERE Edition] Jap;19,90 EUR;+ 6,00 EUR de envío;desde Francia;
Nintendo Gameboy / Game Boy Advance Caesars Palace Advance Spiel en Ovp / CIB;19,95 EUR;+ 40,00 EUR de envío;desde Alemania;
Caesars Palace ADVANCE Milenio Gold Edition Nintendo Gameboy Advance Juego;13,49 EUR;+ 18,32 EUR de envío;desde Reino Unido;
Nintendo Gameboy Juego-Caesars Palace;9,34 EUR;+ 17,09 EUR de envío estimado;desde Reino Unido;
Nintendo Gameboy Juego-Caesars Palace;9,34 EUR;+ 17,09 EUR de envío estimado;desde Reino Unido;
Nintendo Gameboy Juego-Caesars Palace;9,34 EUR;+ 17,09 EUR de envío estimado;desde Reino Unido;
Caesars Palace Gameboy Sin Caja;9,34 EUR;+ 17,09 EUR de envío estimado;desde Reino Unido;
Nintendo Gameboy Juegos-los Simpson, Scooby Doo, Caesars Palace 2, Scrabble;20,04 EUR;+ 17,31 EUR de envío estimado;desde Reino Unido;
Caesars Palace Advance Nintendo Game Boy Advance En Caja;7,03 EUR;+ 21,14 EUR de envío estimado;desde Reino Unido;
Reino Unido - Caesars Palace para Nintendo GameBoy;9,95 EUR;+ 6,50 EUR de envío;desde Alemania;
Notice - Instruction Booklet Caesars Palace II (2) Game Boy EUU;4,00 EUR;Envío internacional gratis;desde Francia;
Caesars Palace GAMEBOY NINTENDO EUR PARI NUOVO consegna Max 3 giorni leggi tutto;8,00 EUR;+ 25,00 EUR de envío;desde Italia;
GameBoy Advance - Caesars Palace Advance en el embalaje muy buen estado usado;21,99 EUR;Envío internacional gratis;desde Alemania;
Nintendo GameBoy juego - Caesars Palace JAPAN cartucho usado;13,99 EUR;Envío internacional gratis;desde Alemania;
Nintendo GameBoy Color juego - Caesars Palace II en el embalaje usado COMO NUEVO;28,99 EUR;Envío internacional gratis;desde Alemania;
Nintendo GameBoy Color juego - Caesars Palace II / 2 cartucho usado;16,99 EUR;Envío internacional gratis;desde Alemania;
Nintendo GameBoy juego - Caesars Palace cartucho usado;18,99 EUR;Envío internacional gratis;desde Alemania;
Nintendo GameBoy juego - Caesars Palace en el embalaje usado COMO NUEVO;69,99 EUR;+ 69,99 EUR de envío;desde Alemania;
Nintendo Gameboy Advance Caesars Palace Advance MILLENIUM GOLD EDITION;17,60 EUR;+ 17,26 EUR de envío estimado;desde Reino Unido;
Caesars Palace - Gameboy - Nintendo - Notice FAH;3,99 EUR;+ 3,88 EUR de envío;desde Francia;
Jeu Gameboy Color Caesars Palace II;9,32 EUR;+ 39,00 EUR de envío;desde Francia;
