Nintendo Game Boy-The Jungle Book-nuevo-en su embalaje original-Wata AFA VGA Ready;1.199,90 EUR;Envío no especificado;desde Alemania;
The Jungle Book (Game Boy GB 1993) Solo Cartucho;6,90 EUR;+ 9,90 EUR de envío;desde España;
Nintendo Gameboy-The Jungle Book-VGA 80+ nm-Embalaje original-nuevo-rar-Top;1.500,00 EUR;Envío no especificado;desde Alemania;
Nintendo Game Boy Color The Jungle Book EUR Très Bon état;6,90 EUR;+ 14,98 EUR de envío;desde Francia;
The Jungle Book Mowgli's Wild Adventure - Nintendo Game Boy Color;5,90 EUR;+ 5,95 EUR de envío;desde Francia;
The Jungle Book-GameBoy Color #191;4,89 EUR;+ 2,99 EUR de envío;desde Alemania;
The Jungle Book Disney's Classic - Gameboy Classic - NHOL/FAH - GB CIB;21,99 EUR;+ 9,70 EUR de envío;desde Bélgica;
Disney's The Jungle Book | With Manual | GameBoy 🕹 Excellent Condition!;9,50 EUR;+ 3,50 EUR de envío;desde Países Bajos;
Disneys The Jungle Book-Nintendo Game Boy Advance-PAL-C-Ware;4,31 EUR;+ 1,09 EUR de envío;desde Austria;
Nintendo Gameboy The Jungle Book ;4,95 EUR;+ 2,95 EUR de envío;desde Países Bajos;
Nintendo Gameboy advance gba The Jungle Book ;4,95 EUR;+ 2,95 EUR de envío;desde Países Bajos;
Nintendo Gameboy Color The Jungle Book Mowgli's Wild Adventure eng/ita/es/fr/ger;4,95 EUR;+ 2,95 EUR de envío;desde Países Bajos;
The Jungle Book Game Boy Color;9,60 EUR;+ 3,00 EUR de envío;desde Francia;
Nintendo Gameboy Classic juego/The Jungle Book;7,95 EUR;+ 6,00 EUR de envío;desde Alemania;
Nintendo Game Boy - The Jungle Book - PAL - EUR;7,99 EUR;+ 4,60 EUR de envío;desde Francia;
The Jungle Book - Disney - Game Boy Advance - GBA - Nintendo - Tested & Working;3,99 EUR;+ 7,00 EUR de envío;desde Bélgica;
