Nintendo Gameboy Advance GBA - Road Rash Jailbreak;17,59 EUR;+ 17,30 EUR de envío estimado;Vendidos  8 dic 2021Artículo vendido;desde Reino Unido;
Nintendo Game Boy Road Rash GameBoy  Vers. UKV;9,90 EUR;Envío no especificado;Vendidos  7 dic 2021Artículo vendido;desde Francia;
Nintendo Gameboy - Road Rash;10,53 EUR;+ 17,15 EUR de envío estimado;Vendidos  29 nov 2021Artículo vendido;desde Reino Unido;
Road Rash - Nintendo Game Boy (Cartridge Only);9,36 EUR;+ 4,71 EUR de envío;Vendidos  25 nov 2021Artículo vendido;desde Reino Unido;
Nintendo Gameboy Boxed - Road Rash White Box;35,25 EUR;+ 17,68 EUR de envío estimado;Vendidos  21 nov 2021Artículo vendido;desde Reino Unido;
Road Rash (Nintendo Game Boy) UK PAL - Fully Tested;8,23 EUR;+ 18,75 EUR de envío estimado;Vendidos  20 nov 2021Artículo vendido;desde Reino Unido;
Nintendo Gameboy Game - Road Rash;10,53 EUR;+ 17,15 EUR de envío estimado;Vendidos  11 nov 2021Artículo vendido;desde Reino Unido;
Road Rash Jailbreak official Soundtrack CD  rare! Playstation 1 Gameboy Advance;35,30 EUR;+ 17,68 EUR de envío estimado;Vendidos  21 sep 2021Artículo vendido;desde Reino Unido;
Road Rash For Nintendo Game Boy With Official Case;11,76 EUR;+ 17,17 EUR de envío estimado;Vendidos  11 sep 2021Artículo vendido;desde Reino Unido;
Game Boy Advance - Road Rash Jailbreak! GBA Game Nintendo Tested And Working;1,78 EUR;+ 4,09 EUR de envío;Vendidos  6 dic 2021Artículo vendido;desde Estados Unidos;
Road Rash 1 (Sega Genesis,1992) Cartridge Only Authentic Tested good;8,00 EUR;+ 4,71 EUR de envío;Vendidos  3 dic 2021Artículo vendido;desde Estados Unidos;
Road Rash - Sega Genesis, Authentic Cartridge & Manual, Tested and WORKING;13,34 EUR;Envío gratis;Vendidos  2 dic 2021Artículo vendido;desde Estados Unidos;
Road Rash I & Road Rash II Game Lot (Sega Genesis, 1992) AUTHENTIC!  TESTED!;17,78 EUR;Envío gratis;Vendidos  27 nov 2021Artículo vendido;desde Estados Unidos;
Road Rash Game Boy Color Nintendo Instruction Manual Only;7,10 EUR;Envío gratis;Vendidos  24 nov 2021Artículo vendido;desde Estados Unidos;
Road Rash (Sega Genesis, 1992) *Case And Artwork Only*;8,89 EUR;+ 4,62 EUR de envío;Vendidos  24 nov 2021Artículo vendido;desde Estados Unidos;
Road Rash (Sega Genesis, 1992) Tested Authentic;11,55 EUR;Envío gratis;Vendidos  23 nov 2021Artículo vendido;desde Estados Unidos;
New Sealed Road Rash (Sega Genesis, 1992) See description;311,19 EUR;+ 8,76 EUR de envío;Vendidos  20 nov 2021Artículo vendido;desde Estados Unidos;
Road Rash (Sega Genesis, 1992);15,11 EUR;+ 4,71 EUR de envío;Vendidos  14 nov 2021Artículo vendido;desde Estados Unidos;
Road Rash (Nintendo Game Boy Color, 2000) authentic cleaned and tested;15,11 EUR;Envío gratis;Vendidos  13 nov 2021Artículo vendido;desde Estados Unidos;
Road Rash (Nintendo Game Boy Color, 2000) authentic cleaned and tested;13,34 EUR;Envío gratis;Vendidos  13 nov 2021Artículo vendido;desde Estados Unidos;
Road Rash 1 (Sega Genesis,1992) Cartridge Only Authentic Tested Free Shipping;13,25 EUR;Envío gratis;Vendidos  13 nov 2021Artículo vendido;desde Estados Unidos;
Road Rash (Sega Genesis, 1992)  NICE VINTAGE GAME! TESTED WORKS! ;19,12 EUR;+ 3,56 EUR de envío;Vendidos  12 nov 2021Artículo vendido;desde Estados Unidos;
Road Rash Jailbreak Nintendo (Gameboy Advance) GBA Authentic Cart Only TESTED;7,85 EUR;Envío gratis;Vendidos  12 nov 2021Artículo vendido;desde Estados Unidos;
Road Rash: Jailbreak (Nintendo Game Boy Advance, 2003) Brand New Sealed;26,63 EUR;+ 3,56 EUR de envío;Vendidos  9 nov 2021Artículo vendido;desde Estados Unidos;
3 Nintendo Game Boy Advance Games: Sims 2, Pirates Of The Caribbean, Road Rash;12,45 EUR;+ 3,69 EUR de envío;Vendidos  5 nov 2021Artículo vendido;desde Estados Unidos;
Road Rash Jailbreak (Nintendo Gameboy Boy Advance GBA) Cart Only GREAT ;6,75 EUR;Envío gratis;Vendidos  4 nov 2021Artículo vendido;desde Estados Unidos;
Road Rash Nintendo Game Boy;21,31 EUR;+ 2,62 EUR de envío;Vendidos  3 nov 2021Artículo vendido;desde Estados Unidos;
Road Rash (Sega Genesis, 1992) Complete With Manual;23,11 EUR;Envío gratis;Vendidos  31 oct 2021Artículo vendido;desde Estados Unidos;
Road Rash (Sega Genesis, 1992) - Complete w/ Box and Manual - Tested;17,78 EUR;+ 4,80 EUR de envío;Vendidos  29 oct 2021Artículo vendido;desde Estados Unidos;
Road Rash 1 (Sega Genesis,1992) Cartridge Only Authentic Tested Free Shipping;13,29 EUR;Envío gratis;Vendidos  28 oct 2021Artículo vendido;desde Estados Unidos;
Road Rash: Jailbreak (Nintendo Game Boy Advance, 2003) ;17,77 EUR;Envío gratis;Vendidos  21 oct 2021Artículo vendido;desde Estados Unidos;
Road Rash (Sega Genesis, 1992) Complete In Box Cib;19,56 EUR;+ 8,76 EUR de envío;Vendidos  20 oct 2021Artículo vendido;desde Estados Unidos;
Road Rash, Island Xtreme, Ballistic (Nintendo Game Boy Advance, 2003) New Sealed;88,91 EUR;Envío gratis;Vendidos  18 oct 2021Artículo vendido;desde Estados Unidos;
Nintendo Game Boy Advance AGB-001 and Road Rash Jailbreak GBA Cartridge;53,34 EUR;Envío gratis;Vendidos  13 oct 2021Artículo vendido;desde Estados Unidos;
Road Rash: Jailbreak (Nintendo Game Boy Advance, 2003);8,45 EUR;Envío gratis;Vendidos  12 oct 2021Artículo vendido;desde Estados Unidos;
Road Rash (Sega Genesis, 1992) cartridge only. Plays great ;10,67 EUR;Envío gratis;Vendidos  3 oct 2021Artículo vendido;desde Estados Unidos;
Road Rash: Jailbreak for Nintendo Game Boy Advance Complete Fast Shipping!;13,29 EUR;Envío gratis;Vendidos  3 oct 2021Artículo vendido;desde Estados Unidos;
Road Rash: Jailbreak (Nintendo Game Boy Advance, 2003) new gba;26,63 EUR;+ 6,21 EUR de envío;Vendidos  3 oct 2021Artículo vendido;desde Estados Unidos;
Road Rash for Original Nintendo Game Boy GB worn ;13,33 EUR;+ 3,99 EUR de envío;Vendidos  30 sep 2021Artículo vendido;desde Estados Unidos;
Road Rash: Jailbreak (Nintendo Game Boy Advance, 2003) Brand New Sealed;24,85 EUR;+ 3,56 EUR de envío;Vendidos  29 sep 2021Artículo vendido;desde Estados Unidos;
Road Rash 1 - Cleaned, Tested, & Working - (Sega Genesis, 1992);11,11 EUR;Envío gratis;Vendidos  27 sep 2021Artículo vendido;desde Estados Unidos;
Road Rash Jailbreak (Nintendo Game Boy Advance Gameboy) NEW Factory Sealed;11,55 EUR;Envío gratis;Vendidos  26 sep 2021Artículo vendido;desde Estados Unidos;
Road Rash Sega Game Gear Mega Rare Cib #0100;117,62 EUR;+ 24,40 EUR de envío estimado;Vendidos  22 nov 2021Artículo vendido;desde Reino Unido;
Road Rash Sega Game Gear Boxed and Complete ;117,67 EUR;+ 24,40 EUR de envío estimado;Vendidos  23 oct 2021Artículo vendido;desde Reino Unido;
Road Rash 2 Sega Mega Drive Game Complete Pal;19,99 EUR;+ 17,35 EUR de envío estimado;Vendidos  10 oct 2021Artículo vendido;desde Reino Unido;
Road Rash 3 - Sega Mega Drive Game (Tested - Fast Dispatch - PAL);23,48 EUR;+ 18,83 EUR de envío estimado;Vendidos  6 oct 2021Artículo vendido;desde Reino Unido;
Road Rash 2 - Sega Mega Drive Game (Tested - Fast Dispatch - PAL);11,71 EUR;+ 18,58 EUR de envío estimado;Vendidos  11 sep 2021Artículo vendido;desde Reino Unido;
Road Rash - Sega Mega Drive Game (Tested - Fast Dispatch - PAL) cart only;10,58 EUR;+ 17,15 EUR de envío estimado;Vendidos  17 sep 2021Artículo vendido;desde Reino Unido;
Road Rash II (2)- Sega Mega drive Game - Complete Very Good Condition;23,52 EUR;+ 17,42 EUR de envío estimado;Vendidos  30 oct 2021Artículo vendido;desde Reino Unido;
Road Rash Sega Game Gear Cib Rare #0025;58,78 EUR;+ 22,30 EUR de envío estimado;Vendidos  21 sep 2021Artículo vendido;desde Reino Unido;
Road Rash 2 - Sega Mega Drive Game (Tested - Fast Dispatch - PAL);11,71 EUR;+ 18,58 EUR de envío estimado;Vendidos  9 sep 2021Artículo vendido;desde Reino Unido;
Road Rash Roadrash 64 NINTENDO 64 N64 GAME OFFICIAL EUR UK PAL cartridge only;29,41 EUR;+ 21,66 EUR de envío estimado;Vendidos  24 nov 2021Artículo vendido;desde Reino Unido;
EA Road Rash Classics Vintage Big Box PC Game with Manual;14,06 EUR;+ 20,75 EUR de envío estimado;Vendidos  5 oct 2021Artículo vendido;desde Reino Unido;
Sega Saturn Road Rash Video Game Pal ;41,78 EUR;+ 18,24 EUR de envío;Vendidos  11 oct 2021Artículo vendido;desde Reino Unido;
Road Rash Jailbreak PS1 game - complete;11,76 EUR;+ 20,69 EUR de envío estimado;Vendidos  1 dic 2021Artículo vendido;desde Reino Unido;
2 x Sega Game Gear Video Games - Road Rash & Chase HQ, + Manuals.;47,06 EUR;+ 17,92 EUR de envío estimado;Vendidos  26 sep 2021Artículo vendido;desde Reino Unido;
Road Rash - Sega Mega Drive Game (Tested - Fast Dispatch - PAL);11,71 EUR;+ 18,58 EUR de envío estimado;Vendidos  17 sep 2021Artículo vendido;desde Reino Unido;
Road Rash Sega Mega Drive Boxed & Complete RARE 90s Game Manual Inc UK SELLER;17,64 EUR;+ 26,36 EUR de envío estimado;Vendidos  21 sep 2021Artículo vendido;desde Reino Unido;
Road Rash - Sega Mega Drive Game (Tested - Fast Dispatch - PAL);11,76 EUR;+ 18,58 EUR de envío estimado;Vendidos  26 sep 2021Artículo vendido;desde Reino Unido;
Road Rash - Sega Mega Drive Game (Tested - Fast Dispatch - PAL);11,76 EUR;+ 18,58 EUR de envío estimado;Vendidos  25 oct 2021Artículo vendido;desde Reino Unido;
Road Rash 3 - Sega Mega Drive Game (Tested - Fast Dispatch - PAL);23,48 EUR;+ 18,83 EUR de envío estimado;Vendidos  4 oct 2021Artículo vendido;desde Reino Unido;
Road Rash 64 Nintendo N64 - Complete & Boxed - Free P&P *Very Rare Game*;88,20 EUR;+ 23,77 EUR de envío estimado;Vendidos  16 sep 2021Artículo vendido;desde Reino Unido;
Road Rash 3D - Sony PS1 Playstation 1 Game;14,06 EUR;+ 17,22 EUR de envío estimado;Vendidos  5 dic 2021Artículo vendido;desde Reino Unido;
Sega Saturn Road Rash Game in very good condion complete;47,06 EUR;+ 22,88 EUR de envío estimado;Vendidos  21 nov 2021Artículo vendido;desde Reino Unido;
Road Rash 2 - Sega Mega Drive Game (Tested - Fast Dispatch - PAL);12,36 EUR;+ 18,59 EUR de envío estimado;Vendidos  26 sep 2021Artículo vendido;desde Reino Unido;
Road Rash Jailbreak Sony PlayStation 1 PS1 Game Complete FREE UK POSTAGE ;13,52 EUR;+ 17,20 EUR de envío estimado;Vendidos  15 nov 2021Artículo vendido;desde Reino Unido;
