Mega Man V/GameBoy/Capcom;99,88 EUR;Envío no especificado;Vendidos  19 nov 2021Artículo vendido;desde Alemania;
RARO NINTENDO GAMEBOY Juego De Mega Man V;175,43 EUR;+ 38,35 EUR de envío estimado;Vendidos  14 nov 2021Artículo vendido;desde Reino Unido;
Mega Man V / 5 Game Boy - Game Boy Color;44,99 EUR;+ 20,00 EUR de envío;Vendidos  20 oct 2021Artículo vendido;desde España;
Mega Man V Game Boy OVP cib;999,00 EUR;+ 20,00 EUR de envío;Vendidos  16 sep 2021Artículo vendido;desde Alemania;
Mega Man V ~ 100% Auténtico Juego CARTUCHO solo ~ Nintendo Game Boy mm 5 Rockman;159,49 EUR;+ 4,43 EUR de envío;Vendidos  11 dic 2021Artículo vendido;desde Estados Unidos;
Mega Man V 5 Nintendo Gameboy Auténtico;155,51 EUR;+ 4,42 EUR de envío;Vendidos  11 dic 2021Artículo vendido;desde Estados Unidos;
Mega Man V ~ 100% Auténtico Juego CARTUCHO solo ~ Nintendo Game Boy mm 5 Rockman;209,73 EUR;Envío gratis;Vendidos  7 dic 2021Artículo vendido;desde Estados Unidos;
Mega Man V Gameboy Original Cartucho (Megaman 5) funciona muy bien!;184,75 EUR;+ 3,94 EUR de envío;Vendidos  6 dic 2021Artículo vendido;desde Estados Unidos;
Mega Man V 5-Nintendo Game Boy, auténtico Cartucho Con Caja! GB Megaman;186,97 EUR;+ 5,32 EUR de envío;Vendidos  6 dic 2021Artículo vendido;desde Estados Unidos;
Juego de reemplazo personalizado de Mega Man V solo Manual De Instrucciones Para Gameboy;29,23 EUR;Envío gratis;Vendidos  2 dic 2021Artículo vendido;desde Estados Unidos;
Mega Man V (Nintendo Gameboy);172,74 EUR;Envío gratis;Vendidos  30 nov 2021Artículo vendido;desde Estados Unidos;
Mega Man V 5-Nintendo Game Boy, auténtico Cartucho, probado, Funciona! GB Megaman;167,47 EUR;Envío gratis;Vendidos  16 nov 2021Artículo vendido;desde Estados Unidos;
Mega Man V Megaman 5 Nintendo Game Boy Gameboy Auténtico Original Juego!;137,79 EUR;+ 7,09 EUR de envío;Vendidos  11 nov 2021Artículo vendido;desde Estados Unidos;
Rockman World 5 Juego Boy japonés Importado Mega Man V GB GBC Japón jp Vendedor de Estados Unidos;7,00 EUR;+ 3,94 EUR de envío;Vendidos  10 nov 2021Artículo vendido;desde Estados Unidos;
Mega Man V Megaman 5 Nintendo Game Boy Gameboy Auténtico Original Juego!;152,85 EUR;+ 7,09 EUR de envío;Vendidos  4 nov 2021Artículo vendido;desde Estados Unidos;
Mega Man Gameboy Colección Bundle! Mega Man IV ~ Mega Man V & Mega Man I-III;354,44 EUR;+ 7,09 EUR de envío;Vendidos  3 nov 2021Artículo vendido;desde Estados Unidos;
Mega Man V 5 Nintendo Game Boy limpiado & probado Auténtico;203,79 EUR;Envío gratis;Vendidos  25 oct 2021Artículo vendido;desde Estados Unidos;
Mega Man V Nintendo Game Boy Solo Manual;79,75 EUR;Envío gratis;Vendidos  22 oct 2021Artículo vendido;desde Estados Unidos;
Rockman World 5 Juego Boy japonés Importado Mega Man V GB GBC Japón jp Vendedor de Estados Unidos;35,43 EUR;Envío gratis;Vendidos  21 oct 2021Artículo vendido;desde Estados Unidos;
Mega Man V Megaman 5 Nintendo Game Boy Gameboy Auténtico Original Juego!;221,50 EUR;Envío gratis;Vendidos  13 oct 2021Artículo vendido;desde Estados Unidos;
Mega Man V-Nintendo Game Boy, auténtico Cartucho, probado, Funciona!;186,08 EUR;Envío gratis;Vendidos  13 oct 2021Artículo vendido;desde Estados Unidos;
Mega Man V-Nintendo Game Boy, auténtico Cartucho, probado, Funciona!;177,21 EUR;+ 4,03 EUR de envío;Vendidos  2 oct 2021Artículo vendido;desde Estados Unidos;
Mega Man V Nintendo Game Boy Juego ClassA;53,17 EUR;+ 4,21 EUR de envío;Vendidos  25 sep 2021Artículo vendido;desde Estados Unidos;
Mega Man V (5) Gameboy GB Excelentes Condiciones;177,21 EUR;+ 4,21 EUR de envío;Vendidos  24 sep 2021Artículo vendido;desde Estados Unidos;
Mega Man V Nintendo Game Boy Con Manual Y Caja;152,85 EUR;+ 3,90 EUR de envío;Vendidos  24 sep 2021Artículo vendido;desde Estados Unidos;
Mega Man V (5) Gameboy GB Excelentes Condiciones;177,22 EUR;+ 4,87 EUR de envío;Vendidos  19 sep 2021Artículo vendido;desde Estados Unidos;
Auténtico limpio Mega Man V 5 Nintendo Game Boy;159,50 EUR;+ 4,21 EUR de envío;Vendidos  14 sep 2021Artículo vendido;desde Estados Unidos;
