The Pagemaster (Nintendo Game Boy, probado 1994) solo carro;7,11 EUR;+ 3,56 EUR de envío;Vendidos  5 dic 2021Artículo vendido;desde Estados Unidos;
The Pagemaster Para Nintendo Gameboy limpiado probado Auténtico;7,90 EUR;Envío gratis;Vendidos  2 dic 2021Artículo vendido;desde Estados Unidos;
The Pagemaster (Nintendo Game Boy, 1994);4,45 EUR;+ 4,09 EUR de envío;Vendidos  2 dic 2021Artículo vendido;desde Estados Unidos;
The Pagemaster (Nintendo Gameboy GB) solo Carro Gran forma Juego Boy;7,10 EUR;Envío gratis;Vendidos  27 nov 2021Artículo vendido;desde Estados Unidos;
The Pagemaster (Nintendo Game Boy, 1994);7,10 EUR;Envío gratis;Vendidos  17 nov 2021Artículo vendido;desde Estados Unidos;
The Pagemaster Nintendo Game Boy, probado 1994.;6,21 EUR;Envío gratis;Vendidos  26 oct 2021Artículo vendido;desde Estados Unidos;
The Pagemaster (Nintendo Game Boy, 1994);5,79 EUR;+ 4,22 EUR de envío;Vendidos  26 sep 2021Artículo vendido;desde Estados Unidos;
The Pagemaster (Nintendo Game Boy, 1994) Gameboy viene con manual * funciona *;13,29 EUR;+ 4,00 EUR de envío;Vendidos  13 sep 2021Artículo vendido;desde Estados Unidos;
The Pagemaster Para Nintendo Gameboy auténtico probado Envío rápido;7,10 EUR;+ 4,05 EUR de envío;Vendidos  12 sep 2021Artículo vendido;desde Estados Unidos;
