Nuevo anuncioNintendo Game Boy * Bubble Ghost * EMBALAJE ORIGINAL CiB instrucciones BG-SCN;129,95 EUR;+ 6,70 EUR de envío;desde Alemania;
Bubble Ghost-Game Boy-juego-Nintendo-Gameboy buen estado;39,99 EUR;+ 4,99 EUR de envío;desde Alemania;
Jeu Nintendo Game boy Gameboy Bubble Ghost complet version française fah mit tbe;289,90 EUR;Envío no especificado;desde Francia;
Nintendo Game Boy * Bubble Ghost * Wata 6.0 B + no VGA;999,95 EUR;+ 35,99 EUR de envío;desde Alemania;
Bubble Ghost * Nintendo GameBoy * PAL FAH ;129,95 EUR;+ 21,00 EUR de envío;desde Países Bajos;
Nuevo anuncioBubble Ghost - Nintendo GameBoy Classic #184;59,89 EUR;+ 5,99 EUR de envío;desde Alemania;
Bubble Ghost | GameBoy🕹Excellent Condition !🌍 ;24,00 EUR;+ 3,50 EUR de envío;desde Países Bajos;
Nintendo-Game Boy VGA Juego-Bubble Ghost-SEALED - 85 nm + plata-rar;2.299,99 EUR;+ 150,00 EUR de envío;desde Alemania;
Notice Nintendo Game Boy Bubble Ghost SCN Bon état;14,90 EUR;+ 11,98 EUR de envío;desde Francia;
Nintendo Gameboy Bubble Ghost Blister VGA Ready ?? Neuf! ;1.699,99 EUR;+ 20,00 EUR de envío;desde Francia;
Bubble Ghost // Nintendo Gameboy - Solo Cartucho // PAL UKV - RARE;24,95 EUR;+ 14,95 EUR de envío;desde España;
Gb-Bubble Ghost para Nintendo GameBoy;64,95 EUR;+ 6,50 EUR de envío;desde Alemania;
Bubble Ghost Nintendo Gameboy OVP cib Boxed;199,00 EUR;Envío no especificado;desde Alemania;
Bubble Ghost, game boy ;36,30 EUR;Envío no especificado;desde España;
Bubble Ghost Mattel NINTENDO GAMEBOY GB COMPLETO CIB;149,85 EUR;Envío no especificado;desde Italia;
Bubble Ghost Gameboy Game Manual Only UKV;8,99 EUR;Envío no especificado;desde Irlanda;
