Battleship Nintendo Gameboy juego muy bien probado;4,99 EUR;+ 8,89 EUR de envío;Vendidos  14 nov 2021Artículo vendido;desde Alemania;
Battleship - EUR - Nintendo Gameboy Color - GBC;20,00 EUR;+ 25,00 EUR de envío;Vendidos  7 nov 2021Artículo vendido;desde Países Bajos;
Juego Battleship Nintendo Gameboy;7,04 EUR;+ 17,05 EUR de envío estimado;Vendidos  19 oct 2021Artículo vendido;desde Reino Unido;
Battleship-auténtico-NINTENDO GAME BOY GB-Solo Manual!;2,56 EUR;Envío gratis;Vendidos  27 nov 2021Artículo vendido;desde Estados Unidos;
Battleship (Nintendo Game Boy Color, 1999) Game Boy Color Auténtico Probado;13,25 EUR;Envío gratis;Vendidos  22 nov 2021Artículo vendido;desde Estados Unidos;
Battleship (Nintendo Game Boy Color, 1999) - auténtico-etiqueta del cartucho falta;4,27 EUR;Envío gratis;Vendidos  11 nov 2021Artículo vendido;desde Estados Unidos;
Battleship (Nintendo GameBoy, 1992) - solo Carro-limpiado & probado, auténtico;8,79 EUR;Envío gratis;Vendidos  3 nov 2021Artículo vendido;desde Estados Unidos;
Battleship (Nintendo Game Boy Color, 1999);8,79 EUR;Envío gratis;Vendidos  31 oct 2021Artículo vendido;desde Estados Unidos;
Juego Battleship riesgo pista Gameboy avanzada GBA CARTUCHO sólo;7,06 EUR;Envío gratis;Vendidos  28 oct 2021Artículo vendido;desde Estados Unidos;
Nintendo Game Boy Original Negro Nuevo Vidrio Pantalla con Battleship De Trabajo;66,27 EUR;+ 8,17 EUR de envío;Vendidos  26 oct 2021Artículo vendido;desde Estados Unidos;
Nintendo Game Boy Original Negro Nuevo Vidrio Pantalla con Battleship De Trabajo;66,27 EUR;+ 8,17 EUR de envío;Vendidos  18 oct 2021Artículo vendido;desde Estados Unidos;
Risk / Clue / Battleship (Nintendo Game Boy Advance) Cart Only ;6,86 EUR;+ 10,33 EUR de envío;Vendidos  16 oct 2021Artículo vendido;desde Canadá;
Battleship Juego Boy Color Gameboy juego probado Funcionando Auténtico;6,19 EUR;Envío gratis;Vendidos  11 oct 2021Artículo vendido;desde Estados Unidos;
2X Battleship (Nintendo Game Boy, 1992) Auténtico-solo carro;8,83 EUR;Envío gratis;Vendidos  7 sep 2021Artículo vendido;desde Estados Unidos;
Battleship (Nintendo 3DS Juego) Nuevo y Sellado Rápido Gratis 🚚 🚚 🚚;18,75 EUR;+ 19,46 EUR de envío estimado;Vendidos  2 dic 2021Artículo vendido;desde Reino Unido;
