Milon's Secret Castle Game Boy FAH ;25,00 EUR;Envío internacional gratis;Vendidos  30 sep 2021Artículo vendido;desde Francia;
Milon's Secret Castle Nintendo Game Boy Gameboy auténtico Original Retro Clásico;23,00 EUR;Envío gratis;Vendidos  20 dic 2021Artículo vendido;desde Estados Unidos;
Milon's Secret Castle Nintendo Gameboy solo manual de instrucciones;8,41 EUR;Envío gratis;Vendidos  8 nov 2021Artículo vendido;desde Estados Unidos;
Milon's Secret Castle (Nintendo Game Boy) Auténtico Juego sólo Buen Sello;17,67 EUR;Envío gratis;Vendidos  1 nov 2021Artículo vendido;desde Estados Unidos;
Milon's Secret Castle Nintendo Game Boy Cartucho Completo en Caja ciento sin reserva One;100,54 EUR;+ 4,43 EUR de envío;Vendidos  23 oct 2021Artículo vendido;desde Estados Unidos;
Milon's Secret Castle Nintendo Game Boy Juego Y Manual. GAMEBOY. Excelente Estado;24,79 EUR;+ 4,87 EUR de envío;Vendidos  19 oct 2021Artículo vendido;desde Estados Unidos;
Milon's Secret Castle Juego Original Nintendo GameBoy Probado;16,73 EUR;Envío gratis;Vendidos  3 oct 2021Artículo vendido;desde Estados Unidos;
Milon's Secret Castle Nintendo Game Boy Juego Y Manual ~ probado y de trabajo;14,62 EUR;+ 8,15 EUR de envío;Vendidos  24 sep 2021Artículo vendido;desde Estados Unidos;
Milon's Secret Castle Nintendo Nes - No original Nasa Yess Funciona;8,50 EUR;+ 10,95 EUR de envío;Vendidos  18 nov 2021Artículo vendido;desde España;
