Nintendo Game Boy Classic juego Choplifter III con embalaje original y guía EUR;129,90 EUR;+ 36,99 EUR de envío;desde Alemania;
Nintendo Game Boy Classic juego Choplifter III módulo EUR;21,90 EUR;+ 8,99 EUR de envío;desde Alemania;
Nintendo Game Boy Choplifter III EUR Très Bon état #1;34,90 EUR;+ 11,98 EUR de envío;desde Francia;
Nuevo anuncioNintendo Game Boy * Choplifter III/3 * EMBALAJE ORIGINAL CiB Instrucciones Ocean White AC3E-UKV;69,95 EUR;+ 6,70 EUR de envío;desde Alemania;
Nintendo Game Boy Choplifter III EUR Très Bon état;29,90 EUR;+ 11,98 EUR de envío;desde Francia;
Nuevo anuncioNintendo Game Boy *Choplifter III/ 3* OVP CiB Manual AC3E-EUR;99,95 EUR;+ 6,70 EUR de envío;desde Alemania;
Nintendo Game Boy Classic juego Choplifter III módulo EUR;24,90 EUR;+ 8,99 EUR de envío;desde Alemania;
Choplifter III-Nintendo Gameboy;17,54 EUR;+ 13,48 EUR de envío;desde Reino Unido;
Nintendo Game Boy - Choplifter III - PAL - EUR;34,99 EUR;+ 5,00 EUR de envío;desde Francia;
Choplifter III (3) - Nintendo Gameboy Original En Caja;117,16 EUR;+ 15,22 EUR de envío;desde Reino Unido;
1994 Choplifter III SNES Sega Genesis Game Boy Vintage Mini / Poster Ad Framed;42,27 EUR;+ 15,24 EUR de envío;desde Alemania;
Choplifter III Nintendo Game Boy Fridge Magnet Magnete Frigorifero;2,22 EUR;+ 2,50 EUR de envío;desde España;
Choplifter III NINTENDO GAME BOY FRIDGE MAGNET;1,80 EUR;+ 2,47 EUR de envío;desde España;
Choplifter III Game Boy Nintendo Llavero;1,80 EUR;+ 2,47 EUR de envío;desde España;
Choplifter III Nintendo Game Boy Fridge Magnet Aimant Frigo;2,18 EUR;+ 2,50 EUR de envío;desde España;
SEGA Game Gear - Choplifter III 3 Rescue Survive - NTSC - USA;29,99 EUR;+ 5,50 EUR de envío;desde Francia;
