Battletoads in Ragnarok's World Notice - Instruction Booklet Game Boy FAH;15,00 EUR;Envío internacional gratis;desde Francia;
Nintendo Game Boy Battletoads in Ragnarok's World DMG-R7-ITA #ebayheroes;15,00 EUR;+ 28,00 EUR de envío;desde Italia;
Battletoads in Ragnarok's World (Nintendo Game Boy) Good Label Authentic Gameboy;27,72 EUR;+ 10,26 EUR de envío;desde Canadá;
Battletoads in Ragnarok's World Game Boy Spiel #1603;23,99 EUR;+ 16,09 EUR de envío;desde Suiza;
Battletoads in Ragnarok's World - GameBoy - PAL - AUS;24,82 EUR;+ 13,06 EUR de envío;desde Australia;
Battletoads in Ragnarok's World - Nintendo Game Boy;18,19 EUR;+ 15,94 EUR de envío;desde Canadá;
Battletoads in Ragnarok's World SNES Game Boy Vintage Poster / Ad Page Framed;42,27 EUR;+ 15,24 EUR de envío;desde Alemania;
