Nintendo Game Boy Dr. Franken II FAH Très Bon état;34,90 EUR;+ 11,98 EUR de envío;desde Francia;
Nintendo Gameboy Juego-Dr. Franken II 2;10,50 EUR;+ 17,08 EUR de envío estimado;desde Reino Unido;
Gameboy Color Dr. Franken II CARTUCHO;11,59 EUR;+ 17,10 EUR de envío estimado;desde Reino Unido;
NINTENDO GAME BOY-Dr. Franken II (en Caja);103,54 EUR;Envío internacional gratis;desde Reino Unido;
Dr. Franken II Nintendo GameBoy Cartucho De Juego Original;10,54 EUR;+ 6,45 EUR de envío;desde Reino Unido;
Nintendo Game Boy-Dr. Franken II (BOXED2);103,54 EUR;Envío internacional gratis;desde Reino Unido;
NINTENDO GAMEBOY GB Game Dr. Franken II;14,05 EUR;Envío no especificado;desde Reino Unido;
Dr. Franken II 2 (Nintendo Gameboy GB) solo Carro Gran forma Juego Boy;16,39 EUR;Envío gratis;desde Estados Unidos;
Dr. Franken II (Nintendo Game Boy) cartucho sólo probado;15,87 EUR;Envío gratis;desde Estados Unidos;
Dr. Franken II (Nintendo Game Boy) Usado;20,38 EUR;+ 2,65 EUR de envío;desde Estados Unidos;
Dr. Franken II 2 (Game Boy, 1997) - Ultra Poco común!;17,69 EUR;+ 5,54 EUR de envío;desde Estados Unidos;
Dr. Franken II Nintendo Game Boy Video Juego Carro;11,09 EUR;Envío gratis;desde Estados Unidos;
Dr. Franken II 2 (Nintendo GameBoy) Auténtico -- Completo En Caja;390,03 EUR;Envío gratis;desde Estados Unidos;
Dr. Franken II (Nintendo Game Boy);44,28 EUR;+ 2,65 EUR de envío;desde Estados Unidos;
Dr. Franken II NINTENDO GAME BOY Vidpro tarjeta de pantalla promocionales sólo;23,93 EUR;Envío gratis;desde Estados Unidos;
1993 Dr. Franken II NINTENDO SUPER NES GAME BOY Vintage Mini Cartel Promo enmarcado/ad;39,88 EUR;+ 15,06 EUR de envío;desde Alemania;
Dr. Franken II Game Boy Nintendo Llavero;1,80 EUR;+ 2,47 EUR de envío;desde España;
Dr. Franken II NINTENDO GAME BOY FRIDGE MAGNET;1,80 EUR;+ 2,47 EUR de envío;desde España;
Dr. Franken II 2 Gameboy manual de instrucciones solo Jaleco Raro;53,19 EUR;Envío gratis;desde Estados Unidos;
Dr. Franken II ** Caja, plástico, y cartucho sólo ** (Nintendo Game Boy);265,95 EUR;Envío gratis;desde Estados Unidos;
