Nintendo Game Boy Dr. Franken II FAH Très Bon état;34,90 EUR;+ 11,98 EUR de envío;desde Francia;
Nintendo Gameboy Juego-Dr. Franken II 2;10,45 EUR;+ 16,99 EUR de envío estimado;desde Reino Unido;
Dr. Franken II Nintendo GameBoy Cartucho De Juego Original;10,48 EUR;+ 6,41 EUR de envío;desde Reino Unido;
Gameboy Color Dr. Franken II CARTUCHO;11,53 EUR;+ 17,02 EUR de envío estimado;desde Reino Unido;
NINTENDO GAME BOY-Dr. Franken II (en Caja);103,04 EUR;Envío internacional gratis;desde Reino Unido;
Nintendo Game Boy-Dr. Franken II (BOXED2);103,04 EUR;Envío internacional gratis;desde Reino Unido;
1993 Dr. Franken II NINTENDO SUPER NES GAME BOY Vintage Mini Cartel Promo enmarcado/ad;39,70 EUR;+ 14,99 EUR de envío;desde Alemania;
NINTENDO GAMEBOY GB Game Dr. Franken II;13,98 EUR;Envío no especificado;desde Reino Unido;
