Dr. Franken 2 II Nintendo Game Boy DMG | Carro-Original-Libre P&P;11,69 EUR;+ 17,07 EUR de envío estimado;desde Reino Unido;
Dr. Franken-NINTENDO GAME BOY 1992 juego solo carro versión USA MBC-Libre P&P;12,81 EUR;+ 17,10 EUR de envío estimado;desde Reino Unido;
Dr. Franken Nintendo Game Boy Juego Reino Unido Genuino (Solo Tarjeta);14,66 EUR;Envío internacional gratis;desde Reino Unido;
Nintendo Game Boy Dr. Franken II FAH Très Bon état;34,90 EUR;+ 11,98 EUR de envío;desde Francia;
Nintendo Gameboy En Caja Juego-Dr. Franken;31,55 EUR;+ 17,50 EUR de envío estimado;desde Reino Unido;
Dr. Franken 2 Cartucho sólo Gameboy;14,03 EUR;+ 17,12 EUR de envío estimado;desde Reino Unido;
Nintendo Gameboy Juego-EE. UU. variante-Dr. Franken;21,01 EUR;+ 17,27 EUR de envío estimado;desde Reino Unido;
Nintendo Gameboy Juego-Dr. Franken;11,64 EUR;+ 17,07 EUR de envío estimado;desde Reino Unido;
Nintendo Gameboy Juego-Dr. Franken II 2;10,49 EUR;+ 17,05 EUR de envío estimado;desde Reino Unido;
NINTENDO GAME BOY-Dr. Franken II (en Caja);103,40 EUR;Envío internacional gratis;desde Reino Unido;
NINTENDO GAME BOY-Dr. Franken (en Caja);105,27 EUR;+ 24,01 EUR de envío estimado;desde Reino Unido;
Dr. Franken 2 Juego Boy Completamente En Caja Con Manual;93,61 EUR;+ 23,76 EUR de envío estimado;desde Reino Unido;
Nintendo Game Boy-Dr. Franken II (BOXED2);103,40 EUR;Envío internacional gratis;desde Reino Unido;
Gameboy Color Dr. Franken II CARTUCHO;11,57 EUR;+ 17,07 EUR de envío estimado;desde Reino Unido;
Super Mario Land/Bust a Move 4 y el Dr. Franken 2 Nintendo Game Boy Paquete;25,75 EUR;+ 17,38 EUR de envío estimado;desde Reino Unido;
Dr. Franken II Nintendo GameBoy Cartucho De Juego Original;10,52 EUR;+ 6,44 EUR de envío;desde Reino Unido;
Nintendo Gameboy Juego-Dr. Franken;11,64 EUR;+ 17,07 EUR de envío estimado;desde Reino Unido;
Nintendo Gameboy Juego-Dr. Franken;11,64 EUR;+ 17,07 EUR de envío estimado;desde Reino Unido;
Nintendo Gameboy Juego-Dr. Franken;10,49 EUR;+ 17,05 EUR de envío estimado;desde Reino Unido;
Nintendo GameBoy juego - Dr. Franken cartucho usado;20,99 EUR;Envío internacional gratis;desde Alemania;
Nintendo GameBoy juego - Dr. Franken en el embalaje usado;55,99 EUR;+ 69,99 EUR de envío;desde Alemania;
Manual De Nintendo Gameboy-Dr. Franken;11,54 EUR;+ 17,07 EUR de envío estimado;desde Reino Unido;
Solo módulo Dr. Franken (Nintendo GameBoy Classic) - Game Boy - probado;8,99 EUR;Envío no especificado;desde Alemania;
Dr. Franken Nintendo Gameboy Juego Cartucho Solo;11,34 EUR;Envío no especificado;desde Reino Unido;
