Micro Machines Nintendo Gameboy Advance GBA 💯% Genuino probado Juego;29,25 EUR;+ 17,45 EUR de envío estimado;desde Reino Unido;
Micro Machines 2: Turbo Tournament-Nintendo Game Boy módulo & Case;17,99 EUR;+ 6,90 EUR de envío;desde Alemania;
Micro Machines V3-Nintendo Game Boy Color;10,52 EUR;+ 17,05 EUR de envío estimado;desde Reino Unido;
Nintendo Game Boy Micro Machines 2 FAH Très Bon état;9,90 EUR;+ 11,98 EUR de envío;desde Francia;
Nintendo Gameboy Game Boy Micro Machines Juego Video Juego Carro;10,52 EUR;+ 9,36 EUR de envío;desde Reino Unido;
Nintendo Gameboy (gb) // Micro Machines 1 + embalaje original + INST. // dt. PAL;44,99 EUR;+ 5,99 EUR de envío;desde Alemania;
Nintendo Gameboy Micro Machines Juego en Caja Con Manual;35,10 EUR;+ 17,58 EUR de envío estimado;desde Reino Unido;
MicroMachines Micro Machines Nintendo Gameboy GB - Complet - PAL EUR - Near Mint;69,90 EUR;+ 24,90 EUR de envío;desde Francia;
Nintendo Gameboy-Micro Machines-VGA 90+ nm +/mt-Embalaje original-nuevo-rar-Top;3.500,00 EUR;Envío no especificado;desde Alemania;
Nintendo Gameboy juego-Micro Machines 2 Turbo Tournament-Embalaje original-pal-rar;199,90 EUR;Envío no especificado;desde Alemania;
Nintendo Micro Machines 1 and 2 twin turbo Game Boy Color cgb-at8p-eur;6,45 EUR;+ 23,50 EUR de envío;desde Bélgica;
Micro Machines Gameboy CIB Raro #0023;44,41 EUR;+ 17,78 EUR de envío estimado;desde Reino Unido;
Micro Machines 1 y 2 Twin Turbo-Nintendo Game Boy Color UE-probado y funciona;14,03 EUR;+ 17,12 EUR de envío estimado;desde Reino Unido;
Nintendo Gameboy-Micro Machines-VGA 85+ nm + - Embalaje original-nuevo-rar-Top;2.800,00 EUR;Envío no especificado;desde Alemania;
Micro Machines Para Nintendo Game Boy GB En Caja Con Manual;40,95 EUR;+ 17,71 EUR de envío estimado;desde Reino Unido;
NINTENDO GAME BOY-Micro Machines (en Caja);70,16 EUR;Envío internacional gratis;desde Reino Unido;
NINTENDO GAME BOY-Micro Machines (en Caja);81,86 EUR;Envío internacional gratis;desde Reino Unido;
NINTENDO GAME BOY COLOR Micro Machines 1 y 2 Twin Turbo PAL Nortec;12,75 EUR;+ 16,84 EUR de envío;desde Grecia;
Micro Machines Gameboy RARO CIB #0021;58,46 EUR;+ 18,08 EUR de envío estimado;desde Reino Unido;
Micro Machines y muy raro Micro Machines 2 UKV PARA GAMEBOY;50,31 EUR;+ 17,91 EUR de envío estimado;desde Reino Unido;
Nintendo Gameboy Color Juego-Micro Machines 1 y 2 Twin Turbo;11,64 EUR;+ 17,07 EUR de envío estimado;desde Reino Unido;
Micro Machines-Nintendo Gameboy;9,34 EUR;+ 17,03 EUR de envío estimado;desde Reino Unido;
Nintendo Gameboy-Micro Machines-Embalaje original-Top-pal-Ocean;69,90 EUR;Envío no especificado;desde Alemania;
Nintendo Gameboy Game Boy Micro Machines Juego Video Juego Carro;9,12 EUR;+ 17,02 EUR de envío estimado;desde Reino Unido;
Nintendo Gameboy Micro Machines Carro De Juego Y Manual Probado Funcionando en muy buena condición 1991;15,20 EUR;+ 15,21 EUR de envío;desde Reino Unido;
Nintendo Gameboy Micro Machines OVP módulo como nuevo;73,99 EUR;+ 35,99 EUR de envío;desde Alemania;
Gb-Micro Machines 2: Turbo Tournament para Nintendo GameBoy;14,95 EUR;+ 9,95 EUR de envío;desde Alemania;
Micro Machines V3 Nintendo Gameboy Color solo carro probado PAL;12,86 EUR;+ 17,10 EUR de envío estimado;desde Reino Unido;
Micro Machines Juego Boy Advance solo Carro De Muy Buena;15,16 EUR;+ 17,14 EUR de envío estimado;desde Reino Unido;
Micro Machines Nintendo Game Boy Juego Original;13,28 EUR;+ 7,09 EUR de envío;desde Ucrania;
Micro Machines 2-Nintendo Game Boy juego;18,99 EUR;Envío no especificado;desde Alemania;
Nintendo Gameboy Advance juego-Micro Machines (módulo) GBA;24,99 EUR;+ 67,99 EUR de envío;desde Alemania;
Nintendo Gameboy Advance GBA-Micro Machines;25,69 EUR;+ 17,38 EUR de envío estimado;desde Reino Unido;
Micro Machines - EUR - Nintendo Gameboy;8,00 EUR;+ 25,00 EUR de envío;desde Países Bajos;
Nintendo Gameboy GB GBC GBA SP - Micro Machines 2 UKV PAL Micromachines Turbo;28,00 EUR;+ 12,00 EUR de envío;desde Países Bajos;
Nintendo Game Boy Color - Micro Machines 1 and 2 Twin Turbo - PAL - EUR;14,99 EUR;+ 4,60 EUR de envío;desde Francia;
Nintendo Game Boy - Micro Machines - PAL - EUR;14,99 EUR;+ 4,60 EUR de envío;desde Francia;
1999 Micro Machines V3 PS1 Game Boy Promo Poster Vintage/ad arte enmarcado;35,43 EUR;+ 15,05 EUR de envío;desde Alemania;
1996 Micro Machines V3 PS1 N64 Game Boy Vintage Promo Poster/AD Art Print;26,57 EUR;+ 11,51 EUR de envío;desde Alemania;
