Battle Arena Toshinden Nintendo Game boy PAL Eur Cartucho Envio Combinado ;33,90 EUR;+ 29,80 EUR de envío;Vendidos  9 nov 2021Artículo vendido;desde España;
Battle Arena Toshinden Nintendo Gameboy Game Boy Classic pal EUR cib OVP VGC;226,00 EUR;+ 7,35 EUR de envío;Vendidos  7 nov 2021Artículo vendido;desde Alemania;
Battle Arena Toshinden (Nintendo Gameboy Game Boy) solo carro gran forma;17,65 EUR;Envío gratis;Vendidos  6 dic 2021Artículo vendido;desde Estados Unidos;
Battle Arena Toshinden (Nintendo Game Boy, 1996), limpiado y probado;15,97 EUR;Envío gratis;Vendidos  3 dic 2021Artículo vendido;desde Estados Unidos;
Battle Arena Toshinden 1995 Sega Saturn PS1 Game Boy Raro pequeño cartel vintage;70,97 EUR;+ 11,53 EUR de envío;Vendidos  1 dic 2021Artículo vendido;desde Alemania;
Battle Arena Toshinden Nintendo Game Boy Gameboy solo carro;4,44 EUR;+ 4,43 EUR de envío;Vendidos  29 nov 2021Artículo vendido;desde Estados Unidos;
Nintendo Game Boy Battle Arena Toshinden Solo Carro Probado;7,98 EUR;+ 3,95 EUR de envío;Vendidos  12 nov 2021Artículo vendido;desde Estados Unidos;
Battle Arena Toshinden (Nintendo Game Boy, 1996), limpiado y probado;17,74 EUR;Envío gratis;Vendidos  7 nov 2021Artículo vendido;desde Estados Unidos;
Battle Arena Toshinden (Nintendo Game Boy) Gb Solo Manual;8,86 EUR;+ 3,72 EUR de envío;Vendidos  25 oct 2021Artículo vendido;desde Estados Unidos;
Battle Arena Toshinden (Nintendo Game Boy) Gb Caja Y Manual only Juego Boy;55,90 EUR;+ 4,88 EUR de envío;Vendidos  15 oct 2021Artículo vendido;desde Estados Unidos;
Battle Arena Toshinden (Nintendo Game Boy Gameboy auténtico, 1996);15,96 EUR;Envío gratis;Vendidos  28 sep 2021Artículo vendido;desde Estados Unidos;
Battle Arena Toshinden (Nintendo Game Boy) Gb con Manual;19,51 EUR;+ 3,98 EUR de envío;Vendidos  21 sep 2021Artículo vendido;desde Estados Unidos;
(sin juego) Battle Arena Toshinden (Nintendo Game Boy) Gb * Solo Manual *;8,86 EUR;Envío gratis;Vendidos  17 sep 2021Artículo vendido;desde Estados Unidos;
Battle Arena Toshinden GB GameBoy Suelto;6,21 EUR;+ 4,61 EUR de envío;Vendidos  17 sep 2021Artículo vendido;desde Estados Unidos;
Battle Arena Toshinden (Nintendo Game Boy, 1996);13,30 EUR;+ 3,82 EUR de envío;Vendidos  10 sep 2021Artículo vendido;desde Estados Unidos;
Battle Arena Toshinden Nintendo Game Boy Original Exmt COND Cartucho Auténtico;19,51 EUR;Envío gratis;Vendidos  9 sep 2021Artículo vendido;desde Estados Unidos;
Battle Arena Toshinden URA Saturn Pal en bon état.;16,50 EUR;+ 35,00 EUR de envío;Vendidos  5 dic 2021Artículo vendido;desde Francia;
Battle Arena Toshinden PS1 Juego UK PAL USADO;9,35 EUR;+ 17,09 EUR de envío estimado;Vendidos  6 nov 2021Artículo vendido;desde Reino Unido;
Battle Arena Toshinden de Sony Computer Entertainment | Juego | buen estado;9,78 EUR;Envío no especificado;Vendidos  4 dic 2021Artículo vendido;desde Alemania;
PC IBM Battle Arena Toshinden gran caja de MS-DOS Vintage juego de computadora Takara;29,36 EUR;+ 17,62 EUR de envío;Vendidos  19 sep 2021Artículo vendido;desde Reino Unido;
Battle Arena Toshinden Remix. SEGA Saturn. disco de juego y manual solamente. sin Caja/Caso;4,70 EUR;+ 34,01 EUR de envío estimado;Vendidos  9 nov 2021Artículo vendido;desde Reino Unido;
