Kirby's Dream Land-Nintendo Game Boy-Completo en Caja Completo En Caja;65,60 EUR;+ 7,09 EUR de envío;desde Portugal;
Kirby's Dream Land-Game Boy-módulo-Nintendo-Game Boy-buen estado;14,99 EUR;+ 4,99 EUR de envío;desde Alemania;
Nuevo anuncioKirby's Dream Land Nintendo Game Boy Original;12,89 EUR;+ 17,12 EUR de envío estimado;desde Reino Unido;
Kirby's Dream Land Notice - Manuel - Handleiding FAH Game Boy;8,00 EUR;Envío internacional gratis;desde Francia;
Kirby's Dream Land - Nintendo Game Boy NTSC-JAP;35,00 EUR;+ 20,00 EUR de envío;desde Italia;
Kirby's Dream Land 1 / 2 Jeux Nintendo Game Boy FAH;99,90 EUR;+ 10,00 EUR de envío;desde Francia;
Kirby's Dream Land Nintendo Gameboy Juego PAL con manual;11,66 EUR;+ 34,23 EUR de envío estimado;desde Reino Unido;
Kirby's Dream Land  Nintendo Game boy  PAL Aleman Cartucho Envio Combinado ;11,90 EUR;+ 19,80 EUR de envío;desde España;
Game Boy Kirby's Dream Land 2 DMG-akbp-frg OVP & instrucciones cib Kirbys Nintendo;119,95 EUR;Envío no especificado;desde Alemania;
Genuine Kirby's Dream Land 2 para Nintendo Game Boy japonés Probado;11,71 EUR;+ 17,10 EUR de envío estimado;desde Reino Unido;
Kirby's Dream Land + Pinball Land Nintendo Game Boy Color Advance Paquete De Juegos;36,60 EUR;+ 17,64 EUR de envío estimado;desde Reino Unido;
Kirby's Dream Land 2 Jeu Nintendo Game Boy Import Japon;39,99 EUR;+ 6,00 EUR de envío;desde Francia;
Kirby's Dream Land 2 - NOE - Nintendo Gameboy;139,00 EUR;+ 25,00 EUR de envío;desde Países Bajos;
Kirby's Dream Land (Game Boy GB 1992) Solo Cartucho;25,00 EUR;+ 12,90 EUR de envío;desde España;
Nuevo anuncioKirby's Dream Land Nintendo Gameboy Juego PAL solo carro;16,40 EUR;+ 7,62 EUR de envío;desde Reino Unido;
Kirby's Dream Land & Kirby's Pinball Land Nintendo Gameboy paquete de juegos PAL Carro;23,43 EUR;+ 7,62 EUR de envío;desde Reino Unido;
Hoshi no Kirby's Dream Land Nintendo Game Boy GB Japan NTSC;48,00 EUR;+ 36,00 EUR de envío;desde Francia;
Nuevo anuncioKirby's Dream Land Nintendo Gameboy Juego PAL solo carro;16,40 EUR;+ 7,62 EUR de envío;desde Reino Unido;
Nuevo anuncioKirby's Dream Land Nintendo Gameboy Juego PAL solo carro;16,40 EUR;+ 7,62 EUR de envío;desde Reino Unido;
Kirby's Dream Land-en Caja-NINTENDO GAMEBOY;41,02 EUR;+ 22,67 EUR de envío estimado;desde Reino Unido;
Gameboy Kirby's Dream Land Cartucho gwo;14,05 EUR;+ 17,15 EUR de envío estimado;desde Reino Unido;
Kirby's Dream Land (Game Boy GB 1992) solo cartucho;25,00 EUR;+ 12,90 EUR de envío;desde España;
Nuevo anuncioNintendo Gameboy Kirby's Dream Land Cartucho;17,57 EUR;+ 34,22 EUR de envío estimado;desde Reino Unido;
Kirby's Dream Land pour Game Boy;25,00 EUR;+ 5,50 EUR de envío;desde Francia;
Kirby's Dream Land 2 Nintendo Gameboy OVP cib Boxed #3;66,90 EUR;Envío no especificado;desde Alemania;
Kirby's Dream Land 2-Nintendo Gameboy Classic #07;45,89 EUR;+ 5,99 EUR de envío;desde Alemania;
Kirby's Dream Land * NINTENDO GAMEBOY Juego COLOR ADVANCE SP;16,38 EUR;+ 17,20 EUR de envío estimado;desde Reino Unido;
Nintendo Gameboy dmg Kirby's Dream Land Genuino Carro;23,43 EUR;+ 11,72 EUR de envío;desde Reino Unido;
Kirby's Dream Land (Noe) (Nintendo Game Boy En Caja Personalizada);31,03 EUR;+ 15,96 EUR de envío;desde Grecia;
