Jurassic Park-Original Nintendo Game Boy-Cartucho únicamente;8,69 EUR;+ 16,96 EUR de envío estimado;Vendidos  8 dic 2021Artículo vendido;desde Reino Unido;
Nintendo Gameboy Advance/SP juego Jurassic Park 3 Island Attack módulo GBA SP;25,49 EUR;+ 4,99 EUR de envío;Vendidos  4 dic 2021Artículo vendido;desde Alemania;
Factor de ADN Jurassic Park Nintendo Gameboy Advance;13,98 EUR;+ 17,06 EUR de envío estimado;Vendidos  2 dic 2021Artículo vendido;desde Reino Unido;
Jurassic Park Nintendo Gameboy;44,90 EUR;+ 17,73 EUR de envío estimado;Vendidos  2 dic 2021Artículo vendido;desde Reino Unido;
Jurassic Park * Nintendo Game Boy * Gameboy módulo #4;14,75 EUR;Envío no especificado;Vendidos  30 nov 2021Artículo vendido;desde Alemania;
Gameboy Jurassic Park El Mundo Perdido *OVP*;170,00 EUR;Envío no especificado;Vendidos  28 nov 2021Artículo vendido;desde Alemania;
Nintendo Gameboy Advance GBA-Harry Potter, Jurassic Park, fightbox fantástico 4;14,65 EUR;+ 17,09 EUR de envío estimado;Vendidos  26 nov 2021Artículo vendido;desde Reino Unido;
Nintendo Gameboy En Caja Completo-Jurassic Park Océano Versión Caja Blanca;41,94 EUR;+ 17,67 EUR de envío estimado;Vendidos  24 nov 2021Artículo vendido;desde Reino Unido;
Jurassic Park 3 Parque constructor Nintendo Gameboy Advance Cartucho De Juego;9,32 EUR;+ 19,29 EUR de envío estimado;Vendidos  22 nov 2021Artículo vendido;desde Reino Unido;
Jurassic Park III Park Builder Game Boy EUR complet ;50,00 EUR;Envío internacional gratis;Vendidos  17 nov 2021Artículo vendido;desde Francia;
Original Nintendo Game Boy Jurassic Park Carro De Cartucho De Juego;11,66 EUR;+ 17,02 EUR de envío estimado;Vendidos  10 nov 2021Artículo vendido;desde Reino Unido;
NINTENDO GAMEBOY Jurassic Park Cartucho gastos de envío gratis en Reino Unido;10,48 EUR;+ 16,99 EUR de envío estimado;Vendidos  8 nov 2021Artículo vendido;desde Reino Unido;
