Nintendo Game Boy Classic juego Jurassic Park módulo Noe;14,90 EUR;+ 8,99 EUR de envío;Vendidos  19 dic 2021Artículo vendido;desde Alemania;
Nintendo Gameboy Juegos-Jurassic Park;11,65 EUR;+ 17,09 EUR de envío estimado;Vendidos  17 dic 2021Artículo vendido;desde Reino Unido;
Jurassic Park Gameboy juego! busque en la tienda;8,20 EUR;+ 19,11 EUR de envío estimado;Vendidos  12 dic 2021Artículo vendido;desde Reino Unido;
Jurassic Park-Nintendo Game Boy-Cartucho únicamente (marcas en Plástico);11,70 EUR;+ 8,19 EUR de envío;Vendidos  11 dic 2021Artículo vendido;desde Reino Unido;
Jurassic Park (Nintendo Game Boy, 1993) - Pal probado Vintage Retro;8,65 EUR;+ 19,36 EUR de envío estimado;Vendidos  11 dic 2021Artículo vendido;desde Reino Unido;
Jurassic Park-Original Nintendo Game Boy-Cartucho únicamente;8,72 EUR;+ 17,03 EUR de envío estimado;Vendidos  8 dic 2021Artículo vendido;desde Reino Unido;
Nintendo Gameboy Advance/SP juego Jurassic Park 3 Island Attack módulo GBA SP;25,49 EUR;+ 4,99 EUR de envío;Vendidos  4 dic 2021Artículo vendido;desde Alemania;
Factor de ADN Jurassic Park Nintendo Gameboy Advance;14,04 EUR;+ 17,13 EUR de envío estimado;Vendidos  2 dic 2021Artículo vendido;desde Reino Unido;
Jurassic Park Nintendo Gameboy;45,09 EUR;+ 17,80 EUR de envío estimado;Vendidos  2 dic 2021Artículo vendido;desde Reino Unido;
Jurassic Park * Nintendo Game Boy * Gameboy módulo #4;14,75 EUR;Envío no especificado;Vendidos  30 nov 2021Artículo vendido;desde Alemania;
Gameboy Jurassic Park El Mundo Perdido *OVP*;170,00 EUR;Envío no especificado;Vendidos  28 nov 2021Artículo vendido;desde Alemania;
Nintendo Gameboy Advance GBA-Harry Potter, Jurassic Park, fightbox fantástico 4;14,71 EUR;+ 17,16 EUR de envío estimado;Vendidos  26 nov 2021Artículo vendido;desde Reino Unido;
Nintendo Gameboy En Caja Completo-Jurassic Park Océano Versión Caja Blanca;42,11 EUR;+ 17,74 EUR de envío estimado;Vendidos  24 nov 2021Artículo vendido;desde Reino Unido;
Jurassic Park 3 Parque constructor Nintendo Gameboy Advance Cartucho De Juego;9,36 EUR;+ 19,37 EUR de envío estimado;Vendidos  22 nov 2021Artículo vendido;desde Reino Unido;
Jurassic Park III Park Builder Game Boy EUR complet ;50,00 EUR;Envío internacional gratis;Vendidos  17 nov 2021Artículo vendido;desde Francia;
Original Nintendo Game Boy Jurassic Park Carro De Cartucho De Juego;11,71 EUR;+ 17,09 EUR de envío estimado;Vendidos  10 nov 2021Artículo vendido;desde Reino Unido;
NINTENDO GAMEBOY Jurassic Park Cartucho gastos de envío gratis en Reino Unido;10,53 EUR;+ 17,06 EUR de envío estimado;Vendidos  8 nov 2021Artículo vendido;desde Reino Unido;
Jurassic Park III Park constructor Nintendo Gameboy Advance Juego;17,55 EUR;+ 21,08 EUR de envío;Vendidos  3 nov 2021Artículo vendido;desde Reino Unido;
Jurassic Park III el factor de ADN-Gameboy Advance/SP-Nintendo DS/Lite;5,84 EUR;+ 18,08 EUR de envío estimado;Vendidos  2 nov 2021Artículo vendido;desde Reino Unido;
Jurassic Park Nintendo GameBoy Game Boy USA Completo Ottimo Stato Ocean GB Works;64,90 EUR;Envío no especificado;Vendidos  31 oct 2021Artículo vendido;desde Italia;
Gameboy Advance Jurassic Park 3 factor de ADN versión UK Gba;16,38 EUR;Envío no especificado;Vendidos  30 oct 2021Artículo vendido;desde Reino Unido;
Nintendo Gameboy Jurassic Park Juego BOY ORIGINAL;12,75 EUR;Envío no especificado;Vendidos  30 oct 2021Artículo vendido;desde Reino Unido;
Jurassic Park 3 isla de ataque NINTENDO GAMEBOY ADVANCE;17,55 EUR;+ 17,21 EUR de envío estimado;Vendidos  21 oct 2021Artículo vendido;desde Reino Unido;
The Lost World Jurassic Park-Game Boy módulo-Nintendo Gameboy-Top estado;28,49 EUR;Envío no especificado;Vendidos  21 oct 2021Artículo vendido;desde Alemania;
Jurassic Park 3 III: parque Builder (Nintendo Gameboy Advance GBA) Completa;35,12 EUR;+ 17,59 EUR de envío estimado;Vendidos  16 oct 2021Artículo vendido;desde Reino Unido;
Jurassic Park III 3: the ADN factor para Gameboy Advance/GBA;4,99 EUR;+ 9,99 EUR de envío;Vendidos  15 oct 2021Artículo vendido;desde Alemania;
Jurassic Park~Nintendo GameBoy~1993~Ocean~Multi-languages;18,00 EUR;Envío no especificado;Vendidos  15 oct 2021Artículo vendido;desde España;
Gameboy juego Jurassic Park En Caja CIB;46,83 EUR;+ 17,83 EUR de envío estimado;Vendidos  9 oct 2021Artículo vendido;desde Reino Unido;
Gameboy Advance (ccm)/Jurassic Park III-Park Builder + embalaje original + instrucciones/pal cib;79,99 EUR;+ 5,99 EUR de envío;Vendidos  9 oct 2021Artículo vendido;desde Alemania;
Jurassic Park (Nintendo Game Boy, 1993) - Versión Europea;52,70 EUR;+ 21,71 EUR de envío estimado;Vendidos  1 oct 2021Artículo vendido;desde Reino Unido;
Nintendo Gameboy Advance GBA Jurassic Park III Dino ataque Carro Genuino;11,70 EUR;+ 10,54 EUR de envío;Vendidos  30 sep 2021Artículo vendido;desde Reino Unido;
Jurassic Park III Park constructor Nintendo Game Boy Advance GBA solo carro;11,65 EUR;+ 17,09 EUR de envío estimado;Vendidos  29 sep 2021Artículo vendido;desde Reino Unido;
