Blaster Master Boy Nintendo Game Boy GB CARTUCHO-solo Carro-AUTHENTIC!;88,57 EUR;+ 2,93 EUR de envío;desde Estados Unidos;
Blaster Master Boy Game Boy video juego y manual sólo ~ probado y de trabajo;173,60 EUR;Envío gratis;desde Estados Unidos;
GB-Blaster Master Boy Nintendo Gameboy Game Boy solo carro;97,34 EUR;Envío gratis;desde Estados Unidos;
Blaster Master Boy (Nintendo Game Boy);110,72 EUR;+ 4,56 EUR de envío;desde Estados Unidos;
Bomber King: escenario 2 (Blaster Master Boy/jr.) (Nintendo Game Boy) Vendedor de Estados Unidos;64,66 EUR;Envío gratis;desde Estados Unidos;
Blaster Master Boy (Nintendo Game Boy, 1991) - solo Carro Y Manual;159,22 EUR;Envío gratis;desde Estados Unidos;
Blaster Master Boy por Sunsoft Carro Y Manual Gameboy Auténtico Muy Raro;132,87 EUR;+ 5,31 EUR de envío;desde Estados Unidos;
Blaster Master Boy (Nintendo Game Boy Gameboy) RARE, Authentic, Tested!;102,51 EUR;+ 10,24 EUR de envío;desde Canadá;
Blaster Master Boy (Gameboy, auténtico).;110,71 EUR;+ 4,21 EUR de envío;desde Estados Unidos;
Game Boy Blaster Master Boy;1.062,93 EUR;+ 17,72 EUR de envío;desde México;
