Blaster Master Boy (Nintendo Game Boy) Auténtico!;84,13 EUR;+ 4,21 EUR de envío;Vendidos  8 dic 2021Artículo vendido;desde Estados Unidos;
Blaster Master Boy Nintendo Game Boy auténtico solo carro;79,68 EUR;+ 4,43 EUR de envío;Vendidos  12 nov 2021Artículo vendido;desde Estados Unidos;
Blaster Master Boy (Nintendo Game Boy) EE. UU. NTSC Cartucho Gameboy;31,00 EUR;+ 8,46 EUR de envío;Vendidos  8 nov 2021Artículo vendido;desde Estados Unidos;
Blaster Master Boy OEM Juego Oficial Gameboy Cartucho sólo-Raro Sunsoft Funciona;88,57 EUR;+ 4,87 EUR de envío;Vendidos  3 nov 2021Artículo vendido;desde Estados Unidos;
Blaster Master Boy | Game Boy | Cartucho sólo, Funciona Perfecto;87,69 EUR;+ 8,15 EUR de envío;Vendidos  2 nov 2021Artículo vendido;desde Estados Unidos;
Blaster Master Boy Nintendo Game Boy 100% Auténtico solo carro;88,57 EUR;Envío gratis;Vendidos  31 oct 2021Artículo vendido;desde Estados Unidos;
Blaster Master Boy Gameboy;39,00 EUR;+ 15,00 EUR de envío;Vendidos  25 oct 2021Artículo vendido;desde Países Bajos;
