Ferrari Grand Prix Challenge-Nintendo Gameboy Original;5,80 EUR;+ 6,45 EUR de envío;Vendidos  4 dic 2021Artículo vendido;desde Reino Unido;
Ferrari Grand Prix Challenge para Nintendo GameBoy;3,99 EUR;Envío no especificado;Vendidos  28 nov 2021Artículo vendido;desde Alemania;
Ferrari Grand Prix Challenge | Nintendo Game Boy | Gameboy Classic | aceptable;4,45 EUR;Envío no especificado;Vendidos  6 nov 2021Artículo vendido;desde Alemania;
Ferrari Grand Prix Challenge-Nintendo Gameboy T2 Terminator Tetris 3 Juegos;11,71 EUR;+ 19,44 EUR de envío estimado;Vendidos  28 sep 2021Artículo vendido;desde Reino Unido;
Ferrari Grand Prix Challenge (Nintendo Game Boy, 1992);13,29 EUR;Envío gratis;Vendidos  2 dic 2021Artículo vendido;desde Estados Unidos;
Ferrari Grand Prix Challenge Sega Genesis Cartucho De Juego Completo En Caja Original;8,86 EUR;+ 5,27 EUR de envío;Vendidos  20 nov 2021Artículo vendido;desde Estados Unidos;
Ferrari Grand Prix Challenge (Nintendo Game Boy, 1992) completo CIB Raro probado!;26,59 EUR;Envío gratis;Vendidos  6 nov 2021Artículo vendido;desde Estados Unidos;
Ferrari Grand Prix Challenge (Sega Genesis, 1992) Completo;11,07 EUR;Envío gratis;Vendidos  12 oct 2021Artículo vendido;desde Estados Unidos;
Ferrari Grand Prix Challenge (Sega Genesis, 1992) * Juego y caso *;3,99 EUR;+ 2,30 EUR de envío;Vendidos  3 oct 2021Artículo vendido;desde Estados Unidos;
Ferrari Grand Prix Challenge (Sega Genesis, 1992);11,48 EUR;+ 4,39 EUR de envío;Vendidos  27 sep 2021Artículo vendido;desde Estados Unidos;
Ferrari Grand Prix Challenge-Sega Mega Drive Juego (probado, envío rápido, PAL);4,63 EUR;+ 18,35 EUR de envío estimado;Vendidos  11 sep 2021Artículo vendido;desde Reino Unido;
Ferrari Grand Prix Challenge con Manual, Sega Megadrive;9,96 EUR;+ 17,06 EUR de envío estimado;Vendidos  4 oct 2021Artículo vendido;desde Reino Unido;
Notice de Ferrari Grand Prix Challenge pour Sega Megadrive PAL FR - Floto Games;6,90 EUR;+ 5,00 EUR de envío;Vendidos  6 nov 2021Artículo vendido;desde Francia;
