Ferrari Grand Prix Challenge Nintendo Game Boy juego muy buen estado probado;5,99 EUR;+ 9,99 EUR de envío;Vendidos  17 dic 2021Artículo vendido;desde Alemania;
Ferrari Grand Prix Challenge-Nintendo Gameboy Original;5,80 EUR;+ 6,44 EUR de envío;Vendidos  6 dic 2021Artículo vendido;desde Reino Unido;
Ferrari Grand Prix Challenge para Nintendo GameBoy;3,99 EUR;Envío no especificado;Vendidos  28 nov 2021Artículo vendido;desde Alemania;
Ferrari Grand Prix Challenge | Nintendo Game Boy | Gameboy Classic | aceptable;4,45 EUR;Envío no especificado;Vendidos  6 nov 2021Artículo vendido;desde Alemania;
Ferrari Grand Prix Challenge-Nintendo Gameboy T2 Terminator Tetris 3 Juegos;11,70 EUR;+ 19,43 EUR de envío estimado;Vendidos  28 sep 2021Artículo vendido;desde Reino Unido;
Ferrari Grand Prix Challenge (Nintendo Game Boy, 1992);13,28 EUR;Envío gratis;Vendidos  2 dic 2021Artículo vendido;desde Estados Unidos;
Ferrari Grand Prix Challenge Sega Genesis Cartucho De Juego Completo En Caja Original;8,85 EUR;+ 5,27 EUR de envío;Vendidos  20 nov 2021Artículo vendido;desde Estados Unidos;
Ferrari Grand Prix Challenge (Nintendo Game Boy, 1992) completo CIB Raro probado!;26,56 EUR;Envío gratis;Vendidos  6 nov 2021Artículo vendido;desde Estados Unidos;
Ferrari Grand Prix Challenge (Sega Genesis, 1992) Completo;11,06 EUR;Envío gratis;Vendidos  12 oct 2021Artículo vendido;desde Estados Unidos;
Ferrari Grand Prix Challenge (Sega Genesis, 1992) * Juego y caso *;3,99 EUR;+ 2,30 EUR de envío;Vendidos  3 oct 2021Artículo vendido;desde Estados Unidos;
Ferrari Grand Prix Challenge (Sega Genesis, 1992);11,47 EUR;+ 4,38 EUR de envío;Vendidos  27 sep 2021Artículo vendido;desde Estados Unidos;
Nintendo NES Juego-Ferrari Grand Prix Challenge;10,48 EUR;+ 17,06 EUR de envío estimado;Vendidos  14 dic 2021Artículo vendido;desde Reino Unido;
Notice de Ferrari Grand Prix Challenge pour Sega Megadrive PAL FR - Floto Games;6,90 EUR;+ 5,00 EUR de envío;Vendidos  6 nov 2021Artículo vendido;desde Francia;
Ferrari Grand Prix Challenge con Manual, Sega Megadrive;9,95 EUR;+ 17,05 EUR de envío estimado;Vendidos  4 oct 2021Artículo vendido;desde Reino Unido;
