Nintendo Game Boy Juego Clásico Mighty Morphin Power Rangers The Movie Module EE. UU.;19,90 EUR;+ 8,99 EUR de envío;desde Alemania;
Mighty Morphin Power Rangers-Nintendo Game Boy Libre P&P;23,39 EUR;+ 17,32 EUR de envío estimado;desde Reino Unido;
Nintendo Gameboy Solo Manual-Mighty Morphin Power Rangers;12,59 EUR;+ 17,10 EUR de envío estimado;desde Reino Unido;
Nuevo anuncioMighty Morphin Power Rangers Nintendo Game Boy Auténtico Original Video Juego;18,40 EUR;Envío gratis;desde Estados Unidos;
Mighty Morphin Power Rangers La Película Nintendo Game Boy-Excelente & Probado;22,99 EUR;Envío gratis;desde Estados Unidos;
Mighty Morphin Power Rangers: la película (Nintendo GAME BOY) Auténtico Impecable;35,43 EUR;Envío gratis;desde Estados Unidos;
Mighty Morphin Power Rangers Nintendo Game Boy Auténtico Original Video Juego;17,71 EUR;Envío gratis;desde Estados Unidos;
Mighty Morphin Power Rangers (Nintendo Game Boy, 1994) Bandai;8,86 EUR;+ 4,03 EUR de envío;desde Estados Unidos;
Mighty Morphin Power Rangers-Juego Boy-Probado-auténtica;26,57 EUR;Envío gratis;desde Estados Unidos;
Mighty Morphin Power Rangers: Lightspeed Rescue Game Boy Color * limpiado Probado *;7,06 EUR;Envío gratis;desde Estados Unidos;
