Ms. Pac-Man Special Colour Edition Nintendo GameBoy Color Game Module GBC;4,00 EUR;+ 11,39 EUR de envío;Vendidos  27 nov 2021Artículo vendido;desde Alemania;
Nintendo Game Boy  Ms. Pac-Man  GameBoy  Vers. FAH;6,00 EUR;+ 30,00 EUR de envío;Vendidos  5 nov 2021Artículo vendido;desde Francia;
Nintendo Game Boy  Ms. Pac-Man  GameBoy  Vers. FAH;6,00 EUR;+ 30,00 EUR de envío;Vendidos  5 oct 2021Artículo vendido;desde Francia;
Ms. Pac-Man - Nintendo Gameboy;35,00 EUR;+ 25,00 EUR de envío;Vendidos  14 sep 2021Artículo vendido;desde Países Bajos;
Nintendo Game Boy Gris (Gb) + Ms. Pac-Man;62,05 EUR;+ 6,16 EUR de envío;Vendidos  19 nov 2021Artículo vendido;desde Estados Unidos;
Ms. Pac-Man   - SEGA GAME GEAR - GG - USA;25,50 EUR;+ 15,00 EUR de envío;Vendidos  29 oct 2021Artículo vendido;desde Francia;
Tiger Virca Orlitronics Ms. Pac-Man Lcd Game;100,00 EUR;+ 35,00 EUR de envío;Vendidos  15 sep 2021Artículo vendido;desde Italia;
