Gb-Battletoads: en Ragnarok's World para Nintendo GameBoy;12,95 EUR;+ 9,95 EUR de envío;Vendidos  20 nov 2021Artículo vendido;desde Alemania;
Nintendo Gameboy Battletoads Game boy Fat;24,90 EUR;+ 12,00 EUR de envío;Vendidos  13 nov 2021Artículo vendido;desde Francia;
Battletoads-Nintendo Gameboy Cartucho de juego solo carro;13,99 EUR;+ 19,39 EUR de envío estimado;Vendidos  10 nov 2021Artículo vendido;desde Reino Unido;
Battletoads en ragnaroks Mundo para Game Boy. en Caja Con Manual;58,30 EUR;+ 21,75 EUR de envío estimado;Vendidos  28 oct 2021Artículo vendido;desde Reino Unido;
Battletoads en raknaroks World Gameboy cómo jugar instruction cuadernillo Noe;6,90 EUR;Envío no especificado;Vendidos  28 oct 2021Artículo vendido;desde Alemania;
Battletoads Ragnarok's World-Game Boy-módulo-GameBoy-muy buen estado;11,99 EUR;Envío no especificado;Vendidos  26 oct 2021Artículo vendido;desde Alemania;
Nintendo Gameboy juego-Battletoads en Ragnarok's World-Embalaje original-pal-rar;109,90 EUR;Envío no especificado;Vendidos  24 oct 2021Artículo vendido;desde Alemania;
NINTENDO GAME BOY ORIGINAL Battletoads Super Mario Land Paquete Juego Batman;23,31 EUR;+ 19,04 EUR de envío estimado;Vendidos  20 oct 2021Artículo vendido;desde Reino Unido;
Battletoads en Ragnarok's World para Nintendo GameBoy;8,99 EUR;Envío no especificado;Vendidos  19 oct 2021Artículo vendido;desde Alemania;
Battletoads-Nintendo Gameboy Cartucho de juego solo carro;11,65 EUR;+ 20,23 EUR de envío estimado;Vendidos  16 oct 2021Artículo vendido;desde Reino Unido;
Nintendo Original Gameboy Battletoads A4 volante/Poster/anuncio Tra-DMG-US 1991;17,44 EUR;+ 17,14 EUR de envío estimado;Vendidos  12 oct 2021Artículo vendido;desde Reino Unido;
Battletoads In Ragnarok's World - Gameboy - Nintendo - Notice NOE;14,99 EUR;+ 3,88 EUR de envío;Vendidos  10 oct 2021Artículo vendido;desde Francia;
Battletoads - USA - Nintendo Gameboy;17,00 EUR;+ 25,00 EUR de envío;Vendidos  10 oct 2021Artículo vendido;desde Países Bajos;
Battletoads NINTENDO GAMEBOY Solo Manual;6,99 EUR;+ 16,91 EUR de envío estimado;Vendidos  9 oct 2021Artículo vendido;desde Reino Unido;
Battletoads - box reproduction with insert - Gameboy /GB. HQ !!;11,29 EUR;+ 5,21 EUR de envío;Vendidos  4 oct 2021Artículo vendido;desde Polonia;
Battletoads & Double Dragon: The Ultimate Team - REPRO box with tray - Gameboy. ;11,29 EUR;+ 5,21 EUR de envío;Vendidos  4 oct 2021Artículo vendido;desde Polonia;
45 GB Unidad De Batalla varios libros de instrucciones Zeoth Battletoads Mr do y más;104,95 EUR;+ 32,42 EUR de envío estimado;Vendidos  30 sep 2021Artículo vendido;desde Reino Unido;
Battletoads game boy Gameboy Originale Nintendo ITA (no zelda pokemon metroid);22,35 EUR;+ 12,99 EUR de envío;Vendidos  17 sep 2021Artículo vendido;desde Italia;
Battletoads game boy Gameboy Originale Nintendo NOE (no zelda pokemon metroid);19,90 EUR;+ 9,00 EUR de envío;Vendidos  12 sep 2021Artículo vendido;desde Italia;
Battletoads (Nintendo Game Boy, 1991);15,88 EUR;+ 3,53 EUR de envío;Vendidos  4 dic 2021Artículo vendido;desde Estados Unidos;
Battletoads (Nintendo Game Boy, 1991) Cartucho De Juego Batalla Sapos;12,35 EUR;+ 4,06 EUR de envío;Vendidos  4 dic 2021Artículo vendido;desde Estados Unidos;
Super Mario Land, Battletoads, Teenage Mutant Ninja Turtles caída del pie clan-Juego Boy Lote de 3;44,11 EUR;Envío gratis;Vendidos  4 dic 2021Artículo vendido;desde Estados Unidos;
Battletoads batalla sapos Nintendo Game Boy NRMT CND Cartucho Auténtico Original;19,49 EUR;Envío gratis;Vendidos  4 dic 2021Artículo vendido;desde Estados Unidos;
Battletoads (Nintendo Game Boy, 1991) solo carro * probado y trabajo *;17,64 EUR;Envío gratis;Vendidos  3 dic 2021Artículo vendido;desde Estados Unidos;
Battletoads * Game Boy Nintendo GBC GBA Clásico Beat em up 8-bit Rad Amigo Regalo;22,05 EUR;Envío gratis;Vendidos  3 dic 2021Artículo vendido;desde Estados Unidos;
Battletoads cart Nintendo Gameboy;15,33 EUR;+ 4,18 EUR de envío;Vendidos  30 nov 2021Artículo vendido;desde Canadá;
Battletoads Juego Gameboy;17,64 EUR;Envío gratis;Vendidos  29 nov 2021Artículo vendido;desde Estados Unidos;
Battletoads-Nintendo Game Boy-juego, caja y folleto sólo 🔥;22,93 EUR;Envío gratis;Vendidos  27 nov 2021Artículo vendido;desde Estados Unidos;
Battletoads (Nintendo Game Boy, 1991) solo carro * probado y trabajo *;19,40 EUR;Envío gratis;Vendidos  26 nov 2021Artículo vendido;desde Estados Unidos;
Battletoads Nintendo Game Boy Gameboy Auténtico Original Juego! probado Con Estuche;19,40 EUR;+ 4,06 EUR de envío;Vendidos  24 nov 2021Artículo vendido;desde Estados Unidos;
Battletoads Para Nintendo Game Boy, de 1991, Cartucho Solo;13,24 EUR;+ 3,97 EUR de envío;Vendidos  23 nov 2021Artículo vendido;desde Estados Unidos;
Battletoads In Ragnrok's World Nintendo Gameboy Game Boy Authentic;20,21 EUR;+ 13,24 EUR de envío;Vendidos  19 nov 2021Artículo vendido;desde Canadá;
Battletoads (Nintendo Game Boy, 1991);14,12 EUR;+ 4,06 EUR de envío;Vendidos  14 nov 2021Artículo vendido;desde Estados Unidos;
Battletoads (Nintendo Game Boy, 1991) Auténtico amarilleado Shell probado y funciona;15,88 EUR;Envío gratis;Vendidos  14 nov 2021Artículo vendido;desde Estados Unidos;
Battletoads in Ragnarok World Gameboy GB Game Cart;16,38 EUR;+ 16,73 EUR de envío;Vendidos  10 nov 2021Artículo vendido;desde Canadá;
Battletoads (Nintendo Game Boy, 1991) probado y de trabajo;14,56 EUR;Envío gratis;Vendidos  8 nov 2021Artículo vendido;desde Estados Unidos;
Battletoads en el mundo de Nintendo Gameboy manual Ragnarok Muy Buen Estado;10,69 EUR;+ 4,19 EUR de envío;Vendidos  7 nov 2021Artículo vendido;desde Estados Unidos;
Battletoads NINTENDO GAMEBOY (Solo Manual) sin juego Sin Caja. Manual de instrucciones;5,29 EUR;Envío gratis;Vendidos  7 nov 2021Artículo vendido;desde Estados Unidos;
Battletoads en el mundo-auténtica Ragnarok-Nintendo Game Boy-Solo Manual!;9,06 EUR;Envío gratis;Vendidos  4 nov 2021Artículo vendido;desde Estados Unidos;
Battletoads Nintendo Game Boy Gameboy Auténtico Original Juego! VHTF;21,18 EUR;Envío gratis;Vendidos  1 nov 2021Artículo vendido;desde Estados Unidos;
Battletoads en el mundo para Nintendo Gameboy Ragnarok;21,97 EUR;Envío gratis;Vendidos  31 oct 2021Artículo vendido;desde Estados Unidos;
Battletoads (Nintendo Game Boy, 1991) juego y el caso;14,12 EUR;+ 3,53 EUR de envío;Vendidos  28 oct 2021Artículo vendido;desde Estados Unidos;
Battletoads Nintendo Game Boy Gameboy Auténtico Original Juego! probado Con Estuche;21,17 EUR;Envío gratis;Vendidos  27 oct 2021Artículo vendido;desde Estados Unidos;
Battletoads (Nintendo Game Boy, 1991);18,53 EUR;+ 1,76 EUR de envío;Vendidos  26 oct 2021Artículo vendido;desde Estados Unidos;
Nintendo Game Boy; Battletoads en el mundo de Ragnarok, muy buena, probado, Envío Gratis;26,47 EUR;Envío gratis;Vendidos  25 oct 2021Artículo vendido;desde Estados Unidos;
Nintendo Gameboy Battletoads Con Caja Manual Y Cartel Original Rara;43,23 EUR;Envío gratis;Vendidos  24 oct 2021Artículo vendido;desde Estados Unidos;
Raro Battletoads Ragnarok's World Gameboy Game Boy Solo Manual-en muy buena condición;8,78 EUR;Envío gratis;Vendidos  21 oct 2021Artículo vendido;desde Estados Unidos;
Battletoads Nintendo Game Boy Gameboy Auténtico Original Juego!;17,64 EUR;Envío gratis;Vendidos  20 oct 2021Artículo vendido;desde Estados Unidos;
Battletoads - Nintendo Gameboy - Cartridge Only - Tested & Working;17,39 EUR;Envío internacional gratis;Vendidos  20 oct 2021Artículo vendido;desde Canadá;
Battletoads Gameboy ** ** Solo Manual;6,13 EUR;Envío gratis;Vendidos  17 oct 2021Artículo vendido;desde Estados Unidos;
Nintendo Game Boy Battletoads en el mundo de Ragnarok solo carro;22,06 EUR;Envío gratis;Vendidos  11 oct 2021Artículo vendido;desde Estados Unidos;
Battletoads Nintendo Game Boy Original * Versión PAL * envío rápido!;17,62 EUR;Envío gratis;Vendidos  7 oct 2021Artículo vendido;desde Estados Unidos;
Battletoads (Nintendo Game Boy, 1991) Completo con Manual Rápido Envío Gratis!!!;88,23 EUR;Envío gratis;Vendidos  7 oct 2021Artículo vendido;desde Estados Unidos;
Battletoads Nintendo Game Boy Gameboy Auténtico Original Juego!;18,50 EUR;Envío gratis;Vendidos  6 oct 2021Artículo vendido;desde Estados Unidos;
Battletoads (Nintendo Game Boy, 1991) - limpiado y probado;17,65 EUR;Envío gratis;Vendidos  6 oct 2021Artículo vendido;desde Estados Unidos;
Juego Battletoads Double Dragon Nintendo NES solo carro PAL un;53,64 EUR;+ 17,91 EUR de envío estimado;Vendidos  8 dic 2021Artículo vendido;desde Reino Unido;
