Tetris Attack (Nintendo Gameboy Classic juego) con instrucciones-Game Boy módulo;16,49 EUR;Envío no especificado;desde Alemania;
Tetris Attack Nintendo Gameboy Game Boy solo carro ** ** GRATIS UK FRANQUEO;22,09 EUR;+ 13,83 EUR de envío;desde Reino Unido;
Tetris Attack Para Nintendo Game Boy Con Estuche Oficial;21,08 EUR;+ 17,30 EUR de envío estimado;desde Reino Unido;
Nuevo anuncio9 Nintendo Game Boy Juegos Colección GB solo Módulos Tetris Attack Dr. Mario Yoshi;99,90 EUR;+ 4,90 EUR de envío;desde Alemania;
Nintendo Game Boy Tetris Attack EUR Bon état;12,90 EUR;+ 11,98 EUR de envío;desde Francia;
 Tetris Attack * Nintendo GameBoy * PAL FAH ;69,95 EUR;+ 21,00 EUR de envío;desde Países Bajos;
Tetris Attack video juego Nintendo Game Boy Probado en Caja;23,38 EUR;+ 17,58 EUR de envío;desde Reino Unido;
Tetris Attack | With Manual | GameBoy 🕹 Excellent Condition!;16,00 EUR;+ 5,00 EUR de envío;desde Países Bajos;
Tetris Attack Nintendo Game Boy Color Advance Juego Completo En Caja Original Raro;64,64 EUR;+ 27,27 EUR de envío estimado;desde Reino Unido;
Tetris Attack Nintendo Game Boy Color Advance Juego Solo Carro Genuino Rompecabezas;19,87 EUR;+ 17,28 EUR de envío estimado;desde Reino Unido;
Game Boy Tetris Attack CIB muy limpio UK Libre Post;21,08 EUR;+ 17,30 EUR de envío estimado;desde Reino Unido;
Nintendo Gameboy juego-Tetris Attack-Embalaje original-Top-Pal;44,90 EUR;Envío no especificado;desde Alemania;
Game Boy Tetris Attack;29,29 EUR;+ 17,47 EUR de envío estimado;desde Reino Unido;
NINTENDO GAME BOY-Tetris Attack (en Caja);46,82 EUR;Envío internacional gratis;desde Reino Unido;
Nintendo Gameboy Juegos + Manual Tetris, Tetris 2, Tetris Attack;25,27 EUR;+ 17,39 EUR de envío estimado;desde Reino Unido;
Tetris Attack NUKV - Nintendo GameBoy - NGB;38,21 EUR;+ 19,95 EUR de envío;desde Países Bajos;
Tetris Attack - Nintendo GameBoy - NGB;8,26 EUR;+ 19,95 EUR de envío;desde Países Bajos;
Gb-Tetris Attack para Nintendo GameBoy;12,95 EUR;+ 6,50 EUR de envío;desde Alemania;
Nintendo Gameboy Tetris Attack;29,29 EUR;+ 17,47 EUR de envío estimado;desde Reino Unido;
Nintendo GameBoy jeu - Tetris Attack dans l'emballage utilisé COMME NEUF;76,99 EUR;+ 69,99 EUR de envío;desde Alemania;
Nintendo GameBoy Juego-Tetris Attack En Caja Perfecto Estado;77,12 EUR;Envío internacional gratis;desde Alemania;
Nintendo GameBoy gioco - Tetris Attack nell'imballaggio usato COME NUOVO;78,99 EUR;+ 69,99 EUR de envío;desde Alemania;
Nintendo GameBoy Juego Tetris Attack En Caja Perfecto Estado;73,82 EUR;Envío internacional gratis;desde Alemania;
Nintendo GameBoy juego - Tetris Attack en el embalaje usado COMO NUEVO;78,99 EUR;+ 69,99 EUR de envío;desde Alemania;
Tetris Attack-Game Boy-Módulo de juego-Nintendo-Gameboy muy buen estado;13,49 EUR;Envío no especificado;desde Alemania;
Tetris Attack-Nintendo Game Boy Game-módulo alemán PAL;8,99 EUR;Envío no especificado;desde Alemania;
Tetris Y Tetris Attack Nintendo Gameboy Juego X 2 Cartuchos De Colección Retro;23,44 EUR;Envío no especificado;desde Reino Unido;
Tetris Attack-Nintendo Gameboy juego;8,99 EUR;Envío no especificado;desde Alemania;
Gb Tetris Attack Nintendo Gameboy módulo top retro;15,99 EUR;Envío no especificado;desde Alemania;
Nintendo GameBoy game - Tetris Attack boxed  MINT CONDITION;75,54 EUR;+ 55,44 EUR de envío;desde Alemania;
