Tetris Attack-GameBoy Classic-embalaje original/cib/boxed-pal/noe-Top estado;49,99 EUR;Envío no especificado;Vendidos  27 nov 2021Artículo vendido;desde Alemania;
Nintendo Gameboy Solo Manual-Tetris Attack;7,33 EUR;+ 16,98 EUR de envío estimado;Vendidos  26 nov 2021Artículo vendido;desde Reino Unido;
Tetris Attack-Game Boy-Módulo de juego-Nintendo-GameBoy expositor estado;14,49 EUR;Envío no especificado;Vendidos  25 nov 2021Artículo vendido;desde Alemania;
Nintendo Gameboy Tetris Attack CIB muy limpio libre poste del Reino Unido;35,10 EUR;+ 17,58 EUR de envío estimado;Vendidos  13 nov 2021Artículo vendido;desde Reino Unido;
Tetris Attack Nintendo Gameboy COMPLETO PAL;29,25 EUR;+ 21,55 EUR de envío estimado;Vendidos  6 nov 2021Artículo vendido;desde Reino Unido;
Tetris Attack (Nintendo Game Boy, 1996) solo carro;7,08 EUR;Envío gratis;Vendidos  11 dic 2021Artículo vendido;desde Estados Unidos;
Tetris Attack Nintendo Gameboy auténtico Probado Funcionando Envío Gratis;10,19 EUR;Envío gratis;Vendidos  10 dic 2021Artículo vendido;desde Estados Unidos;
Tetris Attack Snes Gameboy 1996 Cartel;66,46 EUR;+ 14,17 EUR de envío;Vendidos  9 dic 2021Artículo vendido;desde Estados Unidos;
Tetris Attack (Nintendo GameBoy, 1996) Con Estuche Y Manual;11,30 EUR;+ 5,76 EUR de envío;Vendidos  8 dic 2021Artículo vendido;desde Estados Unidos;
Tetris Attack (Nintendo Game Boy, 1996);9,74 EUR;Envío gratis;Vendidos  5 dic 2021Artículo vendido;desde Estados Unidos;
Tetris Attack Nintendo Game Boy Video Juego Carro;5,51 EUR;Envío gratis;Vendidos  5 dic 2021Artículo vendido;desde Estados Unidos;
Tetris Attack Nintendo Game Boy Gameboy auténtico Original Retro Clásico!;9,01 EUR;Envío gratis;Vendidos  2 dic 2021Artículo vendido;desde Estados Unidos;
Tetris Attack (Nintendo Game Boy, 1996) Seminuevo;8,85 EUR;Envío gratis;Vendidos  25 nov 2021Artículo vendido;desde Estados Unidos;
Tetris Attack (Nintendo Game Boy, de 1996, Probado);8,85 EUR;Envío gratis;Vendidos  24 nov 2021Artículo vendido;desde Estados Unidos;
Nintendo Game Boy Gameboy Pocket Azul + Tetris Attack Completo en Caja Toys R Us;354,43 EUR;Envío gratis;Vendidos  5 nov 2021Artículo vendido;desde Estados Unidos;
Tetris Attack (Nintendo Game Boy, de 1996, Probado);8,85 EUR;Envío gratis;Vendidos  31 oct 2021Artículo vendido;desde Estados Unidos;
Original Nintendo GameBoy DMG-01 portátil de consola con Tetris Attack;61,13 EUR;Envío gratis;Vendidos  28 oct 2021Artículo vendido;desde Estados Unidos;
Tetris Attack Para Nintendo Game Boy GB Con Manual;7,08 EUR;+ 3,98 EUR de envío;Vendidos  19 oct 2021Artículo vendido;desde Estados Unidos;
Tetris Attack (Nintendo GameBoy, 1996) - solo Carro-limpiado & probado, auténtico;13,25 EUR;Envío gratis;Vendidos  18 oct 2021Artículo vendido;desde Estados Unidos;
Tetris Attack (Nintendo Game Boy, auténtico, cartucho, funciona) Con Estuche;11,51 EUR;Envío gratis;Vendidos  15 oct 2021Artículo vendido;desde Estados Unidos;
Nintendo Game Boy Pocket Verde sistema portátil sin pantalla Lente Tetris Attack;35,44 EUR;Envío gratis;Vendidos  14 oct 2021Artículo vendido;desde Estados Unidos;
Tetris Attack - Jeu Super Nintendo / SNES Game Video Retro  - PAL EUR ;36,99 EUR;Envío internacional gratis;Vendidos  12 oct 2021Artículo vendido;desde Francia;
