NBA Jam'99 | Game Boy Color | solo carro;9,38 EUR;+ 17,09 EUR de envío estimado;Vendidos  30 nov 2021Artículo vendido;desde Reino Unido;
NBA Jam USA Nintendo Gameboy Cartucho oficial & gwo;10,44 EUR;+ 17,11 EUR de envío estimado;Vendidos  7 nov 2021Artículo vendido;desde Reino Unido;
Nintendo Gameboy Color Verde Lima CGB-001 portátil de consola con NBA Jam 99 En Caja;58,71 EUR;+ 31,87 EUR de envío estimado;Vendidos  5 nov 2021Artículo vendido;desde Reino Unido;
Nintendo Gameboy NBA Jam Game boy Fat;14,90 EUR;+ 12,00 EUR de envío;Vendidos  25 oct 2021Artículo vendido;desde Francia;
Nintendo Game Boy COLOUR "NBA Jam 99" Juego en Caja-Excelente;7,63 EUR;+ 35,37 EUR de envío estimado;Vendidos  24 oct 2021Artículo vendido;desde Reino Unido;
NBA Jame T.E. torneo edición Gameboy;35,23 EUR;+ 36,04 EUR de envío estimado;Vendidos  26 sep 2021Artículo vendido;desde Reino Unido;
Gb-NBA Jam para Nintendo GameBoy;6,95 EUR;+ 6,50 EUR de envío;Vendidos  16 sep 2021Artículo vendido;desde Alemania;
Nintendo Gameboy Color Classic juego/NBA Jam 99;4,95 EUR;+ 6,00 EUR de envío;Vendidos  14 sep 2021Artículo vendido;desde Alemania;
NBA Jam: edición del torneo (Nintendo Game Boy, 1995);5,31 EUR;+ 3,82 EUR de envío;Vendidos  6 dic 2021Artículo vendido;desde Estados Unidos;
NBA Jam Te (Nintendo Game Boy, 1994) probado funciona sólo cartucho.;8,83 EUR;Envío gratis;Vendidos  4 dic 2021Artículo vendido;desde Estados Unidos;
NBA Jam 2002 (Nintendo Game Boy Advance, 2002) + probado trabajando;7,10 EUR;+ 3,55 EUR de envío;Vendidos  4 dic 2021Artículo vendido;desde Estados Unidos;
NBA Jam 2002 (Nintendo Game Boy Advance, 2002) sólo juego de trabajo probado +;4,88 EUR;+ 3,36 EUR de envío;Vendidos  3 dic 2021Artículo vendido;desde Estados Unidos;
NBA Jam (Nintendo Game Boy, 1994);6,18 EUR;Envío gratis;Vendidos  26 nov 2021Artículo vendido;desde Estados Unidos;
NBA Jam 99-Juego Boy Color;3,08 EUR;+ 2,62 EUR de envío;Vendidos  19 nov 2021Artículo vendido;desde Estados Unidos;
NBA Jam - (Nintendo Game Boy, 1995), con Manual, Probado, Funciona, Original;6,21 EUR;+ 4,53 EUR de envío;Vendidos  17 nov 2021Artículo vendido;desde Estados Unidos;
NBA Jam: edición del torneo (Nintendo Game Boy, 1995) Usado C/manual;22,17 EUR;Envío gratis;Vendidos  16 nov 2021Artículo vendido;desde Estados Unidos;
NBA Jam 2002 (Nintendo Game Boy Advance GBA) * Auténtico-solo Carro *;13,57 EUR;Envío gratis;Vendidos  13 nov 2021Artículo vendido;desde Estados Unidos;
NBA Jam (Nintendo Gameboy, 1994) * con manual * caja de video juego & Carro De Baloncesto;9,80 EUR;+ 3,99 EUR de envío;Vendidos  13 nov 2021Artículo vendido;desde Estados Unidos;
NBA Jam 2001 Nintendo Game Boy Color-Buen Estado-Probado;8,86 EUR;Envío gratis;Vendidos  9 nov 2021Artículo vendido;desde Estados Unidos;
Original Nintendo Gameboy DMG-01 In Box. Games Inc NBA Jam TE Inc Boxes.;274,43 EUR;+ 18,75 EUR de envío;Vendidos  6 nov 2021Artículo vendido;desde Australia;
