NBA Jam'99 | Game Boy Color | solo carro;9,40 EUR;+ 17,12 EUR de envío estimado;Vendidos  30 nov 2021Artículo vendido;desde Reino Unido;
NBA Jam USA Nintendo Gameboy Cartucho oficial & gwo;10,46 EUR;+ 17,15 EUR de envío estimado;Vendidos  7 nov 2021Artículo vendido;desde Reino Unido;
Nintendo Gameboy Color Verde Lima CGB-001 portátil de consola con NBA Jam 99 En Caja;58,83 EUR;+ 31,94 EUR de envío estimado;Vendidos  5 nov 2021Artículo vendido;desde Reino Unido;
Nintendo Gameboy NBA Jam Game boy Fat;14,90 EUR;+ 12,00 EUR de envío;Vendidos  25 oct 2021Artículo vendido;desde Francia;
Gb-NBA Jam para Nintendo GameBoy;6,95 EUR;+ 6,50 EUR de envío;Vendidos  16 sep 2021Artículo vendido;desde Alemania;
Nintendo Gameboy Color Classic juego/NBA Jam 99;4,95 EUR;+ 6,00 EUR de envío;Vendidos  14 sep 2021Artículo vendido;desde Alemania;
NBA Jam: edición del torneo (Nintendo Game Boy, 1995);5,33 EUR;+ 3,82 EUR de envío;Vendidos  6 dic 2021Artículo vendido;desde Estados Unidos;
NBA Jam Te (Nintendo Game Boy, 1994) probado funciona sólo cartucho.;8,85 EUR;Envío gratis;Vendidos  4 dic 2021Artículo vendido;desde Estados Unidos;
NBA Jam 2002 (Nintendo Game Boy Advance, 2002) + probado trabajando;7,11 EUR;+ 3,56 EUR de envío;Vendidos  4 dic 2021Artículo vendido;desde Estados Unidos;
NBA Jam 99 Nintendo Game Boy Color * limpiado & Probado *;7,09 EUR;Envío gratis;Vendidos  3 dic 2021Artículo vendido;desde Estados Unidos;
NBA Jam (Nintendo Game Boy, 1994);6,20 EUR;Envío gratis;Vendidos  26 nov 2021Artículo vendido;desde Estados Unidos;
NBA Jam 99-Juego Boy Color;3,09 EUR;+ 2,62 EUR de envío;Vendidos  19 nov 2021Artículo vendido;desde Estados Unidos;
NBA Jam: edición del torneo (Nintendo Game Boy, 1995) Usado C/manual;22,22 EUR;Envío gratis;Vendidos  16 nov 2021Artículo vendido;desde Estados Unidos;
NBA Jam 2002 (Nintendo Game Boy Advance GBA) * Auténtico-solo Carro *;13,59 EUR;Envío gratis;Vendidos  13 nov 2021Artículo vendido;desde Estados Unidos;
NBA Jam (Nintendo Gameboy, 1994) * con manual * caja de video juego & Carro De Baloncesto;9,82 EUR;+ 4,00 EUR de envío;Vendidos  13 nov 2021Artículo vendido;desde Estados Unidos;
NBA Jam 2001 Nintendo Game Boy Color-Buen Estado-Probado;8,88 EUR;Envío gratis;Vendidos  9 nov 2021Artículo vendido;desde Estados Unidos;
NBA Jam: edición del torneo (Nintendo Game Boy, 1995) Auténtico Y Probado;8,88 EUR;Envío gratis;Vendidos  5 nov 2021Artículo vendido;desde Estados Unidos;
NBA Jam torneo edición T.E. Nintendo Juego Original Boy * limpiado & Probado *;13,31 EUR;Envío gratis;Vendidos  3 nov 2021Artículo vendido;desde Estados Unidos;
NBA Jam (Nintendo Game Boy, 1994) Usado C/manual;14,22 EUR;Envío gratis;Vendidos  3 nov 2021Artículo vendido;desde Estados Unidos;
NBA Jam (Nintendo Gameboy, 1994) - solo Carro-no probado;8,00 EUR;Envío gratis;Vendidos  2 nov 2021Artículo vendido;desde Estados Unidos;
NBA Jam (Nintendo Game Boy probado, 1994);4,27 EUR;+ 4,22 EUR de envío;Vendidos  25 oct 2021Artículo vendido;desde Estados Unidos;
NBA Jam 2002 (Nintendo Game Boy Advance, 2002) + probado trabajando;11,51 EUR;Envío gratis;Vendidos  16 oct 2021Artículo vendido;desde Estados Unidos;
Gameboy Advance Lote De 2-Ready 2 Rumble RD 2/NBA Jam 2002-Juegos solamente;15,11 EUR;+ 4,22 EUR de envío;Vendidos  12 oct 2021Artículo vendido;desde Estados Unidos;
NBA Jam (Nintendo Game Boy, 1994) Original Equipment Manufacturer Cartucho Con Caja!! auténtico Nintendo GB;8,88 EUR;Envío gratis;Vendidos  10 oct 2021Artículo vendido;desde Estados Unidos;
NBA Jam 99 (Nintendo Game Boy Color, 1999) Cartucho De Juego;6,21 EUR;Envío gratis;Vendidos  9 oct 2021Artículo vendido;desde Estados Unidos;
NBA Jam T.e. y NBA JAM 99 (Gameboy) - Probado - 2 Cartuchos-ACCLAIM;10,67 EUR;+ 3,56 EUR de envío;Vendidos  6 oct 2021Artículo vendido;desde Estados Unidos;
NBA Jam Te (Nintendo Game Boy, 1994) probadas suena genial!!!;6,18 EUR;+ 2,66 EUR de envío;Vendidos  5 oct 2021Artículo vendido;desde Estados Unidos;
★☆☆ Nintendo Gameboy Classic - NBA Jam ☆☆★ ;6,95 EUR;+ 11,95 EUR de envío;Vendidos  4 oct 2021Artículo vendido;desde Países Bajos;
NBA Jam 2001 Nintendo Game Boy Color-Buen Estado-Probado;8,88 EUR;Envío gratis;Vendidos  2 oct 2021Artículo vendido;desde Estados Unidos;
NBA Jam Te (Nintendo Game Boy, 1994);7,82 EUR;Envío gratis;Vendidos  20 sep 2021Artículo vendido;desde Estados Unidos;
NBA Jam (Nintendo Gameboy, 1994) * con manual * caja de video juego & Carro De Baloncesto;13,11 EUR;Envío gratis;Vendidos  19 sep 2021Artículo vendido;desde Estados Unidos;
NBA Jam 2001 (Nintendo Game Boy Color GBC) Manual de instrucciones;5,33 EUR;Envío gratis;Vendidos  18 sep 2021Artículo vendido;desde Estados Unidos;
NBA Jam: edición del torneo-Nintendo Game Boy-Caja y manual ONLY-Sin juego;31,11 EUR;Envío gratis;Vendidos  18 sep 2021Artículo vendido;desde Estados Unidos;
NBA Jam PS3 Sony Playstation 3 video juego en muy buen estado Completo rápido 🚚 🚚;15,89 EUR;+ 19,06 EUR de envío estimado;Vendidos  5 dic 2021Artículo vendido;desde Reino Unido;
NBA Jam Sega juego de Mega CD;35,30 EUR;+ 21,79 EUR de envío estimado;Vendidos  16 sep 2021Artículo vendido;desde Reino Unido;
NBA Jam Sega Mega Drive Juego PAL versión MEGADRIVE CON MANUAL;16,46 EUR;+ 17,28 EUR de envío estimado;Vendidos  19 oct 2021Artículo vendido;desde Reino Unido;
NBA Jam 99-N64 Carro De Juego-Raro;9,40 EUR;+ 17,12 EUR de envío estimado;Vendidos  10 nov 2021Artículo vendido;desde Reino Unido;
NBA Jam PS3 Sony Playstation 3 video juego Pal Muy Buen Estado Completo;17,59 EUR;+ 3,52 EUR de envío;Vendidos  30 oct 2021Artículo vendido;desde Reino Unido;
NBA Jam-Sega Mega Drive Juego (probado-Envío Rápido-Pal);10,53 EUR;+ 18,56 EUR de envío estimado;Vendidos  30 nov 2021Artículo vendido;desde Reino Unido;
NBA Jam-Super Nintendo (SNES) - Reino Unido PAL-en Caja;17,59 EUR;+ 21,06 EUR de envío estimado;Vendidos  13 oct 2021Artículo vendido;desde Reino Unido;
NBA Jam T.e. Super Nintendo SNES Juego;17,64 EUR;+ 21,18 EUR de envío;Vendidos  25 oct 2021Artículo vendido;desde Reino Unido;
NBA Jam Sega Game Gear Juego en Caja;18,77 EUR;+ 17,32 EUR de envío estimado;Vendidos  26 nov 2021Artículo vendido;desde Reino Unido;
NBA Jam T.e. - Sega Mega Drive Juego (probado-Genesis pero funciona en PAL);10,53 EUR;+ 18,56 EUR de envío estimado;Vendidos  27 sep 2021Artículo vendido;desde Reino Unido;
NBA Jam Super Nintendo Juego SNES PAL versión Super Nes;12,93 EUR;+ 6,88 EUR de envío;Vendidos  17 oct 2021Artículo vendido;desde Reino Unido;
NBA Jam 2010 PS3 PlayStation 3 video juego Asociación Nacional de Baloncesto Reino Unido Rel;17,64 EUR;+ 17,30 EUR de envío estimado;Vendidos  31 oct 2021Artículo vendido;desde Reino Unido;
NBA Jam Xbox 360 Video Juego;8,57 EUR;+ 17,10 EUR de envío estimado;Vendidos  23 nov 2021Artículo vendido;desde Reino Unido;
NBA Jam Original Xbox Clásico Juego-Completo-Buen Estado;6,59 EUR;+ 17,06 EUR de envío estimado;Vendidos  16 sep 2021Artículo vendido;desde Reino Unido;
- NBA Jam Snes Juego De Reemplazo Estuche caja + portada funcionan sólo;8,23 EUR;+ 2,34 EUR de envío;Vendidos  17 nov 2021Artículo vendido;desde Reino Unido;
NBA Jam Juego Cartucho PAL ESP Super Nintendo SNES Genuino;15,83 EUR;Envío no especificado;Vendidos  6 dic 2021Artículo vendido;desde Reino Unido;
