Genuine Golf Juego De Video Para Nintendo Game Boy japonés Probado;4,67 EUR;+ 16,92 EUR de envío estimado;desde Reino Unido;
Genuine Golf Juego De Video Para Nintendo Game Boy japonés Probado;4,67 EUR;+ 16,92 EUR de envío estimado;desde Reino Unido;
5 Juegos de Game Boy Duck Tales, Wario, Lucky Luke, Mickey's, Golf;1,00 EUR;Envío no especificado;desde Alemania;
Nintendo Game Boy Color juego-Mario Golf-Embalaje original-pal-rar-Top;49,90 EUR;Envío no especificado;desde Alemania;
Genuine Mario Golf GB de vídeo juego para Nintendo Game Boy Color japonés;5,84 EUR;+ 16,95 EUR de envío estimado;desde Reino Unido;
Genuine Golf de OHA Suta video juego para Nintendo Game Boy japonés;5,84 EUR;+ 16,95 EUR de envío estimado;desde Reino Unido;
Original Nintendo Game Boy Ultra Golf Carro De Cartucho De Juego;11,70 EUR;+ 17,07 EUR de envío estimado;desde Reino Unido;
Mario Golf - Jeu Game Boy Color GBC EUR - Cartouche seule;19,90 EUR;+ 19,90 EUR de envío;desde Francia;
Nintendo Game Boy Golf FAH Très Bon état #2;7,90 EUR;+ 11,98 EUR de envío;desde Francia;
Jack Nicklaus Golf juego de vídeo juego para Nintendo Game Boy PAL En Caja Probado;29,25 EUR;+ 17,45 EUR de envío estimado;desde Reino Unido;
NINTENDO GAME BOY  / Jack Nicklaus Golf [ DMG-JN-FAH ];89,95 EUR;+ 36,00 EUR de envío;desde Francia;
Nintendo Game Boy-Golf Classic-Embalaje original-pal-Top;109,90 EUR;Envío no especificado;desde Alemania;
Game Boy-Golf + instrucciones & funda-Game Boy, usado;14,99 EUR;+ 6,90 EUR de envío;desde Alemania;
