Jack Nicklaus Golf juego de vídeo juego para Nintendo Game Boy PAL En Caja Probado;29,25 EUR;+ 17,45 EUR de envío estimado;desde Reino Unido;
NINTENDO GAME BOY  / Jack Nicklaus Golf [ DMG-JN-FAH ];89,95 EUR;+ 36,00 EUR de envío;desde Francia;
GB-Jack Nicklaus Golf (importado de EE. UU.) - Completa-Nintendo Game Boy;17,54 EUR;+ 21,30 EUR de envío estimado;desde Reino Unido;
Notice - Jack Nicklaus Golf - Nintendo Game Boy - PAL FAH;4,90 EUR;+ 5,80 EUR de envío;desde Francia;
Nintendo Gameboy Bundle: Jack Nicklaus Golf, Super Mario Land 2 Cartuchos sólo;15,51 EUR;+ 17,16 EUR de envío estimado;desde Reino Unido;
Nintendo Game Boy Jack Nicklaus Golf Notice / Instruction Manual;7,99 EUR;+ 2,75 EUR de envío;desde Francia;
Nintendo Gameboy - Jack Nicklaus Golf - Sólo Módulo;5,58 EUR;+ 1,80 EUR de envío;desde Alemania;
Jack Nicklaus Golf (Game Boy);12,87 EUR;Envío no especificado;desde Reino Unido;
Jack Nicklaus Golf Nintendo Game Boy solo manual de instrucciones folleto Auténtico;4,42 EUR;Envío gratis;desde Estados Unidos;
Jack Nicklaus Golf-Nintendo GAME BOY;6,78 EUR;+ 3,90 EUR de envío;desde Estados Unidos;
Jack Nicklaus Golf Para Nintendo Game Boy-Carro Y Estuche;1,76 EUR;+ 3,77 EUR de envío;desde Estados Unidos;
GB-Jack Nicklaus Golf Nintendo Game Boy 1992 solo carro;5,75 EUR;Envío gratis;desde Estados Unidos;
Jack Nicklaus Golf juego de vídeo juego para Nintendo Game Boy PAL En Caja Probado;45,08 EUR;+ 17,72 EUR de envío;desde Reino Unido;
Jack Nicklaus Golf (Nintendo Game Boy de 1992) Excelente Estado & Auténtico;11,47 EUR;Envío gratis;desde Estados Unidos;
Jack Nicklaus Golf (Nintendo Game Boy, 1992) Usado C/manual;42,08 EUR;Envío gratis;desde Estados Unidos;
Jack Nicklaus Golf Con Manual Nintendo Game Boy-auténtica;31,00 EUR;+ 5,94 EUR de envío;desde Estados Unidos;
Jack Nicklaus Golf (Nintendo Game Boy, 1992);11,47 EUR;Envío gratis;desde Estados Unidos;
Jack Nicklaus Golf (Nintendo Game Boy, 1992) solo carro;7,08 EUR;+ 4,87 EUR de envío;desde Estados Unidos;
Jack Nicklaus Golf GBO Gameboy Original limpiado & G51 Probado;8,82 EUR;Envío gratis;desde Estados Unidos;
Jack Nicklaus Golf probado (Nintendo Game Boy, 1992);7,08 EUR;+ 4,87 EUR de envío;desde Estados Unidos;
Jack Nicklaus Golf (gdl) Pre-owned Gameboy;9,70 EUR;Envío gratis;desde Estados Unidos;
Jack Nicklaus Golf GameBoy Used SAME DAY FREE SHIPPING;9,18 EUR;+ 12,66 EUR de envío;desde Australia;
Nintendo Gameboy Lot of 2 Games Jack Nicklaus Golf and Beach Volleyball Games;13,94 EUR;+ 19,28 EUR de envío;desde Canadá;
Nintendo Game Boy Jack Nicklaus Golf Folleto De Instrucciones Solamente;5,32 EUR;Envío gratis;desde Estados Unidos;
Nintendo Game Boy Jack Nicklaus Golf Folleto de instrucciones solamente casi nuevo y sin usar;7,09 EUR;Envío gratis;desde Estados Unidos;
Nintendo Snes/game Boy Jack Nicklaus Golf juego de video revista página de anuncio impreso;8,82 EUR;+ 3,23 EUR de envío;desde Estados Unidos;
Nintendo Gameboy Game Boy Golf & Jack Nicklaus Golf Instruction Booklets no game;9,06 EUR;+ 12,55 EUR de envío;desde Canadá;
Nintendo Gameboy - Jack Nicklaus Golf - solo Modulo;5,63 EUR;+ 1,80 EUR de envío;desde Alemania;
Nintendo Gameboy - Jack Nicklaus Golf - only Module;5,67 EUR;+ 1,80 EUR de envío;desde Alemania;
Nintendo Gameboy - Jack Nicklaus Golf - Seulement Module;5,54 EUR;+ 1,80 EUR de envío;desde Alemania;
Nintendo Gameboy-Jack Nicklaus Golf-Sólo Módulo;5,55 EUR;+ 1,80 EUR de envío;desde Alemania;
Jack Nicklaus Golf mayor 18 Agujeros-Nintendo NES Juego [PAL un UKV] CIB;32,71 EUR;+ 17,50 EUR de envío;desde Reino Unido;
Nintendo NES Jack Nicklaus Golf 👑 Near Mint 👑;129,95 EUR;+ 32,30 EUR de envío;desde Países Bajos;
Jack Nicklaus Golf-Super Nintendo SNES Versión Usa-Completo En Caja;23,35 EUR;+ 21,07 EUR de envío estimado;desde Reino Unido;
Nintendo NES Juego-Jack Nicklaus Golf Championship;9,30 EUR;+ 17,03 EUR de envío estimado;desde Reino Unido;
Nintendo NES Juego-Jack Nicklaus Golf Championship;9,30 EUR;+ 17,03 EUR de envío estimado;desde Reino Unido;
Jack Nicklaus Golf Snes Caja sólo-ver fotografías;5,84 EUR;+ 19,27 EUR de envío estimado;desde Reino Unido;
2 en 1 Pack-Jack Nicklaus Golf & Daley Thompson decathlon-PC CD ROM Caja Grande;1,74 EUR;+ 25,89 EUR de envío estimado;desde Reino Unido;
