Monster Max Gameboy Game Boy gb Classic OVP EUR cib;99,90 EUR;+ 10,00 EUR de envío;desde Alemania;
Monster Max-Game Boy-Completo En Caja-auténtico-Raro;79,13 EUR;+ 7,11 EUR de envío;desde Portugal;
Nintendo Game Boy Classic juego Monster Max con embalaje original y guía frg #2;79,90 EUR;+ 8,99 EUR de envío;desde Alemania;
Nintendo Game Boy-Monster Max-Embalaje original-pal-Top;129,90 EUR;Envío no especificado;desde Alemania;
Monster Max * Nintendo GameBoy * PAL  FAH;99,95 EUR;+ 21,00 EUR de envío;desde Países Bajos;
Monster Max - UKV - Nintendo Gameboy;99,00 EUR;+ 25,00 EUR de envío;desde Países Bajos;
🎮 Monster Max-GameBoy módulo-dmg-x8-ukv ☑ Game Boy juego en protectora para móvil;6,99 EUR;Envío no especificado;desde Alemania;
Monster Max Nintendo Gameboy OVP cib Boxed;99,90 EUR;Envío no especificado;desde Alemania;
Monster Max Nintendo Game Boy OVP con instrucciones en Box;79,98 EUR;Envío no especificado;desde Alemania;
Nintendo Game Boy Classic juego Monster Max con embalaje original y guía frg;99,90 EUR;+ 8,99 EUR de envío;desde Alemania;
Monster Max Juego De Gameboy -! Raro! un solo figuran en América del Norte!;88,91 EUR;Envío gratis;desde Estados Unidos;
De Colección Nintendo Super Power Club desafío Trading Card #132 Monster Max Game Boy;1,24 EUR;+ 0,63 EUR de envío;desde Estados Unidos;
