Nintendo World Cup * Nintendo Game Boy * buen estado * probado;4,99 EUR;Envío no especificado;Vendidos  12 nov 2021Artículo vendido;desde Alemania;
Nintendo World Cup. Nintendo Game Boy. Excelente Estado. en Caja. Reino Unido. DMG-NC-UKV;23,49 EUR;+ 17,39 EUR de envío estimado;Vendidos  4 nov 2021Artículo vendido;desde Reino Unido;
Nintendo World Cup Gameboy Game Boy solo carro PAL ** GRATIS UK FRANQUEO **;8,06 EUR;+ 13,87 EUR de envío;Vendidos  19 oct 2021Artículo vendido;desde Reino Unido;
Nintendo World Cup-Game Boy-Módulo de juego-Nintendo-Game Boy-buen estado;5,79 EUR;Envío no especificado;Vendidos  18 oct 2021Artículo vendido;desde Alemania;
Nintendo World Cup Gameboy OVP;45,00 EUR;Envío no especificado;Vendidos  29 sep 2021Artículo vendido;desde Alemania;
Caja repro Nintendo World Cup, Game Boy, NO incluye juego.;8,95 EUR;Envío no especificado;Vendidos  9 sep 2021Artículo vendido;desde España;
Nintendo World Cup-Nintendo Game Boy juego;6,99 EUR;Envío no especificado;Vendidos  9 sep 2021Artículo vendido;desde Alemania;
