NBA All-Star Challenge Nintendo GameBoy Juego (limpiado, Pulido!);3,54 EUR;+ 2,65 EUR de envío;Vendidos  8 dic 2021Artículo vendido;desde Estados Unidos;
GAMEBOY NBA All-Star Challenge Juego Y Manual Perfecto Estado;13,30 EUR;Envío gratis;Vendidos  1 dic 2021Artículo vendido;desde Estados Unidos;
NBA All-Star Challenge (Nintendo Game Boy, 1991);37,27 EUR;+ 4,30 EUR de envío;Vendidos  27 nov 2021Artículo vendido;desde Estados Unidos;
NBA All-Star Challenge (Nintendo Gameboy, 1990) Con Caja De Juego De Plástico;7,09 EUR;Envío gratis;Vendidos  27 nov 2021Artículo vendido;desde Estados Unidos;
NBA All-Star Challenge Nintendo Juego Original Boy * limpiado & Probado *;5,31 EUR;Envío gratis;Vendidos  17 nov 2021Artículo vendido;desde Estados Unidos;
NBA All-Star Challenge (Nintendo Game Boy, 1991);5,31 EUR;+ 3,54 EUR de envío;Vendidos  12 nov 2021Artículo vendido;desde Estados Unidos;
NBA All-Star Challenge-Nintendo Juego Original Boy;0,88 EUR;+ 4,79 EUR de envío;Vendidos  11 nov 2021Artículo vendido;desde Estados Unidos;
NBA All-Star Challenge 2 (Nintendo Game Boy) Seminuevo Con Manual;8,86 EUR;Envío gratis;Vendidos  10 nov 2021Artículo vendido;desde Estados Unidos;
NBA All-Star Challenge 2 (Nintendo Game Boy) Auténtico, Probado;2,40 EUR;+ 2,66 EUR de envío;Vendidos  8 nov 2021Artículo vendido;desde Estados Unidos;
NBA All-Star Challenge Gameboy manual del juego;4,43 EUR;+ 2,65 EUR de envío;Vendidos  8 nov 2021Artículo vendido;desde Estados Unidos;
NBA All-Star Challenge Nintendo Game Boy Original * limpiado & Probado *;7,07 EUR;Envío gratis;Vendidos  2 nov 2021Artículo vendido;desde Estados Unidos;
NBA All-Star Challenge Juego Boy;1,75 EUR;+ 3,50 EUR de envío;Vendidos  27 oct 2021Artículo vendido;desde Estados Unidos;
Nintendo Game Boy Vintage 1990 NBA All-Star Challenge Caja vacía;26,62 EUR;+ 2,88 EUR de envío;Vendidos  26 oct 2021Artículo vendido;desde Estados Unidos;
NBA All-Star Challenge-Nintendo Juego Original Boy;5,31 EUR;+ 2,65 EUR de envío;Vendidos  22 oct 2021Artículo vendido;desde Estados Unidos;
NBA All-Star Challenge Nintendo Juego Original Boy * limpiado & Probado *;5,88 EUR;Envío gratis;Vendidos  18 oct 2021Artículo vendido;desde Estados Unidos;
NBA All-Star Challenge 2 (Nintendo Game Boy) cartucho sólo;6,43 EUR;Envío gratis;Vendidos  4 oct 2021Artículo vendido;desde Estados Unidos;
NBA All-Star Challenge 2 II Game Boy;1,75 EUR;+ 3,50 EUR de envío;Vendidos  28 sep 2021Artículo vendido;desde Estados Unidos;
Jeu Super Nintendo SNES Complet En Boite PAL Exclu NOE ! NBA All-Star Challenge;33,00 EUR;+ 14,90 EUR de envío;Vendidos  27 sep 2021Artículo vendido;desde Francia;
