NBA All-Star Challenge 2 (Nintendo Gameboy, 1992), sólo cartucho;6,75 EUR;Envío gratis;Vendidos  7 dic 2021Artículo vendido;desde Estados Unidos;
GAMEBOY NBA All-Star Challenge Juego Y Manual Perfecto Estado;13,33 EUR;Envío gratis;Vendidos  1 dic 2021Artículo vendido;desde Estados Unidos;
NBA All-Star Challenge (Nintendo Game Boy, 1991);37,34 EUR;+ 4,31 EUR de envío;Vendidos  27 nov 2021Artículo vendido;desde Estados Unidos;
NBA All-Star Challenge (Nintendo Gameboy, 1990) Con Caja De Juego De Plástico;7,10 EUR;Envío gratis;Vendidos  27 nov 2021Artículo vendido;desde Estados Unidos;
NBA All-Star Challenge Nintendo Juego Original Boy * limpiado & Probado *;5,33 EUR;Envío gratis;Vendidos  17 nov 2021Artículo vendido;desde Estados Unidos;
NBA All-Star Challenge (Nintendo Game Boy, 1991);5,33 EUR;+ 3,55 EUR de envío;Vendidos  12 nov 2021Artículo vendido;desde Estados Unidos;
NBA All-Star Challenge-Nintendo Juego Original Boy;0,88 EUR;+ 4,80 EUR de envío;Vendidos  11 nov 2021Artículo vendido;desde Estados Unidos;
NBA All-Star Challenge 2 (Nintendo Game Boy) Seminuevo Con Manual;8,88 EUR;Envío gratis;Vendidos  10 nov 2021Artículo vendido;desde Estados Unidos;
NBA All-Star Challenge 2 (Nintendo Game Boy) Auténtico, Probado;2,40 EUR;+ 2,67 EUR de envío;Vendidos  8 nov 2021Artículo vendido;desde Estados Unidos;
NBA All-Star Challenge Nintendo Game Boy Original * limpiado & Probado *;7,09 EUR;Envío gratis;Vendidos  2 nov 2021Artículo vendido;desde Estados Unidos;
NBA All-Star Challenge Juego Boy;1,75 EUR;+ 2,62 EUR de envío;Vendidos  27 oct 2021Artículo vendido;desde Estados Unidos;
Nintendo Game Boy Vintage 1990 NBA All-Star Challenge Caja vacía;26,67 EUR;+ 2,89 EUR de envío;Vendidos  26 oct 2021Artículo vendido;desde Estados Unidos;
NBA All-Star Challenge-Nintendo Juego Original Boy;5,33 EUR;+ 2,66 EUR de envío;Vendidos  22 oct 2021Artículo vendido;desde Estados Unidos;
NBA All-Star Challenge Nintendo Juego Original Boy * limpiado & Probado *;5,89 EUR;Envío gratis;Vendidos  18 oct 2021Artículo vendido;desde Estados Unidos;
NBA All-Star Challenge 2 (Nintendo Game Boy) cartucho sólo;6,45 EUR;Envío gratis;Vendidos  4 oct 2021Artículo vendido;desde Estados Unidos;
NBA All-Star Challenge 2 II Game Boy;1,75 EUR;+ 2,62 EUR de envío;Vendidos  28 sep 2021Artículo vendido;desde Estados Unidos;
Jeu Super Nintendo SNES Complet En Boite PAL Exclu NOE ! NBA All-Star Challenge;33,00 EUR;+ 14,90 EUR de envío;Vendidos  27 sep 2021Artículo vendido;desde Francia;
