NFL Quarterback Club 96 Juego Nintendo Gameboy;29,35 EUR;+ 17,51 EUR de envío estimado;desde Reino Unido;
NFL Quarterback Club 96-muy Raro | Game Boy DMG | En Caja | EUR;52,84 EUR;+ 18,02 EUR de envío estimado;desde Reino Unido;
NFL Quarterback Club 95 Nuevo Sellado? juego Boy Color GB Juego Japón NTSC J JAP;28,11 EUR;+ 13,45 EUR de envío;desde Reino Unido;
NFL Quarterback Club II 2 | Game Boy Color| | de GBA módulo utilizado sólo;17,99 EUR;+ 15,00 EUR de envío;desde Alemania;
NFL Quarterback Club-Nintendo Game Boy GB;23,49 EUR;+ 21,14 EUR de envío estimado;desde Reino Unido;
NFL Quarterback Club-Nintendo Gameboy;11,71 EUR;+ 13,51 EUR de envío;desde Reino Unido;
Nintendo Gameboy Juego-NFL Quarterback Club;11,58 EUR;+ 17,13 EUR de envío estimado;desde Reino Unido;
Nintendo Gameboy Juego-NFL Quarterback Club;11,58 EUR;+ 17,13 EUR de envío estimado;desde Reino Unido;
Nintendo Gameboy solo manual: NFL Quarterback Club;4,40 EUR;+ 16,98 EUR de envío estimado;desde Reino Unido;
Nintendo Gameboy solo manual: NFL Quarterback Club;5,24 EUR;+ 16,99 EUR de envío estimado;desde Reino Unido;
NFL Quarterback Club (Nintendo Game Boy, 1993);9,75 EUR;+ 3,73 EUR de envío;desde Estados Unidos;
NFL Quarterback Club 96 Juego Boy Juego Nintendo;6,17 EUR;Envío gratis;desde Estados Unidos;
NFL Quarterback Club 96 (Nintendo Game Boy) Original Gameboy auténtico Probado;6,65 EUR;Envío gratis;desde Estados Unidos;
NFL Quarterback Club 96 (Nintendo Game Boy, 1995) NUEVO-golpeados Up Caja Ver Fotos;70,97 EUR;Envío gratis;desde Estados Unidos;
NFL Quarterback Club 96 (Nintendo Game Boy, 1995) nueva abrir caja, Nunca Usado;31,05 EUR;Envío gratis;desde Estados Unidos;
NFL Quarterback Club Para Nintendo Game Boy-Carro Y Estuche;1,77 EUR;+ 3,77 EUR de envío;desde Estados Unidos;