NFL Quarterback Club 96-muy Raro | Game Boy DMG | En Caja | EUR;52,69 EUR;+ 17,96 EUR de envío estimado;desde Reino Unido;
NFL Quarterback Club II 2 | Game Boy Color| | de GBA módulo utilizado sólo;17,99 EUR;+ 15,00 EUR de envío;desde Alemania;
NFL Quarterback Club-Nintendo Game Boy GB;23,42 EUR;+ 21,08 EUR de envío estimado;desde Reino Unido;
NFL Quarterback Club Nintendo Gameboy. probado y trabajo ver fotos. UKV. Excelente;12,87 EUR;+ 18,90 EUR de envío estimado;desde Reino Unido;
NFL Quarterback Club-Nintendo Gameboy;11,68 EUR;+ 13,47 EUR de envío;desde Reino Unido;
Nintendo Gameboy Juego-NFL Quarterback Club;11,55 EUR;+ 17,09 EUR de envío estimado;desde Reino Unido;
Nintendo Gameboy Juego-NFL Quarterback Club;11,55 EUR;+ 17,09 EUR de envío estimado;desde Reino Unido;
NFL Quarterback Club 95 Nuevo Sellado? juego Boy Color GB Juego Japón NTSC J JAP;25,24 EUR;+ 13,41 EUR de envío;desde Reino Unido;
Nintendo Gameboy solo manual: NFL Quarterback Club;5,22 EUR;+ 16,95 EUR de envío estimado;desde Reino Unido;
NFL Quarterback Club (Nintendo Game Boy, 1993);9,73 EUR;+ 3,72 EUR de envío;desde Estados Unidos;
NFL Quarterback Club 96 (Nintendo Game Boy, 1995) NUEVO-golpeados Up Caja Ver Fotos;53,14 EUR;Envío gratis;desde Estados Unidos;
NFL Quarterback Club 96 (Nintendo Game Boy) Nueva, Sellado De Fábrica Casi Nuevo +;132,82 EUR;Envío gratis;desde Estados Unidos;
NFL Quarterback Club 96 Juego Boy Juego Nintendo;6,16 EUR;Envío gratis;desde Estados Unidos;
NFL Quarterback Club 96 (Nintendo Game Boy) Original Gameboy auténtico Probado;6,63 EUR;Envío gratis;desde Estados Unidos;
NFL Quarterback Club 96 (Nintendo Game Boy, 1995) nueva abrir caja, Nunca Usado;31,00 EUR;Envío gratis;desde Estados Unidos;
NFL Quarterback Club (Nintendo Game Boy, 1993) Completo En Caja;26,56 EUR;Envío gratis;desde Estados Unidos;
NFL Quarterback Club probado Game Boy;5,31 EUR;Envío gratis;desde Estados Unidos;
NFL Quarterback Club II (Nintendo Game Boy, 1995);9,79 EUR;Envío gratis;desde Estados Unidos;
NFL Quarterback Club-Game Boy-Nintendo-auténtico Probado Funcionando! muy Bueno!;9,79 EUR;Envío gratis;desde Estados Unidos;
NFL Quarterback Club 96 con manual de instrucciones Nintendo Game Boy Probado Funcionando;4,43 EUR;+ 4,21 EUR de envío;desde Estados Unidos;
NFL Quarterback Club'96 Nintendo Game Boy *** *** Solo Manual;7,04 EUR;Envío gratis;desde Estados Unidos;
NFL Quarterback Club 96-Game Boy auténtico manual;2,91 EUR;+ 2,61 EUR de envío;desde Estados Unidos;
NFL Quarterback Club-juego BOY Juego Cartucho Solo;2,83 EUR;+ 3,94 EUR de envío;desde Estados Unidos;
NFL Quarterback Club 96 Juego Boy compatible con GBC & GBA Probado Funcionando;2,66 EUR;+ 1,76 EUR de envío;desde Estados Unidos;
NFL Quarterback Club (Nintendo Game Boy) cartucho sólo!;5,31 EUR;+ 0,88 EUR de envío;desde Estados Unidos;
NFL Quarterback Club 2 Nintendo Game Boy Video Juego;4,69 EUR;+ 2,83 EUR de envío;desde Estados Unidos;
NFL Quarterback Club 2 ORIGINAL NINTENDO GAMEBOY probado + trabajo & Auténtico;9,79 EUR;Envío gratis;desde Estados Unidos;
NFL Quarterback Club Nintendo Game Boy Original * limpiado & Probado *;7,06 EUR;Envío gratis;desde Estados Unidos;
NFL Quarterback Club Game Boy Clásico;13,29 EUR;+ 4,21 EUR de envío;desde Estados Unidos;
NFL Quarterback Club II (Nintendo Game Boy, 1995) Completo en Caja Caja de menta completo manual;35,43 EUR;Envío gratis;desde Estados Unidos;
NFL Quarterback Club Original NINTENDO GAMEBOY GB juego probado funciona Estuche de plástico;7,04 EUR;+ 3,54 EUR de envío;desde Estados Unidos;
NFL Quarterback Club (Nintendo Game Boy, 1993) Authentic Cartridge;5,12 EUR;+ 10,12 EUR de envío;desde Canadá;
NFL Quarterback Club 96 (Nintendo Game Boy) Nueva, Sellado De Fábrica;88,53 EUR;Envío gratis;desde Estados Unidos;
NFL Quarterback Club-juego Boy-Nintendo-auténtica;4,42 EUR;+ 3,36 EUR de envío;desde Estados Unidos;
NFL Quarterback Club 96 GB Juego Nintendo;6,28 EUR;Envío gratis;desde Estados Unidos;
NFL Quarterback Club 96, Nintendo Game Boy, carro de juego solamente;2,66 EUR;+ 3,53 EUR de envío;desde Estados Unidos;
NFL Quarterback Club-juego BOY Juego Cartucho Solo;4,43 EUR;+ 4,07 EUR de envío;desde Estados Unidos;
NFL Quarterback Club 96 (Nintendo Game Boy) Nuevo, Sellado-VGA clasificados 80+ Casi Nuevo;309,98 EUR;Envío gratis;desde Estados Unidos;
NFL Quarterback Club II (Nintendo Game Boy, 1995) solo carro;6,90 EUR;Envío gratis;desde Estados Unidos;
NFL Quarterback Club (Nintendo Game Boy) probado y auténtico;7,05 EUR;+ 3,84 EUR de envío;desde Estados Unidos;
NFL Quarterback Club II (Nintendo Game Boy, 1995) Gameboy Probado;4,42 EUR;+ 3,32 EUR de envío;desde Estados Unidos;
NFL Quarterback Club II (Nintendo Game Boy) Seminuevo Con Manual;12,61 EUR;Envío gratis;desde Estados Unidos;
NFL Quarterback Club (Nintendo Game Boy, 1996);7,41 EUR;+ 4,78 EUR de envío;desde Estados Unidos;
NFL Quarterback Club 96 (Nintendo Game Boy) Seminuevo Con Manual;12,61 EUR;Envío gratis;desde Estados Unidos;
Gameboy NFL Quarterback Club 96 funciona bien!;1,76 EUR;+ 4,42 EUR de envío;desde Estados Unidos;
NFL Quarterback Club (Nintendo Game Boy, 1993) Auténtico CARTUCHO-PROBADO Y FUNCIONA;4,42 EUR;+ 3,81 EUR de envío;desde Estados Unidos;
NFL Quarterback Club 96 (Nintendo Game Boy) Auténtico CARTUCHO-PROBADO Y FUNCIONA;7,96 EUR;+ 3,81 EUR de envío;desde Estados Unidos;
NFL Quarterback Club-juego Boy Juego-Cartucho únicamente;4,42 EUR;+ 2,83 EUR de envío;desde Estados Unidos;
NFL Quarterback Club 2 II (Nintendo Game Boy Cartucho Original);17,71 EUR;+ 5,45 EUR de envío;desde Estados Unidos;
NFL Quarterback Club II (Nintendo Game Boy) ** ** solo Cartucho;7,16 EUR;+ 4,36 EUR de envío;desde Estados Unidos;
NFL Quarterback Club 2 GameBoy verificado Funciona;4,43 EUR;+ 4,07 EUR de envío;desde Estados Unidos;
NFL Quarterback Club 2 GameBoy, sólo Carro;9,07 EUR;Envío gratis;desde Estados Unidos;
NFL Quarterback Club 96 (Nintendo Game Boy, 1995) cartucho sólo ver fotos;7,08 EUR;+ 4,07 EUR de envío;desde Estados Unidos;
Super GameBoy Adaptador Nintendo SNES un-SNS-027 probado con NFL Quarterback Club;30,99 EUR;+ 9,43 EUR de envío;desde Estados Unidos;
NFL Quarterback Club-Sega Game Gear-pal-Completo con Manual CIB;152,22 EUR;+ 29,14 EUR de envío estimado;desde Reino Unido;
NFL Quarterback Club - SEGA Megadrive 32X - Blister Sealed - NEW NEUF;214,90 EUR;+ 24,90 EUR de envío;desde Francia;
NFL Quarterback Club-Sega Game Gear-PAL-solo carro;38,63 EUR;+ 17,66 EUR de envío estimado;desde Reino Unido;
NFL Quarterback Club-Sega Game Gear-PAL-NUEVO y Sellado;199,07 EUR;+ 40,05 EUR de envío estimado;desde Reino Unido;
NFL Quarterback Club Snes Super Nintendo condición de Coleccionistas de juego, además de cartel;140,53 EUR;+ 24,78 EUR de envío estimado;desde Reino Unido;
Vintage N64 NINTENDO NFL Quarterback Club 98 Video Juego Carro Original poste libre;15,13 EUR;+ 17,16 EUR de envío estimado;desde Reino Unido;
NFL Quarterback Club 98 N64 Juego-Nintendo;15,21 EUR;+ 17,16 EUR de envío estimado;desde Reino Unido;
NFL Quarterback Club & NFL Quarterback Club 96 Sega Mega Drive Completo;69,08 EUR;+ 27,34 EUR de envío estimado;desde Reino Unido;
NFL Quarterback Club Sega 32x;81,96 EUR;+ 18,60 EUR de envío estimado;desde Reino Unido;
NFL Quarterback Club 96 Super Nintendo - SNES - Solo carrito - Envío España;5,84 EUR;+ 16,96 EUR de envío estimado;desde Reino Unido;
NFL Quarterback Club para SEGA Mega Drive (Completo en Caja) RJ wws;26,34 EUR;+ 17,55 EUR de envío;desde Reino Unido;
NFL Quarterback Club 2000 Para Sega Dreamcast completos y en en muy buena condición;25,75 EUR;+ 25,75 EUR de envío;desde Reino Unido;
NFL Quarterback Club 96 | Sega Saturn | En Caja | PAL;35,12 EUR;+ 17,59 EUR de envío estimado;desde Reino Unido;
NFL Quarterback Club 96-Sega Mega Drive Juego Nuevo Sellado;409,81 EUR;+ 23,42 EUR de envío;desde Reino Unido;
NFL Quarterback Club 96 Sega Saturn;87,83 EUR;+ 23,66 EUR de envío estimado;desde Reino Unido;
NFL Quarterback Club Snes Super Nintendo Muy Buen Estado;76,12 EUR;+ 23,40 EUR de envío estimado;desde Reino Unido;
Super Nintendo SNES-NFL Quarterback Club, Tenis & PGA Tour Golf;16,34 EUR;+ 17,18 EUR de envío estimado;desde Reino Unido;
NFL Quarterback Club 2000 Nintendo 64 PAL;76,12 EUR;