Navy SEALs Nintendo Gameboy juego bien Game Boy;9,90 EUR;Envío no especificado;Vendidos  24 oct 2021Artículo vendido;desde Alemania;
Navy SEALs (Nintendo Game Boy) | Cartucho sólo | probado y de trabajo;11,49 EUR;Envío gratis;Vendidos  6 dic 2021Artículo vendido;desde Estados Unidos;
Navy SEALs (Nintendo Game Boy);11,53 EUR;Envío gratis;Vendidos  2 dic 2021Artículo vendido;desde Estados Unidos;
Navy SEALs (Nintendo Game Boy);11,53 EUR;Envío gratis;Vendidos  7 nov 2021Artículo vendido;desde Estados Unidos;
Navy SEALs (Nintendo Gameboy) Completo en Caja Gran forma Juego Boy;47,02 EUR;Envío gratis;Vendidos  16 sep 2021Artículo vendido;desde Estados Unidos;
SOCOM II: U.S. Navy SEALs Game muy bien PlayStation 2 envío rápido Shooter rar;5,00 EUR;Envío no especificado;Vendidos  14 sep 2021Artículo vendido;desde Alemania;
