Game Boy GB:Nemesis II 2 - Gradius [TOP KONAMI & EDITION RARE] Jap;99,90 EUR;+ 30,30 EUR de envío;desde Francia;
Nemesis Gradius Nintendo Game Boy Japan Ver. Shmup Shooting Konami 1990 DMG-NMA ;51,29 EUR;+ 7,00 EUR de envío;desde Francia;
Nemesis Game Boy FAH ;15,00 EUR;Envío internacional gratis;desde Francia;
Game Boy Advance Shell Funda Nemesis Uv Impreso IPS Resident Evil 3 Gba;15,26 EUR;+ 7,05 EUR de envío;desde Reino Unido;
Genuine Nemesis II para Nintendo Game Boy japonés Probado;46,99 EUR;+ 17,90 EUR de envío estimado;desde Reino Unido;
Genuine Nemesis De Vídeo Juego Para Nintendo Game Boy japonés Probado;17,61 EUR;+ 17,27 EUR de envío estimado;desde Reino Unido;
Game Boy Nemesis II japonesa en caja con instrucciones nuevo viejo Stock Free UK Post;52,86 EUR;+ 18,02 EUR de envío estimado;desde Reino Unido;
Vintage Video Juego Nintendo GameBoy Nemesis * Importado Japonés *;11,99 EUR;+ 11,16 EUR de envío;desde Reino Unido;
Nintendo Gameboy Juego-Nemesis el regreso del héroe;27,45 EUR;+ 17,48 EUR de envío estimado;desde Reino Unido;
Nemesis-Nintendo Gameboy Juego [EE. UU. en Caja con Manual CIB] [RESERVADO];469,94 EUR;+ 17,57 EUR de envío;desde Reino Unido;
NINTENDO GAME BOY - Konami Nemesis - Instruction Booklet Manual Italian;12,70 EUR;+ 4,45 EUR de envío;desde Italia;
Nemesis 2 Juego Boy Game-versión Japonesa-Sólo Juego-Buen Estado;41,07 EUR;+ 19,93 EUR de envío estimado;desde Reino Unido;
Nintendo Game Boy Nemesis buena condición;70,49 EUR;+ 23,35 EUR de envío estimado;desde Reino Unido;
Nemesis Nintendo Gameboy Japonés Original Cartucho De Juego DMG-Pastoral;15,26 EUR;+ 17,21 EUR de envío estimado;desde Reino Unido;
Japonés Nintendo Gameboy Juego-DMG-Pastoral-Nemesis;15,82 EUR;+ 17,23 EUR de envío estimado;desde Reino Unido;
Nemesis Para El Juego Original Nintendo Gameboy Cartucho y sólo PAL UK;12,91 EUR;+ 18,64 EUR de envío estimado;desde Reino Unido;
Nemesis Nintendo Game Boy Cartucho y Manual Solamente!;23,49 EUR;+ 17,39 EUR de envío estimado;desde Reino Unido;
Nemesis GB para Nintendo GameBoy;9,95 EUR;+ 6,50 EUR de envío;desde Alemania;
Nuevo anuncioNintendo GameBoy juego - Nemesis 1 cartucha con manual usado;29,99 EUR;Envío internacional gratis;desde Alemania;
Nemesis Nintendo Gameboy Module Lightning Envío ⚡;9,99 EUR;+ 9,00 EUR de envío;desde Alemania;
JOBLOT 45x Gameboy  Akihabara sealed Nemesis Kirby Txin Txan Pokemon(s) Kitty;70,00 EUR;+ 30,00 EUR de envío;desde España;
Nuevo anuncioConsola Game Boy Color IPS LCD Q5 Nemesis Resident Evil GBC Prestige Edición ABS;282,00 EUR;+ 7,05 EUR de envío;desde Reino Unido;
Game Boy Original Estuche Rígido UV Nemesis reemplazo GB retrosix;29,36 EUR;+ 7,05 EUR de envío;desde Reino Unido;
Nintendo Game Boy * Nemesis II/2: the Return of the Hero * instrucciones DMG-ne-noe;24,95 EUR;+ 6,70 EUR de envío;desde Alemania;
Game Boy cómo jugar Nemesis;8,00 EUR;+ 1,99 EUR de envío;desde Alemania;
Game Boy Advance Pegatina Nemesis Resident Evil caso Gba retrosix Adhesivo;3,80 EUR;+ 7,05 EUR de envío;desde Reino Unido;
Manual De Nintendo Gameboy-Nemesis;12,87 EUR;+ 17,17 EUR de envío estimado;desde Reino Unido;
© video games Secrets Nintendo Game Boy juegos 1 dt. Batman/Double Dragon/Nemesis;24,90 EUR;+ 7,00 EUR de envío;desde Alemania;
Nemesis Nintendo Game Boy GB PAL FAH Loose;20,00 EUR;Envío no especificado;desde Francia;
Nemesis 2 the return of the Hero (Nintendo Gameboy Classic) módulo con funda;28,89 EUR;Envío no especificado;desde Alemania;
Jeu Nemesis pour Nintendo Game Boy JAP Loose  - Floto Games;8,90 EUR;Envío no especificado;desde Francia;
Nemesis para Nintendo GameBoy;6,99 EUR;Envío no especificado;desde Alemania;
Nemesis Nintendo Game Boy GB Jap Loose;16,00 EUR;Envío no especificado;desde Francia;
