Speedy Gonzales - Nintendo Game Boy - PAL FAH;7,90 EUR;+ 5,80 EUR de envío;Vendidos  26 nov 2021Artículo vendido;desde Francia;
Speedy Gonzales Aventura Azteca Nintendo Game Boy Clásico, Color;5,85 EUR;+ 18,38 EUR de envío estimado;Vendidos  24 nov 2021Artículo vendido;desde Reino Unido;
Speedy Gonzales-juego de módulo-Nintendo-Game Boy-gb;13,99 EUR;+ 7,99 EUR de envío;Vendidos  25 oct 2021Artículo vendido;desde Alemania;
Sonic Adventures 6 Nintendo Gameboy Advance GBA Speedy Gonzales Hack;22,16 EUR;+ 7,98 EUR de envío;Vendidos  17 oct 2021Artículo vendido;desde Portugal;
Sonic Adventures 6 Nintendo Gameboy Advance GBA Speedy Gonzales Hack;22,16 EUR;+ 7,98 EUR de envío;Vendidos  15 sep 2021Artículo vendido;desde Portugal;
Speedy Gonzales Nintendo Gameboy juego módulo muy bien probado;4,99 EUR;+ 7,39 EUR de envío;Vendidos  7 sep 2021Artículo vendido;desde Alemania;
Caja Original Nintendo Gameboy solo Speedy Gonzales Insertos Genuino Auténtico;70,92 EUR;+ 5,19 EUR de envío;Vendidos  3 dic 2021Artículo vendido;desde Estados Unidos;
Speedy Gonzales auténtico Nintendo GameBoy Original Juego Clásico;10,88 EUR;Envío gratis;Vendidos  1 dic 2021Artículo vendido;desde Estados Unidos;
Speedy Gonzales Nintendo Game Boy;12,83 EUR;+ 2,62 EUR de envío;Vendidos  24 nov 2021Artículo vendido;desde Estados Unidos;
Lote De Tres Nintendo Gameboy (Speedy Gonzales, Monster Truck guerras, tetris);22,16 EUR;Envío gratis;Vendidos  22 nov 2021Artículo vendido;desde Estados Unidos;
Speedy Gonzales-Juego Original Nintendo GameBoy;9,74 EUR;+ 2,62 EUR de envío;Vendidos  18 nov 2021Artículo vendido;desde Estados Unidos;
Speedy Gonzales: Aztec Adventure (Nintendo Game Boy Color, 1999);8,86 EUR;Envío gratis;Vendidos  7 nov 2021Artículo vendido;desde Estados Unidos;
Speedy Gonzales (Nintendo Game Boy, 1993) probado!;10,63 EUR;Envío gratis;Vendidos  31 oct 2021Artículo vendido;desde Estados Unidos;
Speedy Gonzales: Aztec Adventure (Nintendo Game Boy Color, 1999);15,95 EUR;Envío gratis;Vendidos  11 oct 2021Artículo vendido;desde Estados Unidos;
Nintendo Game Boy (Speedy Gonzales) 1993 Juego Original-Case-caja-manual DMG P G6;23,05 EUR;+ 5,32 EUR de envío;Vendidos  6 oct 2021Artículo vendido;desde Estados Unidos;
Speedy Gonzales: Aztec Adventure (GameBoy Color) Auténtico Cartucho * Probado *;13,19 EUR;Envío gratis;Vendidos  4 oct 2021Artículo vendido;desde Estados Unidos;
Speedy Gonzales (Nintendo Game Boy, 1993);13,30 EUR;+ 4,34 EUR de envío;Vendidos  4 oct 2021Artículo vendido;desde Estados Unidos;
Speedy Gonzales (Nintendo Game Boy, 1993) Solo La Caja!!! ver descripción completa;22,16 EUR;+ 3,95 EUR de envío;Vendidos  21 sep 2021Artículo vendido;desde Estados Unidos;
Speedy Gonzales (Nintendo Game Boy, 1993) * * Probado;13,25 EUR;Envío gratis;Vendidos  21 sep 2021Artículo vendido;desde Estados Unidos;
Speedy Gonzales Nintendo Game Boy caja Original Probado Con Estuche Protector;93,04 EUR;Envío gratis;Vendidos  14 sep 2021Artículo vendido;desde Estados Unidos;
Speedy Gonzales (Nintendo Game Boy, 1993) sólo juego probadas;8,86 EUR;Envío gratis;Vendidos  10 sep 2021Artículo vendido;desde Estados Unidos;
