Speedy Gonzales / Game Boy / Gameboy / With Box And Manual / Original;59,90 EUR;+ 15,00 EUR de envío;desde Francia;
Nintendo Game Boy Classic juego Speedy Gonzales con embalaje original y guía fah;159,90 EUR;+ 36,99 EUR de envío;desde Alemania;
Nintendo Game Boy - Speedy Gonzales - PAL - FAH;9,99 EUR;+ 5,00 EUR de envío;desde Francia;
Speedy Gonzales aventura en aztekenreich Game Boy Color juego por completo cib;39,99 EUR;+ 30,00 EUR de envío;desde Alemania;
Nintendo Gameboy Speedy Gonzales CIB muy limpio libre poste del Reino Unido;68,80 EUR;+ 23,15 EUR de envío estimado;desde Reino Unido;
Nintendo Gameboy Speedy Gonzales EE. UU. en muy buena condición libre poste del Reino Unido;81,63 EUR;+ 23,43 EUR de envío estimado;desde Reino Unido;
Nintendo Gameboy/Game Boy Speedy Gonzales juego/módulo;10,99 EUR;+ 40,00 EUR de envío;desde Alemania;
Speedy Gonzales Aventura Oficial Nintendo Game Boy Color Juego Usado;5,83 EUR;+ 17,82 EUR de envío estimado;desde Reino Unido;
GBC-Speedy Gonzales: aventura en aztekenreich para Nintendo Gameboy Color;19,95 EUR;+ 9,95 EUR de envío;desde Alemania;
Speedy Gonzales Aventura Azteca Gameboy Color Juego-Sin Adhesivo en la parte delantera;5,77 EUR;+ 16,89 EUR de envío estimado;desde Reino Unido;
Speedy Gonzales | Game Boy Classic | Nintendo | Tested & Working | DMG-G6-HOL;15,00 EUR;+ 5,00 EUR de envío;desde Bélgica;
Gb-Speedy Gonzales para Nintendo GameBoy;14,95 EUR;+ 9,95 EUR de envío;desde Alemania;
Speedy Gonzales: Aztec Adventure FAH - Nintendo GameBoy Color - GBC;5,91 EUR;+ 19,95 EUR de envío;desde Países Bajos;
Nintendo Game Boy - Speedy Gonzales - Notice / Instruction Manual - FAH;19,99 EUR;+ 5,00 EUR de envío;desde Francia;
Original Gameboy Speedy Gonzales Au Pays Des Azteques Nintendo * CART * DMG-01;8,00 EUR;+ 14,00 EUR de envío;desde Bélgica;
Speedy Gonzales NOE - Nintendo GameBoy - NGB;6,76 EUR;+ 19,95 EUR de envío;desde Países Bajos;
Speedy Gonzales FAH - Nintendo GameBoy - NGB;8,46 EUR;+ 19,95 EUR de envío;desde Países Bajos;
Speedy Gonzales (losse cassette) Nintendo GameBoy Color GBC;9,95 EUR;+ 20,00 EUR de envío;desde Países Bajos;
Game Boy Speedy Gonzales Manual FAH;8,46 EUR;+ 19,95 EUR de envío;desde Países Bajos;
Speedy Gonzales Game boy PAL Eur Cartucho Envio Combinado ;14,90 EUR;Envío no especificado;desde España;
Speedy Gonzales Looney Tunes Game boy NTSC-USA Completo Envio Combinado ;89,90 EUR;Envío no especificado;desde España;
Nintendo Gameboy / Game Boy Color Speedy Gonzales [FAH] Complete GBC;24,95 EUR;Envío no especificado;desde Países Bajos;
