Disney's Aladdin Juego BOY ADVANCE Juego en Caja Y Completo con Manual;34,93 EUR;+ 15,04 EUR de envío;desde Reino Unido;
Nintendo Game Boy * Disney's Aladdin * EMBALAJE ORIGINAL CiB instrucciones ALAP-EUR;46,95 EUR;+ 6,70 EUR de envío;desde Alemania;
Aladdin Game Boy Completo Pal España;30,00 EUR;Envío no especificado;desde España;
Aladdin-Nintendo Game Boy Advance En Caja Con Manual-Gameboy Aladin;58,50 EUR;+ 18,08 EUR de envío estimado;desde Reino Unido;
Aladdin Game Boy juego completo con embalaje original y guía cib;49,99 EUR;+ 8,00 EUR de envío;desde Alemania;
Nintendo Game Boy * Disney's Aladdin * EMBALAJE ORIGINAL CiB instrucciones ALAP-EUR-1;42,95 EUR;+ 35,99 EUR de envío;desde Alemania;
Aladdin (Nintendo Game Boy Advance, 2004);31,60 EUR;+ 9,36 EUR de envío;desde Portugal;
Nintendo Game Boy - Aladdin - PAL - EUR;7,99 EUR;+ 5,00 EUR de envío;desde Francia;
Nintendo Game Boy Aladdin EUR Très Bon état;7,90 EUR;+ 11,98 EUR de envío;desde Francia;
Jeu Nintendo Game Boy - Aladdin - EUR - Loose;8,90 EUR;+ 7,90 EUR de envío;desde Francia;
Aladdin Disney Jeu Nintendo Game Boy PAL EUR;7,99 EUR;+ 3,50 EUR de envío;desde Francia;
Aladdin GameBoy Advance Nintendo Cartucho PAL;46,80 EUR;+ 17,82 EUR de envío estimado;desde Reino Unido;
Aladdin Game Boy juego completo con embalaje original y guía cib;49,99 EUR;+ 8,00 EUR de envío;desde Alemania;
Gameboy Aladdin Gwo Cartucho De Juego Gratis Reino Unido franqueo;11,69 EUR;+ 17,07 EUR de envío estimado;desde Reino Unido;
Nintendo Game Boy Aladdin EUR Très Bon état #3;7,90 EUR;+ 11,98 EUR de envío;desde Francia;
Nintendo Gameboy Advance-Disney 's Aladdin;29,20 EUR;+ 17,45 EUR de envío estimado;desde Reino Unido;
Disney's Aladdin Nintendo Game Boy Videogioco Virgin Gameboy;15,00 EUR;+ 12,00 EUR de envío;desde Italia;
Disney's Aladdin (Nintendo Game Boy Color, 2000);18,72 EUR;+ 7,02 EUR de envío;desde Portugal;
Nintendo Game Boy classic Disney's Aladdin OVP instrucciones cib rar retro Virgin;44,99 EUR;+ 65,00 EUR de envío;desde Alemania;
Nintendo Game Boy gameboy color GBC, gb juego Aladdin con embalaje original;20,00 EUR;+ 18,50 EUR de envío;desde Alemania;
Notice - Disney's Aladdin - Nintendo Game Boy - PAL NEU5;6,90 EUR;+ 5,80 EUR de envío;desde Francia;
Notice - Disney's Aladdin - Nintendo Game Boy - PAL EUR;4,90 EUR;+ 5,80 EUR de envío;desde Francia;
Nintendo Gameboy Color-Disney 's Aladdin;17,50 EUR;+ 17,20 EUR de envío estimado;desde Reino Unido;
Nintendo Gameboy Advance Disney Aladdin;26,91 EUR;+ 17,40 EUR de envío estimado;desde Reino Unido;
Nintendo - Jeu - Gameboy - Aladdin - EUR;8,90 EUR;+ 3,00 EUR de envío;desde Francia;
Aladdin Juego Nintendo Game Boy Advance GBA CARTUCHO sólo;25,74 EUR;+ 17,38 EUR de envío estimado;desde Reino Unido;
Lot De 15 Jeux Nintendo Gameboy Aladdin Fortress Of Fear Spirou Pinocchio Soccer;79,90 EUR;+ 14,90 EUR de envío;desde Francia;
Aladdin GameBoy Advance Version euro;34,99 EUR;+ 29,40 EUR de envío;desde Francia;
Nintendo Gameboy Game Boy Disney's Aladdin en caja con instrucciones en muy buena condición;58,50 EUR;+ 22,18 EUR de envío estimado;desde Reino Unido;
Reino Unido - Disney's: Aladdin para Nintendo GameBoy;7,95 EUR;+ 6,50 EUR de envío;desde Alemania;
Booklet manual Aladdin - Nintendo Game Boy Color;5,60 EUR;+ 5,70 EUR de envío;desde Francia;
Nintendo Gameboy Color-Disney 's Aladdin;17,50 EUR;+ 17,20 EUR de envío estimado;desde Reino Unido;
Disney Aladdin Original De Gameboy;15,20 EUR;+ 19,47 EUR de envío estimado;desde Reino Unido;
Nintendo Game Boy - Aladdin - PAL - EUR;9,99 EUR;+ 5,00 EUR de envío;desde Francia;
Aladdin - EUR -  Nintendo Gameboy Color;10,00 EUR;+ 25,00 EUR de envío;desde Países Bajos;
Disney's Aladdin Nintendo Game Boy Color Cartucho;23,35 EUR;+ 9,95 EUR de envío;desde Reino Unido;
Juego Aladdin GameBoy | Buen Estado | Sin Caja Ni Manual Incluido;9,35 EUR;+ 19,17 EUR de envío estimado;desde Reino Unido;
Notice jeu Nintendo Game Boy Disney Aladdin PAL FAH Instruction Booklet;6,99 EUR;+ 3,50 EUR de envío;desde Francia;
