Nintendo Gameboy X 6 hockey sobre hielo Sneaky Snakes Ducktales Tetris Princesa blobette;23,44 EUR;+ 34,96 EUR de envío estimado;Vendidos  6 dic 2021Artículo vendido;desde Reino Unido;
Juego de Gameboy - Sneaky Snakes - TOP Condition;199,99 EUR;+ 7,50 EUR de envío;Vendidos  20 nov 2021Artículo vendido;desde Alemania;
Sneaky Snakes | Nintendo Game Boy UKV | Sin Caja;7,70 EUR;+ 16,93 EUR de envío estimado;Vendidos  14 nov 2021Artículo vendido;desde Reino Unido;
NINTENDO GAME BOY Sneaky Snakes Caja sólo juego de computadora Vintage Raro Tradewest;29,16 EUR;+ 17,49 EUR de envío;Vendidos  13 nov 2021Artículo vendido;desde Reino Unido;
Nintendo Game Boy - Sneaky Snakes - PAL - FAH;12,99 EUR;+ 4,60 EUR de envío;Vendidos  2 nov 2021Artículo vendido;desde Francia;
Nintendo Gameboy Juego-Sneaky Snakes;9,27 EUR;+ 16,97 EUR de envío estimado;Vendidos  5 oct 2021Artículo vendido;desde Reino Unido;
Nintendo Gameboy Sneaky Snakes Juego Con Manual.;5,81 EUR;+ 35,15 EUR de envío estimado;Vendidos  26 sep 2021Artículo vendido;desde Reino Unido;
Sneaky Snakes (Nintendo Game Boy);10,58 EUR;Envío gratis;Vendidos  30 nov 2021Artículo vendido;desde Estados Unidos;
Sneaky Snakes (Nintendo Game Boy);13,23 EUR;Envío gratis;Vendidos  25 oct 2021Artículo vendido;desde Estados Unidos;
Lote de juegos de Gameboy. Super Mario Land. Sneaky Snakes. Mario Béisbol. Punk atómica.;35,30 EUR;Envío gratis;Vendidos  12 oct 2021Artículo vendido;desde Estados Unidos;
Sneaky Snakes en Gameboy juego sólo 9E;19,72 EUR;Envío gratis;Vendidos  10 oct 2021Artículo vendido;desde Estados Unidos;
1989 Sneaky Snakes Gameboy con caja, Probado Funciona Muy Bien;36,40 EUR;+ 4,19 EUR de envío;Vendidos  10 oct 2021Artículo vendido;desde Estados Unidos;
