Judge Dredd Nintendo Game Boy Color Advance Juego Solo Carro Genuino;11,56 EUR;+ 7,03 EUR de envío;desde Reino Unido;
Judge Dredd Game Boy USA ;10,00 EUR;Envío internacional gratis;desde Francia;
Judge Dredd Game Boy juego con embalaje original y guía;99,99 EUR;+ 8,00 EUR de envío;desde Alemania;
Judge Dredd Juego Boy CIB Raro #0018;70,26 EUR;+ 23,29 EUR de envío estimado;desde Reino Unido;
Nintendo Game Boy  Judge Dredd  GameBoy  Vers. EUR  voir descriptif;13,90 EUR;Envío no especificado;desde Francia;
Nintendo Game Boy  Judge Dredd  GameBoy  Vers. EUR;19,90 EUR;Envío no especificado;desde Francia;
Judge Dredd (Nintendo Game Boy, 1995);7,98 EUR;+ 3,95 EUR de envío;desde Estados Unidos;
Judge Dredd (Nintendo Game Boy GB GameBoy auténtico, 1995);8,86 EUR;+ 4,03 EUR de envío;desde Estados Unidos;
Judge Dredd (Nintendo Game Boy, 1995);12,36 EUR;Envío gratis;desde Estados Unidos;
Judge Dredd Para Nintendo Game Boy GB;8,82 EUR;+ 2,62 EUR de envío;desde Estados Unidos;
Judge Dredd (Nintendo Gameboy) Solo Carro Gran forma Juego Boy;12,40 EUR;Envío gratis;desde Estados Unidos;
Judge Dredd Para Nintendo Game Boy GB;8,86 EUR;+ 3,90 EUR de envío;desde Estados Unidos;
Judge Dredd Con Manual Nintendo Game Boy Original * más difícil encontrar *;22,14 EUR;Envío gratis;desde Estados Unidos;
Judge Dredd (Nintendo Game Boy, 1995);11,52 EUR;+ 3,99 EUR de envío;desde Estados Unidos;
Judge Dredd Nintendo Game Boy;11,94 EUR;+ 2,62 EUR de envío;desde Estados Unidos;
Judge Dredd Juego Boy Aklaim Nuevo Sellado De Fábrica;1.305,41 EUR;Envío internacional gratis;desde Japón;
Lote De Juegos Nintendo Gameboy Judge Dredd fútbol Rueda De La Fortuna;15,06 EUR;+ 2,65 EUR de envío;desde Estados Unidos;
Auténtico Judge Dredd (Nintendo GameBoy, 1995) liberado & Probado;11,52 EUR;+ 2,66 EUR de envío;desde Estados Unidos;
Cartel Promo 1995 tienda minorista Judge Dredd 22 X 28 Super Nintendo Sega Genesis;354,61 EUR;+ 8,47 EUR de envío;desde Estados Unidos;
Judge Dredd (Nintendo Gameboy Game Boy)-Cart Only ;20,79 EUR;+ 4,16 EUR de envío;desde Canadá;
Judge Dredd Para Nintendo Game Boy GB;10,63 EUR;+ 3,98 EUR de envío;desde Estados Unidos;
Judge Dredd (Nintendo Game Boy): Probado Y Envío Gratis!;14,18 EUR;Envío gratis;desde Estados Unidos;
Judge Dredd GameBoy Color-probado y funciona -! casi en perfecto estado!;14,18 EUR;+ 4,61 EUR de envío;desde Estados Unidos;
Judge Dredd Nintendo Gameboy;8,32 EUR;Envío no especificado;desde Canadá;
Judge Dredd Nintendo Game Boy Manual Only Very Good Fast Shipping;6,92 EUR;+ 7,44 EUR de envío;desde Canadá;
Judge Dredd Nintendo Game Boy FRIDGE MAGNET;1,80 EUR;+ 2,47 EUR de envío;desde España;
Gameboy Judge Dredd Solo Manual En Buen Estado;9,21 EUR;+ 2,83 EUR de envío;desde Estados Unidos;
Indy HeroClix 2003 Hell Boy Judge Dredd Witchblade Game Toy PROMO Poster VF;9,70 EUR;+ 8,32 EUR de envío;desde Canadá;
Lote de 78 Heroclix Indi Hell Boy, Judge Dredd, Shi, antiguo sistema Envío Gratis;44,33 EUR;Envío gratis;desde Estados Unidos;
Pre-owned Judge Dredd Para Nintendo Game Boy;17,72 EUR;Envío gratis;desde Estados Unidos;
Judge Dredd Sega Mega Drive juego probado completo con manual pal;23,43 EUR;+ 32,19 EUR de envío estimado;desde Reino Unido;
Judge Dredd SUPER NINTENDO SNES JUEGO EUR REINO UNIDO PAL * solo Carro *;26,94 EUR;+ 17,43 EUR de envío estimado;desde Reino Unido;
Judge Dredd SUPER NINTENDO SNES PAL JUEGO Completo con Manual Gratis P&P;93,75 EUR;+ 23,79 EUR de envío estimado;desde Reino Unido;
Judge Dredd Sega Game Gear Juego con Estuche de plástico-en muy buena condición Probado;29,29 EUR;+ 17,47 EUR de envío estimado;desde Reino Unido;
Judge Dredd SEGA GENESIS juego de NTSC Completa Con Manual Gratis P&P;23,43 EUR;+ 17,35 EUR de envío estimado;desde Reino Unido;
Jeu Pc Judge Dredd  Dredd Vs Dead Game Cd-Rom Sierra;15,00 EUR;+ 12,96 EUR de envío;desde Francia;
Judge Dredd Juego Nintendo NTSC nos SNES Super Nintendo-solo Carro-Libre P&P;29,29 EUR;+ 17,47 EUR de envío estimado;desde Reino Unido;
PlayStation 1 * Judge Dredd * ps1 OVP instrucciones FSK 18;22,95 EUR;+ 6,70 EUR de envío;desde Alemania;
Judge Dredd-Sega Game Gear Juego-PAL-solo carro;28,12 EUR;+ 17,45 EUR de envío estimado;desde Reino Unido;
Judge Dredd-Sega Mega Drive Juego (probado-Envío Rápido-Pal);14,01 EUR;+ 18,55 EUR de envío estimado;desde Reino Unido;
Judge Dredd-Dredd vs Death [video game];21,95 EUR;+ 7,50 EUR de envío;desde Alemania;
Judge Dredd de Vídeo Juego Para Sony PlayStation PS1 ~ PAL ~;11,66 EUR;+ 19,43 EUR de envío estimado;desde Reino Unido;
Judge Dredd Sony Playstation PS1 Juego UK PAL COMPLETA One en en Caja Con Manual;10,54 EUR;+ 20,83 EUR de envío estimado;desde Reino Unido;
Commodore 64/C64: Judge Dredd-juego de cinta-con instrucciones - 1986;11,72 EUR;+ 17,10 EUR de envío estimado;desde Reino Unido;
Judge Dredd: Dredd vs Death (Sony PlayStation 2, 2003) COMPLETA Juego PS2 Manual;11,71 EUR;+ 17,10 EUR de envío estimado;desde Reino Unido;
Judge Dredd PS1 Juego Nuevo Sellado Black Label Zoo Classics Sony PlayStation PAL;23,43 EUR;+ 17,35 EUR de envío estimado;desde Reino Unido;
Judge Dredd PlayStation PS1 PSX En Caja Con Manual PAL juego UK;15,93 EUR;+ 17,19 EUR de envío estimado;desde Reino Unido;
Judge Dredd Juego PS1 Playstation 1 Reino Unido PAL;11,71 EUR;+ 14,06 EUR de envío;desde Reino Unido;
Judge Dredd: DREDD VS DEATH, PAL, Completa, NINTENDO GAMECUBE Juego;16,40 EUR;+ 19,30 EUR de envío estimado;desde Reino Unido;
Judge Dredd-PS1 Playstation 1 juego Zoo Classics versión sin Manual Disco Gran;11,71 EUR;+ 17,10 EUR de envío estimado;desde Reino Unido;
Judge Dredd para SNES Super Nintendo Juego UK PAL COMPLETO EN CAJA RARO;123,06 EUR;+ 24,42 EUR de envío estimado;desde Reino Unido;
Sega Mega Drive Genesis Judge Dredd módulo Game;23,05 EUR;+ 18,00 EUR de envío;desde Alemania;
Judge Dredd Sega Megadrive Sega Genesis Juego;175,80 EUR;+ 6,67 EUR de envío;desde Reino Unido;
Judge Dredd: Dredd vs Death Video Juego (PC) [];2,05 EUR;+ 18,65 EUR de envío estimado;desde Reino Unido;
Judge Dredd SNES Super Nintendo Entertainment sistema 2000AD acción juego de plataformas;23,43 EUR;+ 11,72 EUR de envío;desde Reino Unido;
Sega Mega Drive juego Judge Dredd En Caja 1995 PAL MEGADRIVE;15,22 EUR;+ 20,92 EUR de envío estimado;desde Reino Unido;
Judge Dredd Juego De Pinball-PC CD ROM-Dinamita ** el mismo día de despacho ***;6,39 EUR;+ 16,98 EUR de envío estimado;desde Reino Unido;
Judge Dredd: Dredd vs Death ps2 Promo Juego;7,02 EUR;+ 35,12 EUR de envío estimado;desde Reino Unido;
Raras Judge Dredd PC CD retro juego por Acclaim;56,26 EUR;+ 21,46 EUR de envío estimado;desde Reino Unido;
Judge Dredd SEGA GENESIS juego de NTSC Completa Con Manual Gratis P&P;15,82 EUR;+ 21,29 EUR de envío estimado;desde Reino Unido;
