Judge Dredd Nintendo Game Boy Color Advance Juego Solo Carro Genuino;11,54 EUR;+ 7,02 EUR de envío;Vendidos  7 dic 2021Artículo vendido;desde Reino Unido;
Judge Dredd Nintendo Game Boy Juego Suelto Cartucho sólo * Probado * EUR;7,01 EUR;+ 19,19 EUR de envío estimado;Vendidos  21 nov 2021Artículo vendido;desde Reino Unido;
Nintendo Game Boy juego: Judge Dredd # buen estado;12,90 EUR;Envío no especificado;Vendidos  5 nov 2021Artículo vendido;desde Alemania;
Judge Dredd Nintendo Game Boy Juego Suelto Cartucho sólo * Probado * EUR miedo;8,18 EUR;+ 19,33 EUR de envío estimado;Vendidos  2 oct 2021Artículo vendido;desde Reino Unido;
Genuine Judge Dredd NINTENDO GAMEBOY Carro De Juego Original * * probado y funciona;15,20 EUR;+ 17,14 EUR de envío estimado;Vendidos  15 sep 2021Artículo vendido;desde Reino Unido;
Judge Dredd (Nintendo Game Boy, 1995) GB GameBoy auténtico CIB;75,32 EUR;+ 4,43 EUR de envío;Vendidos  5 dic 2021Artículo vendido;desde Estados Unidos;
Judge Dredd (Nintendo Game Boy, 1995) GB GameBoy auténtico Probado Funciona;9,89 EUR;Envío gratis;Vendidos  8 nov 2021Artículo vendido;desde Estados Unidos;
Gameboy lote-Judge Dredd, El Rey León, Ren y Stimpy: Veediots, cadete espacial;26,57 EUR;Envío gratis;