Naxat Soft Snow Bros. Jr. Nintendo Game Boy GB DMG-SJJ From Japan;263,31 EUR;Free International Shipping;from Japan;
Snow Bros. Jr. Nintendo Game Boy GB naxat SOFT;278,32 EUR;Free International Shipping;from Japan;
Snow Bros. Jr. Game Boy with Box and Manual [Gameboy Japanese version];291,58 EUR;+17,67 EUR shipping;from Japan;
Snow Bros. Jr. Japanese Nintendo Game Boy game complete ;265,07 EUR;+17,67 EUR shipping;from Germany;
Snow Bros. Jr. Cartridge Only Nintendo Game Boy GB;91,00 EUR;Free International Shipping;from Japan;
Snow Bros. Jr. NINTENDO Gameboy Cartridge ONLY [Gameboy Japanese version];74,12 EUR;+17,67 EUR shipping;from Japan;
