Jeu Gameboy - Super Kick Off - Jeu Nintendo Game Boy compatible Color / Advance;3,50 EUR;+ 5,00 EUR de envío;desde Francia;
Nintendo Gameboy Super Kick Off en Caja con Manual gwo;35,11 EUR;+ 17,60 EUR de envío estimado;desde Reino Unido;
Super Kick Off Nintendo Gameboy en caja con instrucciones Vintage juego de fútbol;19,91 EUR;+ 17,28 EUR de envío estimado;desde Reino Unido;
Super Kick Off Nintendo Gameboy GBC GBA. probado y funcionando, ver fotos! en muy buen estado PAL UKV;11,71 EUR;+ 18,89 EUR de envío estimado;desde Reino Unido;
Nintendo Gameboy En Caja Juego-Super Kick Off en muy buena condición;24,21 EUR;+ 17,37 EUR de envío estimado;desde Reino Unido;
Super Kick Off Nintendo Gameboy genuino cartucho de juego;5,85 EUR;+ 16,97 EUR de envío estimado;desde Reino Unido;
Super Kick Off | Nintendo Game Boy UKV | Sin Caja;5,85 EUR;+ 16,97 EUR de envío estimado;desde Reino Unido;
Nintendo Gameboy Juegos-Super Kick Off, fútbol & Fifa Soccer 96;16,35 EUR;+ 17,19 EUR de envío estimado;desde Reino Unido;
Nintendo Game Boy Super Kick Off Notice / Instruction Manual;4,99 EUR;+ 2,75 EUR de envío;desde Francia;
Nintendo Gameboy Juegos-Dr Mario Super Kick Off tenis Gameboy Galería;19,87 EUR;+ 17,28 EUR de envío estimado;desde Reino Unido;
Nintendo Gameboy Juegos-Dr Mario F1 Race Wave Race Super Kick Off;18,69 EUR;+ 17,25 EUR de envío estimado;desde Reino Unido;
Nintendo Game Boy - Super Kick Off - PAL - FAH;4,99 EUR;+ 4,60 EUR de envío;desde Francia;
Super Kick Off Nintendo Gameboy Juego;5,80 EUR;+ 16,97 EUR de envío estimado;desde Reino Unido;
Super Kick Off World Cup Nintendo Gameboy Cartucho sólo;9,36 EUR;+ 17,05 EUR de envío estimado;desde Reino Unido;
Nintendo GameBoy juego - Super Kick Off cartucha con manual usado;23,99 EUR;Envío internacional gratis;desde Alemania;
Notice Mode d'emploi Instruction jeu Nintendo Console game boy Super Kick Off;10,00 EUR;+ 5,00 EUR de envío;desde Francia;
Nintendo Game Boy,Super Kick Off,OVP,CIB,Collector's State;44,90 EUR;Envío no especificado;desde Alemania;
Nintendo Game Boy Juego Super Kick Off;5,85 EUR;Envío no especificado;desde Reino Unido;
Juego Super Kick Off.Nintendo Game boy.;12,00 EUR;Envío no especificado;desde España;
Nintendo Game Boy Super Kick Off  GameBoy Vers. FAH ;9,90 EUR;Envío no especificado;desde Francia;
Super Kick Off Game Boy 1996 Gameboy Imagineer DMG-KF-FAG;18,00 EUR;Envío no especificado;desde Italia;
