Gb-Tetris Plus para Nintendo GameBoy;12,95 EUR;+ 9,95 EUR de envío;Vendidos  9 dic 2021Artículo vendido;desde Alemania;
[JAP] Tetris Plus + - Nintendo Game Boy - NTSC-J;7,99 EUR;+ 3,00 EUR de envío;Vendidos  5 dic 2021Artículo vendido;desde Francia;
Tetris Plus | Game Boy DMG | solo carro;9,35 EUR;+ 17,03 EUR de envío estimado;Vendidos  1 dic 2021Artículo vendido;desde Reino Unido;
Tetris Plus Nintendo Game Boy embalaje original muy bueno probado;5,99 EUR;+ 9,99 EUR de envío;Vendidos  27 nov 2021Artículo vendido;desde Alemania;
Nintendo Gameboy juego-Tetris Plus-Embalaje original-pal-rar-Top;49,90 EUR;Envío no especificado;Vendidos  23 nov 2021Artículo vendido;desde Alemania;
Nintendo Gameboy Tetris Plus en Caja Con Manual;46,80 EUR;+ 17,82 EUR de envío estimado;Vendidos  6 nov 2021Artículo vendido;desde Reino Unido;
Lote de 2x Original GameBoy Juegos: Tetris Plus + Rayman JUEGO Boy Color * Ganga *;11,69 EUR;+ 20,00 EUR de envío estimado;Vendidos  18 oct 2021Artículo vendido;desde Reino Unido;
Tetris Plus-Game Boy-Módulo de juego-Nintendo-Game Boy-estado expositor;14,99 EUR;Envío no especificado;Vendidos  28 sep 2021Artículo vendido;desde Alemania;
Tetris Plus Juego Boy probado y funciona;11,08 EUR;Envío gratis;Vendidos  3 dic 2021Artículo vendido;desde Estados Unidos;
Tetris Plus Original Nintendo Gameboy Juego probado + trabajo & Auténtico;14,17 EUR;Envío gratis;Vendidos  1 dic 2021Artículo vendido;desde Estados Unidos;
Nintendo Game Boy Pocket Silver Sistema Portátil con Tetris Plus envío el mismo día;57,37 EUR;Envío gratis;Vendidos  24 nov 2021Artículo vendido;desde Estados Unidos;
Nintendo Game Boy Pocket Edition Rojo Probado Funcionando MGB-001 + Tetris Plus Juego;44,30 EUR;+ 5,27 EUR de envío;Vendidos  19 nov 2021Artículo vendido;desde Estados Unidos;
Tetris Y Tetris Plus Original Game Boy;19,84 EUR;Envío gratis;Vendidos  19 nov 2021Artículo vendido;desde Estados Unidos;
Nintendo Game Boy Pocket Verde Sistema Portátil con Tetris Plus juego probado/obras;53,16 EUR;Envío gratis;Vendidos  16 nov 2021Artículo vendido;desde Estados Unidos;
Tetris Plus Nintendo Game Boy Probado Funcionando & Auténtico Casi Nuevo-Mt envío rápido!;10,63 EUR;Envío gratis;Vendidos  8 nov 2021Artículo vendido;desde Estados Unidos;
Tetris Plus-auténtico-Nintendo Game Boy-Solo Manual!;3,99 EUR;Envío gratis;Vendidos  4 nov 2021Artículo vendido;desde Estados Unidos;
Tetris Plus GB (Nintendo GameBoy, 1997) Sólo Cartucho De Juego Boy;10,62 EUR;Envío gratis;Vendidos  2 nov 2021Artículo vendido;desde Estados Unidos;
Tetris Plus-Nintendo Game Boy-Jaleco - 1996-Japón Importación;9,30 EUR;Envío internacional gratis;Vendidos  30 oct 2021Artículo vendido;desde Japón;
Nintendo Game Boy Color (UVA) con Tetris Plus y Worm Luz-funciona Muy Bien;44,30 EUR;+ 8,15 EUR de envío;Vendidos  27 oct 2021Artículo vendido;desde Estados Unidos;
Tetris Plus Original Nintendo Game Boy Probado Funcionando & Auténtico!;5,32 EUR;+ 4,08 EUR de envío;Vendidos  25 oct 2021Artículo vendido;desde Estados Unidos;
Tetris Plus Juego Boy probado y funciona;13,25 EUR;Envío gratis;Vendidos  25 oct 2021Artículo vendido;desde Estados Unidos;
Tetris Plus Nintendo Game Boy;7,06 EUR;+ 2,61 EUR de envío;Vendidos  25 oct 2021Artículo vendido;desde Estados Unidos;
*** Tetris Plus Original Nintendo Game Boy Probado Funcionando & Auténtico! **;10,62 EUR;Envío gratis;Vendidos  22 oct 2021Artículo vendido;desde Estados Unidos;
Juego Tetris Plus (solo carro) Nintendo Game Boy GB R5531;13,25 EUR;Envío gratis;Vendidos  18 oct 2021Artículo vendido;desde Estados Unidos;
Tetris Tetris Plus Juego Boy Gameboy GB Nintendo Soft Japón Japón;15,95 EUR;Envío internacional gratis;Vendidos  16 oct 2021Artículo vendido;desde Japón;
Tetris Plus Game Boy PS1 Saturno 1996 ANUNCIO IMPRESO DE COLECCIÓN/arte cartel Auténtico Juego;13,28 EUR;Envío gratis;Vendidos  15 oct 2021Artículo vendido;desde Estados Unidos;
Tetris Plus Para Gameboy Con Manual;7,09 EUR;+ 3,54 EUR de envío;Vendidos  30 sep 2021Artículo vendido;desde Estados Unidos;
Gameboy Tetris Plus en Caja;23,92 EUR;Envío gratis;Vendidos  27 sep 2021Artículo vendido;desde Estados Unidos;
PLAYSTATION 1 juego ~ Tetris Plus ~ Sony PS1 PAL;7,02 EUR;+ 16,97 EUR de envío estimado;Vendidos  6 oct 2021Artículo vendido;desde Reino Unido;
