Bubble Bobble Game Boy Jap;16,00 EUR;Env칤o no especificado;Vendidos  5 dic 2021Art칤culo vendido;desde Espa침a;
Bubble Bobble Game Boy NOE ;25,00 EUR;Env칤o internacional gratis;Vendidos  5 dic 2021Art칤culo vendido;desde Francia;
Cl치sico Bubble Bobble Gameboy Color MEGA RARO CIB #0024;117,62 EUR;+ 24,40 EUR de env칤o estimado;Vendidos  20 nov 2021Art칤culo vendido;desde Reino Unido;
Console Nintendo Game Boy FAT Grise classic originale 1 jeu Bubble Bobble repro;69,99 EUR;Env칤o no especificado;Vendidos  7 nov 2021Art칤culo vendido;desde Francia;
Nintendo Gameboy Color Bubble Bobble Cl치sico en muy buena condici칩n Freepost UK;70,60 EUR;+ 23,38 EUR de env칤o estimado;Vendidos  2 nov 2021Art칤culo vendido;desde Reino Unido;
Nintendo Gameboy juego-Bubble Bobble-Embalaje original-pal-rar-Top - Taito;99,90 EUR;Env칤o no especificado;Vendidos  28 oct 2021Art칤culo vendido;desde Alemania;
Bubble Bobble Nintendo Gameboy Suelto Cartucho s칩lo nos liberaci칩n Taito;14,11 EUR;+ 20,10 EUR de env칤o estimado;Vendidos  23 oct 2021Art칤culo vendido;desde Reino Unido;
Bubble Bobble viejo & Nuevo (Game Boy Advance, GBA) solo Carro-Original;15,29 EUR;+ 19,59 EUR de env칤o estimado;Vendidos  22 oct 2021Art칤culo vendido;desde Reino Unido;
Bubble Bobble Nintendo Gameboy Cartucho De Juego-DMG-B2-UKV;11,77 EUR;+ 17,17 EUR de env칤o estimado;Vendidos  19 oct 2021Art칤culo vendido;desde Reino Unido;
Bubble Bobble ESP Nintendo Game Boy / Cartucho + manual ORIGINALES;50,00 EUR;Env칤o no especificado;Vendidos  19 oct 2021Art칤culo vendido;desde Espa침a;
Bubble Bobble cl치sico-Gameboy Colour;47,07 EUR;+ 22,04 EUR de env칤o estimado;Vendidos  13 oct 2021Art칤culo vendido;desde Reino Unido;
Bubble Bobble VIEJO & NUEVO-Gameboy Advance 游눮% original juego probado;14,12 EUR;+ 17,22 EUR de env칤o estimado;Vendidos  22 sep 2021Art칤culo vendido;desde Reino Unido;
Bubble Bobble-NINTENDO Game Boy Usa NSTC-Gameboy-raro usado genuino;15,29 EUR;+11,77 EUR de env칤o;Vendidos  14 sep 2021Art칤culo vendido;desde Reino Unido;
