Kwirk for Nintendo Game Boy;12,95 EUR;+ 2,95 EUR de envío;Vendidos  9 dic 2021Artículo vendido;desde Países Bajos;
Kwirk para Gameboy y color y Advance;8,75 EUR;+ 5,00 EUR de envío;Vendidos  2 dic 2021Artículo vendido;desde Alemania;
Kwirk Nintendo Gameboy Game Boy Classic pal noe cib OVP;52,00 EUR;+ 7,35 EUR de envío;Vendidos  28 nov 2021Artículo vendido;desde Alemania;
Kwirk-Game Boy-Módulo de juego-Nintendo-Game Boy-muy buen estado;10,99 EUR;Envío no especificado;Vendidos  26 nov 2021Artículo vendido;desde Alemania;
Kwirk/GameBoy/Nintendo;6,50 EUR;Envío no especificado;Vendidos  21 nov 2021Artículo vendido;desde Alemania;
Kwirk Game Boy;15,50 EUR;+ 5,50 EUR de envío;Vendidos  20 nov 2021Artículo vendido;desde Austria;
Kwirk Gameboy OVP;54,00 EUR;Envío no especificado;Vendidos  3 nov 2021Artículo vendido;desde Alemania;
Kwirk Nintendo Game Boy envoi rapide et suivi;15,49 EUR;Envío no especificado;Vendidos  2 nov 2021Artículo vendido;desde Francia;
Kwirk Gioco per Nintendo Game Boy Classic funzionante cartuccia videogioco gbc;9,99 EUR;+ 12,00 EUR de envío;Vendidos  31 oct 2021Artículo vendido;desde Italia;
Kwirk-Nintendo Gameboy Classic juego clásico módulo;5,00 EUR;+ 7,00 EUR de envío;Vendidos  31 oct 2021Artículo vendido;desde Alemania;
Kwirk para Nintendo GameBoy;7,99 EUR;Envío no especificado;Vendidos  19 oct 2021Artículo vendido;desde Alemania;
Kwirk ESP Nintendo Game Boy / Cartucho + manual ORIGINALES;25,00 EUR;Envío no especificado;Vendidos  19 oct 2021Artículo vendido;desde España;
Kwirk Nintendo Gameboy;8,99 EUR;+ 4,95 EUR de envío;Vendidos  18 oct 2021Artículo vendido;desde Austria;
Kwirk-Nintendo Game Boy juego;9,99 EUR;Envío no especificado;Vendidos  8 oct 2021Artículo vendido;desde Alemania;
Notice - Instruction Booklet Kwirk Game Boy FAH ;7,00 EUR;Envío internacional gratis;Vendidos  4 oct 2021Artículo vendido;desde Francia;
