Nuevo anuncioJeu video Nintendo Game boy Advance Mario Power Tennis + notice;14,90 EUR;+ 9,70 EUR de envío;desde Francia;
Lot cartouches Game Boy Japonaises Pokémon Mario Tennis Kirby etc;20,00 EUR;+ 6,00 EUR de envío;desde Francia;
Mario Power Tennis GBA Game Boy Advance juego nuevo New Sealed;159,99 EUR;+ 8,00 EUR de envío;desde Alemania;
Nintendo Game Boy Color juego Mario Tennis con embalaje original y guía EUR;64,90 EUR;+ 8,99 EUR de envío;desde Alemania;
Mario Tennis Nintendo Game Boy Color;33,49 EUR;+ 17,61 EUR de envío estimado;desde Reino Unido;
NINTENDO GAME BOY ADVANCE - Mario Tennis Advance - AGB-P-BTMJ(JPN) - Japon;29,93 EUR;+ 19,90 EUR de envío;desde España;
Mario Tennis Nintendo Game Boy Color Version EUR en Boite;39,99 EUR;+ 12,95 EUR de envío;desde Francia;
Snoopy Tennis (CGB-BS9P-FAH) pour Game Boy - Color - Advance - DS -DS LITE;8,49 EUR;+ 16,00 EUR de envío;desde Francia;
✨ Tennis 1st Version Game Boy 1989 Nintendo Japan Complet Boxed GB DMG-TNA ✨;24,90 EUR;+ 28,10 EUR de envío;desde Francia;
Nintendo Game Boy Tennis EUR Très Bon état;9,90 EUR;+ 14,98 EUR de envío;desde Francia;
Mario Power Tennis - PAL - Game Boy Advance / GBA;45,00 EUR;+ 16,00 EUR de envío;desde España;
[JAP] Tennis - Jeu Nintendo Game boy - NTSC-J;4,99 EUR;+ 3,00 EUR de envío;desde Francia;
Tennis no Oji-Sama 2003: Cool Blue Game Boy Advance GBA Version NTSC-J (Japon);4,99 EUR;+ 3,00 EUR de envío;desde Francia;
Nintendo Game Boy Color GBC All Star Tennis 2000 PAL Completo en Caja en muy buena condición;41,01 EUR;+ 14,10 EUR de envío;desde Reino Unido;
Tennis Masters Series (Nintendo Game Boy Advance GBA 2003) ~ ~ En Caja;21,09 EUR;+ 17,34 EUR de envío estimado;desde Reino Unido;
✨ Mario Tennis GB  New Game Boy Color 2001 Nintendo Boxed CGB-BM8J-JPN ✨;23,90 EUR;+ 28,10 EUR de envío;desde Francia;
Jeu Tennis pour Nintendo Game Boy FAH Cartouche Seule Loose  - Floto Games;6,90 EUR;+ 5,00 EUR de envío;desde Francia;
Tennis Jeu Nintendo Game Boy GB Version PAL NOE;6,99 EUR;+ 3,00 EUR de envío;desde Francia;
Nintendo Game Boy Tennis UKV Très Bon état;4,90 EUR;+ 11,98 EUR de envío;desde Francia;
Nuevo anuncioMario Power Tennis En Caja-NINTENDO GAMEBOY ADVANCE GBA;23,50 EUR;+ 17,39 EUR de envío estimado;desde Reino Unido;
