Lot cartouches Game Boy Japonaises Pokémon Mario Tennis Kirby etc;20,00 EUR;+ 6,00 EUR de envío;desde Francia;
Mario Power Tennis GBA Game Boy Advance juego nuevo New Sealed;149,99 EUR;+ 8,00 EUR de envío;desde Alemania;
Jimmy Connors Tennis Nintendo Game Boy Ubisoft Gameboy Videogioco ;12,00 EUR;Envío no especificado;desde España;
Mario Tennis Nintendo Game Boy Color Version EUR en Boite;39,99 EUR;+ 12,95 EUR de envío;desde Francia;
Mario Power Tennis - PAL - Game Boy Advance / GBA;45,00 EUR;+ 16,00 EUR de envío;desde España;
✨ Tennis 1st Version Game Boy 1989 Nintendo Japan Complet Boxed GB DMG-TNA ✨;24,90 EUR;+ 28,10 EUR de envío;desde Francia;
Nintendo Game Boy Tennis EUR Très Bon état;9,90 EUR;+ 14,98 EUR de envío;desde Francia;
NINTENDO GAME BOY ADVANCE - Mario Tennis Advance - AGB-P-BTMJ(JPN) - Japon;39,90 EUR;+ 19,90 EUR de envío;desde España;
Nintendo Game Boy Color juego Mario Tennis con embalaje original y guía EUR;64,90 EUR;+ 8,99 EUR de envío;desde Alemania;
Jimmy Connors Tennis Nintendo Game Boy Ubisoft Gameboy Videogioco Sport 90s raro;62,00 EUR;+ 15,00 EUR de envío;desde Italia;
✨ Mario Tennis GB  New Game Boy Color 2001 Nintendo Boxed CGB-BM8J-JPN ✨;23,90 EUR;+ 28,10 EUR de envío;desde Francia;
Jeu Tennis pour Nintendo Game Boy FAH Cartouche Seule Loose  - Floto Games;6,90 EUR;+ 5,00 EUR de envío;desde Francia;
Nintendo Game Boy Tennis UKV Très Bon état;4,90 EUR;+ 11,98 EUR de envío;desde Francia;
Tennis Masters Series (Nintendo Game Boy Advance GBA 2003) ~ ~ En Caja;21,01 EUR;+ 17,27 EUR de envío estimado;desde Reino Unido;
[JAP] Tennis - Jeu Nintendo Game boy - NTSC-J;4,99 EUR;+ 3,00 EUR de envío;desde Francia;
Snoopy Tennis - Nintendo Game Boy Color GBC - PAL EUR - Avec Notice;7,90 EUR;+ 5,80 EUR de envío;desde Francia;
Nintendo Game Boy Color GBC All Star Tennis 2000 PAL Completo en Caja en muy buena condición;32,67 EUR;