Mario Tennis | Nintendo Gameboy Color | módulo | ** como nuevo! **;8,94 EUR;Envío no especificado;Vendidos  21 dic 2021Artículo vendido;desde Alemania;
GameBoy Color Mario Tennis GB CARTUCHO sólo Japón-Probado - 🇬 🇧 vendedor;7,81 EUR;+ 5,86 EUR de envío;Vendidos  21 dic 2021Artículo vendido;desde Reino Unido;
Mario Tennis En Caja-Nintendo Gameboy Color;37,46 EUR;+ 17,64 EUR de envío estimado;Vendidos  18 dic 2021Artículo vendido;desde Reino Unido;
Mario Tennis-Gameboy Advance GBA (japonés);12,82 EUR;Envío no especificado;Vendidos  15 dic 2021Artículo vendido;desde Reino Unido;
Jeu Nintendo Game Boy Color - Snoopy Tennis  - FAH - Loose;6,90 EUR;+ 6,70 EUR de envío;Vendidos  13 dic 2021Artículo vendido;desde Francia;
De Droopy Tennis Open + instrucciones (muy buenas) para fines micro Gameboy Advance SP;5,39 EUR;Envío no especificado;Vendidos  6 dic 2021Artículo vendido;desde Alemania;
Mario Tennis Nintendo Game Boy Color;33,37 EUR;+ 17,55 EUR de envío estimado;Vendidos  6 dic 2021Artículo vendido;desde Reino Unido;
•Mario Tennis • Neuf•Nintendo Game Boy Advance •Cartmob  GBA SP•Or/gold;9,90 EUR;+ 5,50 EUR de envío;Vendidos  5 dic 2021Artículo vendido;desde Francia;
Genuine Mario Tennis GB de vídeo juego para Nintendo Game Boy Color japonés;5,84 EUR;+ 16,96 EUR de envío estimado;Vendidos  25 nov 2021Artículo vendido;desde Reino Unido;
Lotto Tetris + Tennis PAL OTTIME CONDIZIONI Nintendo Game Boy gb gbc gba gbasp ;16,00 EUR;Envío no especificado;Vendidos  24 nov 2021Artículo vendido;desde Italia;
