Nintendo Game Boy Classic juego Last Action Hero módulo Noe;39,90 EUR;+ 8,99 EUR de envío;desde Alemania;
Nintendo Game Boy Last Action Hero  GameBoy  Vers. FAH;37,90 EUR;Envío no especificado;desde Francia;
Nintendo-Game Boy-VGA-Last Action Hero-nuevo sellado & - 85+ Gold nm +;2.999,99 EUR;+ 75,00 EUR de envío;desde Alemania;
Gameboy Color juego OVP pokemon, Zelda; mario, Last Action Hero, Kirby;70,00 EUR;+ 15,00 EUR de envío;desde Alemania;
Last Action Hero - Nintendo GameBoy - NGB;33,96 EUR;+ 19,95 EUR de envío;desde Países Bajos;
Last Action Hero (losse cassette) nintendo gameboy gb;24,95 EUR;+ 20,00 EUR de envío;desde Países Bajos;
Last Action Hero NINTENDO Gameboy Pal RARE;55,68 EUR;+ 18,98 EUR de envío;desde Australia;
Last Action Hero - Super Nintendo - SNES - FAH;24,99 EUR;+ 3,88 EUR de envío;desde Francia;
