** Elevator Action ** GBC Game Boy Color-Nintendo-Arcade hit-cib pal OVP;139,00 EUR;+ 25,00 EUR de envío;desde Alemania;
Elevator Action Old&New Game Boy Advance GBA Japan Ver. Arcade Taito Nintendo (D;1.082,99 EUR;+ 29,94 EUR de envío;desde Francia;
Nintendo Game Boy Classic juego Elevator Action con embalaje original y guía EE. UU.;199,90 EUR;+ 36,99 EUR de envío;desde Alemania;
Nintendo Gameboy juego-Elevator Action-Embalaje original-Top-Pal;259,90 EUR;Envío no especificado;desde Alemania;
Elevator Action - NOE - Nintendo Gameboy;109,00 EUR;+ 25,00 EUR de envío;desde Países Bajos;
Elevator Action old & New GBA Nintendo Game Boy Advance jp New!!!;1.450,00 EUR;+ 33,00 EUR de envío;desde Suiza;
GB-Elevator Action para Nintendo GameBoy;59,95 EUR;+ 6,50 EUR de envío;desde Alemania;
Elevator Action - Nintendo GameBoy Color - GBC;59,46 EUR;+ 19,95 EUR de envío;desde Países Bajos;
Elevator Action-Nintendo Game Boy Color juego;12,99 EUR;Envío no especificado;desde Alemania;
Elevator Action Nintendo Game Boy Japan Jap;12,00 EUR;Envío no especificado;desde España;
Elevator Action cómo jugar (Nintendo Game Boy Color, 2001);5,00 EUR;Envío no especificado;desde Alemania;
Elevator Action originale Per Nintendo game Boy 1989 SOLO CARTUCCIA;24,90 EUR;Envío no especificado;desde Italia;
Elevator Action cómo jugar cuadernillo Gameboy classic game boy buen estado;5,99 EUR;Envío no especificado;desde Alemania;
Elevator Action Gameboy Classic cómo jugar instruction cuadernillo Noe;6,90 EUR;Envío no especificado;desde Alemania;
