Tamagotchi osutchi a Mesutchi Nintendo Gameboy DMG-AOMJ-JPN 🇬 🇧 vendedor-Probado;6,67 EUR;+ 7,06 EUR de envío;Vendidos  4 dic 2021Artículo vendido;desde Reino Unido;
Tamagotchi osutchi a Mesutchi En Caja Nintendo Gameboy Juego Japonés Original;41,18 EUR;+ 93,57 EUR de envío estimado;Vendidos  30 nov 2021Artículo vendido;desde Reino Unido;
Tamagotchi 2 video juego para Nintendo Game Boy NTSC-J Japonés Probado;5,87 EUR;+ 17,04 EUR de envío estimado;Vendidos  17 nov 2021Artículo vendido;desde Reino Unido;
Tamagotchi Video Juego Para Nintendo Game Boy NTSC-J Japonés Probado;5,87 EUR;+ 17,04 EUR de envío estimado;Vendidos  17 nov 2021Artículo vendido;desde Reino Unido;
Tamagotchi original: osutchi & mesutchi Juego Para Nintendo Game Boy Color japonés;5,87 EUR;+ 17,04 EUR de envío estimado;Vendidos  4 nov 2021Artículo vendido;desde Reino Unido;
Lot 3 cartouches Game Boy Japonaises Trilogie Tamagotchi;9,00 EUR;+ 6,00 EUR de envío;Vendidos  1 nov 2021Artículo vendido;desde Francia;
Tamagotchi Nintendo Game Boy DMG-ATAP-NOE Made in Japan 1997;12,68 EUR;+ 6,00 EUR de envío;Vendidos  29 oct 2021Artículo vendido;desde Italia;
🎮 Tamagotchi-GameBoy módulo-DMG-atap-noe ☑ Game Boy;5,49 EUR;Envío no especificado;Vendidos  11 oct 2021Artículo vendido;desde Alemania;
Tamagotchi + Tamagotchi 2 + Tamagotchi 3 Import Nintendo Gameboy Game Boy Japan;10,00 EUR;+ 2,80 EUR de envío;Vendidos  8 oct 2021Artículo vendido;desde Francia;
GAMEBOY Tamagotchi En Caja Con Manual Gwo japonés;25,88 EUR;+ 17,48 EUR de envío estimado;Vendidos  6 oct 2021Artículo vendido;desde Reino Unido;
Tamagotchi GB Nintendo Gameboy Juego Original;17,65 EUR;+ 20,18 EUR de envío estimado;Vendidos  19 sep 2021Artículo vendido;desde Reino Unido;
Tamagotchi para Gameboy y color y Advance;9,75 EUR;+ 7,00 EUR de envío;Vendidos  18 sep 2021Artículo vendido;desde Alemania;
Nintendo Game Boy Classic Tamagotchi con embalaje original y guía Noe;34,90 EUR;+ 8,99 EUR de envío;Vendidos  10 sep 2021Artículo vendido;desde Alemania;
Tamagotchi GAMEBOY Carrito Manual #0091;11,71 EUR;+ 20,35 EUR de envío estimado;Vendidos  9 sep 2021Artículo vendido;desde Reino Unido;
Tamagotchi Nintendo Game Boy Original * Auténtico y ahorra *;17,76 EUR;Envío gratis;Vendidos  8 dic 2021Artículo vendido;desde Estados Unidos;
Game de Hakken!! Tamagotchi 2 JAPAN GameBoy;1,84 EUR;+ 5,88 EUR de envío;Vendidos  7 dic 2021Artículo vendido;desde Canadá;
Gameboy Pocket Pink Tamagotchi Cartucho en Caja Consola Raro casi nuevo en caja Vendedor de Estados Unidos;311,19 EUR;+ 9,47 EUR de envío;Vendidos  6 dic 2021Artículo vendido;desde Estados Unidos;
Nintendo Game Boy Pocket Rosa Consola Tamagotchi Limited Edición juego japonés;177,82 EUR;+ 17,78 EUR de envío;Vendidos  5 dic 2021Artículo vendido;desde Japón;
Tamagotchi 2 Nintendo Game Boy GB auténtico probado funciona limpio;6,66 EUR;Envío gratis;Vendidos  5 dic 2021Artículo vendido;desde Estados Unidos;
Tamagotchi (Nintendo Game Boy, 1997). probado y funcionando.;9,07 EUR;+ 4,89 EUR de envío;Vendidos  5 dic 2021Artículo vendido;desde Estados Unidos;
Tamagotchi Edición Limitada Versión Rosa -- GameBoy GB Japón jp Cartucho;10,66 EUR;+ 7,11 EUR de envío;Vendidos  1 dic 2021Artículo vendido;desde Japón;
Juego de Hakken!!! Tamagotchi 2 Nintendo Game Boy Japón importación Vendedor de Estados Unidos;17,78 EUR;Envío gratis;Vendidos  1 dic 2021Artículo vendido;desde Estados Unidos;
Game Boy Juego de Hakken!!! Tamagotchi En Caja Japón juego GB Vendedor de Estados Unidos;12,45 EUR;+ 7,56 EUR de envío;Vendidos  1 dic 2021Artículo vendido;desde Estados Unidos;
Game Boy Juego de Hakken!!! Tamagotchi 2 Gb En Caja Japón Juego Vendedor de Estados Unidos;13,34 EUR;+ 7,56 EUR de envío;Vendidos  1 dic 2021Artículo vendido;desde Estados Unidos;
Tamagotchi Nintendo Gameboy auténtico de juego probadas;9,07 EUR;+ 4,09 EUR de envío;Vendidos  1 dic 2021Artículo vendido;desde Estados Unidos;
Tamagotchi Game Boy Japan Bandai;10,66 EUR;+ 12,45 EUR de envío;Vendidos  29 nov 2021Artículo vendido;desde Japón;
Nintendo Gameboy Tamagotchi 2 GB GameBoy Completo en Caja Con Manual;10,67 EUR;+ 4,43 EUR de envío;Vendidos  29 nov 2021Artículo vendido;desde Estados Unidos;
Nintendo Gameboy Tamagotchi Gb Game Boy Bundle Lote - 1 & 2;10,66 EUR;Envío gratis;Vendidos  28 nov 2021Artículo vendido;desde Estados Unidos;
Tamagotchi (Nintendo Game Boy, 1997) cartucho sólo probado Envío Gratis;13,29 EUR;Envío gratis;Vendidos  28 nov 2021Artículo vendido;desde Estados Unidos;
Tamagotchi Nintendo Game Boy Video Juego Carro;10,19 EUR;Envío gratis;Vendidos  27 nov 2021Artículo vendido;desde Estados Unidos;
Tamagotchi 2 Nintendo Game Boy Color Japón importación * Vendedor de EE. UU. *;8,86 EUR;Envío gratis;Vendidos  27 nov 2021Artículo vendido;desde Estados Unidos;
Tamagotchi Nintendo Game Boy Folleto De Instrucciones Manual Solamente;4,44 EUR;Envío gratis;Vendidos  27 nov 2021Artículo vendido;desde Estados Unidos;
Tamagotchi Edición Limitada Versión Rosa -- GameBoy GB Japón jp Cartucho;10,66 EUR;+ 7,11 EUR de envío;Vendidos  27 nov 2021Artículo vendido;desde Japón;
Tamagotchi 1 & 2-Japón (Nintendo Game Boy) Ahorra;13,33 EUR;Envío gratis;Vendidos  26 nov 2021Artículo vendido;desde Estados Unidos;
Juego de Hakken!!! Tamagotchi 1 2 Paquete de 3-Nintendo Game Boy-Japón Importación;28,45 EUR;Envío internacional gratis;Vendidos  26 nov 2021Artículo vendido;desde Japón;
Tamagotchi 1 & 2 Juego Boy Lote 2 Juegos Japón importación * Vendedor de EE. UU. *;17,76 EUR;Envío gratis;Vendidos  26 nov 2021Artículo vendido;desde Estados Unidos;
Tamagotchi Nintendo Game Boy limpiado & probado Batería ahorra Auténtico;17,77 EUR;Envío gratis;Vendidos  24 nov 2021Artículo vendido;desde Estados Unidos;
Tamagotchi 2 En Caja, Manual Nintendo GameBoy GB Japón importación de juego probadas;17,77 EUR;Envío internacional gratis;Vendidos  24 nov 2021Artículo vendido;desde Japón;
Juego de Hakken!!! Tamagotchi Japón versión Game Boy GB Nintendo;7,11 EUR;+ 10,67 EUR de envío;Vendidos  23 nov 2021Artículo vendido;desde Japón;
Tamagotchi 1+2 en Caja Lote Japón Ver Nintendo GameBoy;16,00 EUR;+ 3,55 EUR de envío;Vendidos  19 nov 2021Artículo vendido;desde Estados Unidos;
Tamagotchi (Nintendo Game Boy, 1997);20,87 EUR;+ 8,43 EUR de envío;Vendidos  18 nov 2021Artículo vendido;desde Canadá;
Japanese Original Equipment Manufacturer Tamagotchi 3 Nintendo GameBoy * Vendedor de EE. UU. * Versión Azul Auténtico;16,00 EUR;+ 4,00 EUR de envío;Vendidos  17 nov 2021Artículo vendido;desde Estados Unidos;
Tamagotchi PINK Version + Tamagotchi 2 Nintendo Game Boy Cartridges Tested Japan;12,00 EUR;+ 7,00 EUR de envío;Vendidos  16 nov 2021Artículo vendido;desde Grecia;
Tamagotchi for Nintendo GAMEBOY [DMG-ATAJ-JPN] (Japanese Version);8,70 EUR;+ 12,65 EUR de envío;Vendidos  15 nov 2021Artículo vendido;desde Australia;
Nintendo Gameboy GB-Tamagotchi-Nueva Estuche Sellado de fábrica fresca;155,55 EUR;Envío gratis;Vendidos  14 nov 2021Artículo vendido;desde Estados Unidos;
Juego de Hakken Tamagotchi Osucchi a Mesucchi Game Boy Japón en Caja Vendedor de Estados Unidos;31,12 EUR;Envío gratis;Vendidos  14 nov 2021Artículo vendido;desde Estados Unidos;
Tamagotchi Nintendo Gameboy Juego;17,77 EUR;Envío gratis;Vendidos  14 nov 2021Artículo vendido;desde Estados Unidos;
Gameboy Pocket Pink Tamagotchi Consola Japón * RAROS COLECCIONISTAS artículo *;253,40 EUR;Envío internacional gratis;Vendidos  13 nov 2021Artículo vendido;desde Japón;
Tamagotchi Nintendo Gameboy auténtico Cartucho limpiado & probada! envío rápido!;14,13 EUR;Envío gratis;Vendidos  12 nov 2021Artículo vendido;desde Estados Unidos;
Tamagotchi (Nintendo Game Boy, 1997) -Cart Only;21,08 EUR;+ 4,22 EUR de envío;Vendidos  10 nov 2021Artículo vendido;desde Canadá;
Tamagotchi (Nintendo Game Boy, 1997) - Caja y juego solamente-Probado;17,78 EUR;+ 3,73 EUR de envío;Vendidos  9 nov 2021Artículo vendido;desde Estados Unidos;
Tamagotchi (Nintendo Game Boy probado y auténtico, 1997);12,40 EUR;Envío gratis;Vendidos  8 nov 2021Artículo vendido;desde Estados Unidos;
Nintendo Gameboy Tamagotchi Gb Game Boy Bundle Lote - 1 & 2;10,66 EUR;Envío gratis;Vendidos  5 nov 2021Artículo vendido;desde Estados Unidos;
