Nintendo Gameboy Original Casino FunPak Juego en Caja + Folletos;15,10 EUR;+ 17,49 EUR de envío;desde Reino Unido;
Casino FunPak Gameboy Cartucho sólo;6,94 EUR;+ 16,91 EUR de envío estimado;desde Reino Unido;
Casino FunPak-Nintendo Game Boy ✭ ✭ probado Manual, Caja ✭ (Gameboy no incl);11,46 EUR;+ 4,41 EUR de envío;desde Estados Unidos;
Casino FunPak completo juego Boy Cartucho en Caja Nintendo Original vg1;17,64 EUR;+ 9,40 EUR de envío;desde Estados Unidos;
Casino FunPak (Nintendo Game Boy) Con Estuche probado y funciona;8,11 EUR;Envío gratis;desde Estados Unidos;
Casino FunPak (Nintendo Game Boy, 1993) completo juego de Cartucho en Caja GameBoy buena forma;65,19 EUR;desde Estados Unidos;
Casino FunPak, Nintendo Game Boy, carro de juego solamente, Probado;4,40 EUR;+ 3,53 EUR de envío;desde Estados Unidos;
Casino FunPak (Nintendo Game Boy);7,49 EUR;desde Estados Unidos;
Casino FunPak Nintendo Game Boy;3,50 EUR;+ 2,60 EUR de envío;desde Estados Unidos;
Casino FunPak (Nintendo Game Boy, 1993) Con Caja Y Manual;15,87 EUR;Envío gratis;desde Estados Unidos;
Casino FunPak (Nintendo Game Boy) Completo Con Caja Manual Juego Funciona! diversión Pack;15,87 EUR;Envío gratis;desde Estados Unidos;
Casino FunPak-Nintendo Game Boy-limpiado-Probado-auténtica;8,74 EUR;+ 4,19 EUR de envío;desde Estados Unidos;
Casino FunPak (Nintendo Game Boy Fun Pak Pack) Nuevo, Sellado-VGA clasificados 85 Casi Nuevo +;308,80 EUR;Envío gratis;desde Estados Unidos;
Casino FunPak (Nintendo Game Boy) Sólo Cartucho Y Manual;8,82 EUR;+ 3,52 EUR de envío;desde Estados Unidos;
Casino FunPak (Nintendo Game Boy) (sellado de fábrica);57,35 EUR;+ 9,27 EUR de envío;desde Estados Unidos;
Casino FunPak (Nintendo Game Boy) Authentic/Cleaned/Tested - Card Game Original;2,77 EUR;+ 10,43 EUR de envío;desde Canadá;
Casino FunPak Gameboy * AUTÉNTICO *;8,82 EUR;+ 3,53 EUR de envío;desde Estados Unidos;
Casino FunPak-Game Boy auténtico manual;2,90 EUR;+ 2,60 EUR de envío;desde Estados Unidos;
Casino FunPak (Nintendo Game Boy) Authentic/Cleaned/Tested - Card Game Original;5,55 EUR;+ 10,43 EUR de envío;desde Canadá;
Casino FunPak (Nintendo Game Boy) Sellado De Fábrica;70,59 EUR;+ 4,63 EUR de envío;desde Estados Unidos;
Casino FunPak Nintendo Game Boy Manual Only Very Good Fast Shipping;3,48 EUR;+ 7,55 EUR de envío;desde Canadá;
Casino FunPak Fun Pak Paquete Original Nintendo Gameboy solo manual de instrucciones;2,37 EUR;+ 1,76 EUR de envío;desde Estados Unidos;
Casino FunPak-Gameboy-Solo Manual De Instrucciones;1,76 EUR;+ 3,97 EUR de envío;desde Estados Unidos;
