Monopoly para Nintendo GameBoy;8,99 EUR;Envío no especificado;Vendidos  15 dic 2021Artículo vendido;desde Alemania;
Nintendo Gameboy-Monopoly-Top-Embalaje original-pal alemán;39,90 EUR;Envío no especificado;Vendidos  13 dic 2021Artículo vendido;desde Alemania;
Monopoly - Gameboy - Nintendo - Notice EUR;4,49 EUR;+ 3,88 EUR de envío;Vendidos  31 oct 2021Artículo vendido;desde Francia;
Paquete De Juego Monopoly + Golf Gameboy solamente carros PAL;12,87 EUR;+ 7,61 EUR de envío;Vendidos  26 oct 2021Artículo vendido;desde Reino Unido;
Nintendo Game Boy Advance  Monopoly GBA Vers. EUR;7,90 EUR;Envío no especificado;Vendidos  25 oct 2021Artículo vendido;desde Francia;
Monopoly Nintendo Game Boy Cartridge;9,41 EUR;+ 12,59 EUR de envío;Vendidos  11 dic 2021Artículo vendido;desde Australia;
Nintendo Gameboy Color Video Juego Monopoly;6,88 EUR;+ 4,07 EUR de envío;Vendidos  7 dic 2021Artículo vendido;desde Estados Unidos;
Nintendo (Gameboy, 1999) Gameboy Color Video Juego Monopoly;4,43 EUR;+ 3,54 EUR de envío;Vendidos  3 dic 2021Artículo vendido;desde Estados Unidos;
Green Nintendo Game Boy Pocket Con Pac - & Monopoly-Funciona muy bien Man -! envío rápido!;34,55 EUR;+ 4,87 EUR de envío;Vendidos  16 nov 2021Artículo vendido;desde Estados Unidos;
Monopoly Game for Nintendo SWITCH Brand New;1,85 EUR;+ 1,00 EUR de envío;Vendidos  11 nov 2021Artículo vendido;desde Taiwán;
Juego Monopoly, Nintendo Switch-cartucho de juego solamente;12,30 EUR;+ 11,71 EUR de envío;Vendidos  5 dic 2021Artículo vendido;desde Reino Unido;
