Nintendo Game Boy * Batman Forever * OVP CiB Instrucciones A3BE-EE. UU.;99,95 EUR;+ 6,70 EUR de envío;desde Alemania;
Batman Forever Jeu Nintendo Game Boy Occasion Version PAL;11,99 EUR;+ 3,00 EUR de envío;desde Francia;
Nintendo Game Boy Game-The Real Game begins Batman Forever-Embalaje original-pal-rar;279,90 EUR;Envío no especificado;desde Alemania;
GB: Batman Forever   GAME BOY   MOLTO BELLO!! TOP!!!;13,99 EUR;+ 8,50 EUR de envío;desde Italia;
Gb-Batman Forever: the Real Game begins para Nintendo GameBoy;49,95 EUR;+ 9,95 EUR de envío;desde Alemania;
Nintendo Game Boy Batman Forever USA Version;9,90 EUR;+ 9,90 EUR de envío;desde Italia;
Batman Forever Game Boy Spiel #5275;23,99 EUR;+ 16,09 EUR de envío;desde Suiza;
Nintendo Game Boy - Batman Forever - PAL - EUR;12,99 EUR;+ 5,00 EUR de envío;desde Francia;
1995 Batman Forever Snes Sega Genesis Game Boy Vintage Promo Poster Enmarcado/ad;32,80 EUR;+ 15,22 EUR de envío;desde Alemania;
Batman Forever Game Boy Folleto De Instrucciones Manual;8,20 EUR;+ 17,03 EUR de envío estimado;desde Reino Unido;
1995 Batman Forever Sega Genesis Game Boy SNES Vintage Promo Poster / Ad Framed;38,04 EUR;+ 15,24 EUR de envío;desde Alemania;
Gameboy Batman Forever Solo Manual;9,36 EUR;+ 17,05 EUR de envío estimado;desde Reino Unido;
Batman Forever Nintendo Gameboy Classic;14,95 EUR;+ 2,95 EUR de envío;desde Países Bajos;
Batman Forever-Game Boy-Módulo de juego-Nintendo-Game Boy-Pal;13,99 EUR;Envío no especificado;desde Alemania;
Batman Forever para Nintendo GameBoy;19,99 EUR;Envío no especificado;desde Alemania;
Nintendo Gameboy -- Batman Forever -- DMG-A3BP-EUR;14,99 EUR;Envío no especificado;desde Países Bajos;
Juego Game Boy Advance 108 En 1 - Batman Forever+Batman The Animated Series+The ;6,00 EUR;Envío no especificado;desde España;
