Urban Strike Nintendo Game Boy probado y funciona solo carro;10,58 EUR;Envío gratis;Vendidos  25 nov 2021Artículo vendido;desde Estados Unidos;
Urban Strike la secuela huelga de la selva (Nintendo Gameboy) Juego Boy;6,18 EUR;Envío gratis;Vendidos  14 nov 2021Artículo vendido;desde Estados Unidos;
Urban Strike Nintendo Game Boy Jungle Strike Secuela * más difícil encontrar * Auténtico;7,94 EUR;+ 3,02 EUR de envío;Vendidos  14 oct 2021Artículo vendido;desde Estados Unidos;
Urban Strike Nintendo Game Boy probado-Cartucho únicamente;7,93 EUR;+ 4,40 EUR de envío;Vendidos  13 sep 2021Artículo vendido;desde Estados Unidos;
Urban Strike En Caja Con Manual-Super Nintendo SNES juego PAL;40,82 EUR;+ 21,73 EUR de envío estimado;Vendidos  24 sep 2021Artículo vendido;desde Reino Unido;
Urban Strike-SNES-Super Nintendo Game-módulo PAL;10,00 EUR;+ 8,00 EUR de envío;Vendidos  17 sep 2021Artículo vendido;desde Alemania;
Urban Strike Cartucho de juego para SEGA Mega Drive 1994;6,99 EUR;+ 20,41 EUR de envío estimado;Vendidos  26 nov 2021Artículo vendido;desde Reino Unido;
Urban Strike Juego Super Nintendo SNES;11,65 EUR;+ 17,02 EUR de envío estimado;Vendidos  27 oct 2021Artículo vendido;desde Reino Unido;
