Elite Soccer | Nintendo Game Boy Usa | Sin Caja;7,58 EUR;+ 16,92 EUR de envío estimado;Vendidos  25 oct 2021Artículo vendido;desde Reino Unido;
Elite Soccer Nintendo Game boy caja sólo;132,35 EUR;Envío gratis;Vendidos  29 nov 2021Artículo vendido;desde Estados Unidos;
Elite Soccer-Nintendo Gameboy-auténtico probado y juega gran vendedor de EE. UU.;26,43 EUR;+ 6,13 EUR de envío;Vendidos  19 nov 2021Artículo vendido;desde Estados Unidos;
Elite Soccer Nintendo Game Boy GB;11,90 EUR;Envío gratis;Vendidos  6 nov 2021Artículo vendido;desde Estados Unidos;
Elite Soccer Nintendo Game Boy GB;13,24 EUR;Envío gratis;Vendidos  23 sep 2021Artículo vendido;desde Estados Unidos;
Elite Soccer-Nintendo Gameboy-auténtica;13,22 EUR;Envío gratis;Vendidos  23 sep 2021Artículo vendido;desde Estados Unidos;
