Nintendo Game Boy-The Incredible Crash Dummies;4,99 EUR;+ 12,99 EUR de envío;desde Alemania;
Nuevo anuncioNintendo GameBoy jeu - The Incredible Crash Dummies cartouche utilisé;17,99 EUR;Envío internacional gratis;desde Alemania;
Nuevo anuncioNintendo GameBoy gioco - The Incredible Crash Dummies cartuccia usato;19,99 EUR;Envío internacional gratis;desde Alemania;
The Incredible Crash Dummies USA - Nintendo GameBoy - NGB;4,95 EUR;+ 19,95 EUR de envío;desde Países Bajos;
The Incredible Crash Dummies  - Game Boy- Anleitung C-Ware ;8,37 EUR;+ 1,09 EUR de envío;desde Austria;
Gameboy juego-The Incredible Crash Dummies (PAL) (módulo) 10823088;4,89 EUR;+ 67,99 EUR de envío;desde Alemania;
Nintendo Gameboy Classic, Color & GBA Game: The Incredible Crash Dummies (ESP);4,95 EUR;+ 5,00 EUR de envío;desde Países Bajos;
Nintendo GameBoy - The Incredible Crash Dummies DMG-C8-USA - Manual Only;4,25 EUR;+ 3,00 EUR de envío;desde Países Bajos;
Nuevo anuncioNintendo GameBoy game - The Incredible Crash Dummies cartridge;13,83 EUR;Envío internacional gratis;desde Alemania;
Nuevo anuncioNintendo GameBoy juego - The Incredible Crash Dummies cartucho usado;19,99 EUR;Envío internacional gratis;desde Alemania;
