Godzilla dominación! Nintendo Game Boy Advance GBA Juego Solo Carro Genuino Atari;26,99 EUR;+ 7,06 EUR de envío;desde Reino Unido;
Godzilla Nintendo Game Boy Juego Completo Con Caja Y Manual;309,25 EUR;+ 17,67 EUR de envío;desde Alemania;
Godzilla la serie Monster guerras Nintendo Game Boy Color Advance Carro Genuino;16,88 EUR;+ 7,06 EUR de envío;desde Reino Unido;
Godzilla Domination para GameBoy Advance SP DS Lite;29,99 EUR;+ 7,00 EUR de envío;desde Alemania;
Godzilla (Nintendo Game Boy, 1990) RARE ReD Version;199,95 EUR;+ 24,95 EUR de envío;desde Francia;
Nintendo Gameboy Godzilla en Caja con Manual gwo;152,85 EUR;+ 25,14 EUR de envío estimado;desde Reino Unido;
Game Boy Advance * Godzilla: dominación! * Wata 9.2 a + no VGA;1.199,95 EUR;+ 35,99 EUR de envío;desde Alemania;
Godzilla * Nintendo GameBoy * PAL UK;69,95 EUR;+ 21,00 EUR de envío;desde Países Bajos;
Godzilla Mattel 1St Edition per Nintendo Game boy  GBC-GBA-SP-GBPK;22,90 EUR;+ 11,90 EUR de envío;desde Italia;
Godzilla la serie + 5 en 1 juego Galería Nintendo Gameboy PAL Paquete De Carro;10,57 EUR;+ 7,64 EUR de envío;desde Reino Unido;
Nintendo Gameboy juego-Godzilla-Embalaje original-pal-Top;109,90 EUR;Envío no especificado;desde Alemania;
Nintendo Game Boy Color Godzilla EUR Très Bon état;9,90 EUR;+ 11,98 EUR de envío;desde Francia;
Nintendo Console Play Gioco Game Boy Cartuccia GameBoy DMG-GZ-ITA  Godzilla;29,00 EUR;+ 12,00 EUR de envío;desde Italia;
Nintendo Game Boy Color GBC Godzilla MONSTRUO Wars PAL EUR GC cartucho sólo;17,52 EUR;+ 14,11 EUR de envío;desde Reino Unido;
Nintendo Gameboy Color-Godzilla la serie Monster guerras;17,58 EUR;+ 17,28 EUR de envío estimado;desde Reino Unido;
NINTENDO GAME BOY-Godzilla (en Caja);323,30 EUR;Envío internacional gratis;desde Reino Unido;
Godzilla Nintendo Game Boy-La Serie Color;9,99 EUR;+ 5,88 EUR de envío;desde Reino Unido;
Nintendo Gameboy Juego-Godzilla;17,58 EUR;+ 17,28 EUR de envío estimado;desde Reino Unido;
Nintendo Gameboy Juego-Godzilla la serie;12,65 EUR;+ 17,18 EUR de envío estimado;desde Reino Unido;
Godzilla (Nintendo Game Boy 2001);12,49 EUR;+ 5,00 EUR de envío;desde Alemania;
Nintendo Gameboy juego-Godzilla-Embalaje original-us-rar-Top;279,90 EUR;Envío no especificado;desde Alemania;
Godzilla MONSTRUO guerras Nintendo Gameboy (REPRO);6,46 EUR;+ 17,04 EUR de envío estimado;desde Reino Unido;
Godzilla - The Series - Monster Wars - EUR - Nintendo Gameboy Color - GBC;59,00 EUR;+ 25,00 EUR de envío;desde Países Bajos;
Godzilla la serie Gameboy Color;35,26 EUR;+ 17,66 EUR de envío estimado;desde Reino Unido;
Nintendo Game Boy Advance Juego: Godzilla dominación Nuevo y en caja sin abrir..;88,19 EUR;+ 23,75 EUR de envío estimado;desde Reino Unido;
Godzilla - The Series - EUR - Nintendo Gameboy Color - GBC;40,00 EUR;+ 25,00 EUR de envío;desde Países Bajos;
Genuine Godzilla Gameboy Juego-solo carro;9,98 EUR;+ 17,12 EUR de envío estimado;desde Reino Unido;
Godzilla the Series: Monster Wars EUR - Nintendo GameBoy Color - GBC;15,73 EUR;+ 19,95 EUR de envío;desde Países Bajos;
Nintendo Game Boy Godzilla MONSTRUO guerras;10,45 EUR;+ 8,83 EUR de envío;desde Bulgaria;
Nintendo Gameboy Game: Godzilla [PAL] (Complete) [UKV];69,95 EUR;+ 25,00 EUR de envío;desde Países Bajos;
Nintendo GAME BOY Godzilla la serie probado y de trabajo;8,11 EUR;+ 17,07 EUR de envío estimado;desde Reino Unido;
Nintendo Game Boy Godzilla la versión de juego serie euros;5,87 EUR;+ 20,55 EUR de envío estimado;desde Reino Unido;
Godzilla-Monster guerras ** Oficial Nintendo Gameboy Colour Carro;16,76 EUR;+ 17,26 EUR de envío estimado;desde Reino Unido;
Godzilla the Series: Monster Wars EUR - Nintendo GameBoy Color - GBC;12,41 EUR;+ 19,95 EUR de envío;desde Países Bajos;
Godzilla Gameboy juego! busque en la tienda!;41,15 EUR;+ 20,73 EUR de envío estimado;desde Reino Unido;
