Godzilla dominación! Nintendo Game Boy Advance GBA Juego Solo Carro Genuino Atari;26,88 EUR;+ 7,03 EUR de envío;Vendidos  8 dic 2021Artículo vendido;desde Reino Unido;
Nintendo Gameboy Advance-Godzilla dominación;25,70 EUR;+ 17,39 EUR de envío estimado;Vendidos  3 dic 2021Artículo vendido;desde Reino Unido;
Nintendo Gameboy Color Paquete 4 Juegos X Men listo para Rumble Tiger Woods Godzilla;16,38 EUR;+ 17,19 EUR de envío estimado;Vendidos  1 dic 2021Artículo vendido;desde Reino Unido;
Godzilla The Series game boy color completo con embalaje original y guía;39,99 EUR;+ 8,00 EUR de envío;Vendidos  12 nov 2021Artículo vendido;desde Alemania;
Godzilla dominación Gba;21,08 EUR;+ 17,28 EUR de envío estimado;Vendidos  9 nov 2021Artículo vendido;desde Reino Unido;
Nintendo Game Boy - Godzilla - PAL - EUR;12,99 EUR;+ 5,00 EUR de envío;Vendidos  26 oct 2021Artículo vendido;desde Francia;
Godzilla dominación Gameboy Advance GBA 💯% original juego probado + Caja Protector;40,97 EUR;+ 17,72 EUR de envío estimado;Vendidos  1 oct 2021Artículo vendido;desde Reino Unido;
Godzilla (Nintendo Game Boy, 1990) * solo Cartucho * envío gratuito;20,55 EUR;Envío gratis;Vendidos  21 dic 2021Artículo vendido;desde Estados Unidos;
Godzilla: la serie (Nintendo Game Boy Color, 1999) Sólo Cartucho;3,54 EUR;+ 4,21 EUR de envío;Vendidos  18 dic 2021Artículo vendido;desde Estados Unidos;
Godzilla MONSTRUO de la serie: Wars (Nintendo Game Boy Color, 2000) * Probado;11,51 EUR;Envío gratis;Vendidos  17 dic 2021Artículo vendido;desde Estados Unidos;
Godzilla: la serie Nintendo Game Boy Color * limpiado & Probado *;11,49 EUR;Envío gratis;Vendidos  17 dic 2021Artículo vendido;desde Estados Unidos;
Godzilla: dominación Nintendo Game Boy Advance, 2002 sólo juego probadas Auténtico;26,56 EUR;+ 3,43 EUR de envío;Vendidos  16 dic 2021Artículo vendido;desde Estados Unidos;
Godzilla: la serie (Nintendo Game Boy Color, 1999);8,77 EUR;+ 4,21 EUR de envío;Vendidos  16 dic 2021Artículo vendido;desde Estados Unidos;
Godzilla la serie: Monster guerras Nintendo Game Boy Color Cartucho de juego probadas;13,24 EUR;Envío gratis;Vendidos  16 dic 2021Artículo vendido;desde Estados Unidos;
Godzilla: la serie (Nintendo Game Boy Color, 1999) *** solo Cartucho ***;9,73 EUR;Envío gratis;Vendidos  16 dic 2021Artículo vendido;desde Estados Unidos;
Godzilla Gameboy probado Auténtico Original;17,71 EUR;+ 4,87 EUR de envío;Vendidos  12 dic 2021Artículo vendido;desde Estados Unidos;
Godzilla: dominación (Nintendo Game Boy Advance GBA, 2002) cartucho sólo probado;35,43 EUR;Envío gratis;Vendidos  12 dic 2021Artículo vendido;desde Estados Unidos;
Godzilla la serie Nintendo Gameboy Color GBC Auténtico Juego Boy;12,39 EUR;Envío gratis;Vendidos  11 dic 2021Artículo vendido;desde Estados Unidos;
Godzilla: dominación! auténtico Nintendo Game Boy Advance Funciona;22,14 EUR;Envío gratis;Vendidos  8 dic 2021Artículo vendido;desde Estados Unidos;
Godzilla-Solo Manual de instrucciones (Nintendo Game Boy);11,07 EUR;+ 2,65 EUR de envío;Vendidos  7 dic 2021Artículo vendido;desde Estados Unidos;
Godzilla la serie Nintendo Gameboy Color GBC Auténtico Juego Boy De Colección Original;13,28 EUR;Envío gratis;Vendidos  6 dic 2021Artículo vendido;desde Estados Unidos;
Godzilla (Nintendo Game Boy, 1990) * solo Cartucho * envío gratuito;23,02 EUR;Envío gratis;Vendidos  6 dic 2021Artículo vendido;desde Estados Unidos;
Game Boy Monster rey Godzilla;88,58 EUR;Envío internacional gratis;Vendidos  6 dic 2021Artículo vendido;desde Japón;
Godzilla MONSTRUO Rey Nintendo GameBoy Japón Raro Envío Gratis;69,01 EUR;+ 8,86 EUR de envío;Vendidos  6 dic 2021Artículo vendido;desde Japón;
Godzilla dominación PARA GAMEBOY ADVANCE;22,06 EUR;+ 3,54 EUR de envío;Vendidos  5 dic 2021Artículo vendido;desde Estados Unidos;
Godzilla Nintendo Gameboy;17,09 EUR;+ 3,42 EUR de envío;Vendidos  3 dic 2021Artículo vendido;desde Canadá;
Godzilla Nintendo Gameboy Caja únicamente (sin juego) 1989;115,14 EUR;Envío gratis;Vendidos  30 nov 2021Artículo vendido;desde Estados Unidos;
Godzilla Nintendo Boy juego de juego original solo carro Auténtico;19,92 EUR;+ 3,94 EUR de envío;Vendidos  28 nov 2021Artículo vendido;desde Estados Unidos;
Godzilla: dominación (Nintendo Game Boy Advance auténtico, 2002);29,49 EUR;+ 4,21 EUR de envío;Vendidos  28 nov 2021Artículo vendido;desde Estados Unidos;
Gameboy Advance Godzilla MONSTRUO cuerpo a cuerpo Advance Sin Caja Solo Cartucho Japón Usado;54,33 EUR;Envío internacional gratis;Vendidos  28 nov 2021Artículo vendido;desde Japón;
Godzilla: la serie -- Monster Wars (Nintendo Game Boy Color, 2000);15,05 EUR;Envío gratis;Vendidos  27 nov 2021Artículo vendido;desde Estados Unidos;
Nintendo Gameboy Color Juegos ~ Pick & elegir ~ Mario Godzilla Mickey Arcade Hits;9,73 EUR;+ 3,27 EUR de envío;Vendidos  27 nov 2021Artículo vendido;desde Estados Unidos;
Godzilla: la serie (Nintendo Game Boy Color, 1999) completo, probado, auténtico;35,42 EUR;+ 8,15 EUR de envío;Vendidos  26 nov 2021Artículo vendido;desde Estados Unidos;
Godzilla: dominación Nintendo Game Boy Advance, 2002 sólo juego probadas Auténtico;31,00 EUR;+ 4,43 EUR de envío;Vendidos  25 nov 2021Artículo vendido;desde Estados Unidos;
Godzilla MONSTRUO de la serie: Wars (Nintendo Game Boy Color, 2000) * Probado;13,28 EUR;Envío gratis;Vendidos  25 nov 2021Artículo vendido;desde Estados Unidos;
Godzilla la serie Nintendo Gameboy Color GBC Auténtico Juego Boy;17,71 EUR;Envío gratis;Vendidos  25 nov 2021Artículo vendido;desde Estados Unidos;
Nintendo Game Boy Advance Godzilla dominación Game Boy Advance auténtico probado y de trabajo;19,49 EUR;+ 4,21 EUR de envío;Vendidos  24 nov 2021Artículo vendido;desde Estados Unidos;
Godzilla la serie Nintendo Gameboy Color GBC Auténtico Juego Boy;11,47 EUR;Envío gratis;Vendidos  22 nov 2021Artículo vendido;desde Estados Unidos;
Godzilla: dominación! auténtico Nintendo Game Boy Advance;44,29 EUR;+ 4,32 EUR de envío;Vendidos  21 nov 2021Artículo vendido;desde Estados Unidos;
Godzilla MONSTRUO King & marzo Lot2 Nintendo Gameboy GB RARO Japón;46,95 EUR;+ 17,72 EUR de envío;Vendidos  21 nov 2021Artículo vendido;desde Japón;
Godzilla dominación Nintendo Game Boy Advance Video Juego Carro;27,80 EUR;Envío gratis;Vendidos  19 nov 2021Artículo vendido;desde Estados Unidos;
Godzilla: dominación! Nintendo Game Boy Advance * Auténtico y ahorra *;23,91 EUR;+ 3,94 EUR de envío;Vendidos  18 nov 2021Artículo vendido;desde Estados Unidos;
Kaijuu-Oh Godzilla Nintendo GameBoy Game Boy DMG Japón importación probado de vendedor de Estados Unidos;34,22 EUR;+ 4,07 EUR de envío;Vendidos  18 nov 2021Artículo vendido;desde Estados Unidos;
Godzilla: dominación (Nintendo Game Boy Advance, 2002);26,56 EUR;Envío gratis;Vendidos  18 nov 2021Artículo vendido;desde Estados Unidos;
Godzilla: dominación (Nintendo Game Boy Advance, 2002) Sólo Cartucho;30,99 EUR;Envío gratis;Vendidos  17 nov 2021Artículo vendido;desde Estados Unidos;
Godzilla (Nintendo Game Boy, 1990) probado y trabajo. * solo Cartucho *;22,89 EUR;Envío gratis;Vendidos  16 nov 2021Artículo vendido;desde Estados Unidos;
Godzilla PS3 Juego. Playstation 3 PAL UK Release Completo Con Folleto Rare fuera de imprenta;117,09 EUR;+ 24,28 EUR de envío estimado;Vendidos  13 nov 2021Artículo vendido;desde Reino Unido;
