Dr. Mario - Game Boy - Módulo - Nintendo - Gameboy Classic como nuevo;16,99 EUR;Envío no especificado;desde Alemania;
Genuine Dr. Mario De Vídeo Juego Para Nintendo Game Boy japonés Probado;5,86 EUR;+ 17,01 EUR de envío estimado;desde Reino Unido;
Nintendo Game Boy Advance, Dr. Mario Classic NES Series VGA Silver 85 NM +;1.299,00 EUR;+ 55,00 EUR de envío;desde Alemania;
9 Nintendo Game Boy Juegos Colección GB solo Módulos Tetris Attack Dr. Mario Yoshi;99,90 EUR;+ 4,90 EUR de envío;desde Alemania;
Nintendo Game Boy Dr. Mario JAP Très Bon état;4,90 EUR;+ 11,98 EUR de envío;desde Francia;
Nintendo Game Niño Dr. Mario 1990 de Japón;4,69 EUR;+ 17,62 EUR de envío;desde Japón;
