Genuine Dr. Mario De Vídeo Juego Para Nintendo Game Boy japonés Probado;5,87 EUR;+ 17,04 EUR de envío estimado;desde Reino Unido;
Nintendo Game Boy Advance, Dr. Mario Classic NES Series VGA Silver 85 NM +;1.299,00 EUR;+ 55,00 EUR de envío;desde Alemania;
Dr. Mario - Game Boy - Módulo - Nintendo - Gameboy Classic como nuevo;16,99 EUR;Envío no especificado;desde Alemania;
9 Nintendo Game Boy Juegos Colección GB solo Módulos Tetris Attack Dr. Mario Yoshi;99,90 EUR;+ 4,90 EUR de envío;desde Alemania;
Nintendo Game Boy Dr. Mario JAP Très Bon état;4,90 EUR;+ 11,98 EUR de envío;desde Francia;
Nintendo Game Niño Dr. Mario 1990 de Japón;4,70 EUR;+ 17,65 EUR de envío;desde Japón;
Dr. Mario Nintendo Gameboy;3,99 EUR;+ 8,00 EUR de envío;desde Alemania;
Dr. Mario GAMEBOY en caja Japón en muy buena condición;23,52 EUR;+ 20,94 EUR de envío estimado;desde Reino Unido;
