Dr. Mario - Game Boy - Módulo - Nintendo - Gameboy Classic como nuevo;16,99 EUR;Envío no especificado;Vendidos  15 dic 2021Artículo vendido;desde Alemania;
Jeu Nintendo Gameboy PAL FAH Dr. Mario;9,90 EUR;+ 3,90 EUR de envío;Vendidos  13 dic 2021Artículo vendido;desde Francia;
Genuine Dr. Mario De Vídeo Juego Para Nintendo Game Boy japonés Probado;5,84 EUR;+ 16,96 EUR de envío estimado;Vendidos  10 dic 2021Artículo vendido;desde Reino Unido;
Genuine Dr. Mario De Vídeo Juego Para Nintendo Game Boy japonés Probado;5,84 EUR;+ 16,96 EUR de envío estimado;Vendidos  24 nov 2021Artículo vendido;desde Reino Unido;
Dr. Mario 1990 NINTENDO GAME BOY Acción Puzzle Juego Y ESTUCHE en muy buena condición probado-Libre P&P;13,99 EUR;+ 17,13 EUR de envío estimado;Vendidos  19 nov 2021Artículo vendido;desde Reino Unido;
Instrucciones de juego Dr. Mario-Nintendo GameBoy Classic Game Boy EXCELENTE;5,09 EUR;Envío no especificado;Vendidos  17 nov 2021Artículo vendido;desde Alemania;
