New Game Boy GIG arcade Classic 1 Asteroids Missile Command ;49,00 EUR;+ 8,00 EUR de envío;desde Italia;
Arcade clásico Asteroids/de misil comando 1: | Game Boy DMG | solo carro | ukv;10,57 EUR;+ 17,13 EUR de envío estimado;desde Reino Unido;
Nintendo Game Boy 💎 Asteroids misil comando 💎 juego sin caja 💎;7,36 EUR;+ 23,46 EUR de envío;desde Reino Unido;
Asteroids 1979 Original Nintendo GameBoy Gran Juego Raro Retro Excelente Estado;23,50 EUR;+ 17,40 EUR de envío estimado;desde Reino Unido;
Arcade Classic 1 2 Asteroids Missile Command Centipede Millipede Game Boy nuovo;99,00 EUR;+ 35,00 EUR de envío;desde Italia;
Game Boy Advance Pong Asteroids Yars Revenge;12,00 EUR;+ 12,00 EUR de envío;desde Italia;
NINTENDO GAME BOY COLOR Asteroids Caja sólo Vintage juego de computadora ACTIVISION;11,76 EUR;+ 17,64 EUR de envío;desde Reino Unido;
Nintendo Game Boy Advance Pong Yars' Revenge Asteroids EUR Très Bon état;5,90 EUR;+ 11,98 EUR de envío;desde Francia;
Asteroids Para Nintendo Gameboy Color en Caja en muy buena condición;23,46 EUR;+ 17,40 EUR de envío estimado;desde Reino Unido;
Nintendo Gameboy Juego-Asteroids;23,46 EUR;+ 17,40 EUR de envío estimado;desde Reino Unido;
Paquete De Juegos Nintendo Gameboy-muñequillo, Crash Dummies, Asteroids;15,83 EUR;+ 17,24 EUR de envío estimado;desde Reino Unido;
Asteroids videogioco per Nintendo Game Boy Classic funzionante gioco loose;7,99 EUR;+ 12,00 EUR de envío;desde Italia;
Asteroids misil comando (Nintendo Game Boy);17,64 EUR;+ 20,69 EUR de envío estimado;desde Reino Unido;
Asteroids Carro Nintendo Gameboy NTSC;11,75 EUR;+ 19,50 EUR de envío estimado;desde Reino Unido;
Asteroids (Nintendo Gameboy);9,39 EUR;+ 18,91 EUR de envío estimado;desde Reino Unido;
Nintendo Gameboy-Asteroids DMG [] * en Caja/Manual *;78,19 EUR;+ 22,69 EUR de envío estimado;desde Reino Unido;
Nintendo Game Boy Color Asteroids Notice / Instruction Manual;4,99 EUR;+ 2,75 EUR de envío;desde Francia;
Pong Asteroids Yars Revenge Gba Nintendo Game Boy Advance ;23,00 EUR;+ 22,00 EUR de envío;desde Francia;
Asteroids-GAMEBOY COLOR-perfecto Estado-en caja, inserte y las instrucciones;58,78 EUR;+ 29,40 EUR de envío;desde Reino Unido;
Asteroids por Atari Corporation para Gameboy-Cartucho únicamente-Buen;22,33 EUR;+ 17,38 EUR de envío estimado;desde Reino Unido;
Nintendo Game Boy Asteroids Accolade libro de instrucciones;4,70 EUR;+ 18,80 EUR de envío estimado;desde Reino Unido;
Game Boy arcade clásico Asteroids & en Caja con Manual de comando de misiles;18,80 EUR;+ 22,26 EUR de envío estimado;desde Reino Unido;
Nintendo Game Boy Asteroids  GameBoy  Vers. FRA;3,90 EUR;Envío no especificado;desde Francia;
Asteroids manual de instrucciones gameboy;4,70 EUR;+ 18,35 EUR de envío estimado;desde Reino Unido;
Asteroids - Gameboy - Nintendo - Notice USA;4,99 EUR;+ 3,88 EUR de envío;desde Francia;
FOLLETO de comando de misiles Super Gameboy Asteroids Nintendo Gameboy;2,34 EUR;+ 16,96 EUR de envío estimado;desde Reino Unido;
Pong/Asteroids/Yars Revenge   Piattaforma : Game Boy Advance;12,90 EUR;+ 6,50 EUR de envío;desde Italia;
Asteroids - Nintendo Game Boy Color;24,00 EUR;Envío no especificado;desde Francia;
Arcade Classic Asteroids Missile Command Game Boy Nintendo Gameboy Funzionante;36,00 EUR;Envío no especificado;desde Italia;
Pong / Asteroids / Yars Revenge - Gameboy;21,71 EUR;Envío no especificado;desde Italia;
