New Game Boy GIG arcade Classic 1 Asteroids Missile Command ;49,00 EUR;+ 8,00 EUR de envío;desde Italia;
Arcade clásico Asteroids/de misil comando 1: | Game Boy DMG | solo carro | ukv;10,54 EUR;+ 17,08 EUR de envío estimado;desde Reino Unido;
Asteroids 1979 Original Nintendo GameBoy Gran Juego Raro Retro Excelente Estado;23,43 EUR;+ 17,35 EUR de envío estimado;desde Reino Unido;
Game Boy Advance Pong Asteroids Yars Revenge;10,98 EUR;+ 7,09 EUR de envío;desde Italia;
Arcade Classic 1 2 Asteroids Missile Command Centipede Millipede Game Boy nuovo;99,00 EUR;+ 35,00 EUR de envío;desde Italia;
Arcade Classics 1 - Asteroids & Missile Command | Game Boy 🕹 | Excellent Con;9,00 EUR;+ 3,50 EUR de envío;desde Países Bajos;
Game Boy Advance Pong Asteroids Yars Revenge;12,00 EUR;+ 12,00 EUR de envío;desde Italia;
NINTENDO GAME BOY COLOR Asteroids Caja sólo Vintage juego de computadora ACTIVISION;11,72 EUR;+ 17,58 EUR de envío;desde Reino Unido;
Nintendo Game Boy Advance Pong Yars' Revenge Asteroids EUR Très Bon état;5,90 EUR;+ 11,98 EUR de envío;desde Francia;
Asteroids Para Nintendo Gameboy Color en Caja en muy buena condición;23,38 EUR;+ 17,35 EUR de envío estimado;desde Reino Unido;
Arcade Classic 1 Asteroids Missile Command Game Boy Spiel #881;19,17 EUR;+ 16,09 EUR de envío;desde Suiza;
Pong Asteroids Yars's Revenge// (Nintendo Game Boy Advance, 2005);10,63 EUR;+ 14,18 EUR de envío;desde Grecia;
Asteroids videogioco per Nintendo Game Boy Classic funzionante gioco loose;7,99 EUR;+ 12,00 EUR de envío;desde Italia;
Nintendo Gameboy Juego-Asteroids;23,38 EUR;+ 17,35 EUR de envío estimado;desde Reino Unido;
Paquete De Juegos Nintendo Gameboy-muñequillo, Crash Dummies, Asteroids;15,77 EUR;+ 17,18 EUR de envío estimado;desde Reino Unido;
Asteroids misil comando (Nintendo Game Boy);17,58 EUR;+ 20,63 EUR de envío estimado;desde Reino Unido;
Nuevo anuncioNintendo Gameboy-Asteroids DMG [] * en Caja/Manual *;77,94 EUR;+ 22,62 EUR de envío estimado;desde Reino Unido;
Poing Asteroids yardas venganza GBA Game Boy Advance Japón Nuevo;23,82 EUR;+ 10,64 EUR de envío;desde Grecia;
Nintendo Game Boy Color Asteroids Notice / Instruction Manual;4,99 EUR;+ 2,75 EUR de envío;desde Francia;
Asteroids Carro Nintendo Gameboy NTSC;9,36 EUR;+ 19,38 EUR de envío estimado;desde Reino Unido;
Asteroids-GAMEBOY COLOR-perfecto Estado-en caja, inserte y las instrucciones;58,59 EUR;+ 29,30 EUR de envío;desde Reino Unido;
Asteroids (Nintendo Gameboy);9,36 EUR;+ 18,85 EUR de envío estimado;desde Reino Unido;
Pong Asteroids Yars Revenge Gba Nintendo Game Boy Advance ;23,00 EUR;+ 22,00 EUR de envío;desde Francia;
Asteroids por Atari Corporation para Gameboy-Cartucho únicamente-Buen;22,26 EUR;+ 17,32 EUR de envío estimado;desde Reino Unido;
Nintendo Game Boy Asteroids Accolade libro de instrucciones;4,69 EUR;+ 18,74 EUR de envío estimado;desde Reino Unido;
Arcade Classic No. 1: Asteroids / Missile Command USA - Nintendo GameBoy - NGB;6,95 EUR;+ 19,95 EUR de envío;desde Países Bajos;
Game Boy arcade clásico Asteroids & en Caja con Manual de comando de misiles;18,74 EUR;+ 22,19 EUR de envío estimado;desde Reino Unido;
Nintendo Game Boy Asteroids  GameBoy  Vers. FRA;3,90 EUR;Envío no especificado;desde Francia;
Arcade Classic 1: Asteroids & Missile Command (losse cassette) nintendo gameboy ;9,95 EUR;+ 20,00 EUR de envío;desde Países Bajos;
Asteroids manual de instrucciones gameboy;4,69 EUR;+ 18,29 EUR de envío estimado;desde Reino Unido;
Asteroids - Gameboy - Nintendo - Notice USA;4,99 EUR;+ 3,88 EUR de envío;desde Francia;
FOLLETO de comando de misiles Super Gameboy Asteroids Nintendo Gameboy;2,33 EUR;+ 16,90 EUR de envío estimado;desde Reino Unido;
Arcade Classic Asteroids Missile Command Game Boy Nintendo Gameboy Funzionante;36,00 EUR;Envío no especificado;desde Italia;
Pong / Asteroids / Yars Revenge - Gameboy;21,71 EUR;Envío no especificado;desde Italia;
