Asteroids, NINTENDO GAMEBOY COLOR;8,16 EUR;+ 17,05 EUR de envío estimado;Vendidos  16 nov 2021Artículo vendido;desde Reino Unido;
Game Boy arcade clásico Asteroids & en Caja con Manual de comando de misiles;21,13 EUR;+ 17,33 EUR de envío estimado;Vendidos  5 nov 2021Artículo vendido;desde Reino Unido;
Asteroids Gameboy Color / Advance / Sp Gbc Game;17,56 EUR;+ 12,33 EUR de envío;Vendidos  5 nov 2021Artículo vendido;desde Reino Unido;
Nintendo Gameboy Juego-Asteroids;10,51 EUR;+ 17,11 EUR de envío estimado;Vendidos  21 oct 2021Artículo vendido;desde Reino Unido;
Arcade Classic 1 + 3 Nintendo Gameboy paquete de juegos PAL Galaga Galaxian Asteroids;17,60 EUR;+ 7,63 EUR de envío;Vendidos  30 sep 2021Artículo vendido;desde Reino Unido;
GBC Game Boy Color Asteroids PAL EUR Nintendo Genuine;11,95 EUR;+ 2,50 EUR de envío;Vendidos  28 sep 2021Artículo vendido;desde España;
Asteroids Nintendo Game Boy Color Advance Juego Solo Carro Genuino;15,21 EUR;+ 7,05 EUR de envío;Vendidos  25 sep 2021Artículo vendido;desde Reino Unido;
Asteroids Game Boy USA ;15,00 EUR;Envío internacional gratis;Vendidos  15 sep 2021Artículo vendido;desde Francia;
Asteroids Nintendo Game Boy Juego Activision DMG-Aare-EE. UU. probado Funcionando;9,36 EUR;Envío gratis;Vendidos  6 dic 2021Artículo vendido;desde Estados Unidos;
! Sellado! Asteroids Pong Yar's Revenge ciempiés caudillos GBA Game Boy Advance;26,62 EUR;+ 2,83 EUR de envío;Vendidos  5 dic 2021Artículo vendido;desde Estados Unidos;
Nintendo Game Boy Color Juegos [lote de 4] Pac-Man, Asteroids, Hoyle, juego de armonía;19,51 EUR;Envío gratis;Vendidos  5 dic 2021Artículo vendido;desde Estados Unidos;
Asteroids (Nintendo Game Boy, 1992) Con Manual;8,99 EUR;Envío gratis;Vendidos  4 dic 2021Artículo vendido;desde Estados Unidos;
Arcade Clásico Nº 1: Asteroids/de misil comando (Nintendo Game Boy, 1995);5,32 EUR;+ 3,54 EUR de envío;Vendidos  3 dic 2021Artículo vendido;desde Estados Unidos;
Asteroids Original (Nintendo Game Boy, 1991) Auténtico Accolade versión GB Carro;9,23 EUR;+ 4,79 EUR de envío;Vendidos  3 dic 2021Artículo vendido;desde Estados Unidos;
Asteroids Nintendo Game Boy Color Gameboy Auténtico Original!;7,96 EUR;Envío gratis;Vendidos  30 nov 2021Artículo vendido;desde Estados Unidos;
Asteroids Para Nintendo Game Boy Color Incluye Folleto Gameboy limpio Probado;13,30 EUR;Envío gratis;Vendidos  25 nov 2021Artículo vendido;desde Estados Unidos;
Game Boy Color-Lote Mixto De 4 Juegos Frogger Pacman Asteroids Bomberman Probado;26,53 EUR;Envío gratis;Vendidos  25 nov 2021Artículo vendido;desde Estados Unidos;
Game Boy arcade clásicos 1 3 Cartucho de 4 en caja como nuevo Asteroids Galaga Galaxian defender justo;88,73 EUR;+ 9,45 EUR de envío;Vendidos  25 nov 2021Artículo vendido;desde Estados Unidos;
Asteroids/Pong/Yar's Revenge-Juego Boy Advance Gba;3,08 EUR;+ 2,62 EUR de envío;Vendidos  22 nov 2021Artículo vendido;desde Estados Unidos;
Pong Asteroids Yars's Revenge// (Nintendo Game Boy Advance, 2005);5,28 EUR;Envío gratis;Vendidos  22 nov 2021Artículo vendido;desde Estados Unidos;
DMG-01 Red Play It Loud Gameboy Console with Arcade Asteroids/Missile Command;65,89 EUR;+ 16,79 EUR de envío;Vendidos  17 nov 2021Artículo vendido;desde Canadá;
Lote Nintendo Game Boy Launch Edition Gris limpio DMG-01 FIFA Soccer, Asteroids;70,09 EUR;+ 5,31 EUR de envío;Vendidos  14 nov 2021Artículo vendido;desde Estados Unidos;
Asteroids, Nintendo Game Boy Color, de 1999, Probado;3,99 EUR;+ 4,44 EUR de envío;Vendidos  11 nov 2021Artículo vendido;desde Estados Unidos;
Pong Asteroids Yars's Revenge// (Nintendo Game Boy Advance, 2005) sello Nueva &;8,83 EUR;Envío gratis;Vendidos  7 nov 2021Artículo vendido;desde Estados Unidos;
GameBoy: Super Breakout/Battlezone & Asteroids/de misil comando * probado/trabajo!;8,87 EUR;+ 8,16 EUR de envío;Vendidos  31 oct 2021Artículo vendido;desde Estados Unidos;
Gameboy Advance Pong/Asteroids/Yars Revenge. Nueva Sellado;7,76 EUR;Envío gratis;Vendidos  30 oct 2021Artículo vendido;desde Estados Unidos;
Lote de 3 Juegos Nintendo Game Boy arcade clásico Asteroids Galaga ciempiés 1 2 3;29,28 EUR;Envío gratis;Vendidos  29 oct 2021Artículo vendido;desde Estados Unidos;
Lote 2 Juegos Atari Arcade Nintendo Game Boy Color Asteroids + SPACE INVADERS;26,59 EUR;Envío gratis;Vendidos  29 oct 2021Artículo vendido;desde Estados Unidos;
Asteroids Game Boy Color (versión estadounidense Nueva Sellado de fábrica) Juego Boy Advance;19,07 EUR;Envío gratis;Vendidos  28 oct 2021Artículo vendido;desde Estados Unidos;
Asteroids (Nintendo Game Boy Color, 1999) y probado Edición De Color De Pac-Man;14,19 EUR;Envío gratis;Vendidos  24 oct 2021Artículo vendido;desde Estados Unidos;
Asteroids/Pong/Yar's Revenge-Nintendo Game Boy Advance;6,63 EUR;Envío gratis;Vendidos  24 oct 2021Artículo vendido;desde Estados Unidos;
Asteroids, Nintendo Game Boy Color, de 1999, Probado;7,90 EUR;Envío gratis;Vendidos  24 oct 2021Artículo vendido;desde Estados Unidos;
Pong, Asteroids, Yars's Revenge (Nintendo Game Boy Advance, 2005) Nueva, Sellada;10,60 EUR;Envío gratis;Vendidos  21 oct 2021Artículo vendido;desde Estados Unidos;
Plata Nintendo Game Boy Pocket Con Asteroids & Missile Command Juego Y Manual;57,66 EUR;Envío gratis;Vendidos  18 oct 2021Artículo vendido;desde Estados Unidos;
Arcade Clásico Nº 1: Asteroids/de misil comando (Nintendo Game Boy, 1995) Con Estuche;10,35 EUR;Envío gratis;Vendidos  18 oct 2021Artículo vendido;desde Estados Unidos;
Asteroids (Nintendo Game Boy);7,99 EUR;+ 4,08 EUR de envío;Vendidos  18 oct 2021Artículo vendido;desde Estados Unidos;
4 Vintage Nintendo Game Boy Color STM Super Mario Bros. Deluxe Asteroids el Grinch;17,70 EUR;Envío gratis;Vendidos  9 oct 2021Artículo vendido;desde Estados Unidos;
Pong Asteroids Yars's Revenge// (Nintendo Game Boy Advance, 2005) se ve funciona muy bien;3,55 EUR;+ 2,48 EUR de envío;Vendidos  9 oct 2021Artículo vendido;desde Estados Unidos;
Asteroids (Nintendo Game Boy Color, 1999);4,44 EUR;+ 3,99 EUR de envío;Vendidos  6 oct 2021Artículo vendido;desde Estados Unidos;
Nintendo Gameboy Advance Pong & Asteroids Yars Revenge & en Caja Sellada;9,85 EUR;+ 4,44 EUR de envío;Vendidos  3 oct 2021Artículo vendido;desde Estados Unidos;
Asteroids (Nintendo Gameboy Color, 1999), sólo cartucho;6,65 EUR;Envío gratis;Vendidos  1 oct 2021Artículo vendido;desde Estados Unidos;
Asteroids Game Boy Color (versión estadounidense Nueva Sellado de fábrica) Juego Boy Advance;19,07 EUR;Envío gratis;Vendidos  27 sep 2021Artículo vendido;desde Estados Unidos;
