Trip World Game Boy Color GBC EUR Cartridge;9,95 EUR;Envío internacional gratis;desde Hong Kong;
Trip World NOE version art box for Game Boy+manual+cart sticker NO GAME inside;49,80 EUR;Envío no especificado;desde Italia;
Trip World game boy FRG version ,art box only.NO GAME ;22,90 EUR;Envío no especificado;desde Italia;
Boîte GAME BOY – Trip World NOE;15,00 EUR;+ 3,50 EUR de envío;desde Francia;
Trip World NOE game boy ART BOX open only,no Game Inside!;16,99 EUR;Envío no especificado;desde Italia;
Trip World NOE game boy ART. BOX only NO GAME INSIDE!!;24,90 EUR;Envío no especificado;desde Italia;
Trip World FRG Art box for Game Boy,box only.NO GAME Inside;24,90 EUR;Envío no especificado;desde Italia;
Trip World NOE version ,Game Boy art box +manual+cart sticker NO GAME inside;49,80 EUR;Envío no especificado;desde Italia;
