Lamborghini American Challenge Gameboy;22,10 EUR;+ 3,94 EUR de envío;Vendidos  16 nov 2021Artículo vendido;desde Estados Unidos;
Lamborghini American Challenge (Nintendo Game Boy, 1994) Usado C/manual;35,42 EUR;Envío gratis;Vendidos  11 nov 2021Artículo vendido;desde Estados Unidos;
SNES juego: Lamborghini American Challenge super nintendo "OVP + instrucciones;39,95 EUR;+ 4,50 EUR de envío;Vendidos  30 oct 2021Artículo vendido;desde Alemania;
Commodore Amiga CD32 Juego-Lamborghini American Challenge;37,18 EUR;+ 12,87 EUR de envío;Vendidos  3 nov 2021Artículo vendido;desde Reino Unido;
Lamborghini American Challenge Snes CIB Raro #0051;87,77 EUR;+ 27,75 EUR de envío estimado;Vendidos  22 oct 2021Artículo vendido;desde Reino Unido;
Lamborghini American Challenge-commodore amiga CD32;26,92 EUR;+ 36,17 EUR de envío estimado;Vendidos  20 dic 2021Artículo vendido;desde Reino Unido;
Lamborghini American Challenge un Titus juego para la amiga CD32 testedworking en muy buena condición;46,83 EUR;+ 24,59 EUR de envío;