Super Hunchback Starring Quasimodo Game Boy NOE ;10,00 EUR;Envío internacional gratis;desde Francia;
Super Hunchback, GB, GAME BOY. Españolizado;95,00 EUR;Envío no especificado;desde España;
GAME BOY GB Super Hunchback IMAGINEER DMG-HNJ JAPÓN ;89,00 EUR;+ 19,90 EUR de envío;desde España;
Super Hunchback + Notice - FAH -  Nintendo Gameboy Game Boy GB ;50,00 EUR;+ 16,00 EUR de envío;desde Francia;
Nintendo Game Boy Super Hunchback USA Très Bon état;29,90 EUR;+ 11,98 EUR de envío;desde Francia;
Nintendo Gameboy-Super Hunchback Star anillo Quasimodo-Embalaje original-Top-pal-Ocean;99,90 EUR;Envío no especificado;desde Alemania;
Super Hunchback Gameboy Juego-Cartucho únicamente;7,02 EUR;+ 18,12 EUR de envío estimado;desde Reino Unido;
Notice Manuel Instruction Booklet Nintendo Gameboy Le Bossu Super Hunchback FAH;9,90 EUR;+ 3,00 EUR de envío;desde Francia;
Super Hunchback Gameboy;11,71 EUR;+ 17,10 EUR de envío estimado;desde Reino Unido;
Super Hunchback Gameboy juego;15,70 EUR;+ 17,18 EUR de envío estimado;desde Reino Unido;
Super Hunchback Starring Quasimodo Notice - Spielanleitung NOE-1 Game Boy;6,00 EUR;Envío internacional gratis;desde Francia;
Super Hunchback Gameboy Nintendo solo carro;9,36 EUR;+ 18,56 EUR de envío estimado;desde Reino Unido;
Nintendo Gameboy juego-Super Hunchback Star anillo Cuasimodo (módulo);14,99 EUR;+ 67,99 EUR de envío;desde Alemania;
Nintendo Gameboy (gb) // Super Hunchback-instrucciones/instructions // dt. PAL;5,99 EUR;+ 5,99 EUR de envío;desde Alemania;
Super Hunchback | Instruction Manual / Spielanleitung | GameBoy🕹 | NOE-1;4,49 EUR;Envío no especificado;desde Países Bajos;
