Nintendo Gameboy Bomb Jack En Caja Con Manual FAH franqueo gratuito Reino Unido;117,19 EUR;+ 24,30 EUR de envío estimado;Vendidos  29 nov 2021Artículo vendido;desde Reino Unido;
Bomb Jack-Nintendo Game Boy juego;9,99 EUR;Envío no especificado;Vendidos  19 nov 2021Artículo vendido;desde Alemania;
Bomb Jack Gameboy Nintendo Game Boy Classic pal cib OVP Noe;74,00 EUR;+ 7,35 EUR de envío;Vendidos  7 nov 2021Artículo vendido;desde Alemania;
Raro Nintendo Gameboy Juego-Bomb Jack Cartucho sólo gwc gastos de envío gratis;31,59 EUR;+ 17,52 EUR de envío estimado;Vendidos  27 oct 2021Artículo vendido;desde Reino Unido;
Nintendo Gameboy-Bomb Jack-Top estado!;13,90 EUR;+ 10,90 EUR de envío;Vendidos  16 oct 2021Artículo vendido;desde Alemania;
Nintendo Gameboy Juego-Bomb Jack;26,32 EUR;+ 17,42 EUR de envío estimado;Vendidos  26 sep 2021Artículo vendido;desde Reino Unido;
Bomb Jack Nintendo Game Boy Juego Original;22,15 EUR;+ 7,09 EUR de envío;Vendidos  30 sep 2021Artículo vendido;desde Ucrania;
Mighty Bomb Jack amiga retro renderizas;25,50 EUR;+ 40,00 EUR de envío;Vendidos  2 oct 2021Artículo vendido;desde Alemania;
XBOX Raro juego Tecmo Classic Arcade Inc Bomb Jack con instrucciones;29,29 EUR;+ 20,93 EUR de envío estimado;Vendidos  10 nov 2021Artículo vendido;desde Reino Unido;
Original Mighty Bomb Jack de Vídeo Juego Para Nintendo Famicom japonés Probado;9,36 EUR;+ 17,05 EUR de envío estimado;Vendidos  24 oct 2021Artículo vendido;desde Reino Unido;
