Nintendo Gameboy Bomb Jack En Caja Con Manual FAH franqueo gratuito Reino Unido;117,43 EUR;+ 24,35 EUR de envío estimado;Vendidos  29 nov 2021Artículo vendido;desde Reino Unido;
Bomb Jack-Nintendo Game Boy juego;9,99 EUR;Envío no especificado;Vendidos  19 nov 2021Artículo vendido;desde Alemania;
Bomb Jack Gameboy Nintendo Game Boy Classic pal cib OVP Noe;74,00 EUR;+ 7,35 EUR de envío;Vendidos  7 nov 2021Artículo vendido;desde Alemania;
Raro Nintendo Gameboy Juego-Bomb Jack Cartucho sólo gwc gastos de envío gratis;31,65 EUR;+ 17,56 EUR de envío estimado;Vendidos  27 oct 2021Artículo vendido;desde Reino Unido;
Bomb Jack (DMG-B9-FAH) for Nintendo Game Boy. Game Only;17,00 EUR;Envío no especificado;Vendidos  23 oct 2021Artículo vendido;desde Países Bajos;
Nintendo Gameboy-Bomb Jack-Top estado!;13,90 EUR;+ 10,90 EUR de envío;Vendidos  16 oct 2021Artículo vendido;desde Alemania;
Bomb Jack Nintendo Game Boy Juego Original;22,17 EUR;+ 7,10 EUR de envío;Vendidos  30 sep 2021Artículo vendido;desde Ucrania;
Nintendo Gameboy Juego-Bomb Jack;26,38 EUR;+ 17,45 EUR de envío estimado;Vendidos  26 sep 2021Artículo vendido;desde Reino Unido;
Mighty Bomb Jack amiga retro renderizas;25,50 EUR;+ 40,00 EUR de envío;Vendidos  2 oct 2021Artículo vendido;desde Alemania;
XBOX Raro juego Tecmo Classic Arcade Inc Bomb Jack con instrucciones;29,35 EUR;+ 20,97 EUR de envío estimado;Vendidos  10 nov 2021Artículo vendido;desde Reino Unido;
Sinclair ZX Spectrum 48K Game - Bomb Jack - Elite - Tape;14,95 EUR;+ 11,00 EUR de envío;Vendidos  13 oct 2021Artículo vendido;desde Países Bajos;
Original Mighty Bomb Jack de Vídeo Juego Para Nintendo Famicom japonés Probado;9,38 EUR;+ 17,09 EUR de envío estimado;Vendidos  24 oct 2021Artículo vendido;desde Reino Unido;
