Titus the Fox * Nintendo GameBoy * PAL  FRG;99,95 EUR;+ 21,00 EUR de envío;desde Países Bajos;
Titus the Fox - EUR - Nintendo Gameboy Color - GBC;69,00 EUR;+ 25,00 EUR de envío;desde Países Bajos;
Nintendo Game Boy Titus the Fox FAH Bon état;19,90 EUR;+ 11,98 EUR de envío;desde Francia;
Nintendo Game Boy Titus the Fox FAH Très Bon état;22,90 EUR;+ 11,98 EUR de envío;desde Francia;
Titus the Fox FRG - Nintendo GameBoy - NGB;19,95 EUR;+ 19,95 EUR de envío;desde Países Bajos;
Titus the Fox FAH - Nintendo GameBoy - NGB;24,95 EUR;+ 19,95 EUR de envío;desde Países Bajos;
Nintendo Game Boy Color,Titus the Fox,OVP,CIB;59,90 EUR;Envío no especificado;desde Alemania;
