Nintendo Game Boy-Balloon Kid-Embalaje original-pal germano-Top;299,90 EUR;Envío no especificado;desde Alemania;
Balloon Kid GIOCO GB Game Boy nintendo ;24,50 EUR;+ 9,90 EUR de envío;desde Italia;
Notice Nintendo GB Game Boy Balloon Kid FAH, Excellent état;14,90 EUR;+ 11,98 EUR de envío;desde Francia;
Módulo Balloon Kid (juego de Nintendo Gameboy) solo - Game Boy - probado;19,99 EUR;Envío no especificado;desde Alemania;
Balloon Kid GIOCO GB Game Boy;89,99 EUR;Envío no especificado;desde Italia;
Kiwi Game Boy Color Sistema con Donkey Kong Land 3 & Balloon Kid;80,66 EUR;Envío gratis;desde Estados Unidos;
Balloon Kid (Nintendo Game Boy) cart only;15,39 EUR;+ 3,47 EUR de envío;desde Canadá;
Gameboy Balloon Kid - Tested;20,10 EUR;+ 6,93 EUR de envío;desde Canadá;
Balloon Kid Game Boy Spiel #5278;28,81 EUR;+ 16,09 EUR de envío;desde Suiza;
