Gb-WWF Raw para Nintendo GameBoy;4,95 EUR;+ 9,95 EUR de envío;Vendidos  7 dic 2021Artículo vendido;desde Alemania;
WWF Raw Nintendo Gameboy Juego PAL solo carro;9,40 EUR;+ 7,65 EUR de envío;Vendidos  12 nov 2021Artículo vendido;desde Reino Unido;
WWF Raw Gameboy;35,30 EUR;+ 36,70 EUR de envío estimado;Vendidos  10 oct 2021Artículo vendido;desde Reino Unido;
WWF Raw Wrestling Rudest And Roughest Game Boy EUR ;7,00 EUR;Envío internacional gratis;Vendidos  20 sep 2021Artículo vendido;desde Francia;
WWF Raw Nintendo Game Boy Original * limpiado & Probado *;8,86 EUR;Envío gratis;Vendidos  6 dic 2021Artículo vendido;desde Estados Unidos;
WWF Raw para Original GameBoy + Color & Advance | probado juego sólo WWE Wrestling;4,44 EUR;+ 4,53 EUR de envío;Vendidos  22 nov 2021Artículo vendido;desde Estados Unidos;
WWF Raw Sega Genesis Megadrive Juego;17,64 EUR;+ 36,33 EUR de envío estimado;Vendidos  20 nov 2021Artículo vendido;desde Reino Unido;
WWF Raw Sega Game Gear Nuevo Sellado Raro versión estadounidense;176,46 EUR;+ 39,74 EUR de envío estimado;Vendidos  29 sep 2021Artículo vendido;desde Reino Unido;
WWF Raw Genuino Sega Genesis Mega Drive cartucho de juego solamente.;9,40 EUR;+ 14,12 EUR de envío;Vendidos  21 nov 2021Artículo vendido;desde Reino Unido;
Sega Mega Drive juego WWF Raw retrogame cib;23,50 EUR;Envío no especificado;Vendidos  24 oct 2021Artículo vendido;desde Alemania;
WWF Raw Deal Juego De Cartas Coleccionables CCG Nuevo Sellado Lita Trish NWO WWE HULK;11,76 EUR;+ 20,99 EUR de envío estimado;Vendidos  25 nov 2021Artículo vendido;desde Reino Unido;
WWF Raw Deal Collectible Card Game61 Starter Deck 2000 Incl. Shinnies;1,17 EUR;+ 32,23 EUR de envío estimado;Vendidos  26 sep 2021Artículo vendido;desde Reino Unido;
