Tetris Game Boy Classic Nintendo GameBoy PAL NOE EMBALAJE ORIGINAL;73,00 EUR;+ 7,35 EUR de envío;desde Alemania;
Nintendo Game Boy Colour en verde con juego de Tetris;31,73 EUR;+ 21,34 EUR de envío estimado;desde Reino Unido;
Tetris - Nintendo Game boy - NTSC-J JAP;7,99 EUR;+ 3,00 EUR de envío;desde Francia;
Nintendo Gameboy juego Tetris Game Boy Classic módulo;12,99 EUR;+ 4,99 EUR de envío;desde Alemania;
13 Juegos Nintendo GameBoy: Tetris Harvest Moon Pokémon Donkey Kong Zeoth GBC;42,50 EUR;+ 7,35 EUR de envío;desde Alemania;
Tetris - NINTENDO GAME BOY ;11,90 EUR;+ 5,50 EUR de envío;desde Francia;
Tetris Blast De Vídeo Juego Para Nintendo Game Boy & Juego en caja sellada con el hombre;27,01 EUR;+ 17,47 EUR de envío estimado;desde Reino Unido;
Tetris-Game Boy-Módulo de juego-Nintendo-Game Boy-muy buen estado;16,99 EUR;Envío no especificado;desde Alemania;
Tetris Serie Classic FR Game Boy TBE ;150,00 EUR;Envío no especificado;desde Francia;
Genuine Tetris Flash Video Juego Para Nintendo Game Boy japonés Probado;5,86 EUR;+ 17,01 EUR de envío estimado;desde Reino Unido;
Tetris Flash | Game Boy DMG | solo carro;5,86 EUR;+ 17,01 EUR de envío estimado;desde Reino Unido;
Genuine Tetris De Vídeo Juego Para Nintendo Game Boy japonés Probado;5,86 EUR;+ 17,01 EUR de envío estimado;desde Reino Unido;
Tetris Attack (Nintendo Gameboy Classic juego) con instrucciones-Game Boy módulo;16,49 EUR;Envío no especificado;desde Alemania;
Nintendo Game Boy Tetris Store Display Box Con Carro Y Manual;117,49 EUR;+ 24,36 EUR de envío estimado;desde Reino Unido;
Tetris-Nintendo Game Boy módulo;12,95 EUR;Envío no especificado;desde Alemania;
Tetris DX-Game Boy-Módulo de juego-Nintendo-Game Boy-muy buen estado Top;19,99 EUR;Envío no especificado;desde Alemania;
Nintendo Game Boy Color Juego Tetris DX Módulo EUR;14,90 EUR;+ 8,99 EUR de envío;desde Alemania;
Nintendo-Game Boy-Tetris-Top-Embalaje original-Pal;379,90 EUR;Envío no especificado;desde Alemania;
Nintendo Game Boy Classic juego Tetris con embalaje original y guía ukv;249,90 EUR;+ 36,99 EUR de envío;desde Alemania;
Tetris (Game Boy GB 1989) Solo Cartucho;12,90 EUR;+ 9,90 EUR de envío;desde España;
GameBoy Tetris DX incl. OVP & Manual CiB ;2,50 EUR;+ 13,99 EUR de envío;desde Alemania;
Magical Tetris Challenge Nintendo Game Boy Color BOXED PAL;35,24 EUR;+ 17,65 EUR de envío estimado;desde Reino Unido;
Tetris Blast Nintendo Gameboy Game Boy Carro UKV ** GRATIS UK FRANQUEO **;18,62 EUR;+ 13,87 EUR de envío;desde Reino Unido;
Tetris Attack Nintendo Gameboy Game Boy solo carro ** ** GRATIS UK FRANQUEO;22,15 EUR;+ 13,87 EUR de envío;desde Reino Unido;
Tetris Nintendo Gameboy VGA no WATA;10.000,00 EUR;+ 60,00 EUR de envío;desde Alemania;
Tetris Deluxe DX Nintendo Game Boy Color GBC Japan NTSC;37,00 EUR;+ 36,00 EUR de envío;desde Francia;
Jeu Gameboy - Tetris - Jeu Nintendo Game Boy GB - Version NOE;9,99 EUR;+ 5,00 EUR de envío;desde Francia;
Tetris Plus Nintendo Game Boy Color Advance Juego Carro + Manual Original Rompecabezas;20,03 EUR;+ 7,05 EUR de envío;desde Reino Unido;
Nintendo Game Boy Advance Tetris Worlds con embalaje original y guía EUR;24,90 EUR;+ 8,99 EUR de envío;desde Alemania;
Tetris | Game Boy DMG | solo carro;11,75 EUR;+ 17,14 EUR de envío estimado;desde Reino Unido;
Tetris Nintendo Game Boy Version FAH Cartouche avec Notice;19,99 EUR;+ 5,95 EUR de envío;desde Francia;
Nintendo Gameboy X 6 hockey sobre hielo Sneaky Snakes Ducktales Tetris Princesa blobette;6,46 EUR;+ 34,85 EUR de envío estimado;desde Reino Unido;
Tetris 2 Nintendo Game Boy En Caja Con Manual Y Caja Protector;29,36 EUR;+ 21,28 EUR de envío estimado;desde Reino Unido;
Game Boy Tetris Nintendo Cartucho sólo-Yeo D3;11,75 EUR;+ 19,43 EUR de envío estimado;desde Reino Unido;
GameBoy Tetris Blast incl. OVP & Manual CiB ;14,50 EUR;+ 13,99 EUR de envío;desde Alemania;
Game Boy Color Tetris DX en caja con manual buenas condiciones de funcionamiento;29,36 EUR;+ 17,52 EUR de envío estimado;desde Reino Unido;
Nintendo Game Boy Advance/SP juego Tetris Worlds con embalaje original y guía EUR;29,90 EUR;+ 8,99 EUR de envío;desde Alemania;
Nintendo-Game Boy Classic-unfolded Brand New "Tetris" boxes-rar OVP;179,99 EUR;+ 30,00 EUR de envío;desde Alemania;
Tetris 2 Nintendo Game Boy Color Advance Juego Carro + Manual Original Rompecabezas;16,87 EUR;+ 7,05 EUR de envío;desde Reino Unido;
Tetris Flash Nintendo Game Boy Japan Ver. Action Puzzle Game DMG-EHJ Gameboy;19,37 EUR;+ 7,00 EUR de envío;desde Francia;
Cartouche et notice Tetris 2 FAH Nintendo - Jeu gb Game Boy;32,00 EUR;+ 12,96 EUR de envío;desde Francia;
Nintendo Game Boy Classic juego Tetris 2 con embalaje original y guía ukv;49,90 EUR;+ 8,99 EUR de envío;desde Alemania;
Tetris Worlds-Game Boy Advance-Embalaje original-cib;29,90 EUR;Envío no especificado;desde Alemania;
Nintendo Game Boy Advance GBA/SP juegos módulos los pitufos Tetris hugo EUR;7,90 EUR a 14,90 EUR;+ 8,99 EUR de envío;desde Alemania;
