Tetris Nintendo Game Boy Game Boy;12,90 EUR;Envío no especificado;Vendidos  9 dic 2021Artículo vendido;desde Alemania;
Gb-Tetris 2 para Nintendo GameBoy;12,95 EUR;+ 6,50 EUR de envío;Vendidos  9 dic 2021Artículo vendido;desde Alemania;
Tetris DX-Game Boy Color-embalaje original/cib-pal/EUR-Top;31,99 EUR;Envío no especificado;Vendidos  9 dic 2021Artículo vendido;desde Alemania;
Gb-Tetris Plus para Nintendo GameBoy;12,95 EUR;+ 9,95 EUR de envío;Vendidos  9 dic 2021Artículo vendido;desde Alemania;
Nintendo Gameboy Tetris Juego;10,48 EUR;+ 16,99 EUR de envío estimado;Vendidos  9 dic 2021Artículo vendido;desde Reino Unido;
Genuine Tetris Flash Video Juego Para Nintendo Game Boy japonés Probado;5,82 EUR;+ 16,89 EUR de envío estimado;Vendidos  9 dic 2021Artículo vendido;desde Reino Unido;
Tetris Come Nuovo GIOCO NINTENDO GAMEBOY;20,00 EUR;+ 12,00 EUR de envío;Vendidos  9 dic 2021Artículo vendido;desde Italia;
Jeu Nintendo Gameboy PAL FAH Tetris;9,90 EUR;+ 3,90 EUR de envío;Vendidos  8 dic 2021Artículo vendido;desde Francia;
Módulo Tetris Nintendo Gameboy Blitzversand ☆</s>;9,99 EUR;+ 9,00 EUR de envío;Vendidos  7 dic 2021Artículo vendido;desde Alemania;
Tetris-Nintendo Gameboy Classic #139;11,99 EUR;+ 2,99 EUR de envío;Vendidos  7 dic 2021Artículo vendido;desde Alemania;
Tetris Flash | Game Boy DMG | solo carro;5,82 EUR;+ 16,89 EUR de envío estimado;Vendidos  7 dic 2021Artículo vendido;desde Reino Unido;
Nintendo Game Chico: Tetris (DMG-Tra) (JAP Importación) - Libre P&P;7,57 EUR;+ 13,99 EUR de envío;Vendidos  7 dic 2021Artículo vendido;desde Reino Unido;
Jeu Nintendo Gameboy PAL FAH Tetris;9,90 EUR;+ 3,90 EUR de envío;Vendidos  7 dic 2021Artículo vendido;desde Francia;
Tetris para Nintendo Gameboy #1;12,99 EUR;Envío no especificado;Vendidos  7 dic 2021Artículo vendido;desde Alemania;
Tetris Worlds - Módulo de juego Gameboy Advance;14,95 EUR;Envío no especificado;Vendidos  7 dic 2021Artículo vendido;desde Alemania;
Original Genuino NINTENDO GAMEBOY Juego ** ** Tetris;17,44 EUR;+ 17,14 EUR de envío estimado;Vendidos  7 dic 2021Artículo vendido;desde Reino Unido;
Jeu Nintendo Gameboy Tetris;12,00 EUR;+ 3,00 EUR de envío;Vendidos  7 dic 2021Artículo vendido;desde Francia;
Tetris Gameboy Nintendo módulo entrega urgente ⚡;9,99 EUR;+ 9,00 EUR de envío;Vendidos  6 dic 2021Artículo vendido;desde Alemania;
Tetris-Nintendo Game Boy módulo;12,95 EUR;Envío no especificado;Vendidos  6 dic 2021Artículo vendido;desde Alemania;
Tetris Flash En Caja Original Japonesa Nintendo Gameboy Juego;34,99 EUR;+ 17,49 EUR de envío;Vendidos  5 dic 2021Artículo vendido;desde Reino Unido;
Nintendo Game Boy Advance GBA/SP juegos módulos los pitufos Tetris hugo EUR;7,90 EUR a 9,90 EUR;+ 8,99 EUR de envío;Vendidos  5 dic 2021Artículo vendido;desde Alemania;
NINTENDO GAME BOY-Tetris Blast (en Caja);34,93 EUR;+ 12,77 EUR de envío;Vendidos  5 dic 2021Artículo vendido;desde Reino Unido;
Tetris Dx Nintendo Gameboy Color Advance Juego, Genuine!;11,65 EUR;+ 19,15 EUR de envío estimado;Vendidos  5 dic 2021Artículo vendido;desde Reino Unido;
Tetris - Nintendo Game boy - NTSC-J JAP;7,99 EUR;+ 3,00 EUR de envío;Vendidos  5 dic 2021Artículo vendido;desde Francia;
[JAP] Tetris Plus + - Nintendo Game Boy - NTSC-J;7,99 EUR;+ 3,00 EUR de envío;Vendidos  5 dic 2021Artículo vendido;desde Francia;
Nintendo Game Chico: Tetris (DMG-Tra) (JAP Importación) - Libre P&P;7,57 EUR;+ 13,99 EUR de envío;Vendidos  5 dic 2021Artículo vendido;desde Reino Unido;
Notice / Booklet - Tetris - FAH-2 - Game Boy - No Annotation;4,00 EUR;Envío no especificado;Vendidos  4 dic 2021Artículo vendido;desde Francia;
Tetris Nintendo Gameboy-PAL;9,21 EUR;Envío no especificado;Vendidos  4 dic 2021Artículo vendido;desde Reino Unido;
Tetris-Game Boy-Módulo de juego-Nintendo-Game Boy-muy buen estado;18,49 EUR;Envío no especificado;Vendidos  4 dic 2021Artículo vendido;desde Alemania;
Nintendo Game Boy Color Juego Tetris DX Módulo EUR;14,90 EUR;+ 8,99 EUR de envío;Vendidos  4 dic 2021Artículo vendido;desde Alemania;
Tetris-Game Boy-Módulo de juego-Nintendo-Game Boy-muy buen estado-Top;19,99 EUR;Envío no especificado;Vendidos  4 dic 2021Artículo vendido;desde Alemania;
Tetris - NINTENDO GAME BOY ;11,90 EUR;+ 5,50 EUR de envío;Vendidos  3 dic 2021Artículo vendido;desde Francia;
Tetris (Nintendo Game Boy, 1998, juego) solo módulo con funda-como nuevo coleccionista;16,50 EUR;+ 4,99 EUR de envío;Vendidos  3 dic 2021Artículo vendido;desde Alemania;
Nintendo Gameboy/Game Boy Tetris juego/módulo;12,49 EUR;+ 40,00 EUR de envío;Vendidos  3 dic 2021Artículo vendido;desde Alemania;
Tetris Nintendo Gameboy Japonés Original Cartucho De Juego DMG-Tra #4;9,32 EUR;+ 16,97 EUR de envío estimado;Vendidos  3 dic 2021Artículo vendido;desde Reino Unido;
Pack Tetris (Game Boy GB 1989) Solo Cartuchos;54,00 EUR;+ 9,90 EUR de envío;Vendidos  3 dic 2021Artículo vendido;desde España;
Tetris (Game Boy GB 1989) Solo Cartucho;12,90 EUR;+ 9,90 EUR de envío;Vendidos  3 dic 2021Artículo vendido;desde España;
Tetris (Nintendo Game Boy, 1998, juego) solo módulo con funda-como nuevo coleccionista;18,99 EUR;Envío no especificado;Vendidos  3 dic 2021Artículo vendido;desde Alemania;
Gameboy juegos mario Tetris Zelda Pokemon rojo amarillo azul Donkey Kong solo módulo;5,95 EUR a 32,95 EUR;Envío no especificado;Vendidos  3 dic 2021Artículo vendido;desde Alemania;
NINTENDO GAME BOY Tetris ita con Manuale;30,00 EUR;Envío no especificado;Vendidos  3 dic 2021Artículo vendido;desde Italia;
Tetris * GAMEBOY PAL *;9,32 EUR;+ 16,97 EUR de envío estimado;Vendidos  2 dic 2021Artículo vendido;desde Reino Unido;
Nintendo Gameboy Juegos-Tetris;10,44 EUR;+ 16,99 EUR de envío estimado;Vendidos  2 dic 2021Artículo vendido;desde Reino Unido;
Tetris Plus | Game Boy DMG | solo carro;9,32 EUR;+ 16,97 EUR de envío estimado;Vendidos  1 dic 2021Artículo vendido;desde Reino Unido;
