Nintendo Game Boy Advance Prince of Persia con embalaje original y guía EUR;24,90 EUR;+ 8,99 EUR de envío;desde Alemania;
Nintendo Game Boy Classic juego Prince of Persia con embalaje original y guía Noe;99,90 EUR;+ 36,99 EUR de envío;desde Alemania;
Prince of Persia Gameboy módulo Game Boy Color GBC;18,90 EUR;Envío no especificado;desde Alemania;
Gameboy juego "Prince of Persia" 1989-super estado;19,00 EUR;Envío no especificado;desde Alemania;
Prince of Persia de vídeo juego para Nintendo Game Boy Probado;21,15 EUR;+ 17,36 EUR de envío estimado;desde Reino Unido;
Prince of Persia | Game Boy DMG | solo carro | ukv;24,68 EUR;+ 17,44 EUR de envío estimado;desde Reino Unido;
Game Boy Color-Prince of Persia-Top-pataco Box-Embalaje original-nuevo-VGA Ready;649,90 EUR;Envío no especificado;desde Alemania;
Prince of Persia Nintendo Gameboy juego Game Boy gb Jump N Run Action PAL;28,90 EUR;Envío no especificado;desde Alemania;
Prince of Persia & Tomb Raider GBA Game Boy Advance juego nuevo New Sealed;99,99 EUR;+ 8,00 EUR de envío;desde Alemania;
Prince of Persia (Nintendo Game Boy Color, 1999) Completo En Caja;35,26 EUR;+ 17,66 EUR de envío estimado;desde Reino Unido;
Prince of Persia Nintendo Game Boy Juego;27,03 EUR;+ 21,17 EUR de envío;desde Reino Unido;
Prince of Persia Las Arenas De Tiempo Nintendo Game Boy Advance GBA Carro Genuino;5,88 EUR;+ 19,37 EUR de envío estimado;desde Reino Unido;
Nintendo Gameboy Prince of Persia japón versión vintage con instrucciones;55,00 EUR;+ 15,99 EUR de envío;desde Alemania;
Prince of Persia: las Arenas De Tiempo Nintendo GameBoy Advance Cartucho Y Manual;12,88 EUR;+ 17,18 EUR de envío estimado;desde Reino Unido;
Prince of Persia (Game Boy Color GBC 1999) Solo cartucho;25,00 EUR;+ 12,90 EUR de envío;desde España;
Prince of Persia las dos tronos Original Antiguo Xbox Juego Niños 2 Imanes Retro;2,34 EUR;+ 19,26 EUR de envío estimado;desde Reino Unido;
Nintendo Gameboy Juego-EE. UU. variante-Prince of Persia;26,99 EUR;+ 17,48 EUR de envío estimado;desde Reino Unido;
Prince of Persia & Tomb Raider-JUEGO NINTENDO GAME BOY ADVANCE GBA Multi 5;14,05 EUR;+ 17,20 EUR de envío estimado;desde Reino Unido;
NINTENDO GAME BOY ADVANCE GBA-Prince of Persia Las Arenas De Tiempo solo carro;8,17 EUR;+ 17,07 EUR de envío estimado;desde Reino Unido;
Prince of Persia Arenas De Tiempo En Caja Nintendo Game Boy Advance completa;21,15 EUR;+ 17,36 EUR de envío estimado;desde Reino Unido;
Nintendo Gameboy Juego. Prince of Persia. Caja y manual solamente. Original Mint;58,78 EUR;+ 22,28 EUR de envío estimado;desde Reino Unido;
Nintendo Gameboy Juego. Prince of Persia. todo Original UKV. increíble condición;82,30 EUR;+ 27,74 EUR de envío estimado;desde Reino Unido;
Game Boy Advance Prince of Persia & Tomb Raider En 1 carro de compras;11,75 EUR;+ 17,16 EUR de envío estimado;desde Reino Unido;
Nintendo Gameboy Juego-USA-Prince of Persia;21,11 EUR;+ 17,36 EUR de envío estimado;desde Reino Unido;
Nintendo Gameboy Juego-Prince of Persia;16,40 EUR;+ 17,25 EUR de envío estimado;desde Reino Unido;
Nintendo Gameboy-Prince of Persia;16,40 EUR;+ 17,25 EUR de envío estimado;desde Reino Unido;
Nintendo Gameboy Advance-Prince of Persia Las Arenas De Tiempo;9,35 EUR;+ 17,11 EUR de envío estimado;desde Reino Unido;
Prince of Persia: las Arenas De Tiempo (Nintendo Game Boy Advance, 2003) - Europea;7,04 EUR;+ 18,85 EUR de envío estimado;desde Reino Unido;
Gameboy-Prince of Persia [DMG] * * Completo En Caja;54,68 EUR;+ 22,19 EUR de envío estimado;desde Reino Unido;
Prince of Persia Las Arenas De Tiempo Nintendo Game Boy Advance GBA Carro Genuino;9,39 EUR;+ 17,11 EUR de envío estimado;desde Reino Unido;
Prince of Persia: las Arenas De Tiempo (Nintendo Game Boy Advance, 2003) - Europea;25,87 EUR;+ 20,99 EUR de envío estimado;desde Reino Unido;
Prince of Persia Nintendo Gameboy Color Advance Juego, Genuine! gc!;17,40 EUR;+ 17,27 EUR de envío estimado;desde Reino Unido;
Prince of Persia Las Arenas De Tiempo Gameboy Advance GBA;7,64 EUR;+ 19,40 EUR de envío estimado;desde Reino Unido;
Nintendo Game Boy Advance: Prince of Persia-the Sands of Time ✅ como nuevo ✅;9,99 EUR;+ 2,99 EUR de envío;desde Alemania;
Prince of Persia The Sand of Time - Giochi Nintendo Game Boy Advance - USATO;4,99 EUR;+ 19,90 EUR de envío;desde Italia;
Nintendo DS Prince of Persia la hora olvidada Gameboy estado de juego muy bien!;4,90 EUR;+ 14,90 EUR de envío;desde Alemania;
Nintendo Gameboy Advance juego-Prince of Persia: the Sands of Time (módulo);7,77 EUR;+ 67,99 EUR de envío;desde Alemania;
Gameboy Advance SP-Consola-Gris (con Prince of Persia);70,54 EUR;+ 37,07 EUR de envío estimado;desde Reino Unido;
