Prince of Persia Nintendo Game Boy Cartucho sólo raras;16,37 EUR;+ 18,94 EUR de envío estimado;desde Reino Unido;
Prince of Persia de vídeo juego para Nintendo Game Boy Probado;21,05 EUR;+ 17,27 EUR de envío estimado;desde Reino Unido;
Prince of Persia | Game Boy DMG | solo carro | ukv;24,56 EUR;+ 17,36 EUR de envío estimado;desde Reino Unido;
Nintendo Game Boy Advance Prince of Persia con embalaje original y guía EUR;24,90 EUR;+ 8,99 EUR de envío;desde Alemania;
Prince of Persia & Tomb Raider GBA Game Boy Advance juego nuevo New Sealed;99,99 EUR;+ 8,00 EUR de envío;desde Alemania;
Nintendo Game Boy Classic juego Prince of Persia con embalaje original y guía Noe;99,90 EUR;+ 36,99 EUR de envío;desde Alemania;
Game Boy Color-Prince of Persia-Top-pataco Box-Embalaje original-nuevo-VGA Ready;550,00 EUR;Envío no especificado;desde Alemania;
Prince of Persia Nintendo Game Boy Juego;26,91 EUR;+ 21,07 EUR de envío;desde Reino Unido;
Prince of Persia (Nintendo Game Boy Color, 1999) Completo En Caja;35,10 EUR;+ 17,58 EUR de envío estimado;desde Reino Unido;
Nintendo Gameboy Juego-EE. UU. variante-Prince of Persia;26,86 EUR;+ 17,40 EUR de envío estimado;desde Reino Unido;
Nintendo Gameboy Prince of Persia japón versión vintage con instrucciones;55,00 EUR;+ 15,99 EUR de envío;desde Alemania;
Nuevo anuncioPrince of Persia Las Arenas De Tiempo Nintendo Game Boy Advance GBA Carro Genuino;5,85 EUR;+ 19,27 EUR de envío estimado;desde Reino Unido;
Prince of Persia: las Arenas De Tiempo Nintendo GameBoy Advance Cartucho Y Manual;12,81 EUR;+ 17,10 EUR de envío estimado;desde Reino Unido;
Prince of Persia & Tomb Raider-JUEGO NINTENDO GAME BOY ADVANCE GBA Multi 5;13,99 EUR;+ 17,12 EUR de envío estimado;desde Reino Unido;
Prince of Persia (Game Boy Color GBC 1999) Solo cartucho;25,00 EUR;+ 12,90 EUR de envío;desde España;
NINTENDO GAME BOY ADVANCE GBA-Prince of Persia Las Arenas De Tiempo solo carro;8,13 EUR;+ 16,99 EUR de envío estimado;desde Reino Unido;
Prince of Persia Arenas De Tiempo En Caja Nintendo Game Boy Advance completa;21,05 EUR;+ 17,27 EUR de envío estimado;desde Reino Unido;
Game Boy Advance Prince of Persia & Tomb Raider En 1 carro de compras;11,69 EUR;+ 17,07 EUR de envío estimado;desde Reino Unido;
Nintendo Gameboy Juego. Prince of Persia. Caja y manual solamente. Original Mint;58,50 EUR;+ 22,18 EUR de envío estimado;desde Reino Unido;
Nintendo Gameboy Juego-USA-Prince of Persia;21,01 EUR;+ 17,27 EUR de envío estimado;desde Reino Unido;
Nintendo Gameboy-Prince of Persia;16,33 EUR;+ 17,17 EUR de envío estimado;desde Reino Unido;
Nintendo Gameboy Juego-Prince of Persia;16,33 EUR;+ 17,17 EUR de envío estimado;desde Reino Unido;
Nintendo Gameboy Advance-Prince of Persia Las Arenas De Tiempo;9,30 EUR;+ 17,03 EUR de envío estimado;desde Reino Unido;
Nintendo Gameboy Juego. Prince of Persia. todo Original UKV. increíble condición;81,91 EUR;+ 27,61 EUR de envío estimado;desde Reino Unido;
Prince of Persia: las Arenas De Tiempo (Nintendo Game Boy Advance, 2003) - Europea;7,01 EUR;+ 18,76 EUR de envío estimado;desde Reino Unido;
Gameboy-Prince of Persia [DMG] * * Completo En Caja;54,42 EUR;+ 22,08 EUR de envío estimado;desde Reino Unido;
Prince of Persia Las Arenas De Tiempo Nintendo Game Boy Advance GBA Carro Genuino;9,35 EUR;+ 17,03 EUR de envío estimado;desde Reino Unido;
Prince of Persia Las Arenas De Tiempo Gameboy Advance GBA;7,61 EUR;+ 19,31 EUR de envío estimado;desde Reino Unido;
Prince of Persia: las Arenas De Tiempo (Nintendo Game Boy Advance, 2003) - Europea;25,75 EUR;+ 20,89 EUR de envío estimado;desde Reino Unido;
Prince of Persia Gameboy módulo Game Boy Color GBC;18,90 EUR;Envío no especificado;desde Alemania;
Prince of Persia Nintendo Gameboy Color Advance Juego, Genuine! gc!;17,32 EUR;+ 17,19 EUR de envío estimado;desde Reino Unido;
Nintendo Game Boy Advance: Prince of Persia-the Sands of Time ✅ como nuevo ✅;9,99 EUR;+ 2,99 EUR de envío;desde Alemania;
Prince of Persia The Sand of Time - Giochi Nintendo Game Boy Advance - USATO;4,99 EUR;+ 19,90 EUR de envío;desde Italia;
Nintendo DS Prince of Persia la hora olvidada Gameboy estado de juego muy bien!;4,90 EUR;+ 14,90 EUR de envío;desde Alemania;
Nintendo Gameboy Advance juego-Prince of Persia: the Sands of Time (módulo);7,77 EUR;+ 67,99 EUR de envío;desde Alemania;
