Krusty's Fun House Nintendo Game Boy Color Advance Juego Solo Carro Genuino;15,81 EUR;+ 7,06 EUR de envío;desde Reino Unido;
Krusty's Fun House Simpsons Nintendo Original Gameboy Juego en Caja Completa FAH;82,30 EUR;+ 29,40 EUR de envío;desde Reino Unido;
Nintendo Game Boy - Krusty's Fun House - PAL - FAH;34,99 EUR;+ 5,00 EUR de envío;desde Francia;
Krusty's Fun House Nintendo Game Boy solo carro región libre Gameboy;11,70 EUR;+ 17,16 EUR de envío estimado;desde Reino Unido;
Krusty's Fun House Nintendo Gameboy Juego PAL solo carro;11,75 EUR;+ 7,64 EUR de envío;desde Reino Unido;
Nintendo Game Chico: Krusty's Fun House (con los Simpsons), CIB en muy buena condición;15,27 EUR;+ 19,02 EUR de envío estimado;desde Reino Unido;
Krusty's Fun House (Nintendo Game Boy 1992 Manual) -! envío Gratis!;13,24 EUR;Envío gratis;desde Estados Unidos;
Krusty's Fun House Nintendo Game Boy;397,61 EUR;+ 17,67 EUR de envío;desde México;
Krusty's Fun House NES GAME BOY 1992 ANUNCIO IMPRESO DE COLECCIÓN/cartel oficial Simpsons;13,24 EUR;Envío gratis;desde Estados Unidos;
Krusty Mundo (Krusty's Fun House) Gameboy Cartucho sólo [Gameboy versión JP];38,54 EUR;+ 17,67 EUR de envío;desde Japón;
Krusty's Fun House - Nintendo Game Boy;23,42 EUR;+ 9,64 EUR de envío;desde Canadá;
Commodore Amiga 500 video juego Krusty's Fun House. juego de los Simpsons, solamente.;5,48 EUR;+ 35,69 EUR de envío estimado;desde Reino Unido;
Nuevo anuncioSTARWING & Krusty's Fun House Super Nintendo Snes Juego solo carro PAL;21,15 EUR;+ 7,64 EUR de envío;desde Reino Unido;
Nintendo NES Krusty's Fun House FRA  simpsons;29,99 EUR;+ 12,50 EUR de envío;desde Francia;
Krusty's Fun House-SEGA GAME GEAR-Probado-Cartucho únicamente;15,27 EUR;+ 12,88 EUR de envío;desde Reino Unido;
Nintendo NES Juego-The Simpsons Krusty's Fun House Nes-kf-Noe PAL B;22,18 EUR;+ 17,38 EUR de envío estimado;desde Reino Unido;
Nes Nintendo Krusty's Fun House módulo noe PAL B;19,90 EUR;+ 8,99 EUR de envío;desde Alemania;
Krusty's Fun House-Sega Master Sistema;11,75 EUR;+ 8,23 EUR de envío;desde Reino Unido;
Nintendo NES Juego-The Simpsons Krusty's Fun House;16,40 EUR;+ 17,25 EUR de envío estimado;desde Reino Unido;
Nuevo anuncioNintendo NES Juego Krusty's Fun House;1,16 EUR;+ 9,41 EUR de envío;desde Reino Unido;
SEGA Master System - Krusty's Fun House - PAL;79,99 EUR;+ 29,20 EUR de envío;desde Francia;
Krusty's Fun House Krustys Commodore Amiga Caja Grande Completa De Trabajo;29,38 EUR;+ 21,65 EUR de envío estimado;desde Reino Unido;
Sega Megadrive Simpsons Krusty's Fun House Completa bonito! en Caja Inc Manual;23,27 EUR;+ 21,51 EUR de envío estimado;desde Reino Unido;
