Street Fighter II para Nintendo GameBoy;17,99 EUR;Envío no especificado;Vendidos  10 dic 2021Artículo vendido;desde Alemania;
Super Street Fighter II Turbo revival Game Boy Advance GBA OVP Boxed 2;43,90 EUR;Envío no especificado;Vendidos  8 dic 2021Artículo vendido;desde Alemania;
Street Fighter II (2) Game Boy Classic Nintendo GameBoy PAL NOE CIB OVP VGC;255,00 EUR;+ 7,35 EUR de envío;Vendidos  5 dic 2021Artículo vendido;desde Alemania;
Notice Manuel Instruction Booklet Nintendo Gameboy Street Fighter II (2) FAH;9,90 EUR;+ 3,90 EUR de envío;Vendidos  2 dic 2021Artículo vendido;desde Francia;
Nintendo Game Boy Advance Super Street Fighter II 2 Turbo Revival En Caja Manual;26,91 EUR;Envío no especificado;Vendidos  30 nov 2021Artículo vendido;desde Reino Unido;
Nintendo Game Boy Street Fighter II EUR Très Bon état;29,90 EUR;+ 11,98 EUR de envío;Vendidos  21 nov 2021Artículo vendido;desde Francia;
Super Street Fighter II Turbo Revival Gameboy Advance Gba;17,54 EUR;+ 17,20 EUR de envío estimado;Vendidos  17 nov 2021Artículo vendido;desde Reino Unido;
Super Street Fighter II: Turbo Revival, completa GBA Juego, juego BOY ADVANCE JUEGO;28,01 EUR;+ 17,43 EUR de envío estimado;Vendidos  16 nov 2021Artículo vendido;desde Reino Unido;
Super Street Fighter II 2 X Revival Game Boy Advance Jap;45,00 EUR;+ 10,00 EUR de envío;Vendidos  11 nov 2021Artículo vendido;desde Francia;
Super Street Fighter II Turbo Revival Nintendo Game Boy Advance En Caja Original;45,58 EUR;+ 21,90 EUR de envío estimado;Vendidos  11 nov 2021Artículo vendido;desde Reino Unido;
Super Street Fighter II 2 turbo Revival (Nintendo Gameboy Advance, 2002);19,99 EUR;Envío no especificado;Vendidos  10 nov 2021Artículo vendido;desde Alemania;
Street Fighter II para Nintendo Gameboy #2;16,99 EUR;Envío no especificado;Vendidos  8 nov 2021Artículo vendido;desde Alemania;
Street Fighter II 2 Nintendo Gameboy manual de instrucciones DMG-ASFP-UKV;7,01 EUR;+ 19,30 EUR de envío estimado;Vendidos  7 nov 2021Artículo vendido;desde Reino Unido;
Super Street Fighter II 2 Revival NINTENDO GAMEBOY ADVANCE JUEGO GBA SP DS LITE;15,16 EUR;+ 17,14 EUR de envío estimado;Vendidos  5 nov 2021Artículo vendido;desde Reino Unido;
Street Fighter II Game Boy;47,00 EUR;Envío no especificado;Vendidos  5 nov 2021Artículo vendido;desde Francia;
Nintendo Gameboy Advance Glacier Con Mario Kart & Super Street Fighter II;50,32 EUR;+ 57,85 EUR de envío estimado;Vendidos  28 oct 2021Artículo vendido;desde Reino Unido;
Street Fighter II 2-Nintendo Gameboy;26,86 EUR;+ 17,40 EUR de envío estimado;Vendidos  24 oct 2021Artículo vendido;desde Reino Unido;
Street Fighter II/2-Game Boy-módulo-Nintendo-GameBoy muy buen estado;19,99 EUR;Envío no especificado;Vendidos  23 oct 2021Artículo vendido;desde Alemania;
Street Fighter II Revival * NINTENDO GAMEBOY ADVANCE SP DS;11,69 EUR;+ 34,83 EUR de envío estimado;Vendidos  21 oct 2021Artículo vendido;desde Reino Unido;
Street Fighter II, 2-Nintendo Gameboy Game, cartucho sólo;23,39 EUR;+ 17,32 EUR de envío estimado;Vendidos  15 oct 2021Artículo vendido;desde Reino Unido;
Gameboy Advance instrucción folletos-Street Fighter II, Metroid Fusion, Sonic;12,29 EUR;+ 7,55 EUR de envío;Vendidos  13 oct 2021Artículo vendido;desde Reino Unido;
GBA Gameboy Advance Juego-Street Fighter II 2 Revival;15,16 EUR;+ 17,14 EUR de envío estimado;Vendidos  13 oct 2021Artículo vendido;desde Reino Unido;
