Nintendo Game Boy Classic juego RoboCop 2 con embalaje original y guía EE. UU.;199,90 EUR;+ 36,99 EUR de envío;desde Alemania;
Nintendo Gameboy juego-RoboCop-Embalaje original-Top-Pal;149,90 EUR;Envío no especificado;desde Alemania;
Vintage 1990s Game Boy RoboCop Game robo cop Gameboy with case;17,95 EUR;+ 13,00 EUR de envío;desde Países Bajos;
Nintendo Gameboy-RoboCop 2-Embalaje original-us -;219,90 EUR;Envío no especificado;desde Alemania;
90er Retro Game juego RoboCop the series micro Games Estados Unidos equipo Gameboy Orion;125,00 EUR;+ 20,00 EUR de envío;desde Alemania;
Gb-RoboCop Vs The Terminator para Nintendo GameBoy;24,95 EUR;+ 17,50 EUR de envío;desde Alemania;
Nintendo Gameboy juego-RoboCop (módulo) 11302452;24,99 EUR;+ 67,99 EUR de envío;desde Alemania;
RoboCop vs Terminator-Game Boy-módulo-GameBoy-muy buen estado;23,99 EUR;Envío no especificado;desde Alemania;
RoboCop vs Terminator-Game Boy-módulo-GameBoy-expositor estado;26,99 EUR;Envío no especificado;desde Alemania;
RoboCop para Nintendo GameBoy;22,99 EUR;Envío no especificado;desde Alemania;
