Monster Max Gameboy Game Boy gb Classic OVP EUR cib;99,90 EUR;+ 10,00 EUR de envío;desde Alemania;
Gameboy light Max Top estado con embalaje original coleccionista estado Nintendo Game Boy;99,00 EUR;+ 15,99 EUR de envío;desde Alemania;
Gameboy Advance * Bomberman Max 2 red * Nintendo Game Boy CCM New nuevo Sealed;31,50 EUR;+ 19,00 EUR de envío;desde Alemania;
Max Payne Nintendo-Game Boy Advance-GBA (AGB-P-bmee);152,85 EUR;+ 28,22 EUR de envío;desde Reino Unido;
Bomberman Max: Rojo Challenger de vídeo juego para Nintendo Game Boy Color japonés;9,39 EUR;+ 17,11 EUR de envío estimado;desde Reino Unido;
Nintendo Game Boy Classic juego Monster Max con embalaje original y guía frg #2;79,90 EUR;+ 8,99 EUR de envío;desde Alemania;
Nintendo Game Boy-Monster Max-Embalaje original-pal-Top;129,90 EUR;Envío no especificado;desde Alemania;
Nintendo Game Boy Max (escombros Saver II) Raro en Caja con Instrucciones;211,64 EUR;+ 36,35 EUR de envío estimado;desde Reino Unido;
✨ Metal Max 2 Kai Japan Mint Game Boy Advance GBA 2003 Nintendo Boxed  ✨;39,90 EUR;+ 28,10 EUR de envío;desde Francia;
Nuevo anuncio8 Nintendo Game Boy Juegos Colección GB solo Módulos Power Rangers Mickey Mouse Max;99,90 EUR;+ 4,90 EUR de envío;desde Alemania;
Mini-Yonku GB: Let's & Go!!! Batalla De Las Estrellas Max Para Nintendo Game Boy japonés;5,87 EUR;+ 17,03 EUR de envío estimado;desde Reino Unido;
Bomberman Max 2 Azul Nintendo Game Boy Advance cartucho sólo;19,39 EUR;+ 17,32 EUR de envío estimado;desde Reino Unido;
Bomberman Max 2-Nuevo/Sellado-Nintendo Game Boy Advance-GBA;64,65 EUR;+ 23,25 EUR de envío estimado;desde Reino Unido;
Max-NINTENDO GAME BOY JUEGO solo Carro-UKV-RÁPIDO GRATIS UK FRANQUEO;47,02 EUR;+ 17,91 EUR de envío estimado;desde Reino Unido;
Nintendo Game Boy Advance Bomberman Max 2 EUR Très Bon état;12,90 EUR;+ 11,98 EUR de envío;desde Francia;
F-Zero Max Velocidad Juego Boy Advance pal 2001 Nuevo Sellado UKG no AFA 85NM!;270,43 EUR;+ 25,87 EUR de envío;desde Reino Unido;
Bomberman Max: Red Challenger jeu Nintendo Game Boy Color Import Japon;7,99 EUR;+ 5,50 EUR de envío;desde Francia;
✨ BomberMan Max Yami No Senchi Game Boy Color 2001 Nintendo Boxed CGB-A7BJ-JPN ✨;19,90 EUR;+ 28,10 EUR de envío;desde Francia;
F-Zero Max Velocidad GBA Game Boy Advance pal 2001 Nuevo Sellado UKG no AFA 85NM+!;270,43 EUR;+ 25,87 EUR de envío;desde Reino Unido;
F-Zero Max Velocidad GBA Game Boy Advance pal 2001 Nuevo Sellado UKG no AFA 80+casi como nuevo+!;235,16 EUR;+ 25,87 EUR de envío;desde Reino Unido;
Bomberman Max: Hikari no Yuusha Blue Version Nintendo Game Boy NTSC-J Import JAP;6,99 EUR;+ 3,00 EUR de envío;desde Francia;
Original Nintendo Game Boy Color-bomberman Max Challenger;5,88 EUR;+ 20,79 EUR de envío estimado;desde Reino Unido;
Nintendo Game Boy Advance Bomberman Max 2 EUR Bon état;9,90 EUR;+ 14,98 EUR de envío;desde Francia;
Bomberman Max 2-red Advance-solo módulo-GameBoy Game Boy Advance;34,25 EUR;+ 9,00 EUR de envío;desde Alemania;
Max Payne Advance Game Boy Advance GBA EUR Game Cartridge;9,95 EUR;Envío internacional gratis;desde Hong Kong;
Bomberman Max 2 Blue Advance - Nintendo GameBoy Advance EUR - Neuf;30,00 EUR;+ 9,65 EUR de envío;desde Francia;
Nintendo Gameboy juego-Max-Embalaje original-pal-rar-Top;89,90 EUR;Envío no especificado;desde Alemania;
F-Cero Max Velocity GBA Game Boy Advance Pal 2001 Nuevo Sellado Ukg Not Afa 80+;238,31 EUR;+ 26,22 EUR de envío;desde Reino Unido;
F-Cero Max Velocity Game Boy Advance Pal 2001 Nuevo Precintado Ukg No Afa 85NM;274,06 EUR;+ 26,22 EUR de envío;desde Reino Unido;
Mini-Yonku Let's & Go Batalla De Las Estrellas Max Nintendo Game Boy Japón DMG-P-aamj;29,38 EUR;+ 21,65 EUR de envío estimado;desde Reino Unido;
Nuevo Sellado Max Payne GBA Game Boy Advance;188,13 EUR;+ 15,29 EUR de envío;desde Reino Unido;
Nintendo Gameboy Advance Max Payne Genuino carro.;35,26 EUR;+ 17,66 EUR de envío estimado;desde Reino Unido;
Nintendo Gameboy Advance GBA Max Payne Genuino Carro;30,56 EUR;+ 10,58 EUR de envío;desde Reino Unido;
Nintendo Game Boy Greg Hastings Paintball Torneo Max sería Advance;5,88 EUR;+ 5,88 EUR de envío;desde Lituania;
Bomberman Max Blue Champion CGB-A8BJ cartucho Gameboy color NTSC Jap leer;8,95 EUR;+ 8,95 EUR de envío;desde España;
Nintendo Game Boy Light Max-GameBoy lightmax lupa luz vergrösserungsglas;150,00 EUR;+ 19,00 EUR de envío;desde Alemania;
Bomberman Max Red Advance 2 Gba Nintendo Game Boy Advance ;45,90 EUR;+ 24,00 EUR de envío;desde Francia;
Nintendo Gameboy Advance Max Payne Juego Original * Plus Carcasa;23,48 EUR;+ 17,40 EUR de envío estimado;desde Reino Unido;
Max (1992) Gameboy Juego Original Genuino en Caja en muy buena condición con Manual Raro Nintendo;211,64 EUR;+ 36,35 EUR de envío estimado;desde Reino Unido;
Nintendo Gameboy Advance GBA-bomberman Max 2 Azul;7,06 EUR;+ 17,05 EUR de envío estimado;desde Reino Unido;
Caesars Palace GAMEBOY NINTENDO EUR PARI NUOVO consegna Max 3 giorni leggi tutto;8,00 EUR;+ 25,00 EUR de envío;desde Italia;
Apple iPhone XS Max Case Gamer | Teléfono Cubierta Trasera;9,39 EUR;+ 5,87 EUR de envío;desde Reino Unido;
