Retro Tetris Gameboy jugables teléfono caso cubierta para iPhone XR XS Max Plus 8 X 7 6;8,19 EUR;+ 17,03 EUR de envío estimado;Vendidos  4 dic 2021Artículo vendido;desde Reino Unido;
Blanco Tetris Gameboy jugables teléfono caso cubierta para iPhone XR XS Max Plus 8 X 7 6;8,19 EUR;+ 17,03 EUR de envío estimado;Vendidos  4 dic 2021Artículo vendido;desde Reino Unido;
IPhone Estuche Retro Game Boy 13 12 11 Pro Max XR XS De Silicona Suave X a prueba de golpes;10,54 EUR;Envío internacional gratis;Vendidos  3 dic 2021Artículo vendido;desde China;
Retro Tetris Gameboy jugables teléfono caso cubierta para iPhone 12 11 X XS Max XR 8 7;7,61 EUR a 7,84 EUR;+ 17,02 EUR de envío estimado;Vendidos  2 dic 2021Artículo vendido;desde Reino Unido;
Monster Max Nintendo Gameboy juego Game Boy bien módulo puzzle Action Adventure;13,90 EUR;Envío no especificado;Vendidos  30 nov 2021Artículo vendido;desde Alemania;
Pokemon espada y escudo brillante 6IV Gameboy! Mewtwo! Max EV 6IV!! totalmente Nuevo!;1,75 EUR;Envío internacional gratis;Vendidos  29 nov 2021Artículo vendido;desde Reino Unido;
Rosa Tetris Gameboy jugables teléfono caso cubierta para iPhone XR XS Max Plus 8 X 7 6;8,19 EUR;+ 17,03 EUR de envío estimado;Vendidos  26 nov 2021Artículo vendido;desde Reino Unido;
Nintendo Game Boy Light Max Boy | Gameboy Classic luz lupa-luz, defectuoso;15,99 EUR;Envío no especificado;Vendidos  25 nov 2021Artículo vendido;desde Alemania;
Monster Max - 1994-Juego Boy-Raro;12,88 EUR;+ 19,45 EUR de envío estimado;Vendidos  24 nov 2021Artículo vendido;desde Reino Unido;
Nike Air Max 270 PS entrenadores-Juego Real AO2372-029 Niños Chicas Chicos-todos Los Tamaños;76,17 EUR;+ 29,30 EUR de envío;Vendidos  17 nov 2021Artículo vendido;desde Reino Unido;
Max Payne Nintendo-Game Boy Advance-GBA (AGB-P-bmee);152,35 EUR;+ 28,13 EUR de envío;Vendidos  8 nov 2021Artículo vendido;desde Reino Unido;
Nintendo Gameboy Advance Bomberman Max 2 Rojo Cartucho Artículo Oficial;7,61 EUR;+ 17,01 EUR de envío estimado;Vendidos  6 nov 2021Artículo vendido;desde Reino Unido;
Guía de Monster Max para Gameboy;7,99 EUR;Envío no especificado;Vendidos  3 nov 2021Artículo vendido;desde Alemania;
Monster Max-Nintendo Gameboy;16,37 EUR;+ 13,48 EUR de envío;Vendidos  2 nov 2021Artículo vendido;desde Reino Unido;
Genuine Bomberman Max: Azul campeón de juego para Nintendo Game Boy Color japonés;9,36 EUR;+ 17,05 EUR de envío estimado;Vendidos  29 oct 2021Artículo vendido;desde Reino Unido;
Nintendo Game Boy Light Max-GameBoy lightmax lupa luz vergrösserungsglas;150,00 EUR;+ 19,00 EUR de envío;Vendidos  26 oct 2021Artículo vendido;desde Alemania;
Game Boy Advance Bomberman Max Azul Cartucho genuino;9,36 EUR;+ 17,05 EUR de envío estimado;Vendidos  26 oct 2021Artículo vendido;desde Reino Unido;
Max Payne Advance Game Boy Advance GBA EUR Game Cartridge;9,95 EUR;Envío internacional gratis;Vendidos  26 oct 2021Artículo vendido;desde Hong Kong;
Monster Max-Game Boy-Módulo de juego-Nintendo-Game Boy-muy buen estado;15,49 EUR;Envío no especificado;Vendidos  22 oct 2021Artículo vendido;desde Alemania;
Jeu game boy Monster Max + boite de protection;15,00 EUR;Envío no especificado;Vendidos  21 oct 2021Artículo vendido;desde Francia;
Max Payne 2 la caída de Max Payne Original Antiguo Xbox Juego 15+ chicos Marron;7,02 EUR;+ 19,29 EUR de envío estimado;Vendidos  17 oct 2021Artículo vendido;desde Reino Unido;
Nintendo Game Boy Light Max-GameBoy lightmax lupa luz vergrösserungsglas;150,00 EUR;+ 19,00 EUR de envío;Vendidos  16 oct 2021Artículo vendido;desde Alemania;
Nintendo Game Boy Light Max | Gameboy Classic luz lupa-buen estado;19,99 EUR;Envío no especificado;Vendidos  14 oct 2021Artículo vendido;desde Alemania;
Monster Max Nintendo Gameboy Juego en Caja con Manual de gastos de envío GRATIS Reino Unido.;58,59 EUR;+ 18,11 EUR de envío estimado;Vendidos  14 oct 2021Artículo vendido;desde Reino Unido;
Action Replay Max Para Gameboy Advance & DS;117,20 EUR;+ 17,58 EUR de envío;Vendidos  13 oct 2021Artículo vendido;desde Reino Unido;
Bomberman Max: Blue Champion Nintendo Game Boy Color GBC;150,00 EUR;Envío no especificado;Vendidos  13 oct 2021Artículo vendido;desde Alemania;
Monster Max Game Boy UKV ;14,00 EUR;Envío internacional gratis;Vendidos  29 sep 2021Artículo vendido;desde Francia;
Bomberman Max 2 versión Rojo-Nintendo Gameboy Advance GBA Juego-EUR PAL;8,38 EUR;+ 11,72 EUR de envío;Vendidos  26 sep 2021Artículo vendido;desde Reino Unido;
Max (escombros Saver II) para la Nintendo Gameboy CIB en Caja;175,74 EUR;+ 12,89 EUR de envío;Vendidos  22 sep 2021Artículo vendido;desde Reino Unido;
Bomberman Max : Blue Champion Version - Jeu Game Boy Color GBC JAP Japan ;4,42 EUR;Envío no especificado;Vendidos  20 sep 2021Artículo vendido;desde Francia;
Nintendo Game Boy Advance GBA - Bomberman Max 2 : Blue Advance - PAL - USA;12,99 EUR;+ 5,00 EUR de envío;Vendidos  10 sep 2021Artículo vendido;desde Francia;
Action Replay Max Nintendo DS Lite/ Game Boy Advance;50,00 EUR;Envío no especificado;Vendidos  8 sep 2021Artículo vendido;desde Francia;
