Max Payne (Nintendo Game Boy Advance, 2004) - Versión Europea;23,39 EUR;+ 17,32 EUR de envío estimado;desde Reino Unido;
Monster Max-Game Boy-Completo En Caja-auténtico-Raro;78,86 EUR;+ 7,09 EUR de envío;desde Portugal;
Monster Max Gameboy Game Boy gb Classic OVP EUR cib;99,90 EUR;+ 10,00 EUR de envío;desde Alemania;
Gameboy light Max Top estado con embalaje original coleccionista estado Nintendo Game Boy;99,00 EUR;+ 15,99 EUR de envío;desde Alemania;
Max Payne Nintendo-Game Boy Advance-GBA (AGB-P-bmee);152,13 EUR;+ 28,09 EUR de envío;desde Reino Unido;
Bomberman Max: Rojo Challenger de vídeo juego para Nintendo Game Boy Color japonés;9,35 EUR;+ 17,03 EUR de envío estimado;desde Reino Unido;
Max Payne (Nintendo Game Boy Advance, 2004) - Versión Europea;29,13 EUR;Envío no especificado;desde Reino Unido;
Mini-Yonku GB: Let's & Go!!! Batalla De Las Estrellas Max Para Nintendo Game Boy japonés;5,84 EUR;+ 16,95 EUR de envío estimado;desde Reino Unido;
Nintendo Game Boy Classic juego Monster Max con embalaje original y guía frg #2;79,90 EUR;+ 8,99 EUR de envío;desde Alemania;
Game Boy ★ Max ★ PAL;29,99 EUR;Envío no especificado;desde España;
Bomberman Max 2-Nuevo/Sellado-Nintendo Game Boy Advance-GBA;64,34 EUR;+ 23,14 EUR de envío estimado;desde Reino Unido;
Nintendo Game Boy-Monster Max-Embalaje original-pal-Top;129,90 EUR;Envío no especificado;desde Alemania;
Bomberman Max 2 Azul Nintendo Game Boy Advance cartucho sólo;19,30 EUR;+ 17,24 EUR de envío estimado;desde Reino Unido;
Max-NINTENDO GAME BOY JUEGO solo Carro-UKV-RÁPIDO GRATIS UK FRANQUEO;46,80 EUR;+ 17,82 EUR de envío estimado;desde Reino Unido;
Bomberman Max 2-red Advance-solo módulo-GameBoy Game Boy Advance;32,54 EUR;+ 9,00 EUR de envío;desde Alemania;
8 Nintendo Game Boy Juegos Colección GB solo Módulos Power Rangers Mickey Mouse Max;99,90 EUR;+ 4,90 EUR de envío;desde Alemania;
✨ Metal Max 2 Kai Japan Mint Game Boy Advance GBA 2003 Nintendo Boxed  ✨;39,90 EUR;+ 28,10 EUR de envío;desde Francia;
Nintendo Game Boy Max (escombros Saver II) Raro en Caja con Instrucciones;210,64 EUR;+ 36,17 EUR de envío estimado;desde Reino Unido;
Nintendo Game Boy Classic juego Monster Max con embalaje original y guía frg;99,90 EUR;+ 8,99 EUR de envío;desde Alemania;
Bomberman Max: Red Challenger jeu Nintendo Game Boy Color Import Japon;7,99 EUR;+ 5,50 EUR de envío;desde Francia;
Nintendo Game Boy Advance Bomberman Max 2 EUR Très Bon état;12,90 EUR;+ 11,98 EUR de envío;desde Francia;
F-Zero Max Velocidad Juego Boy Advance pal 2001 Nuevo Sellado UKG no AFA 85NM!;269,16 EUR;+ 25,75 EUR de envío;desde Reino Unido;
Monster Max * Nintendo GameBoy * PAL  FAH;99,95 EUR;+ 21,00 EUR de envío;desde Países Bajos;
Original Nintendo Game Boy Color-bomberman Max Challenger;5,85 EUR;+ 20,69 EUR de envío estimado;desde Reino Unido;
Bomberman Max: Hikari no Yuusha Blue Version Nintendo Game Boy NTSC-J Import JAP;6,99 EUR;+ 3,00 EUR de envío;desde Francia;
✨ BomberMan Max Yami No Senchi Game Boy Color 2001 Nintendo Boxed CGB-A7BJ-JPN ✨;19,90 EUR;+ 28,10 EUR de envío;desde Francia;
F-Zero Max Velocidad GBA Game Boy Advance pal 2001 Nuevo Sellado UKG no AFA 80+casi como nuevo+!;234,05 EUR;+ 25,75 EUR de envío;desde Reino Unido;
F-Zero Max Velocidad GBA Game Boy Advance pal 2001 Nuevo Sellado UKG no AFA 85NM+!;269,16 EUR;+ 25,75 EUR de envío;desde Reino Unido;
Nintendo Game Boy Advance Bomberman Max 2 EUR Bon état;9,90 EUR;+ 14,98 EUR de envío;desde Francia;
Nintendo Gameboy juego-Max-Embalaje original-pal-rar-Top;89,90 EUR;Envío no especificado;desde Alemania;
Bomberman Max-Nintendo Game Boy Color-NTSC JAP-B-Ware;10,37 EUR;+ 0,99 EUR de envío;desde Austria;
Bomberman Max 2 Blue Advance - Nintendo GameBoy Advance EUR - Neuf;30,00 EUR;+ 9,65 EUR de envío;desde Francia;
F-Zero Max Velocidad Game Boy Advance Game Boy Advance pal 2001 Nuevo Sellado UKG no AFA 85NM;277,18 EUR;+ 17,72 EUR de envío;desde Reino Unido;
F-Cero Max Velocity GBA Game Boy Advance Pal 2001 Nuevo Sellado Ukg Not Afa 80+;234,31 EUR;+ 25,78 EUR de envío;desde Reino Unido;
F-Cero Max Velocity Game Boy Advance Pal 2001 Nuevo Precintado Ukg No Afa 85NM;269,46 EUR;+ 25,78 EUR de envío;desde Reino Unido;
Mini-Yonku Let's & Go Batalla De Las Estrellas Max Nintendo Game Boy Japón DMG-P-aamj;29,25 EUR;+ 21,55 EUR de envío estimado;desde Reino Unido;
Bomberman Max-Nintendo Game Boy Color-NTSC JAP-B-Ware;10,22 EUR;+ 0,99 EUR de envío;desde Austria;
Nuevo Sellado Max Payne GBA Game Boy Advance;187,25 EUR;+ 15,21 EUR de envío;desde Reino Unido;
Nintendo Gameboy Advance Max Payne Genuino carro.;35,10 EUR;+ 17,58 EUR de envío estimado;desde Reino Unido;
Nintendo Gameboy Advance GBA Max Payne Genuino Carro;30,42 EUR;+ 10,53 EUR de envío;desde Reino Unido;
Monster Max - UKV - Nintendo Gameboy;99,00 EUR;+ 25,00 EUR de envío;desde Países Bajos;
Nintendo Game Boy Greg Hastings Paintball Torneo Max sería Advance;5,85 EUR;+ 5,85 EUR de envío;desde Lituania;
Nintendo Gameboy Advance Max Payne Juego Original * Plus Carcasa;23,37 EUR;+ 17,32 EUR de envío estimado;desde Reino Unido;
Apple iPhone XS Max Case Gamer | Teléfono Cubierta Trasera;10,47 EUR;+ 5,84 EUR de envío;desde Reino Unido;
