Nintendo Game Boy Darkwing Duck FAH Très Bon état #1;19,90 EUR;+ 11,98 EUR de envío;desde Francia;
Nintendo Game Boy Classic juego Darkwing Duck módulo NOE;19,90 EUR;+ 8,99 EUR de envío;desde Alemania;
Disney's Darkwing Duck Nintendo Gameboy Juego PAL solo carro;21,05 EUR;+ 7,61 EUR de envío;desde Reino Unido;
Nintendo Gameboy-Darkwing Duck-Embalaje original-Top-Pal;179,90 EUR;Envío no especificado;desde Alemania;
Nintendo Gameboy Darkwing Duck Cartucho Gwo Gratis Reino Unido franqueo;17,54 EUR;+ 17,20 EUR de envío estimado;desde Reino Unido;
Nintendo Gameboy Darkwing Duck;16,37 EUR;+ 17,18 EUR de envío estimado;desde Reino Unido;
Gb-Darkwing Duck para Nintendo GameBoy;24,95 EUR;+ 9,95 EUR de envío;desde Alemania;
notice Nintendo Game Boy Darkwing Duck FAH Bon état;16,90 EUR;+ 11,98 EUR de envío;desde Francia;
Notice Nintendo Game Boy Darkwing Duck FAH Bon état;16,90 EUR;+ 11,98 EUR de envío;desde Francia;
1993 Capcom Darkwing Duck NES Game Boy Vintage Promo Poster / Ad Page Framed;34,85 EUR;+ 15,33 EUR de envío;desde Alemania;
Gameboy Darkwing Duck Solo Manual;11,69 EUR;+ 17,07 EUR de envío estimado;desde Reino Unido;
Darkwing Duck - FAH - Manual Nintendo Gameboy Classic;12,00 EUR;+ 5,00 EUR de envío;desde Países Bajos;
Notice de Darkwing Duck pour Nintendo Game Boy FAH - Floto Games;11,90 EUR;Envío no especificado;desde Francia;
Darkwing Duck Gameboy FAH;180,00 EUR;Envío no especificado;desde Países Bajos;
Darkwing Duck (Nintendo Game Boy Classic juego) solo módulo-DMG-DC-Estados Unidos;19,99 EUR;Envío no especificado;desde Alemania;
Nintendo Gameboy Darkwing Duck GB Cart Only DMG-DC-FAH;13,50 EUR;Envío no especificado;desde Países Bajos;
