Mega Man II 2 para Nintendo GameBoy;13,99 EUR;Envío no especificado;Vendidos  10 nov 2021Artículo vendido;desde Alemania;
Mega Man II (2) Game Boy eur gameboy nintendo;18,90 EUR;+ 9,00 EUR de envío;Vendidos  8 nov 2021Artículo vendido;desde Francia;
Nintendo Gameboy Mega Man II Versión en Caja Muy Raro Vers;352,49 EUR;+ 39,35 EUR de envío estimado;Vendidos  11 oct 2021Artículo vendido;desde Reino Unido;
Nintendo Game Boy Classic juego Mega Man II 2 módulo Noe;14,90 EUR;+ 8,99 EUR de envío;Vendidos  29 sep 2021Artículo vendido;desde Alemania;
Mega Man II (2) Game Boy FAH ;15,00 EUR;Envío internacional gratis;Vendidos  23 sep 2021Artículo vendido;desde Francia;
Mega Man II (Game Boy GB 1991) Solo Cartucho;26,31 EUR;+ 12,90 EUR de envío;Vendidos  22 sep 2021Artículo vendido;desde España;
Nintendo Gameboy Juego-Mega Man II 2;23,22 EUR;+ 17,39 EUR de envío estimado;Vendidos  9 sep 2021Artículo vendido;desde Reino Unido;
Mega Man II-Nintendo Game Boy-Probado -! envío Gratis!;22,05 EUR;Envío gratis;Vendidos  23 nov 2021Artículo vendido;desde Estados Unidos;
Nintendo Game Boy Classic juego Mega Man III 3 módulo fah;24,90 EUR;+ 8,99 EUR de envío;Vendidos  6 sep 2021Artículo vendido;desde Alemania;
