Nintendo Game Boy Classic juego The Little Mermaid con embalaje original y guía EE. UU.;69,90 EUR;+ 8,99 EUR de envío;desde Alemania;
Nintendo Game Boy Game-The Little Mermaid-Ariel-Embalaje original-us-rar;79,90 EUR;Envío no especificado;desde Alemania;
Ariel The Little Mermaid - Game Boy GB Nintendo - PAL;42,90 EUR;+ 12,00 EUR de envío;desde Italia;
Nintendo Game Boy Advance GBA - The Little Mermaid : Magic In Two Kingdoms - USA;7,99 EUR;+ 5,00 EUR de envío;desde Francia;
The Little Mermaid /La Petite Sirène - Disney Classic -  Gameboy - Nintendo;24,99 EUR;+ 5,28 EUR de envío;desde Francia;
The Little Mermaid Game Boy versione Italiana;14,00 EUR;+ 6,60 EUR de envío;desde Italia;
Nintendo Gameboy Color-The Little Mermaid 2/Pinball-VGA 85+ nm +/embalaje original-nuevo;650,00 EUR;Envío no especificado;desde Alemania;
Notice NIntendo Game Boy  Disney's The Little Mermaid NFHU Très Bon état;5,90 EUR;+ 11,98 EUR de envío;desde Francia;
Nintendo Gameboy Classic juego-The Little Mermaid-nuevo-SEALED-VGA? Wata?;279,99 EUR;+ 75,00 EUR de envío;desde Alemania;
Time of Vintage - Game Boy Gameboy Color The Little Mermaid II 2 Pinball EZ-A916;13,99 EUR;+ 15,00 EUR de envío;desde Italia;
Nintendo Game Boy - The Little Mermaid - PAL - EUR;7,99 EUR;+ 5,00 EUR de envío;desde Francia;
Game Boy-color-The Little Mermaid II-Pinball Frenzy-solo módulo-usado;14,99 EUR;+ 6,95 EUR de envío;desde Alemania;
Disney's The Little Mermaid Game Boy Advance GBA Box Manual NO GAME pas de cale;11,90 EUR;+ 7,80 EUR de envío;desde Francia;
♠ Nintendo Jeu The Little Mermaid Game Boy Classique ♠;20,00 EUR;Envío no especificado;desde Francia;
Gameboy The Little Mermaid;7,55 EUR;Envío no especificado;desde Francia;
Game Boy Gameboy Color The Little Mermaid II 2 Pinball;22,50 EUR;Envío no especificado;desde España;
