Nintendo Game Boy Classic juego Swamp Thing módulo fah;24,90 EUR;+ 8,99 EUR de envío;Vendidos  17 dic 2021Artículo vendido;desde Alemania;
Gameboy Swamp Thing instrucciones instruction cuadernillo EE. UU.;29,90 EUR;+ 8,99 EUR de envío;Vendidos  1 dic 2021Artículo vendido;desde Alemania;
Swamp Thing/GameBoy/THQ;24,50 EUR;Envío no especificado;Vendidos  19 nov 2021Artículo vendido;desde Alemania;
Swamp Thing Nintendo Gameboy Juego solo carro;17,51 EUR;+ 34,98 EUR de envío estimado;Vendidos  21 oct 2021Artículo vendido;desde Reino Unido;
Swamp Thing (Nintendo Game Boy) Auténtico/Raro-Probado;79,71 EUR;Envío gratis;Vendidos  14 dic 2021Artículo vendido;desde Estados Unidos;
Swamp Thing ~ Nintendo Gameboy ~ Muy Raro ~ Probado Funcionando;47,39 EUR;+ 3,94 EUR de envío;Vendidos  10 dic 2021Artículo vendido;desde Estados Unidos;
Mercancía de servicio de 1992/93 Gameboy Sega Barbie TMT Swamp Thing;25,69 EUR;+ 8,24 EUR de envío;Vendidos  2 dic 2021Artículo vendido;desde Estados Unidos;
Swamp Thing (Nintendo Game Boy) Auténtico-RARE-Probado-trabajo;42,52 EUR;+ 3,94 EUR de envío;Vendidos  20 nov 2021Artículo vendido;desde Estados Unidos;
Swamp Thing Gameboy Muy Raro;31,89 EUR;+ 6,02 EUR de envío;Vendidos  16 oct 2021Artículo vendido;desde Estados Unidos;
Swamp Thing-Metal-Knight Models-Batman Juego de Miniaturas-Fuera de imprenta;17,51 EUR;+ 22,13 EUR de envío estimado;Vendidos  25 sep 2021Artículo vendido;desde Reino Unido;
