Nuevo anuncioNintendo Game Boy *Atomic Punk* OVP CiB Manual Póster Funda Protectora HB-USA;349,95 EUR;+ 35,99 EUR de envío;desde Alemania;
Vintage Nintendo GameBoy Game Niño Bomber Boy Atomic Punk * Importado Japonés *;7,99 EUR;+ 11,16 EUR de envío;desde Reino Unido;
NINTENDO GAMEBOY Atomic Punk Cartucho EE. UU. Gratis UK FRANQUEO;17,57 EUR;+ 17,27 EUR de envío estimado;desde Reino Unido;
Nintendo GameBoy juego - Atomic Punk embalage estropeado NUEVO Y CON EL EMBALAJE;390,99 EUR;+ 69,99 EUR de envío;desde Alemania;
BOMBER Boy gb NINTENDO GAME BOY GBC Japonés multirregión bomberman Atomic Punk;7,55 EUR;Envío no especificado;desde España;
Atomic Punk Para Nintendo Game Boy! envío rápido!;17,60 EUR;+ 3,22 EUR de envío;desde Estados Unidos;
Atomic Punk-Nintendo Game Boy - 1990-Hudson Soft-Japón Importación;13,68 EUR;Envío internacional gratis;desde Japón;
Atomic Punk Game Boy - Cartridge Only Authentic - Tested;17,30 EUR;+ 4,81 EUR de envío;desde Canadá;
Bomber Boy Atomic Punk Original Gameboy GB Japón importación Vendedor de Estados Unidos;9,71 EUR;Envío gratis;desde Estados Unidos;
Bomber Boy ~ Atomic Punk (Nintendo Game Boy GB, 1990) Japan Import;8,99 EUR;+ 3,98 EUR de envío;desde Canadá;
Nintendo Game Boy - Bomber Boy (Atomic Punk/Dynablaster) Bomberman for GameBoy!;18,91 EUR;+ 18,91 EUR de envío;desde Australia;
Bomber Boy Atomic Punk Gameboy Japan Import Game Only North American Seller ;12,45 EUR;+ 6,92 EUR de envío;desde Canadá;
Atomic Punk--Nintendo Game Boy--NTSC JAP--B-Ware;12,54 EUR;+ 0,99 EUR de envío;desde Austria;
Atomic Punk--Nintendo Game Boy--NTSC JAP--C-Ware;11,88 EUR;+ 0,99 EUR de envío;desde Austria;
Atomic Punk Juego Boy Gb;441,15 EUR;+ 17,65 EUR de envío;desde México;
Bomber Boy Atomic Punk Gameboy GB japonés vendedor Original De Japón;7,05 EUR;Envío internacional gratis;desde Japón;
Nintendo GameBoy Bomber Boy Atomic Punk DMG-HBA Japan;13,87 EUR;+ 9,46 EUR de envío;desde Australia;
Nintendo GameBoy Juego Atomic Punk Caja Dañada Nuevo + En Caja;403,01 EUR;Envío internacional gratis;desde Alemania;
Nintendo GameBoy game - Atomic Punk Box damaged NEW & BOXED;421,47 EUR;+ 55,36 EUR de envío;desde Alemania;
Juego De Nintendo Gameboy-Atomic Punk Caja Dañada Nuevo y Sellado;380,26 EUR;Envío internacional gratis;desde Alemania;
Nintendo GameBoy - Atomic Punk imballaggio danneggiato NUOVO E CON L'IMBALLAGGIO;388,99 EUR;+ 69,99 EUR de envío;desde Alemania;
Nintendo GameBoy jeu - Atomic Punk emballage endommagÃ© NEUFS & AVEC L'EMBALLAGE;388,99 EUR;+ 69,99 EUR de envío;desde Alemania;
Bomber Boy (Atomic Punk) for Nintendo GAMEBOY [DMG-HBA];13,84 EUR;+ 12,61 EUR de envío;desde Australia;
Atomic Punk Nintendo Gameboy Cartridge ONLY ;17,30 EUR;Envío internacional gratis;desde Canadá;
