Loopz Nintendo Game Boy juego muy buen estado probado;6,99 EUR;+ 9,99 EUR de envío;Vendidos  14 sep 2021Artículo vendido;desde Alemania;
Loopz, juego con funda protectora, Nintendo Game Boy;5,33 EUR;+ 4,22 EUR de envío;Vendidos  3 dic 2021Artículo vendido;desde Estados Unidos;
Loopz (Nintendo Gameboy);8,85 EUR;Envío gratis;Vendidos  1 nov 2021Artículo vendido;desde Estados Unidos;
 Nintendo Gameboy GB GBC GBA SP LOT - Rodland Prince of persia Loopz FRG SET;45,00 EUR;+ 15,00 EUR de envío;Vendidos  20 oct 2021Artículo vendido;desde Países Bajos;
Loopz-Mindscape internacional Japón-Nintendo Game Boy - 1990-Japón Importación;8,89 EUR;Envío internacional gratis;Vendidos  18 oct 2021Artículo vendido;desde Japón;
Original Nintendo GameBoy DMG-01 Portátil Cargador probado y de trabajo y Loopz;53,35 EUR;+ 13,03 EUR de envío;Vendidos  16 sep 2021Artículo vendido;desde Estados Unidos;
Gameboy Loopz;6,13 EUR;+ 4,89 EUR de envío;Vendidos  13 sep 2021Artículo vendido;desde Estados Unidos;
