 Nintendo Gameboy GB GBC GBA SP LOT - Rodland Prince of persia Loopz FRG SET;45,00 EUR;+ 15,00 EUR de envío;Vendidos  20 oct 2021Artículo vendido;desde Países Bajos;
Loopz Nintendo Game Boy juego muy buen estado probado;6,99 EUR;+ 9,99 EUR de envío;Vendidos  14 sep 2021Artículo vendido;desde Alemania;
Lote De Juego Gameboy: Spiderman (Gameboy color), Tetris 2, & Loopz (Gameboy);8,86 EUR;+ 4,87 EUR de envío;Vendidos  9 dic 2021Artículo vendido;desde Estados Unidos;
Loopz, juego con funda protectora, Nintendo Game Boy;5,32 EUR;+ 4,21 EUR de envío;Vendidos  3 dic 2021Artículo vendido;desde Estados Unidos;
Loopz (Nintendo Gameboy);8,82 EUR;Envío gratis;Vendidos  1 nov 2021Artículo vendido;desde Estados Unidos;
Loopz-Mindscape internacional Japón-Nintendo Game Boy - 1990-Japón Importación;8,86 EUR;Envío internacional gratis;Vendidos  18 oct 2021Artículo vendido;desde Japón;
Original Nintendo GameBoy DMG-01 Portátil Cargador probado y de trabajo y Loopz;53,17 EUR;+ 14,13 EUR de envío;Vendidos  16 sep 2021Artículo vendido;desde Estados Unidos;
Gameboy Loopz;6,11 EUR;+ 4,87 EUR de envío;Vendidos  13 sep 2021Artículo vendido;desde Estados Unidos;
