Cliffhanger Juego Boy Cartucho Raro;32,79 EUR;+ 17,54 EUR de envío estimado;Vendidos  23 nov 2021Artículo vendido;desde Reino Unido;
Cliffhanger Nintendo Game Boy Original Gameboy Juego Cartucho solo. probado!;13,54 EUR;+ 4,21 EUR de envío;Vendidos  13 dic 2021Artículo vendido;desde Estados Unidos;
Lote NES-Juegos 56, 12 de equipos, y más-NES, SNES, Gameboy-Cliffhanger;854,53 EUR;+ 96,68 EUR de envío;Vendidos  7 dic 2021Artículo vendido;desde Estados Unidos;
⭐ Cliffhanger Nintendo Game Boy Original Gameboy limpiado cartucho de juego probadas ⭐ 👀;13,29 EUR;+ 2,83 EUR de envío;Vendidos  4 dic 2021Artículo vendido;desde Estados Unidos;
Cliffhanger (Nintendo Game Boy) GB;8,85 EUR;+ 3,98 EUR de envío;Vendidos  18 nov 2021Artículo vendido;desde Estados Unidos;
Cliffhanger (Nintendo Game Boy, 1993) Clásico Divertido Juego Cartucho Probado Funciona;11,51 EUR;Envío gratis;Vendidos  12 nov 2021Artículo vendido;desde Estados Unidos;
Cliffhanger Juego BOY Gameboy Sellado Nuevo Nunca Abierto;411,70 EUR;+ 7,53 EUR de envío;Vendidos  8 nov 2021Artículo vendido;desde Estados Unidos;
⭐ Cliffhanger Nintendo Game Boy Original Gameboy limpiado cartucho de juego probadas ⭐ 👀;12,01 EUR;+ 3,36 EUR de envío;Vendidos  7 nov 2021Artículo vendido;desde Estados Unidos;
