Nintendo Gameboy juego-George Foreman's KO Boxing-Embalaje original-pal-rar-Top;69,90 EUR;Envío no especificado;desde Alemania;
GAME BOY George Foreman's KO Boxing USA NINTENDO COLOR ADVANCE CARTOUCHE SEULE;8,00 EUR;+ 15,00 EUR de envío;desde Francia;
Game Boy-George Foreman's KO Boxing DMG-JK-noe OVP instrucciones cib-Nintendo;39,95 EUR;Envío no especificado;desde Alemania;
George Foreman's KO Boxing Nintendo Gameboy OVP cib Boxed;32,90 EUR;Envío no especificado;desde Alemania;
George Foreman's KO Boxing - Gameboy Classic - USA - GB CIB;34,99 EUR;+ 9,70 EUR de envío;desde Bélgica;
Nintendo Game Boy George Foreman's KO Boxing (con Folleto);13,23 EUR;Envío gratis;desde Estados Unidos;
George Foreman's KO Boxing UKV - Nintendo GameBoy - NGB;4,21 EUR;+ 19,95 EUR de envío;desde Países Bajos;
Nintendo Gameboy Manual Authentic George Foreman's KO Boxing;8,30 EUR;+ 3,46 EUR de envío;desde Canadá;
Jeu George Foreman's KO Boxing pour Sega Game Gear PAL - Floto Games;9,90 EUR;+ 5,00 EUR de envío;desde Francia;
SEGA Game Gear - George Foreman's KO Boxing - PAL;7,99 EUR;+ 5,50 EUR de envío;desde Francia;
Nes Nintendo, George Foreman's KO Boxing-Embalaje original-Top-pal-alemán;89,90 EUR;Envío no especificado;desde Alemania;
George Foreman's KO Boxing - SEGA Master System - Complet - PAL - Très Bon Etat;34,40 EUR;+ 24,90 EUR de envío;desde Francia;
George Foreman's KO Boxing (Game Gear GG 1992) Solo cartucho;9,90 EUR;+ 9,90 EUR de envío;desde España;
Nes Nintendo, George Foreman's KO Boxing-Embalaje original-Top-pal-alemán;79,90 EUR;Envío no especificado;desde Alemania;
Super Nintendo George Foreman's KO Boxing USA état correct;6,90 EUR;+ 14,98 EUR de envío;desde Francia;
George Foreman's KO Boxing - Super Nintendo SNES Nintendo - USA;26,90 EUR;+ 13,50 EUR de envío;desde Italia;
Super Nintendo SNES George Foreman's KO Boxing PAL;29,99 EUR;+ 7,65 EUR de envío;desde Francia;
George Foreman's KO Boxing, cartucho para compatibles Nintendo NES 60 pin, NUEVO;2,99 EUR;+ 18,00 EUR de envío;desde España;
SNES-George Foreman's KO Boxing para Super Nintendo;9,95 EUR;+ 9,95 EUR de envío;desde Alemania;
Nintendo NES juego - George Foreman's KO Boxing PAL-B cartucho usado;24,99 EUR;Envío internacional gratis;desde Alemania;
# Sega Master System-George Foreman's KO Boxing (sólo el módulo, sin OVP) #;12,98 EUR;+ 8,00 EUR de envío;desde Alemania;
# Sega Master System-George Foreman's KO Boxing/MS juego #;18,98 EUR;+ 8,00 EUR de envío;desde Alemania;
