Tesserae ? Nintendo Gameboy ? Módulo solamente ? Game Boy;8,91 EUR;+ 5,99 EUR de envío;desde Alemania;
Tesserae videogioco per Nintendo Game Boy Classic con scatola funzionante;15,99 EUR;+ 17,00 EUR de envío;desde Italia;
Nintendo Game Boy - Tesserae - PAL - FAH;14,99 EUR;+ 4,60 EUR de envío;desde Francia;
Tesserae (Nintendo Game Boy) -Cart Only;19,97 EUR;+ 4,13 EUR de envío;desde Canadá;
Tetris Plus Tetris Blast Tesserae More Game Lot (Nintendo Gameboy) Tested;27,55 EUR;+ 15,16 EUR de envío;desde Canadá;
Tesserae (game Boy) Gb;7,91 EUR;+ 3,53 EUR de envío;desde Estados Unidos;
