Tesserae ? Nintendo Gameboy ? Módulo solamente ? Game Boy;8,46 EUR;+ 5,99 EUR de envío;desde Alemania;
Nintendo Game Boy - Tesserae - PAL - FAH;14,99 EUR;+ 4,60 EUR de envío;desde Francia;
Tesserae (Nintendo Game Boy) -Cart Only;19,81 EUR;+ 4,10 EUR de envío;desde Canadá;
Tetris Plus Tetris Blast Tesserae More Game Lot (Nintendo Gameboy) Tested;27,33 EUR;+ 15,04 EUR de envío;desde Canadá;
Tesserae (game Boy) Gb;7,93 EUR;+ 3,54 EUR de envío;desde Estados Unidos;
Tesserae Gameboy Perfectas Condiciones Envío rápido;11,90 EUR;+ 3,53 EUR de envío;desde Estados Unidos;
