ISS International Superstar Soccer Nintendo Gameboy Advance Juego;5,85 EUR;+ 8,09 EUR de envío;Vendidos  1 dic 2021Artículo vendido;desde Reino Unido;
ISS International Superstar Soccer Nintendo Gameboy Advance Juego;5,80 EUR;+ 16,97 EUR de envío estimado;Vendidos  29 nov 2021Artículo vendido;desde Reino Unido;
Gameboy Color International Superstar Soccer 99;9,80 EUR;Envío no especificado;Vendidos  20 nov 2021Artículo vendido;desde Alemania;
International Superstar Soccer-NINTENDO GAMEBOY Juego C/w Estuche y las instrucciones;23,17 EUR;+ 36,30 EUR de envío estimado;Vendidos  7 nov 2021Artículo vendido;desde Reino Unido;
Nintendo Game Boy Color International Superstar Soccer 99 en Caja Con Manual;21,08 EUR;+ 17,30 EUR de envío estimado;Vendidos  6 nov 2021Artículo vendido;desde Reino Unido;
Nintendo Game Boy Advance GBA - International Superstar Soccer - ISS - PAL - EUR;7,99 EUR;+ 4,60 EUR de envío;Vendidos  1 nov 2021Artículo vendido;desde Francia;
Jeu International Superstar Soccer ISS pour Nintendo Game Boy EUR - Floto Games;7,90 EUR;+ 5,00 EUR de envío;Vendidos  18 oct 2021Artículo vendido;desde Francia;
Nintendo Game Boy Color International Superstar Soccer 99 en Caja Con Manual;11,60 EUR;+ 35,11 EUR de envío estimado;Vendidos  1 oct 2021Artículo vendido;desde Reino Unido;
International Superstar Soccer. Nintendo Game Boy Advance + Manual. sin Caja.;5,86 EUR;+ 35,60 EUR de envío estimado;Vendidos  20 sep 2021Artículo vendido;desde Reino Unido;
International Superstar Soccer 2000 GBC Nuevo Juego Boy Color;10,64 EUR;Envío gratis;Vendidos  4 nov 2021Artículo vendido;desde Estados Unidos;
1998 NINTENDO GAMEBOY Konami International Superstar Soccer Cartucho Completo En Caja;126,33 EUR;+ 8,82 EUR de envío;Vendidos  18 oct 2021Artículo vendido;desde Estados Unidos;
NTSC Super Nintendo SNES 16bit ISS International Superstar Soccer Juego no Deluxe;112,28 EUR;+ 8,69 EUR de envío;Vendidos  12 oct 2021Artículo vendido;desde Bélgica;
International Superstar Soccer SNES SUPER NINTENDO 100% Original Funciona ISSS B;44,33 EUR;+ 13,30 EUR de envío;Vendidos  11 oct 2021Artículo vendido;desde México;
International Superstar Soccer Super Nintendo SNES probado Genuino KONAMI Usa;199,46 EUR;+ 5,31 EUR de envío;Vendidos  3 oct 2021Artículo vendido;desde Estados Unidos;
NTSC Super Nintendo SNES 16bit ISS International Superstar Soccer Juego no Deluxe;123,23 EUR;+ 8,69 EUR de envío;Vendidos  18 sep 2021Artículo vendido;desde Bélgica;
Nintendo juego Cube Pal International Superstar Soccer 2 352;9,38 EUR;Envío internacional gratis;Vendidos  12 nov 2021Artículo vendido;desde Reino Unido;
Nintendo juego Cube Pal International Superstar Soccer 2 352;2,58 EUR;Envío internacional gratis;Vendidos  15 nov 2021Artículo vendido;desde Reino Unido;
PS1 juego ISS Pro 98 International Superstar Soccer ~ por favor leer;1,16 EUR;+ 33,54 EUR de envío estimado;Vendidos  16 sep 2021Artículo vendido;desde Reino Unido;
International Superstar Soccer 3 PS2 PlayStation 2 Video Juego UK release;2,81 EUR;+ 33,91 EUR de envío estimado;Vendidos  10 oct 2021Artículo vendido;desde Reino Unido;
Nintendo juego Cube Pal International Superstar Soccer 2 352;2,81 EUR;Envío internacional gratis;Vendidos  3 oct 2021Artículo vendido;desde Reino Unido;
International Superstar Soccer PS1 Playstation 1 video juego de la versión original de Reino Unido;3,15 EUR;+ 33,91 EUR de envío estimado;Vendidos  14 oct 2021Artículo vendido;desde Reino Unido;
International Superstar Soccer 64 ISS Nintendo 64 N64 juego PAL Versión;1,16 EUR;+ 6,86 EUR de envío;Vendidos  11 nov 2021Artículo vendido;desde Reino Unido;
International Superstar Soccer ISS N64 (Nintendo 64) versión europea PAL;2,33 EUR;+ 16,40 EUR de envío;Vendidos  3 dic 2021Artículo vendido;desde Reino Unido;
International Superstar Soccer pro'98 Juego Para Sony PlayStation PS1 Pal probado;23,43 EUR;+ 17,35 EUR de envío estimado;Vendidos  31 oct 2021Artículo vendido;desde Reino Unido;
International Superstar Soccer-Nintendo SNES-PAL -1995 - cartucho de juego solamente;12,88 EUR;+ 17,12 EUR de envío estimado;Vendidos  24 oct 2021Artículo vendido;desde Reino Unido;
International Superstar Soccer 98/ISS 98-Nintendo 64/N64-Reino Unido PAL-en Caja;15,24 EUR;+ 36,12 EUR de envío estimado;Vendidos  31 oct 2021Artículo vendido;desde Reino Unido;
Konami ISS International Superstar Soccer-Nuevo Y Sellado-Reino Unido PAL-Sony PS1;39,68 EUR;+ 36,65 EUR de envío estimado;Vendidos  11 nov 2021Artículo vendido;desde Reino Unido;
International Superstar Soccer 64 NINTENDO N64 completa CIB Reino Unido PAL Coleccionable;12,89 EUR;+ 29,29 EUR de envío;Vendidos  10 oct 2021Artículo vendido;desde Reino Unido;
PlayStation ps1: International Superstar Soccer pro;