Nuevo anuncioToy Story 2 NINTENDO GAME BOY Clásico Juego COLOUR ADVANCE SP Disney Original;9,30 EUR;+ 17,55 EUR de envío;desde Reino Unido;
Toy Story Nintendo Game Boy PAL ESPAÑA;89,99 EUR;+ 19,99 EUR de envío;desde España;
Nuevo anuncioToy Story | Game Boy | módulo original | Nintendo | muy buen estado;4,99 EUR;+ 4,00 EUR de envío;desde Alemania;
Toy Story (Nintendo Game Boy, 1996) solo carro GB;5,79 EUR;+ 32,90 EUR de envío estimado;desde Reino Unido;
6 cartridge NINTENDO GAME BOY: Dragon's Lair, Mario Land 2, R-Type, Toy Story...;55,00 EUR;Envío no especificado;desde Italia;
NINTENDO GAME BOY COLOR Juego-Disney Toy Story 2;9,36 EUR;+ 17,03 EUR de envío estimado;desde Reino Unido;
Nintendo Game Boy Color - Toy Story 2 - Notice / Instruction Manual;4,99 EUR;+ 3,60 EUR de envío;desde Francia;
Nintendo GAME BOY Colour Toy Story 2 Cartucho sólo probado y de trabajo;7,01 EUR;+ 18,09 EUR de envío estimado;desde Reino Unido;
Nintendo Game Boy Toy Story 2 FRA Bon état;6,90 EUR;+ 11,98 EUR de envío;desde Francia;
Nintendo Gameboy juego-Disneys Toy Story-Top-Embalaje original-Pal;79,90 EUR;Envío no especificado;desde Alemania;
Toy Story Game Boy PAL;9,95 EUR;+ 19,95 EUR de envío;desde España;
Nintendo Game Boy Disney Toy Story état correct;5,90 EUR;+ 11,98 EUR de envío;desde Francia;
Toy Story 2 gameboy color OVP cib Boxed;24,70 EUR;+ 3,50 EUR de envío;desde Alemania;
Toy Story 2 Nintendo Gameboy Color Juego/Genuino 1999 versión/Manual;11,69 EUR;+ 33,03 EUR de envío estimado;desde Reino Unido;
Toy Story Racer - Nintendo Game Boy Color GBC - PAL EUR;4,90 EUR;+ 5,80 EUR de envío;desde Francia;
Nuevo anuncioDisney's Toy Story 2 + un Bug's Life Nintendo Gameboy Paquete de Juego solamente carros PAL;12,86 EUR;+ 7,61 EUR de envío;desde Reino Unido;
Nintendo Gameboy Color-Toy Story Racer Robot Wars Thunderbirds Crazy Castle 4;15,16 EUR;+ 17,14 EUR de envío estimado;desde Reino Unido;
Notice - Toy Story 2 - Nintendo Game Boy Color GBC - PAL FRA;3,90 EUR;+ 5,80 EUR de envío;desde Francia;
Nintendo Game Boy juego Toy Story 2 sólo módulo;4,00 EUR;+ 9,99 EUR de envío;desde Alemania;
Nintendo Gameboy Color Toy Story 2 en caja con instrucciones muy limpio ￼;35,10 EUR;+ 17,58 EUR de envío estimado;desde Reino Unido;
Vintage Game Boy Nintendo Toy Story 2 Cartucho De Juego Disney;10,52 EUR;+ 18,57 EUR de envío estimado;desde Reino Unido;
Toy Story 2-juego De Gameboy-con Manual;8,18 EUR;+ 18,64 EUR de envío estimado;desde Reino Unido;
Cartucho De Juego De Toy Story Gameboy Gwo libre de gastos de envío del Reino Unido;15,20 EUR;+ 17,14 EUR de envío estimado;desde Reino Unido;
Nintendo Gameboy-Toy Story 2, Antz & A Bugs Life;13,99 EUR;+ 17,12 EUR de envío estimado;desde Reino Unido;
Nuevo anuncioJeu Nintendo Game Boy - Toy Story Racer - TBE;11,00 EUR;+ 3,50 EUR de envío;desde Francia;
Toy Story Racer - Game Boy Color - PAL EUU;6,99 EUR;+ 3,00 EUR de envío;desde Francia;
Disney's Princesa Fashion Boutique & Toy Story 2 - 2 Juegos PC Chicas Chicos Disney;3,50 EUR;+ 6,96 EUR de envío;desde Reino Unido;
52838 manual de instrucciones-Toy Story 2-Nintendo Game Boy Color () DMG-aoqp-UK;7,01 EUR;+ 5,84 EUR de envío;desde Reino Unido;
Toy Story Racer Para Nintendo Game Boy Color (solo carro);11,70 EUR;+ 17,07 EUR de envío estimado;desde Reino Unido;
Toy Story (Game Boy GB 1995) solo cartucho;9,90 EUR;+ 9,90 EUR de envío;desde España;
Toy Story 2-Nintendo Gameboy Color;5,83 EUR;+ 16,95 EUR de envío estimado;desde Reino Unido;
Toy Story 2 para gameboy color y Advance;7,75 EUR;+ 7,00 EUR de envío;desde Alemania;
Disney Toy Story Racer per Game Boy Color - LOOSE - PAL ;10,00 EUR;+ 3,50 EUR de envío;desde Italia;
Disney/Pixar's Toy Story Racer (Nintendo Game Boy Color, 2001) Completo en Caja en muy buena condición;46,80 EUR;+ 17,54 EUR de envío;desde Reino Unido;
Gameboy Color-Paquete Eldorado-belleza-Toy Story-Toonsylvania-Antz L @ @ K;18,67 EUR;+ 19,37 EUR de envío estimado;desde Reino Unido;
Disney/Pixar's Toy Story Racer (Nintendo Game Boy Color, 2001) - europea..;7,01 EUR;+ 18,76 EUR de envío estimado;desde Reino Unido;
Nintendo Gameboy Juego-Toy Story 2-Cartucho únicamente;9,35 EUR;+ 17,03 EUR de envío estimado;desde Reino Unido;
Toy Story Racer-Nintendo Gameboy Color;5,83 EUR;+ 16,95 EUR de envío estimado;desde Reino Unido;
Nintendo Gameboy-Wwf Wrestlemania 2000, Toy Story 2, depósito de rata;15,16 EUR;+ 17,14 EUR de envío estimado;desde Reino Unido;
Toy Story 2 Nintendo Gameboy Color Advance juego, solo carro;11,69 EUR;+ 21,17 EUR de envío estimado;desde Reino Unido;
Nintendo Game Boy Color Carro Toy Story Racer;8,13 EUR;+ 9,95 EUR de envío;desde Reino Unido;
Toy Story 2 Nintendo Gameboy genuino cartucho de juego;7,01 EUR;+ 16,97 EUR de envío estimado;desde Reino Unido;
Juego De Toy Story Nintendo Gameboy;23,41 EUR;+ 19,24 EUR de envío estimado;desde Reino Unido;
Nintendo Gameboy Color De Toy Story 2;21,05 EUR;+ 17,27 EUR de envío estimado;desde Reino Unido;
