Nuevo anuncioNintendo Game Boy *Boulder Dash* OVP CiB Manual BD-NOE;54,95 EUR;+ 6,70 EUR de envío;desde Alemania;
Game Boy * Boulder Dash * OVP instrucciones en cubierta protectora BD-noe;69,95 EUR;+ 6,70 EUR de envío;desde Alemania;
Boulder Dash Game Boy juego completo con embalaje original y guía;59,99 EUR;+ 8,00 EUR de envío;desde Alemania;
Nintendo Game Boy Classic juego Boulder Dash con embalaje original y guía Noe;79,90 EUR;+ 8,99 EUR de envío;desde Alemania;
Corredor, Boulder Dash, Bust a Move 2, Tetris. Genuino Gameboy. GB. juego Boy;37,63 EUR;+ 21,47 EUR de envío estimado;desde Reino Unido;
Boulder Dash-Nintendo Game Boy juego módulo con instrucciones & Case (cubierta protectora);29,99 EUR;+ 6,90 EUR de envío;desde Alemania;
Boulder Dash EX - Nintendo Gameboy Advance GBA - Complet - NTSC-J JAP JAPAN;69,90 EUR;+ 24,90 EUR de envío;desde Francia;
Nintendo Gameboy-Boulder Dash-Top-Embalaje original-Pal;79,90 EUR;Envío no especificado;desde Alemania;
Nintendo Gameboy Advance Boulder Dash Ex En Caja Con Manual;70,54 EUR;+ 23,36 EUR de envío estimado;desde Reino Unido;
Boulder Dash para Gameboy y color y Advance;9,99 EUR;+ 5,00 EUR de envío;desde Alemania;
Boulder Dash-GAMEBOY Juego-UKV;11,75 EUR;+ 17,16 EUR de envío estimado;desde Reino Unido;
Nintendo Game Boy Juego Boulder Dash en Caja Con Manual;52,91 EUR;+ 22,15 EUR de envío estimado;desde Reino Unido;
Nintendo Game Boy Boulder Dash JAP Très Bon état;11,90 EUR;+ 11,98 EUR de envío;desde Francia;
Boulder Dash Con Estuche Nintendo Gameboy Juego;11,75 EUR;+ 20,92 EUR de envío estimado;desde Reino Unido;
Boulder Dash (Game Boy GB 1990) Japan Import;9,90 EUR;+ 9,90 EUR de envío;desde España;
Nintendo Gameboy Juego-Boulder Dash;10,52 EUR;+ 17,13 EUR de envío estimado;desde Reino Unido;
Boulder Dash para Nintendo GameBoy;10,90 EUR;+ 6,50 EUR de envío;desde Alemania;
Nintendo Gameboy Boulder Dash juego con Estuche;14,11 EUR;+ 17,20 EUR de envío estimado;desde Reino Unido;
Boulder Dash / Cartucho Gameboy / Solo Cartucho - PAL NOE;9,95 EUR;+ 7,95 EUR de envío;desde España;
Boulder Dash Gameboy GBA Advance;10,00 EUR;+ 14,00 EUR de envío;desde Italia;
Nintendo GameBoy juego - Boulder Dash en el embalaje usado COMO NUEVO;110,99 EUR;+ 69,99 EUR de envío;desde Alemania;
Boulder Dash Nintendo Game Boy juego muy buen estado probado;14,99 EUR;+ 9,99 EUR de envío;desde Alemania;
Notice Nintendo GB Game Boy Boulder Dash FAH, Très Bon état;4,90 EUR;+ 11,98 EUR de envío;desde Francia;
Boulder Dash (Game Boy GB 1990) Solo Cartucho;14,90 EUR;+ 9,90 EUR de envío;desde España;
Nintendo Game Boy Juego Boulder Dash en Caja Con Manual;52,90 EUR;Envío no especificado;desde Reino Unido;
Boulder Dash - Nintendo Game Boy Import Jap;5,00 EUR;Envío no especificado;desde Francia;
Boulder Dash Nintendo Gameboy solo módulo ❎❎❎;9,99 EUR;Envío no especificado;desde Alemania;
Boulder Dash Nintendo Gameboy OVP cib Boxed;58,90 EUR;Envío no especificado;desde Alemania;
Juego Game Boy Advance 108 En 1 - Rockman 3+Twin Bee+Boulder Dash+Bomb Jack;6,00 EUR;Envío no especificado;desde España;
