Nintendo Gameboy juego-Power Racer-Embalaje original-us-rar-Top - Tecmo;249,90 EUR;Envío no especificado;desde Alemania;
 Nintendo Gameboy GB GBC GBA SP - Power Racer ASI PAL Rare Race game;18,00 EUR;+ 12,00 EUR de envío;desde Países Bajos;
Power Racer Nintendo Gameboy juego muy bien probado;22,99 EUR;+ 9,99 EUR de envío;desde Alemania;
Power Racer Tecmo Game Boy Nintendo DMG-PQ-ITA GameBoy Cartuccia ITA 1991;21,00 EUR;Envío no especificado;desde Italia;
Nintendo Game Boy Power Racer trabaja probado auténtico caso claro;5,31 EUR;+ 3,94 EUR de envío;desde Estados Unidos;
Power Racer Original NINTENDO GAMEBOY Juego Probado Funcionando auténtico!;13,35 EUR;Envío gratis;desde Estados Unidos;
Power Racer (Nintendo Game Boy);11,06 EUR;Envío gratis;desde Estados Unidos;
Power Racer-Nintendo GAME BOY;10,81 EUR;+ 3,90 EUR de envío;desde Estados Unidos;
Power Racer-Game Boy USA. Nintendo Gameboy. buen Estado! probado-auténtica;8,85 EUR;+ 2,52 EUR de envío;desde Estados Unidos;
Power Racer (Nintendo Game Boy) cartucho sólo;7,08 EUR;+ 3,81 EUR de envío;desde Estados Unidos;
Power Racer (Nintendo Game Boy);12,39 EUR;Envío gratis;desde Estados Unidos;
Power Racer (Nintendo Game Boy) Authentic Racing Game - Original Gameboy;15,02 EUR;+ 10,23 EUR de envío;desde Canadá;
Power Racer Nintendo Game Boy Advance, rara, ** Envío Gratis **;17,67 EUR;Envío gratis;desde Estados Unidos;
Power Racer Nintendo Game Boy Gameboy auténtico Original Retro Clásico!;9,70 EUR;Envío gratis;desde Estados Unidos;
Power Racer Nintendo Game Boy Gameboy auténtico Original Retro Clásico!;15,94 EUR;Envío gratis;desde Estados Unidos;
Nuevo anuncioPower Racer Nintendo Game Boy Cartridge (Worn Label);4,72 EUR6,26 EUR;+ 12,59 EUR de envío;desde Australia;
Lote de 7 Juegos Nintendo Gameboy Tetris, Golf, Quarterback Club, Power Racer;42,52 EUR;+ 7,40 EUR de envío;desde Estados Unidos;
Power Racer (Nintendo Game Boy);13,29 EUR;+ 4,87 EUR de envío;desde Estados Unidos;
Power Racer Game Boy Folleto De Instrucciones Manual Solamente;11,51 EUR;Envío gratis;desde Estados Unidos;
Power Racer Game Boy Folleto De Instrucciones Manual Solamente;14,62 EUR;Envío gratis;desde Estados Unidos;
Power Racer - Temco - Instruction Manual Booklet Only - Nintendo GameBoy GB;32,46 EUR;+ 10,24 EUR de envío;desde Canadá;
Power Racer Gameboy manual de instrucciones solamente muy buen Hermoso;12,59 EUR;+ 2,83 EUR de envío;desde Estados Unidos;
Nintendo Inserts Paperwork Game Boy Power Racer Instruction Booklet USA Tecmo;6,83 EUR;+ 14,33 EUR de envío;desde Canadá;
