Nintendo Gameboy-Casper;8,38 EUR;+ 17,00 EUR de envío estimado;Vendidos  1 dic 2021Artículo vendido;desde Reino Unido;
Casper españolizado version española game boy gameboy gbc;150,00 EUR;+ 14,99 EUR de envío;Vendidos  16 nov 2021Artículo vendido;desde España;
Juego original Casper de Nintendo Gameboy con caja y manual;22,00 EUR;Envío no especificado;Vendidos  3 oct 2021Artículo vendido;desde España;
Casper Fantasma Espíritu dimensiones ps2 Juego Los Chicos Niños Niñas-Raro;7,01 EUR;+ 19,26 EUR de envío estimado;Vendidos  2 oct 2021Artículo vendido;desde Reino Unido;
Casper y el trío fantasmal ps2 Juego Niños Boys & Girls-Excelente Estado;2,33 EUR;+ 19,17 EUR de envío estimado;Vendidos  22 sep 2021Artículo vendido;desde Reino Unido;
Nuevo anuncioCasper Juego Nintendo Game boy caja y papel trabajar solamente. no manual no reales de juego;13,29 EUR;Envío gratis;Vendidos  10 dic 2021Artículo vendido;desde Estados Unidos;
Casper-Nintendo Game Boy-Cartucho únicamente-Excelente Estado;2,65 EUR;+ 3,54 EUR de envío;Vendidos  10 dic 2021Artículo vendido;desde Estados Unidos;
Casper Completo en Caja auténtica con manual y tarjeta de registro (Game Boy);35,44 EUR;+ 4,43 EUR de envío;Vendidos  5 dic 2021Artículo vendido;desde Estados Unidos;
Casper (Nintendo Game Boy Color, 1999) Cart Only! ;11,12 EUR;+ 10,46 EUR de envío;Vendidos  29 nov 2021Artículo vendido;desde Canadá;
Casper-Nintendo Game Boy Con Manual-auténtica;4,96 EUR;+ 4,78 EUR de envío;Vendidos  29 nov 2021Artículo vendido;desde Estados Unidos;
F1 Race Rainbow Six Buffy Casper Mermaid Pinball Nintendo Gameboy Color Gba;34,95 EUR;+ 26,00 EUR de envío;Vendidos  24 nov 2021Artículo vendido;desde Austria;
Casper Gameboy Factory Sealed Wata 9.0 A+ Rare;218,21 EUR;+ 20,91 EUR de envío;Vendidos  20 nov 2021Artículo vendido;desde Canadá;
Sellado Casper Gameboy Sellado repartidor de periódicos y Rampage Gameboy;132,91 EUR;+ 4,61 EUR de envío;Vendidos  16 nov 2021Artículo vendido;desde Estados Unidos;
Casper Completo en Caja auténtica con manual y tarjeta de registro (Game Boy);28,35 EUR;+ 5,54 EUR de envío;Vendidos  16 nov 2021Artículo vendido;desde Estados Unidos;
Casper (Nintendo Game Boy Advance, GBA) Cartucho Completo En Caja;44,30 EUR;Envío gratis;Vendidos  5 nov 2021Artículo vendido;desde Estados Unidos;
Casper Game Boy Advance Gba Solo Manual De Instrucciones;7,42 EUR;Envío gratis;Vendidos  23 oct 2021Artículo vendido;desde Estados Unidos;
Casper (Nintendo Game Boy Color, 1998) Auténtico Cartucho probado + limpio;8,82 EUR;Envío gratis;Vendidos  23 oct 2021Artículo vendido;desde Estados Unidos;
Casper (Nintendo Game Boy, 1996) Cartucho Perfecto Estado etiqueta auténtico;0,88 EUR;+ 4,21 EUR de envío;Vendidos  17 oct 2021Artículo vendido;desde Estados Unidos;
Casper Nintendo Game Boy probado-trabajo;7,09 EUR;+ 3,99 EUR de envío;Vendidos  14 oct 2021Artículo vendido;desde Estados Unidos;
Casper (Nintendo Game Boy Color, 1999) Auténtico Cartucho probado + limpio;8,85 EUR;Envío gratis;Vendidos  3 oct 2021Artículo vendido;desde Estados Unidos;
Lote de juego de dos Gameboy Color Casper 102 Dalmations;16,84 EUR;Envío gratis;Vendidos  30 sep 2021Artículo vendido;desde Estados Unidos;
Casper-Nintendo GameBoy GB solo carro;3,93 EUR;+ 3,36 EUR de envío;Vendidos  30 sep 2021Artículo vendido;desde Estados Unidos;
Casper Nintendo Game Boy En Caja Con Insertos Muy Raro;44,22 EUR;+ 7,71 EUR de envío;Vendidos  29 sep 2021Artículo vendido;desde Estados Unidos;
Casper (Nintendo Game Boy Advance, 2002);8,60 EUR;+ 4,08 EUR de envío;Vendidos  28 sep 2021Artículo vendido;desde Estados Unidos;
Casper Nintendo Gameboy Advance (G092);13,28 EUR;+ 3,10 EUR de envío;Vendidos  25 sep 2021Artículo vendido;desde Estados Unidos;
Nintendo Gameboy Casper Juego De Video// Probado Usado;0,88 EUR;+ 4,08 EUR de envío;Vendidos  20 sep 2021Artículo vendido;desde Estados Unidos;
Casper-Game Boy Advance GBA, auténtico Cartucho sólo, probado y de trabajo;10,63 EUR;Envío gratis;Vendidos  18 sep 2021Artículo vendido;desde Estados Unidos;
Casper, Gameboy juego;4,87 EUR;Envío gratis;Vendidos  15 sep 2021Artículo vendido;desde Estados Unidos;
Casper Completo en Caja auténtica con manual y tarjeta de registro (Game Boy);41,16 EUR;+ 4,87 EUR de envío;Vendidos  13 sep 2021Artículo vendido;desde Estados Unidos;
