Choplifter II 2 juego módulo Nintendo Gameboy Classic-muy buen estado 2;20,99 EUR;Envío no especificado;Vendidos  8 nov 2021Artículo vendido;desde Alemania;
Choplifter II (2) - Nintendo Gameboy Game, Cartridge Only;8,99 EUR;Envío no especificado;Vendidos  4 nov 2021Artículo vendido;desde Irlanda;
Notice Choplifter II FAH Nintendo Game Boy Instruction Manual Booklet NM;9,00 EUR;+ 5,90 EUR de envío;Vendidos  1 nov 2021Artículo vendido;desde Francia;
Choplifter II 2 + póster + instrucciones de juego Nintendo Gameboy classic game boy Noe;29,99 EUR;+ 7,35 EUR de envío;Vendidos  24 oct 2021Artículo vendido;desde Alemania;
Gameboy Choplifter II en caja con instrucciones buenas condiciones de funcionamiento;35,12 EUR;+ 19,92 EUR de envío estimado;Vendidos  12 oct 2021Artículo vendido;desde Reino Unido;
Choplifter II 2 (Nintendo Gameboy) Solo Carro Juego Boy;11,51 EUR;Envío gratis;Vendidos  21 dic 2021Artículo vendido;desde Estados Unidos;
Choplifter II Nintendo Game Boy limpiado & probado Auténtico;15,94 EUR;Envío gratis;Vendidos  9 dic 2021Artículo vendido;desde Estados Unidos;
Choplifter II: rescate sobrevivir Gameboy Good 2815;5,75 EUR;+ 4,42 EUR de envío;Vendidos  6 dic 2021Artículo vendido;desde Estados Unidos;
Choplifter II 2 rescate sobrevivir (Nintendo Gameboy, 1991) Con Cartucho Y Estuche;16,72 EUR;Envío gratis;Vendidos  22 nov 2021Artículo vendido;desde Estados Unidos;
* Choplifter II/NINTENDO GAMEBOY Juego! probado! Seminuevo/Buen Estado!;10,62 EUR;Envío gratis;Vendidos  16 nov 2021Artículo vendido;desde Estados Unidos;
Choplifter II (Nintendo Game Boy, 1991) Authentic Tested;12,30 EUR;+ 10,25 EUR de envío;Vendidos  15 nov 2021Artículo vendido;desde Canadá;
Choplifter II Nintendo Game Boy;9,72 EUR;+ 2,61 EUR de envío;Vendidos  31 oct 2021Artículo vendido;desde Estados Unidos;
Choplifter II (Nintendo Game Boy, 1991);12,39 EUR;+ 4,21 EUR de envío;Vendidos  20 oct 2021Artículo vendido;desde Estados Unidos;
Choplifter II (Nintendo Game Boy, 1991) 2 [solo carro];13,28 EUR;Envío gratis;Vendidos  12 oct 2021Artículo vendido;desde Estados Unidos;
Choplifter II (Nintendo Game Boy, 1991) 2 [solo carro];12,39 EUR;Envío gratis;Vendidos  7 oct 2021Artículo vendido;desde Estados Unidos;
Jeu Nintendo Game Boy - Choplifter III - EUR - Loose;19,90 EUR;+ 6,70 EUR de envío;Vendidos  18 nov 2021Artículo vendido;desde Francia;
