Cool Spot Nintendo GAMEBOY ADVANCE GBA SP 💯% Genuino Probado;11,73 EUR;+ 17,13 EUR de envío estimado;desde Reino Unido;
Cool Spot Nintendo Game Boy Juego en Caja Completa;64,58 EUR;+ 43,26 EUR de envío estimado;desde Reino Unido;
Nuevo anuncioCool Spot + Paperboy + Mr. Do ! : 3 jeux Game Boy;29,90 EUR;+ 19,90 EUR de envío;desde Francia;
Nintendo Gameboy Juego-Cool Spot Usa;32,82 EUR;+ 17,59 EUR de envío estimado;desde Reino Unido;
Cool Spot Nintendo Gameboy genuino cartucho de juego;11,14 EUR;+ 17,12 EUR de envío estimado;desde Reino Unido;
Nintendo Gameboy Juego-Cool Spot;12,86 EUR;+ 17,16 EUR de envío estimado;desde Reino Unido;
Cool Spot (Nintendo Game Boy juego) solo módulo-estado muy bien, probado;7,79 EUR;Envío no especificado;desde Alemania;
Cool Spot Para Game Boy;13,30 EUR;Envío gratis;desde Estados Unidos;
Nintendo Game Boy Spot y Cool Spot Paquete;26,61 EUR;Envío gratis;desde Estados Unidos;
Super Mario Land Yoshi's Cookie Cool Spot Bugs Bunny 2 Animaniacs Juego Juegos Boy;62,10 EUR;Envío gratis;desde Estados Unidos;
Cool Spot juego Boy Video Juego Raro Gameboy 1990s Virgin Reino Unido EE. UU.;35,49 EUR;+ 2,98 EUR de envío;desde Estados Unidos;
Cool Spot Nintendo Game Boy;17,72 EUR;+ 3,50 EUR de envío;desde Estados Unidos;
Cool Spot Original Nintendo Gameboy Juego probado + trabajo & Auténtico! Raro!;22,17 EUR;Envío gratis;desde Estados Unidos;
* Probado! * Cool Spot (Nintendo Game Boy) 7-Up/Con Manual! auténtico!;31,98 EUR;Envío gratis;desde Estados Unidos;
The Cool Spot Adventure ( Game Boy );19,07 EUR;+ 6,93 EUR de envío;desde Canadá;
Cool Spot Nintendo Gameboy Original Game oz425;31,23 EUR;+ 16,88 EUR de envío;desde Australia;
Auténtico Raro Cool Spot (Nintendo Gameboy, 1993) probado y de trabajo;13,30 EUR;+ 4,21 EUR de envío;desde Estados Unidos;
Cool Spot Nintendo Gameboy Original Con Estuche Protector de plástico libre! envío rápido!;26,57 EUR;Envío gratis;desde Estados Unidos;
El folleto de instrucciones Manual Cool Spot Aventura Nintendo Game Boy Auténtico;11,53 EUR;Envío gratis;desde Estados Unidos;
Auténtico Raro Cool Spot (Nintendo Gameboy, 1993) probado y de trabajo;26,61 EUR;Envío gratis;desde Estados Unidos;
Cool Spot (Nintendo Gameboy, 1993) Auténtico CARTUCHO-PROBADO Y FUNCIONA;26,61 EUR;+ 3,82 EUR de envío;desde Estados Unidos;
Auténtico Raro Cool Spot (Nintendo Gameboy, 1993) probado y de trabajo;26,61 EUR;Envío gratis;desde Estados Unidos;
Original Nintendo Game Boy 7UP Cool Spot página de anuncio impreso de video juego de aventuras;8,83 EUR;+ 3,24 EUR de envío;desde Estados Unidos;
Cool Spot Game Boy Nintendo Llavero;1,81 EUR;+ 2,48 EUR de envío;desde España;
Cool Spot Nintendo Game Boy Fridge Magnet Magnete Frigorifero;2,22 EUR;+ 2,50 EUR de envío;desde España;
Cool Spot Original Nintendo Gameboy solo manual de instrucciones;88,72 EUR;+ 1,77 EUR de envío;desde Estados Unidos;
Cool Spot Nintendo Game Boy FRIDGE MAGNET;1,81 EUR;+ 2,48 EUR de envío;desde España;
Cool Spot Super Nintendo Snes Juego solo carro PAL Reino Unido EUR;14,08 EUR;+ 7,63 EUR de envío;desde Reino Unido;
Cool Spot Sega Game Gear Completo en Caja #0043;29,30 EUR;+ 17,51 EUR de envío estimado;desde Reino Unido;
Nuevo anuncioCool Spot Sega Game Gear Completo en Caja #0048;29,30 EUR;+ 17,51 EUR de envío estimado;desde Reino Unido;
Cool Spot-Original Sega Mega Drive juego 1993;9,38 EUR;+ 36,08 EUR de envío estimado;desde Reino Unido;
Cool Spot-Sega Mega Drive juego (en Caja Y Completo-Probado-Pal);17,56 EUR;+ 20,90 EUR de envío estimado;desde Reino Unido;
Cool Spot-Game Gear;10,00 EUR;+ 10,00 EUR de envío;desde Alemania;
Nuevo anuncioSega Game Gear-Cool Spot juego de Reino Unido - (DE CARTUCHO, Case, Caja Y Manual);14,68 EUR;+ 35,83 EUR de envío estimado;desde Reino Unido;
Nuevo anuncioCool Spot Sega Game Gear Completo en Caja #0002;32,82 EUR;+ 17,59 EUR de envío estimado;desde Reino Unido;
Cool Spot-Sega Master Sistema Juego (probado-Envío Rápido-Pal);5,81 EUR;+ 18,41 EUR de envío estimado;desde Reino Unido;
Cool Spot Sega Game Gear juego completo con caja y las instrucciones en en muy buena condición.;1,16 EUR;+ 34,13 EUR de envío estimado;desde Reino Unido;
Cool Spot-Sega Game Gear;8,20 EUR;+ 17,06 EUR de envío estimado;desde Reino Unido;
Sega Master System Cool Spot Module Manual Videojuego Pal Retro ;25,00 EUR;+ 20,00 EUR de envío;desde Alemania;
SEGA Game Gear - Cool Spot - PAL;14,99 EUR;+ 5,50 EUR de envío;desde Francia;
