Cool Spot Nintendo GAMEBOY ADVANCE GBA SP 💯% Genuino Probado;11,76 EUR;+ 17,17 EUR de envío estimado;desde Reino Unido;
Cool Spot Nintendo Game Boy Juego en Caja Completa;64,71 EUR;+ 43,35 EUR de envío estimado;desde Reino Unido;
Cool Spot + Paperboy + Mr. Do ! : 3 jeux Game Boy;29,90 EUR;+ 19,90 EUR de envío;desde Francia;
Nintendo Gameboy Juego-Cool Spot Usa;32,89 EUR;+ 17,63 EUR de envío estimado;desde Reino Unido;
Cool Spot Nintendo Gameboy genuino cartucho de juego;11,17 EUR;+ 17,16 EUR de envío estimado;desde Reino Unido;
Nintendo Gameboy Juego-Cool Spot;12,89 EUR;+ 17,19 EUR de envío estimado;desde Reino Unido;
Cool Spot (Nintendo Game Boy juego) solo módulo-estado muy bien, probado;7,79 EUR;Envío no especificado;