Cool Spot Nintendo Game Boy Juego en Caja Completa;64,36 EUR;+ 43,11 EUR de envío estimado;desde Reino Unido;
Cool Spot Nintendo GAMEBOY ADVANCE GBA SP 💯% Genuino Probado;11,69 EUR;+ 17,07 EUR de envío estimado;desde Reino Unido;
Nintendo Gameboy Juego-Cool Spot Usa;32,71 EUR;+ 17,53 EUR de envío estimado;desde Reino Unido;
Cool Spot Nintendo Gameboy genuino cartucho de juego;11,11 EUR;+ 17,06 EUR de envío estimado;desde Reino Unido;
Nintendo Gameboy Juego-Cool Spot;12,81 EUR;+ 17,10 EUR de envío estimado;desde Reino Unido;
Cool Spot (Nintendo Game Boy juego) solo módulo-estado muy bien, probado;7,79 EUR;Envío no especificado;desde Alemania;
Cool Spot Para Game Boy;13,28 EUR;Envío gratis;desde Estados Unidos;
Nintendo Game Boy Spot y Cool Spot Paquete;26,57 EUR;Envío gratis;desde Estados Unidos;
Super Mario Land Yoshi's Cookie Cool Spot Bugs Bunny 2 Animaniacs Juego Juegos Boy;62,02 EUR;Envío gratis;desde Estados Unidos;
Cool Spot juego Boy Video Juego Raro Gameboy 1990s Virgin Reino Unido EE. UU.;35,44 EUR;+ 3,36 EUR de envío;desde Estados Unidos;
Cool Spot Original Nintendo Gameboy Juego probado + trabajo & Auténtico! Raro!;22,14 EUR;Envío gratis;desde Estados Unidos;
Cool Spot Nintendo Game Boy;17,70 EUR;+ 2,61 EUR de envío;desde Estados Unidos;
* Probado! * Cool Spot (Nintendo Game Boy) 7-Up/Con Manual! auténtico!;31,93 EUR;Envío gratis;desde Estados Unidos;
The Cool Spot Adventure ( Game Boy );19,16 EUR;+ 6,96 EUR de envío;desde Canadá;
Cool Spot Nintendo Gameboy Original Game oz425;31,62 EUR;+ 17,09 EUR de envío;desde Australia;
Auténtico Raro Cool Spot (Nintendo Gameboy, 1993) probado y de trabajo;13,28 EUR;+ 3,94 EUR de envío;desde Estados Unidos;
Cool Spot Nintendo Gameboy Original Con Estuche Protector de plástico libre! envío rápido!;26,54 EUR;Envío gratis;desde Estados Unidos;
Cool Spot (Nintendo Gameboy, 1993) Auténtico CARTUCHO-PROBADO Y FUNCIONA;26,57 EUR;+ 4,21 EUR de envío;desde Estados Unidos;
Auténtico Raro Cool Spot (Nintendo Gameboy, 1993) probado y de trabajo;26,57 EUR;Envío gratis;desde Estados Unidos;
Auténtico Raro Cool Spot (Nintendo Gameboy, 1993) probado y de trabajo;26,57 EUR;Envío gratis;desde Estados Unidos;
El folleto de instrucciones Manual Cool Spot Aventura Nintendo Game Boy Auténtico;11,51 EUR;Envío gratis;desde Estados Unidos;
Original Nintendo Game Boy 7UP Cool Spot página de anuncio impreso de video juego de aventuras;8,82 EUR;+ 3,23 EUR de envío;desde Estados Unidos;
Cool Spot Game Boy Nintendo Llavero;1,81 EUR;+ 2,50 EUR de envío;desde España;
Cool Spot Nintendo Game Boy Fridge Magnet Magnete Frigorifero;2,22 EUR;+ 2,50 EUR de envío;desde España;
Cool Spot Nintendo Game Boy FRIDGE MAGNET;1,81 EUR;+ 2,50 EUR de envío;desde España;
Cool Spot Original Nintendo Gameboy solo manual de instrucciones;88,60 EUR;+ 1,76 EUR de envío;desde Estados Unidos;
Cool Spot Nintendo Gameboy Auténtico Original 1993;26,57 EUR;+ 4,56 EUR de envío;desde Estados Unidos;
Cool Spot Nintendo Game Boy Fridge Magnet Aimant Frigo;2,18 EUR;+ 2,50 EUR de envío;desde España;
Cool Spot-Game Gear;10,00 EUR;+ 10,00 EUR de envío;desde Alemania;
Cool Spot-Sega Mega Drive juego (en Caja Y Completo-Probado-Pal);17,50 EUR;+ 20,83 EUR de envío estimado;desde Reino Unido;
Cool Spot Super Nintendo Snes Juego solo carro PAL Reino Unido EUR;14,03 EUR;+ 7,61 EUR de envío;desde Reino Unido;
Cool Spot Sega Game Gear Completo en Caja #0043;29,20 EUR;+ 17,45 EUR de envío estimado;desde Reino Unido;
Cool Spot Sega Game Gear Completo en Caja #0048;29,20 EUR;+ 17,45 EUR de envío estimado;desde Reino Unido;
Cool Spot Sega Game Gear Completo en Caja #0002;32,71 EUR;+ 17,53 EUR de envío estimado;desde Reino Unido;
Cool Spot-Sega Master Sistema Juego (probado-Envío Rápido-Pal);5,79 EUR;+ 18,35 EUR de envío estimado;desde Reino Unido;
Cool Spot-Sega Game Gear;8,17 EUR;+ 17,00 EUR de envío estimado;desde Reino Unido;
Sega Master System Cool Spot Module Manual Videojuego Pal Retro ;25,00 EUR;+ 20,00 EUR de envío;desde Alemania;
Sega Mega Drive Cool Spot pal OVP módulo instrucciones Video Game;25,00 EUR;+ 20,00 EUR de envío;desde Alemania;
SEGA Game Gear - Cool Spot - PAL;14,99 EUR;+ 5,50 EUR de envío;desde Francia;
Sega Game Gear-Cool Spot;10,47 EUR;+ 17,05 EUR de envío estimado;desde Reino Unido;
Cool Spot Sega Game Gear;33,94 EUR;+ 21,65 EUR de envío estimado;desde Reino Unido;
Cool Spot, Sega Mega Drive Juego, Virgin. 1993;18,71 EUR;+ 9,95 EUR de envío;desde Reino Unido;
Cool Spot-SEGA GAME GEAR (CARTUCHO de juego Solamente);5,85 EUR;+ 21,04 EUR de envío estimado;desde Reino Unido;
Cool Spot Super Nintendo Snes Juego Pal En Caja;18,72 EUR;+ 21,32 EUR de envío estimado;desde Reino Unido;
Cool Spot Sega Master Sistema Juego;14,03 EUR;+ 17,12 EUR de envío estimado;desde Reino Unido;
Jeu Sega Game Gear Cool Spot;7,90 EUR;+ 6,90 EUR de envío;desde Francia;
Vintage 1993 SEGA Mega Drive Cool Spot Cartucho Juego De Video Version PAL;29,25 EUR;+ 17,54 EUR de envío;desde Reino Unido;
Cool Spot Snes Super Nintendo Juego en Caja;35,11 EUR;+ 17,58 EUR de envío estimado;desde Reino Unido;
Cool Spot Sega Game Gear European Version;9,99 EUR;+ 18,50 EUR de envío;desde España;
Cool Spot Sega Game Gear solo carro buena condición #1;17,55 EUR;+ 17,20 EUR de envío estimado;desde Reino Unido;
Game Gear - Cool Spot;8,00 EUR;+ 8,00 EUR de envío;desde España;
