Pocket Bomberman - Nintendo Game Boy ;14,90 EUR;+ 5,50 EUR de envío;Vendidos  8 dic 2021Artículo vendido;desde Francia;
Pocket Bomberman para Gameboy;15,00 EUR;Envío no especificado;Vendidos  11 nov 2021Artículo vendido;desde Alemania;
Pocket Bomberman Game Boy Color GBC Gameboy Nintendo EUR cib OVP bombarderos Man;35,99 EUR;+ 7,35 EUR de envío;Vendidos  24 oct 2021Artículo vendido;desde Alemania;
Pocket Bomberman GB2 - Nintendo Game boy - NTSC-J JAP;7,99 EUR;+ 3,00 EUR de envío;Vendidos  17 oct 2021Artículo vendido;desde Francia;
Pocket Bomberman JAPAN WORKING SAVE GameBoy;6,27 EUR;+ 5,83 EUR de envío;Vendidos  20 nov 2021Artículo vendido;desde Canadá;
Pocket Bomberman (Nintendo Game Boy Color, 1998 Gameboy)-Complete;64,83 EUR;+ 4,18 EUR de envío;Vendidos  9 nov 2021Artículo vendido;desde Canadá;
