Jungle Strike - The Sequel to Desert Strike | Game Boy 游돛| Excellent Condition游깴;10,00 EUR;+4,00 EUR de env칤o;desde Pa칤ses Bajos;
Jungle Strike (Game Boy GB 1995 ) Solo cartucho;8,90 EUR;+9,90 EUR de env칤o;desde Espa침a;
Nintendo Gameboy juego-Jungle Strike-the sequel to Desert Strike-Embalaje original-Pal;179,90 EUR;Env칤o no especificado;desde Alemania;
Vintage GAMEBOY NINTENDO Jungle Strike Edici칩n Europea Completo Nuevo Nunca Usado;61,85 EUR;+15,90 EUR de env칤o;desde Grecia;
Nintendo Gameboy-Jungle Strike-Embalaje original-Top-pal-Ocean;49,90 EUR;Env칤o no especificado;desde Alemania;
NINTENDO GAMEBOY Jungle Strike Cartucho gastos de env칤o gratis en Reino Unido;22,33 EUR;+ 17,38 EUR de env칤o estimado;desde Reino Unido;
Nintendo Gameboy Jungle Strike;15,27 EUR;+ 17,23 EUR de env칤o estimado;desde Reino Unido;
NINTENDO GAMEBOY Jungle Strike Cartucho gastos de env칤o gratis en Reino Unido;12,92 EUR;Env칤o no especificado;desde Reino Unido;
Juego Game Boy Advance 108 En 1 - Jungle Strike+Star Wars+Pack-Man+Dr Mario;6,00 EUR;Env칤o no especificado;desde Espa침a;
Urban Strike Nintendo Game Boy Original Jungle Strike Secuela * m치s dif칤cil encontrar *;10,58 EUR;Env칤o gratis;desde Estados Unidos;
Jungle Strike-Nintendo GAME BOY;45,06 EUR;Env칤o gratis;desde Estados Unidos;
Jungle Strike ( Game Boy GB 1995) Solo Cartuccia;19,32 EUR;Env칤o internacional gratis;desde Espa침a;
Jungle Strike (Game Boy GB 1995) Solo Cartridge;9,05 EUR;+9,90 EUR de env칤o;desde Espa침a;
Jungle Strike (Game Boy GB 1995) Solo Cartridge;19,68 EUR;Env칤o internacional gratis;desde Espa침a;
Jungle Strike Gameboy Original/Color game GBC oz257;25,05 EUR;+16,93 EUR de env칤o;desde Australia;
Game Boy Jungle Strike;176,72 EUR;+17,67 EUR de env칤o;desde M칠xico;
Nintendo Gameboy - Jungle Strike - Game Only;17,22 EUR;+3,44 EUR de env칤o;desde Canad치;
Jungle Strike Nintendo Game Boy INV-2930;15,67 EUR;+14,62 EUR de env칤o;desde Espa침a;
Jungle Strike la Secuela De Desert Strike Game Boy Nintendo Llavero;1,81 EUR;+2,48 EUR de env칤o;desde Espa침a;
Jungle Strike la Secuela De Desert Nintendo Game Boy FRIDGE MAGNET;1,81 EUR;+2,48 EUR de env칤o;desde Espa침a;
Jungle Strike-Super Nintendo SNES Juego - [CIB PAL EUR] En Caja Con Manual;52,85 EUR;+17,58 EUR de env칤o;desde Reino Unido;
Jungle Strike & huelga del desierto: volver al Golfo - 1995 Juego De Pc-Edici칩n JC;23,50 EUR;+7,00 EUR de env칤o;desde Reino Unido;
Jungle Strike la Secuela De Desert Strike PC CD-ROM (pc-game) [DOS] Caja Grande;23,50 EUR;+ 36,42 EUR de env칤o estimado;desde Reino Unido;
Jungle Strike, Sega MegaDrive Juego, pal, completa;16,46 EUR;+ 20,78 EUR de env칤o estimado;desde Reino Unido;
Jungle Strike Sega Megadrive Juego Mega Drive Genesis Completa Cl치sico Guerra Ea;9,98 EUR;+ 36,13 EUR de env칤o estimado;desde Reino Unido;
Jungle Strike Juego Super Nintendo SNES;20,57 EUR;+21,17 EUR de env칤o;desde Reino Unido;
