Snoopy's Magic Show Game Boy Noe Boîte Jeux Notice;100,00 EUR;+ 50,00 EUR de envío;desde Francia;
Snoopy's Magic Show Nintendo Gameboy Game Boy Carro UKV ** GRATIS UK FRANQUEO **;18,65 EUR;+ 13,89 EUR de envío;desde Reino Unido;
Nintendo Game Boy Snoopy's Magic Show En Caja Con Manual muy ordenado;70,60 EUR;+ 23,38 EUR de envío estimado;desde Reino Unido;
Jeu Nintendo Game Boy - Snoopy's Magic Show - ITA - Loose;6,90 EUR;+ 6,70 EUR de envío;desde Francia;
Game Boy Snoopy's Magic Show Cartucho sólo Free UK Post;13,83 EUR;+ 17,22 EUR de envío estimado;desde Reino Unido;
Nintendo Game Boy Snoopy's Magic Show ITA Très Bon état;5,90 EUR;+ 11,98 EUR de envío;desde Francia;
Snoopy's Magic Show Gameboy;15,29 EUR;+ 16,48 EUR de envío;desde Reino Unido;
Nintendo Game Boy - Snoopy's Magic Show - PAL - FAH;9,99 EUR;+ 4,60 EUR de envío;desde Francia;
Nintendo Gameboy Classic, Color & GBA Game: Snoopy's Magic Show (FAH);4,95 EUR;+ 5,00 EUR de envío;desde Países Bajos;
Nintendo Game Boy Snoopy's Magic Show  GameBoy  Vers. FAH;9,90 EUR;Envío no especificado;desde Francia;
