Gameboy Snoopy's Magic Show;1,00 EUR;+ 3,70 EUR de envío;desde Alemania;
Nintendo Game Boy Snoopy's Magic Show En Caja Con Manual muy ordenado;70,25 EUR;+ 23,27 EUR de envío estimado;desde Reino Unido;
Nuevo anuncioSnoopy's Magic Show Para Nintendo Game Boy;10,54 EUR;Envío no especificado;desde Reino Unido;
Snoopy's Magic Show Nintendo Gameboy Game Boy Carro UKV ** GRATIS UK FRANQUEO **;26,42 EUR;+ 13,82 EUR de envío;desde Reino Unido;
Jeu Nintendo Game Boy - Snoopy's Magic Show - ITA - Loose;6,90 EUR;+ 6,70 EUR de envío;desde Francia;
Game Boy Snoopy's Magic Show Cartucho sólo Free UK Post;13,76 EUR;+ 17,13 EUR de envío estimado;desde Reino Unido;
Nintendo Game Boy Snoopy's Magic Show ITA Très Bon état;5,90 EUR;+ 11,98 EUR de envío;desde Francia;
Snoopy's Magic Show Game Boy Noe Boîte Jeux Notice;100,00 EUR;+ 50,00 EUR de envío;desde Francia;
Snoopy's Magic Show Gameboy;15,21 EUR;+ 16,39 EUR de envío;desde Reino Unido;
Nintendo Game Boy - Snoopy's Magic Show - PAL - FAH;9,99 EUR;+ 4,60 EUR de envío;desde Francia;
Nintendo Game Boy Snoopy's Magic Show  GameBoy  Vers. FAH;9,90 EUR;Envío no especificado;desde Francia;
