Nintendo Game Boy-Turrican-Top-Embalaje original-us;329,90 EUR;Envío no especificado;desde Alemania;
Turrican Completo Nintendo Game Boy;146,97 EUR;+ 25,01 EUR de envío estimado;desde Reino Unido;
Artículo genuino Gameboy Turrican CARTUCHO USA;29,38 EUR;+ 17,53 EUR de envío estimado;desde Reino Unido;
Nintendo Gameboy : "Turrican" Cartucho Pal Esp.;24,95 EUR;+ 15,00 EUR de envío;desde España;
Manual de Instrucciones de Nintendo Gameboy-USA-Turrican;19,93 EUR;+ 17,33 EUR de envío estimado;desde Reino Unido;
Turrican Folleto De Instrucciones Manual Solamente Para Original Nintendo Gameboy;19,98 EUR;+ 23,52 EUR de envío;desde Reino Unido;
Turrican Game Boy Game Boy Gameboy classicspielanleitung instruction cuadernillo Noe;19,90 EUR;Envío no especificado;desde Alemania;
Turrican cómo jugar instrucciones cuadernillo Gameboy classic game boy buen estado;17,99 EUR;Envío no especificado;desde Alemania;
Gameboy Turrican folleto sólo Reino Unido versión Game Boy;15,26 EUR;Envío no especificado;desde Reino Unido;
Turrican (Nintendo Game Boy) Nuevo Sellado, extremadamente rara!;2.562,39 EUR;+ 34,42 EUR de envío;desde Estados Unidos;
Nuevo anuncioTurrican (Nintendo Game Boy, 1991) Envío Gratuito;22,08 EUR;Envío gratis;desde Estados Unidos;
Turrican-Nintendo GAME BOY;29,16 EUR;+ 3,89 EUR de envío;desde Estados Unidos;
Turrican (Nintendo Game Boy, 1991) Auténtico Probado;26,50 EUR;+ 4,42 EUR de envío;desde Estados Unidos;
Turrican (Nintendo Gameboy GB) solo Carro Gran forma Juego Boy;30,03 EUR;Envío gratis;desde Estados Unidos;
Turrican For The Nintendo Gameboy...- rare;31,00 EUR;+ 13,65 EUR de envío;desde Canadá;
Turrican (Nintendo GameBoy) Accolade Instruction Manual Only!;17,53 EUR;+ 21,95 EUR de envío;desde Australia;
Nintendo Game Boy GameBoy Turrican Nuevo Sellado Super Raro Leer por favor;176,71 EUR;Envío internacional gratis;desde Israel;
Turrican Accolade-Nintendo Gameboy manual de instrucciones-Excelente Estado;15,10 EUR;+ 3,53 EUR de envío;desde Estados Unidos;
Turrican Nintendo Game Boy Folleto De Instrucciones Manual Solamente;17,66 EUR;Envío gratis;desde Estados Unidos;
Turrican Accolade-Nintendo Gameboy manual de instrucciones Muy Buen Estado;22,00 EUR;Envío gratis;desde Estados Unidos;
Turrican Accolade Original Nintendo Gameboy solo manual de instrucciones;22,26 EUR;+ 1,76 EUR de envío;desde Estados Unidos;
Turrican Nintendo Gameboy Game Boy Color GBC;42,34 EUR;Envío internacional gratis;desde Francia;
Turrican-Sega Mega Drive juego (en Caja Y Completo-Probado-Pal);70,54 EUR;+ 27,01 EUR de envío estimado;desde Reino Unido;
