Nintendo Gameboy (gb) // Turrican-instrucciones/instructions // dt. PAL;19,99 EUR;+ 5,99 EUR de envío;Vendidos  23 nov 2021Artículo vendido;desde Alemania;
Turrican-Nintendo Gameboy carro y caso;11,70 EUR;+ 17,07 EUR de envío estimado;Vendidos  6 nov 2021Artículo vendido;desde Reino Unido;
Turrican Nintendo Game Boy Juego Original;26,57 EUR;+ 7,09 EUR de envío;Vendidos  1 nov 2021Artículo vendido;desde Ucrania;
Turrican Nintendo Game Boy Gameboy NTSC USA Completo en Caja Completo en Caja Clásico;176,33 EUR;+ 13,25 EUR de envío;Vendidos  27 oct 2021Artículo vendido;desde España;
Turrican Nintendo Game Boy Juego Con Caja Y Folleto Completo En Caja;203,79 EUR;+ 17,72 EUR de envío;Vendidos  14 oct 2021Artículo vendido;desde Alemania;
Turrican, Terminator, Robocop, Universal Soldier. Genuino Gameboy. GB. juego Boy;67,88 EUR;+ 26,95 EUR de envío estimado;Vendidos  6 oct 2021Artículo vendido;desde Reino Unido;
Turrican para el juego original de Nintendo Boy Cartridge Only USA Gameboy Free P&P;21,05 EUR;+ 17,27 EUR de envío estimado;Vendidos  2 oct 2021Artículo vendido;desde Reino Unido;
Turrican-Nintendo Gameboy;16,35 EUR;Envío no especificado;Vendidos  20 sep 2021Artículo vendido;desde Reino Unido;
Turrican GameBoy auténtico Probado;26,58 EUR;+ 3,99 EUR de envío;Vendidos  20 nov 2021Artículo vendido;desde Estados Unidos;
Turrican (Nintendo Game Boy de 1991) Excelente Etiqueta probado y funcionando. Original Equipment Manufacturer;22,14 EUR;Envío gratis;Vendidos  13 nov 2021Artículo vendido;desde Estados Unidos;
Turrican Accolade Nintendo Game Boy Gb probado Auténtico;26,57 EUR;+ 4,21 EUR de envío;Vendidos  11 nov 2021Artículo vendido;desde Estados Unidos;
Turrican Completo Cartucho en Caja Nintendo Game Boy GameBoy;181,65 EUR;Envío gratis;Vendidos  14 oct 2021Artículo vendido;desde Estados Unidos;
Turrican (Nintendo Game Boy) Auténtico -- Completo en Caja-GameBoy;168,31 EUR;Envío gratis;Vendidos  14 oct 2021Artículo vendido;desde Estados Unidos;
Gameboy Turrican casi nuevo Cartucho en Caja!;159,50 EUR;+ 7,97 EUR de envío;Vendidos  14 oct 2021Artículo vendido;desde Estados Unidos;
Turrican (Nintendo Game Boy de 1991) Excelente Etiqueta probado y funcionando. Original Equipment Manufacturer;22,14 EUR;Envío gratis;Vendidos  17 sep 2021Artículo vendido;desde Estados Unidos;
Turrican (Nintendo Game Boy, 1991): Probado Y Envío Gratis!;22,15 EUR;Envío gratis;Vendidos  16 sep 2021Artículo vendido;desde Estados Unidos;
Turrican Flashback-Reino Unido Pal-Nintendo Switch Juego;18,71 EUR;+ 20,15 EUR de envío estimado;Vendidos  25 sep 2021Artículo vendido;desde Reino Unido;
