Total Carnage Nintendo Game Boy GB con Estuche de plástico;15,96 EUR;+ 3,81 EUR de envío;Vendidos  2 dic 2021Artículo vendido;desde Estados Unidos;
Total Carnage Nintendo Gameboy rare;22,18 EUR;+ 2,77 EUR de envío;Vendidos  15 nov 2021Artículo vendido;desde Canadá;
Total Carnage Folleto De Instrucciones-auténticos-Nintendo Game Boy-Solo Manual!;17,72 EUR;Envío gratis;Vendidos  8 nov 2021Artículo vendido;desde Estados Unidos;
Total Carnage (Nintendo Game Boy);17,10 EUR;Envío gratis;Vendidos  10 oct 2021Artículo vendido;desde Estados Unidos;
Total Carnage - UKV - Nintendo Gameboy;22,00 EUR;+ 25,00 EUR de envío;Vendidos  19 sep 2021Artículo vendido;desde Países Bajos;
Total Carnage Nintendo Game Boy GB con Estuche;26,60 EUR;Envío gratis;Vendidos  18 sep 2021Artículo vendido;desde Estados Unidos;
Total Carnage Super Nintendo Juego SNES PAL versión Super Nes;15,82 EUR;+ 34,96 EUR de envío estimado;Vendidos  7 sep 2021Artículo vendido;desde Reino Unido;
Total Carnage Super Nintendo Juego SNES PAL UKV versión Super Nes;17,56 EUR;+ 17,23 EUR de envío estimado;Vendidos  2 oct 2021Artículo vendido;desde Reino Unido;
